"","reviews","points"
"722","관람객역시 짐자무시.  일상, 사랑, 유머 가득한  한 권의 시집.  ","10"
"723","관람객매일의 일상의 풍부함에 감동  ","10"
"724","관람객반복되는 모든 것들에 대하여  ","8"
"725","글쎄.. 예술의 기준이 뭔지는 모르겠지만일상에 예술의 무거움을 넣으려하니매우 어색해보였음  ","3"
"726","관람객평범한 일상의 아름다움. 패터슨 처럼 살아야 겠다. 무덤덤하지만 나를 지키며.  ","10"
"727","관람객평범한 미국인의 일상담담하게 지루하다  ","5"
"728","시간이 넘쳐나면 보세요.... 그냥 월요일부터 쭉,,,일어나서눈뜨고버스운전하러출근하고퇴근하고개산책시키고맥주먹고계속반복일상  ","1"
"729","관람객지루하겠거니 하고 갔는데 뜻밖에 영화가 끝날 무렵엔 상영시간이 다 되어가는 게 아쉬운 영화였습니다 아담 드라이버라는 배우를 다시 보게 만든 영화이기도 했고요 죽고 죽이고 싸우고 배신하는 영화의 홍수 속에 오랜만에 따뜻한 영화를 볼 수 있어서 좋았습니다  ","10"
"730","관람객무슨 의미일까요..?저만 이러나요? 한번쯤 봐서 나쁠 건 없지만 시간이 저엉말 많구 넘칠때 보는 게 좋을 거 같네요  ","7"
"731","존나재미없음. 지겨워서 겨우봄. 지루함+클리쉐+있는척 하는 영화  ","2"
"732","보는 내내 좋았습니다. 휴식 같은 영화. 별다를 건 없는 패터슨의 일상이지만 사랑스러워요.  ","9"
"733","기억 남은 명대사 때론 텅빈 페이지가 가장 많은 가능성을 선사하죠  ","10"
"734","소소한 삶, 그 속에서 깨닫는 교훈  ","10"
"735","관람객영상도 스토리도 연기도 좋았다  ","10"
"736","짐자무시가 시인에게  경고하는... 개조심!  ","8"
"737","관람객반복되는 일상이지만 늘 같지만은 않지..내 옆 사람을 다시금 생각하게 되었다  ","7"
"738","짐자무쉬 영화 첨 보는데, 좋네요. 유럽영화스러운 잔잔함, 잔잔함 속에 마음이 즐거워지는 영화에요. 영상도 예쁘고, 햇빛이 비치는 집, 거리 등등이 너무 좋아요. 강아지도 귀엽고, 동네 펍 분위기도 너무 좋고. 페터슨과 로라의 아침 모습도 정말 좋아요  ","10"
"739","관람객좋은영화였습니다 감사합니다  ","10"
"740","관람객아하아하아하아하아라아하  ","7"
"741","관람객잔잔한 한편의 시간은 편안한 영화~  ","8"
"742","관람객그 도시의 모두는 예술가였다. 나와 비슷한 일상을 살아가는 그들의 일상은 예술로 이루어져 있었고, 나는 그 사실이 무척이나 마음에 들었다.  ","10"
"743","관람객우리는 누구나 시인이고, 한 번에 여러가지 꿈을 꿀 수 있다. 버스운전기사이며 시인일 수 있듯, 컵케이크를 팔며 기타를 칠 수 있다.이창동 감독의 &#39;시&#39;의 대척점에 있는 것 같은 영화. 내게는 멋진 세트같은 영화들입니다.  ","10"
"744","관람객짐 자무시는 사랑이다. 남의 인생을 훔쳐보는 게 아닌  감상하는 기분.  ","9"
"745","관람객강추, 잔잔한 판타지 영화예요.  ","10"
"746","관람객자칫 무료하고 따분해 보일 수 있는 일상을 다양한 변주를 통해 세밀하게 보게 해줬어요 일상이 그렇게 유지될 수 있도록 해주는 아내와 이웃들과 좋아하는 일이 있었고요 아내의 예술적인 생활도 좋았어요  ","8"
"747","관람객패터슨 시에 사는 패터슨의 일상. 일상에서 예술을 꿈꾸는 이들의 일상, 혹은 예술의 일상. 차이와 반복. 예술과 일상의 일란성.  ","8"
"748","관람객예쁜 연출과 별다를 것 없는 일상 속의 특별함, 나의 다음 일주일이 기다려지는 영화입니다  ","10"
"749","관람객마음 편하게 볼 수 있는 몇 안되는 영화. 시와 시인에 대해서 이야기하는 영화 자체가 시  ","9"
"750","우리집엔 성냥이 많다. 눈꺼풀이 무거워 진다. 잠이 든다. 이제 당신은 깊은 잠에 빠져든다.  그리고 당신은 2시간을 잃게 된다. 평점 낮게 주면 예술 모른다고 할까봐 그랬니? 니들이나 많이 봐라.  ","1"
"751","끝내주는 다양성 영화, 브라보! / 이루어지면 더이상 꿈이 아니라 한다. 매일 반복되는 일상이지만 꿈이 있기에 외롭지 않은 인생이다. 때론 텅 빈 페이지가 더 많은 가능성이 있다는 대사가 와 닿는다.  ","9"
"752","관람객시에 빗댄 영화의 연출이 인상적. 위로가 되는 영화였다. 개인적으로 좋아하던 영화 문라이즈 킹덤의 반가운 얼굴들을 볼수 있는건 덤 !  ","9"
"753","관람객여주가 너무 아름답네요  ","8"
"754","관람객나의 일상을 돌아보게 하는. 나의 일상도 의외로 빛난다는 생각을 하게해준 영화  ","10"
"755","의외로 영화 속에 피식하는 장면들이 있어 놀랐음  ","9"
"756","관람객무료한 일상속을 유영하는 작은 행복의 순간들  ","9"
"757","관람객일상의 단단함에 대한 단상  ","8"
"758","관람객상영관이 적어서 아쉽다. 자극적이고 소란스러움뿐인 것에서 벗어날 수 있다. 패터슨 말처럼 단지 물 위에 쓴 말들뿐이지만 나도 시써야지. 혹 텅빈 페이지가 되더라도  ","9"
"759","관람객너무너무 재밌었어요.  ","10"
"760","관람객루틴한 삶 속에서의 오아시스. 나는 무엇으로 빈 노트를 채우나...  ","9"
"761","관람객하루하루를 값지게 보내는게 너무 인상 깊었습니다  ","8"
"762","관람객참 시같은 영화네요.. 시가 쓰고 싶어졌어요  ","8"
"763","관람객반복되는 일상의 예기치 못한  나른한 위로  ","9"
"764","소중한것의 가치를~~  ","8"
"765","잔잔한 영화다.한 남자의 일주일을 시와 함께  읊조린 느낌.  ","8"
"766","잔잔한 감동을 주는 따뜻한 영화  ","10"
"767","관람객쓴다, 산다, 쓰고 있다, 살고 있다  ","9"
"768","관람객패터슨에게 시란 별 것 아니지만 도움이 되는?  ","8"
"769","관람객시인으로 살기 위해, 소중한 단어를 줍는 이토록 소중한 일상.  ","10"
"770","패터슨과 로라처럼 살고 싶다  ","10"
"771","관람객일상의 소중함 , 자유의 소중함  ","8"
"772","관람객밋밋한것 같으면서도 시간이 지날수록 여운이 길게 남았던 영화  ","8"
"773","보면서 팝콘콜라보다 커피마시고 싶어지는 영화.  ","9"
"774"," 내가 선택하고 내게 익숙해진 반복되는일상이 시가 될때  ","10"
"775","관람객잔잔하고 소중한 시 같은 일상  ","10"
"776","설날에 가족들과 함께 봐도 좋을거 같아욤  ","10"
"777","관람객런치박스 구입 완료ㅋㅋㅋ  ","10"
"778","관람객인생은 로라처럼 사는 거지  ","5"
"779","관람객억제되있는 감정영화.  가볍지만은 않은 영화. 일상 속 빈노트가 필요한 우리 일상.  ","5"
"780","관람객삶은 반복되지만 항상 같지만은 않다  ","10"
"781","관람객일상의 소중함에 대하여  ","8"
"782","카를로스 윌리엄 카를로스...윌리엄 카를로스 윌리엄..  ","8"
"783","내 인생의 로라를 만나고싶고 그 로라가 그립다..  ","10"
"784","관람객아름다운 사랑 일상이 시가되는  ","10"
"785","삶이란 지루한 검은 바탕위에 끊임없이 다채로운 흰 무늬들을 채워나가는 것. 모든게 다 무너져내려도 내일다시 시작하면 되는것~  ","8"
"786","관람객인생이란 시를 쓰는 모든 예술가를 위한 헌정  ","10"
"787","관람객같은 일상, 다른 변주. 이것은 바흐가  만든 영화다.  ","8"
"788","관람객하고 있는 일, 하고 싶은 일을 대하는 태도가 전혀 다른 그러나 서로를 위하는 마음만은 닮은로라와 패터슨.패터슨에서 사는 패터슨의 일상을 통해 본 잔잔하게 흘러가는 삶. 우리의 삶.  ","8"
"789","관람객패터슨 인상깊은영화입니다  ","10"
"790","관람객시 노트가 찣겨지듯 슬픈 일은 일어나도 다시 시를 써가듯 아름다운 일은 또 온다.  ","9"
"791","관람객조용하고 평화로운 영화_감각적인 영상.  ","8"
"792","관람객일상의 아름다움을 발견하게하는 영화  ","9"
"793","관람객재밌었어요 정말로요!  ","10"
"794","관람객졸지 않고 흐뭇하게 봤습니다만, 주인공 남녀의 표정을 보고 있노라면, 뭔가 일이 터지지 않을까 하는 쓸데없는 불안감이 들곤 했습니다. 좋은 영화 추천합니다^^  ","10"
"795","관람객번역이 적당했습니다만 언어에 관한 영화라서 원어를 알면 더 좋을 것 같았습니다  ","8"
"796","관람객좋았어요. ^.^ ㅎㅎㅎㅎ  ","10"
"797","관람객아름답다. 평화롭고.일상의 반짝임을 포착하는 온화함  ","10"
"798","관람객일상을 위로할만한 이야기  ","8"
"799","어느 순간부터 영화의 한 장면에 의미를 부여하고 가치를 넣기 시작했다. 그냥 순수하게 보여지는 그 내용에 만끽하면서 즐길 줄 알았던 어린 시절의 나를 돌아보며. 작은 행동에 무슨 의도가 담겨있을지 고민하다가 흘려버린 영상들이 아깝다. 짐 자무쉬 스타일  ","8"
"800","관람객한번도 말해지지 않은 누군가의 일주일. 누군가의 마음들.누군가의 리듬들.  ","8"
"801","관람객매일의 평범해보이는 일상 속에 늘 숨어있는 아름다움을 발견하는 기쁨을 되찾게 하는 영화.  ","10"
"802","관람객마음이 편안해지는 일상.  ","10"
"803","관람객교향곡 같은 영화 오랜만에 이런 영화. 최고  ","10"
"804","관람객제가 뭐만 하면 남편이 “Um, beautiful!”거리고, 스탠리 런치 박스를 프사로 해두었어요.  ","8"
"805","관람객&#34;아하&#34; 부분이 자꾸 생각나네요 ㅎㅎ평범한 일상속을 잘 나타내면서 울림이 있는 영화였습니다.  ","7"
"806","관람객우리의 일상을 위대하게 만들어준 영화!  ","10"
"807","관람객잔잔하고 어떻게 보면 지루할 수도 있지만, 꽤 재미있는 영화이기도 하다! 여자 주인공이 매력적이다 ^^  ","9"
"808","관람객일상의 반복을 세심하게 시와 어우러지게 잘 표현했네요~~ 둘의 사랑하는 모습도 참 아름다워 저절로 미소짓게 됩니다  ","8"
"809","관람객좋았다 일상에 스며드는 반짝임  ","10"
"810","관람객평범한듯 특별한 일상을 담은 영화  ","8"
"811","관람객오랜만의 짐 자무쉬 좋네요  ","9"
"812","관람객단조로운 일상 속에서의 외침, 아하!  ","6"
"813","관람객나도 저렇게 단조로운 삶을 살고싶다.  ","9"
"814","관람객일상 속의 시를 발견하여, 아하!  ","8"
"815","관람객윌리엄 카를로스 윌리엄스의 시를 좋아하는 패터슨의 버스드라이버 패터슨의 이야기. 시에 대하여 그리고 일상에 대하여.(하나로 경도되지 않은 세상에 대하여 더욱 동경을 품게 만드는 이야기. 최고의 엔딩)  ","10"
"816","관람객카를로 윌리엄 카를로스  ","10"
"817","Just that one line.  ","7"
"818","관람객너무나도 시적인 아름다운 영화...  ","10"
"819","관람객어제의 시인이 오늘의 버스 기사들이다.  ","9"
"820","관람객컵케이크 먹고싶다..  ","8"
"821","관람객자극적인 것이 넘쳐나는 세상에 쉼표를 찍어주는 영화  ","9"
"822","관람객영화 자체가 시 같습니다.  ","10"
"823","관람객우리 모두가 예술가가 될 수 있어요^^멋진영화 였어요. 매일같이 똑같은 일상 속에서 감성을 채워준 영화..  ","10"
"824","관람객당신의 하루는 시가 된다.  ","8"
"825","정말 쉼표같은 영화였다  ","9"
"826","관람객사실 우리 모두가 시인이지  ","8"
"827","관람객같은 버스기사로써..반복되고 같은일상에서 지겨움을 벗어날려고 발버둥치지만 현실은 어렵다 월요일부터 일요일까지 다른일 같지만 결국 반복이다 내일의 해가뜨고 새로운 페이지를 쓰는 인생인데 잘살라면 이쁜아내가 필요하다  ","5"
"828","평범한 일상이 시가 되어가는 과정  ","8"
"829","우아하게 서있는 영화, 정지된 시간을 받아들인다면 기쁠영화  ","7"
"830","관람객영상 하나하나 다 너무나 예뻤던 영화  ","10"
"831","관람객평범한 일상에 숨겨진 보석을 발견해내는 영화  ","9"
"832","관람객&#34;사랑이 없으면 모든게 다 무슨 소용이죠?&#34;시를 잃은 공허와 사랑을 잃은 허무가 마주했을 때.  ","9"
"833","관람객우리 중 대부분이 어떤식으로나마 창작 활동을 지속하고 있고 이런 활동들은 삶의 원동력이 되는것 같다.  ","8"
"834","관람객리듬감이 살아있는 영화가 참 좋다 패터슨은 가장 아름다운 하루하루를 보내고 있구나  ","10"
"835","관람객시 같은 영화. 아름답고 순수하고 착하다 역시 명감독!!  ","9"
"836","관람객삶은 빈여백이 있어야 다시 돌아보게 되는 것 같습니다.그럴 때 아하! 느낌표 하나 찍게 되는게 아닐까요?  ","8"
"837","관람객잔잔하지만 지루하지 않았다  ","9"
"838","관람객인생은 당위성이 없다 하지만 행복은 능동성 위에 있기 마련이다  ","8"
"839","관람객아하! 괜찮은 시집,괜찮은 일상을 읽은 것 같은 기분  ","8"
"840","관람객영화 자체가 하나의 시. 작품이라는 말이 너무나도 잘 어울릴듯한 묘하면서 어렵고도 그 느낌이 좋았어요  ","9"
"841","관람객보통의 일상이 주는 행복  ","8"
"842","관람객사랑한다면 두 번째, 세 번째 . . . 기회는 찾아온다  ","8"
"843","은은한 여혐, 동양에 대한 오리엔탈리즘적 신비주의 판타지, 노장사상적 인생관  ","6"
"844","관람객시에 대한 영화 아니다. 영화에 대한 영화다. 시 타령들 좀 그만 했으면.  ","10"
"845","관람객켜켜이 쌓이는 일상 속 미세한 차이의 순간들, 그것을  시(詩) 속 &#39;행간&#39;이라 칭하고 싶다.  ","9"
"846","관람객반복되는 일상속. 그러나 소중한 다른 특별한 것들. 오랜만에 좋은 영화 봤습니다!  ","8"
"847","관람객보는 내내 이창동 감독의 시가 떠오름  ","7"
"848","관람객같고도 다른 일상에대해  ","8"
"849","관람객아름답고 수많은 아침들! 방 한 쪽에 24시간 틀어놓고 싶다  ","10"
"850","시와 같은 영화. 모든 사람의 삶과 일상은 그대로 예술.  ","8"
"851","관람객좋아요~ 연기가 좋아요! 씨네큐브에서 보세요.  ","8"
"852","관람객영상도 너무 예쁘고 잔잔하게 흘러가서 좋았는데 내용이 조금 이해하긴 어렵긴 했어용ㅎㅎㅎ  ","7"
"853","관람객한국영화 시 처럼 좋아요  ","8"
"854","관람객벌써부터 올해 최고의 영화가 될 것 같은 느낌!  ","10"
"855","관람객인생별거 있나요?사랑하는 연인과 함께할 수 있다면즐겨찾는 작은 바에서 친구들과 얘기 나눌 수 있다면퇴근해서 강아지와 산책할 여유가 있다면시를 몇 줄 끄적일 틈이 있다면아하!!! 행복한 거 아니겠어요?그게 아니라면 차라리 물고기가 될래요?  ","10"
"856","정말 힐링 영화네요.소소한 일상을 특별하게 만드는 연출이 너무 좋았습니다.독특하기도하고 대화가 너무 재밌어서 계속 미소 지으면 봤네요!  ","9"
"857","관람객너무너무 좋은 영화 잔잔하지만 유머도 있고 일단 배우들이 연기를 너무 잘하고 영화 장면속 사소한 소품들 하나하나도 자연스럽고 배경과 잘 어울렸다. 내가 진짜 패터슨에 가 있는 듯한 느낌!! 부부의 모습이 너무나도 사랑스러웠다  ","10"
"858","관람객나는 깨어 있을 때 꿈을 꾼다  ","8"
"859","관람객지루한 감이 있지만 투박한 배경과 어울리는 차분한 일상이 좋았습니다. 시간이 남을 때마다 틈틈이 글을 쓰는 모습이 기억에 남습니다.  ","8"
"860","관람객일상에 대한 깨달음을 주는 영화. 내 일상도 그 존재만으로도 가치있다  ","7"
"861","시를 영화로 만든 영화.  ","8"
"862","관람객나의 일상도 이렇게 평화로웠으면.  ","10"
"863","관람객펜이랑 수첩 가지고 나올걸.. 후회한다  ","9"
"864","관람객한편의 아름다운 시를 읽은 감동우리곁에 잔잔한 일상속에 시는 늘 꽃피울준비를 하고 있다.  ","8"
"865","관람객시詩는 어디에나 있다.  ","10"
"866","관람객무심한듯 순종적인 남편과 철없어보이지만 단순한 아내의 일상이 자칫 지루하게 비춰질 수 있는 영화  ","7"
"867","관람객영화는 너무 좋았음. 근데 이수 아트나인..최악ㅠㅠ스크린 양 옆은 커튼으로 가려서 두시간 내나 굉장히 거슬리고, 다음 영화 공지하는 멘트 상영관 안으로 다 들리고..ㅠㅠ  ","9"
"868","관람객올해 극장에서 본 영화 중 최고  ","8"
"869","관람객일상의 소중함 삶은 예술  ","8"
"870","관람객짐 자무쉬의 세련됨. 때론 반복되는 일상이 그리운 법.  ","9"
"871","관람객일상이란 무엇인가를 많이 생각하게한 영화  ","9"
"872","관람객따뜻한 일상속 소소한 사건들이 만들어내는 드라마  ","10"
"873","관람객매일이 지겨워보이는 일상 속에서도 충분히 색다른 하루들을 살아갈수 있는 방법.  ","8"
"874","훌륭해요... 꿈을 포기하지 않으려고요...  ","10"
"875","관람객배우/화면/시 모두 만점..??  ","10"
"876","관람객똑같은 듯 다른 일상들 속에서 느껴지는 행복들이 잘 전달 되었어요. 영화가 후반부로 갈수록 ‘패터슨이 또 어떤 하루를 보낼까?’ 라고 기대하는 저를 발견했어요.  ","10"
"877","관람객조용한 일상을 지내며 한편으론 깊은 사색으로 시를 친구삼아 보내는 패터슨...  잔잔한 영화보고 지친 마음에 위로를 받고 왔습니다!!  ","8"
"878","관람객사람들의 평범한 일상에 대해 평화롭게 잘 표현했네요. 짐 자무쉬 감독의 다른 영화도 보고 싶습니다  ","8"
"879","관람객좋았어요기대했던 만큼  ","9"
"880","관람객일상에 깃든 아름다운 운율  ","10"
"881","관람객한 번 더 봐야지 그래야 이해가 또 될 거 같네요  ","8"
"882","잔잔하면서 의미있는 영화  ","10"
"883","관람객일상의 평화로움 느껴집니다  ","10"
"884","관람객일상의행복이느껴진다  ","10"
"885","마빈이 제일 불쌍한거같다  ","10"
"886","관람객좋았습니다정말최고!!!  ","10"
"887","관람객굳 감독은 일상속의 아름다움  ","9"
"888","관람객잔잔한 일상 속에서 발견하는 시어들  ","9"
"889","시가 된 영화. 일상의 리듬은 운율이 되고 영감이 된다.  ","9"
"890","Paterson...  ","7"
"891","일하고 사랑하고 시 쓰는 일상을 담담하게 그려내는 편안함 같은 것  ","9"
"892","관람객일상을 대하는 태도의 미묘한 변화.  ","7"
"893","해석을 봐야겠다 잘 모르겠음  ","7"
"894","시를 짓는 무미건조 일상 속의 패터슨  ","10"
"895","관람객평화로운 영화인데 보는 내내 장면마다 무슨 일 터질까봐 조마조마했던 내가 너무 우스웠음. 아무도 다치지 않고 죽지 않으며 누구도 쫄리거나 몰리지 않아 개운하고 후련했다. 인용한 시가 약간 유치했던 것만 빼면 2017년을 마무리하기에 좋은 영화.  ","9"
"896","관람객평온하고 평온하고 평온하다. 나는 왜 평온한 남의 일상을 들여다 보고 있는가...  ","6"
"897","관람객크리스마스 이브에 사랑하는 사람과 맘이 따뜻해지는 영화였습니다~  ","10"
"898","관람객쉼표같은영화입니다!  ","10"
"899","나만 당할 수는 없는 법.  ","10"
"900","관람객졸리지만 평들이 좋아 공부하는 기분으로 봄  ","6"
"901","관람객패터슨이 너무잘살고잇는것같아보기싫엇다 불행갈등하나도없고 주제의식도없다  ","6"
"902","돈낭비시간낭비끝판왕 평론가가 왜 필요없는 직업인지 알수 있게해줌  ","1"
"903","낯선 일본인이 건넨 빈 노트 한권 그안에 모든 것이 담겨 있다.  ","9"
"904","관람객짐 자무쉬의 아름다운 일상 시. 하지만 로라씨 버전도 보고싶다.  ","8"
"905","관람객명불허전 자무시. 최고.  ","10"
"906","관람객일상을 비추는 시와 같은 영화.소설 같은 영화를 기대하셨으면 지루했을지도.  ","9"
"907","관람객짐 자무시, 그가주는 잔잔한  오후의 홍차같은 영화  ","10"
"908","패터슨씨는 그렇게 일주일을, 7개월을,7년을 지냅니다. 모든곳이 패터슨, 우리 모두가 패터슨. 당신의 노트는 무엇으로 채워지나요  ","10"
"909","너무 좋다 뭔 말이 필요하고  ","10"
"910","관람객시집 제목과 겹쳐지는 영화다.&#39; 네 아름다움이 온통 글이 될까봐&#39; -패터슨의 눈빛, 미소, 그 마음이 다 시가 되어 두근거리는 영화.  ","10"
"911","관람객감독의 문체 대사 연기, 음악 모두 다 여운이 짙다. 사랑하는 사람과 보는것도 추천한다  ","10"
"912","관람객밝은 공기에서 물이 떨어진다  ","10"
"913","관람객모든 사람들은 예술가이다  ","10"
"914","배우부터 모든  내용이 ..보세요  ","10"
"915","완벽하고 아름다운 영화- 평범한것들 사이에 숨어있는 특별한  보석을 발견한듯하다  ","10"
"916","극적이지 않은 패터슨의 일상 속으로  ","10"
"917","관람객올해를 장식할수있는 최고의 영화  ","10"
"918","보고나서 개운한 영화는 처음이다. 잔잔한 음향효과와 뛰어난 영상미가 힐링하게 해준다. 평소보다 집중해서 본다면 눈에 띄지 못했던 디테일들이 보인다. 하루하루 반복되는 일상 속에서도 충분히 행복을 찾을 수 있다는 것을 늬우치게 해준다.  ","10"
"919","관람객한 틈의 삶으로도 시를 노래할 수 있음을. 한 줄의 시로도 삶을 이어갈 수 있음을.  ","10"
"920","관람객시. 일상. 리듬. 반복  ","10"
"921","관람객.,.,.,.,.,.,.,.  ","10"
"922","관람객짱재밋어요 와우 와우 와우 모두들 메리크리스마스  ","10"
"923","관람객소소한 일상 아하 아하 아하 기억남네요  ","10"
"924","관람객포스터 문구대로 일상의 아름다움을 보여준 영화였어요. 다른 상업영화처럼 극적인 사건이나 스피드한 스토리 진행은 없었지만 사소한 일에 웃고 행복할 수 있었던 좋은 시간이었습니다. 딱 제 스타일이네요.  ","10"
"925","관람객water fall.  ","6"
"926","관람객올해 본 영화 중에 제일 좋았음!!  ","10"
"927","추천합니다  아하   나는 시로 숨을쉰다  ","10"
"928","관람객좋어요.... 아하 아하  ","10"
"929","관람객평범함 속의 특별함. 당신의 텅 빈 페이지를 두려워 마라.  ","10"
"930","삶에 녹아든 시, 시에 녹아든 삶. 짐 자무쉬 감독이 우리에게 들려주는 일상적이고 낭만적인 시 한 편  ","10"
"931","잔잔한 영화 끝판왕. 마빈도 한몫!ㅋㅋ  ","10"
"932","관람객좋은 영화이네요...  ","10"
"933","관람객올해를 마무리하기에 최고  ","10"
"934","관람객뉴저지의 패터슨시는 좋겠다. 패터슨이란 시인이 있어서.. 낮엔 버스를 몰고 틈틈이 시를 쓰고 그리고 개와 산책 후 한잔의 맥주.. 무엇보다 아내를 사랑하는.. 그는 시인이다. 카일로 렌에서 패터슨으로의 주인공은 사랑의 시인이다.  ","10"
"935","관람객여운이 남는 영화입니다.  ","10"
"936","No ideas but in things  ","10"
"937","관람객성실하고 신중하게 보내는 일상의 모습이 좋습니다  ","10"
"938","자무쉬의 절제된 수다는 이제 노골적으로 시의 형식을 차용해 흐른다. 여백과 함축과 정제의 미학.  ","6"
"939","관람객크리스마스 연휴에 보기 너무 좋은 영화였던거 같아요 ^^  ","5"
"940","관람객환경 분위기 너무 따뜻해지는 영화 였습니다  ","10"
"941","관람객완전 감동 좋았습니닷~~~  ","10"
"942","관람객패터슨의 패터슨. 그 속도대로 그대로 너무 좋다.  ","10"
"943","관람객아름다운 영화.엽서같은 영상미  ","10"
"944","관람객평범한 일상 속에 일어나는 크고 작은사건들, 그리고 그가 적는 시어쩜 삶이란 이런 것이다  ","10"
"945","잔잔하지만 일렁인다.  ","10"
"946","관람객지금 노트 사러 갑니다.  ","10"
"947","관람객사랑에 빠지면 누구나 시인이 된다.일상을 예술로 승화시킨 짐 자무쉬구도가 아름답다.  ","10"
"948","관람객다 보고나니 참으로 차분해집니다  ","10"
"949","관람객아하! 평범한 사람을 연기하는 아담 드라이버의 연기가 멋집니다!:D  ","10"
"950","관람객일상의 시를 쓰는 영화ㅔ  ","10"
"951","관람객오래 기다린 보람이 있다. 진정한 영화  ","10"
"952","이 영화 재밌다고 하는 사람들 ㄹㅇ 참 ture 100퍼 400퍼 알바생으로 의심해야됨. 영화자체가 침묵수준. 3류드라마 3편보는게 더 재밌을듯. 불면증있는사람들에게 이영화 강력 추천합니다.  ","1"
"953","관람객일주일의 평범하지만 고마운 날들을 소박하개 담은 영화  ","10"
