"","reviews","points"
"686","가족영화다운  전편보다 더 재미있어요  ","10"
"687","관람객영화패링턴2가족애그린영화이다  ","10"
"688","재미있게 잘 보고 왔어요~~ 아이도 좋아했고요. 따뜻해지는 영화네요.  ","10"
"689","정말 재미있게 봤습니다.  ","10"
"690","마음이 순수해지는 영화임 ㅋㅋ  ","10"
"691","관람객아이들보기에 재밌는영화에요^^  ","8"
"692","관람객생각보다 재밌었어요 제딸은 코코보다 더재밌다고 또보고싶다네요  ","10"
"693","관람객아이들이 재미있고 슬프기도 했다고 잘보고 나왔다고합니다  ","8"
"694","관람객감동에교훈까지,최고!  ","8"
"695","관람객너무 재밌어요 적극 추천합니다  ","10"
"696","관람객가족영화로 추천 꾹~~^^  ","8"
"697","최근 아이를 위한 영화 중 가장 감동적인 영화였습니다~~  ","10"
"698","1편이랑 비슷하긴 한데 겁나 재밌음ㅋ  ","10"
"699","관람객무해하고 아름다운 현대판 동화  ","10"
"700","관람객아이들이 정말 재미있어해요~~~ 실사라 더 재미있는 듯 하네요.  ","10"
"701","맘이 너무 따뜻해져요ㅠㅠㅠ좋아용  ","10"
"702","패딩턴2 재미있었습니다  ","10"
"703","관람객아이가 재미있대요잘봤어요  ","10"
"704","너무재미있어요!패딩턴3도 나왔으면 좋겠어요.?  ","10"
"705","딸이랑 보는데 넘 잼났어요^^  ","9"
"706","재밌어요. 많이들 보세요. 편안하게 웃을 수 있어요.  ","9"
"707","행복을 전달하는 패딩턴!  ","7"
"708","관람객아이랑 재밌게 봤어요 중간부분엔 아이가 살짝 지루해했지만요  ","8"
"709","지루할틈이 없는 영화 하지만 지루할만한 스토리  ","8"
"710","아이들이랑 친구들, 엄마들 다같이 봤어요 중간중간 어른도 아이도 낄낄거리며 모두들 재미있게 봤어요~ 강추에요!!!  ","10"
"711","관람객잘봤습니다 감사합니다  ","10"
"712","관람객1편만큼이나 재미있게 봤네요~~  ","10"
"713","관람객아이들과 방학을 맞아 정말 유쾌하게 볼수있는 그런 애니메이션이에요~~!!  ","10"
"714","동심으로 돌아가서 , 웃다보니 끝났더라구요~~~^^  ","10"
"715","이번에도 재미있었다.  ","8"
"716","관람객감동적이었습니다  아이들도 좋아했어요  ","10"
"717","관람객A long bear years ago...  ","8"
"718","관람객재밌어요. 원래 좋아하던 배우가 패딩턴 성우 맡았는데 과장되긴 했지만 연기를 잘해서 더 몰입이 됐어용...ㅎㅎ벤 위쇼  ","10"
"719","너무 귀엽고 웃기고 마음편하게 잘 보고 왔습니다:)  ","10"
"720","힝 진짜 재밌었어요!!특히 그 기차씬이...최고입니다 극장에서 큰소리로 웃으면서 봤어요ㅎㅎ  ","10"
"721","완전 사랑스러운 패딩턴ㅎㅎ 악역에 조연들도 사랑스럽다니ㅎㅎ  ","9"
"722","관람객재밌어요. 패딩턴 1보고 딸아이가 보고 싶어해서 봤는데 재밌었습니다. 추천해요~~  ","10"
"723","너무재밌습니다 강추!!!!  ","10"
"724","관람객사람과 곰의 진정성있는 소통.감동적이었어요.  ","8"
"725","관람객너무 재미있었어요7살 딸은 가족들 면회안올때는 슬프다고 울기도하고 웃기도하고 하더라구요~^^  ","10"
"726","관람객너무 재미있게 잘봤어요 패딩턴 너무 착해요!!  ","10"
"727","관람객어린이 영화지만 재밌게 봤어요  ","10"
"728","재밋네요  1편은 전체관람가  아닌걸로 아는데  ","10"
"729","관람객패딩턴 너무 착해ㅠㅠ 귀여움  ","10"
"730","패딩턴 완전 꿀잼이에요~ ㅋㅋㅋ  ","10"
"731","관람객초등생을 위한 애니 ㅋ 그럭 저럭  ","8"
"732","너무 사랑스러운 영화!! 패딩턴의 순수함에 웃음이 나오면서 행복해지는 영화였어요!!!울적할때 봐도 기분전환 될 만한 명작입니다!!! 3탄도 꼭 나왔으면 좋겠어요!!!!귀염둥이 아기곰??  ","10"
"733","관람객재미는 있었지만 앤딩이 좀 그랬어요.  ","7"
"734","관람객아이들이좋아해서 즐거운거같아요  ","6"
"735","관람객재미있어요 아이들이 좋아할듯  ","8"
"736","관람객아이가 아주 재미있게 보았다고 합니다  ","10"
"737","관람객재밌게 봤어요 ㅎㅎ 깔끔한 영화네요 ㅎㅎ  ","10"
"738","애기들 영화라지만..저는 왤케 웃고울고 했는지ㅠㅠ 넘 행복한 영화였어용!!!  ","10"
"739","근데 굳이 휴그랜트가 책까지 훔칠 필요가 있었을까? (안 사고 명소가 어디인지만 메모해도 되었을 텐데.) 그래도 재밌었으니까 넘어가기로 하자.ㅋ  ","10"
"740","2017 2018 본 영화 통틀어 가장 좋았어요! 마음 따뜻해지고 재밌었던 영화에요 ㅠㅠㅠ 코코보다 좋았습니다!1편 안 봤는데 찾아서 보려구요  ","10"
"741","관람객애들이랑 넘 재밌게보고나왔어요~ 굿!  ","8"
"742","곰이 너무 예뻐요.아이도 좋아하네요  ","8"
"743","곰한테 입덕사할뻔 설연휴에 입소문타고 흥행 가능할거라 봄  ","10"
"744","재밌습니다애들과 데리고 갔는데 어른인 제가 더 재밌게 본거 같아요  ","10"
"745","관람객최고 아이들과 즐거운시간을 보냄  ","10"
"746","관람객재밌지만 1탄보고 기대 너무해서그런지 그냥 훈훈한정도였네요 그래도잼나요  ","8"
"747","관람객지루하지않게 잘 봤어요  ","7"
"748","아이들이  정말 좋아할 거 같아요.  저도 재밌게 봤습니다.  ","10"
"749","관람객재밌어요! 아이듷이 좋아해요^^  ","10"
"750","1편보다 귀엽곰 사랑스럽곰  ","10"
"751","나 혼자 봤는데도 진짜 최고였음  ","10"
"752","진짜 너무 따뜻하고 좋아요 ㅜㅜㅜ행복한 영화입니다  ","10"
"753","너무 착한 패딩턴 ㅜㅜㅠㅠ  ","10"
"754","기대하고 봤는데 기대만큼  재미 있었어요~~  ","10"
"755","오랜만에 극장에서 웃었다  ","10"
"756","패딩턴 너무귀여워요!!!!ㅠㅠ 친구하고싶다 ..  ","9"
"757","나홀로 집에와 가위손을 이을 만한 가족영화의 수작. 휴 그랜트 님 존경합니다.  ","8"
"758","보는 내내 행복한 영화였어요 ♥ 조만간 1도 찾아볼 예정입니다!  ","10"
"759","동화가 가지고 있는 포근한 선의(善意).  ","7"
"760","관람객전편을  가뿐하게 뛰어넘는 몇안되는 영화!!!  ","8"
"761","최고다 넌^^웃다가 너왔네 즐거운 곰  ","10"
"762","He is but a cub!  ","4"
"763","관람객평점도 좋고 후기가 좋기에1편은 보지도 않았지만 기대했는데실망. 그저그런  ","8"
"764","재밌는장면 아주 조금. 너무 지루하고 졸렸다. 왜 재밌다는지 모르겠는 영화  ","4"
"765","솔직히 말해서 그렇게 재밌진않아요기대하고 갔는데 애들이 지겹다네요  ","6"
"766","너무 귀여운 패딩턴~아이들이 긴 시간 꿈쩍않고 본 영화는 처음이였어요^^  ","10"
"767","관람객시간가는줄 모르게 봤어요 ㅎㅎ  ","9"
"768","너무 재밌당 ㅁㄴㅇ ㅁ ㄴㅇㅁ ㄴ  ","10"
"769","관람객귀여워요~~ 헨리 아저씨 하드캐리  ","8"
"770","1편보다 뭔가 조금 부족했지만 꿀잼!!! 휴그랜트는 진짜 남자가 봐도 존멋이더라  ","9"
"771","토요일에 초6학년 딸하고 딸친구 보여줬는데재미있었대요  ","10"
"772","관람객ㅇㅐ들이랑 꼭 보세요!  ","8"
"773","너무 어린 자녀들과는 같이 감상하지 말기를  ","7"
"774","아이에게 보여줬는데, 아무래도 1편만큼 재밌지는 않은가 보네요.  ","5"
"775","개봉한지얼마나됬다고 영화 벌써 내릴준비하냐 다른영화가 돈 더주더  ","1"
"776","일욜 조조로 봤음. 출발비디오여행에 낚인 기분..  중간에 조금 지루함.. 4~5세 어린 아이들 데리고 온 부모님들 중 3팀 영화 보다가 중간에 나감.. 어린 아이들은 지루해 함  ","7"
"777","관람객재미는 있는데... 6살짜리 아들내미가 이해하기에는 조금 어려운 개그코드가 ..  ","10"
"778","디즈니나 픽사영화처럼 어른이 봐도 재밌길 기다하면 절대 안됨. 완전 유치한 유아용 영화. 정작 얘들도 집중을 못함. 더빙판 상영 극장갔더니  꼬맹이들 30분 지나니까 다 어수선해져서 총체적  쓰레기 분위기였음  ","1"
"779","시간이 아깝다는 생각이 드네요  ","1"
"780","나만졸았나보구나...  ","2"
"781","관람객아이들은 재밌어하나 어른이 보기엔 다소 현실성 없는부분이 많네요. 그만큼 찌들었단거겠죠? ㅋ  ","6"
"782","관람객인형이 귀엽네요... 내용 자체는 그냥 저냥... 딱 시간 때우기용 인것 같네요  ","8"
"783","이 영화로 힐링하기엔 동심이 메말라버린듯. 아이들과 함께 볼 영화를 찾는다면 추천  ","6"
"784","동화적 감성에서 살짝 더 나간 감옥미화  ","7"
"785","성인이 보기에는 내용이 지루하다...  ","5"
"786","차우니마내돈OOOO  ","2"
"787","영화를 왜 잠오게 만듬? 침대인줄알았네 노잼 진짜 0점 없나요? 1점도 아깝다 으~~~~  ","1"
"788","귀엽다 외에는 무슨 내용인지 모르겠네.. 착하게 살면 사람들이 알아서 도와준다. 정도...  ","2"
"789","ㄹㅇ 노잼이더라 최근에 그 픽사꺼 영화보고 애니 재밌을거같아서 봤는데 절레절레 ;  ","1"
"790","자다가옴..첨만재밌음  ","1"
"791","잠이 쏟아졌지만 돈이 아까워서 이악물고 버텼습니다.  ","1"
"792","영화 보는중인데...평점에 속았음너무 유치함ㅜㅜ 10세이하수준인가봄  ","2"
"793","걍 유쾌한 해피엔딩 가족영화..10점으로 도배된건 알바같기도..난 몇번은 웃었지만 좀 지루했고, 같이간 친구는 워낙 자잘한거 별거아닌걸로도 잘 웃는 친군데 나름 잼있게 봤다고 함.  ","5"
"794","진짜 재미 드럽게 없다.  ","1"
"795","1편은 너무 재밌게 봤다. 2편은 그냥 어린이용 소품. 어른이 보기엔 무리. 실망스럽다.  ","6"
"796","1점도아까워ㅠㅠ블랙펜서나봐야지  ","1"
"797","걍 곰새끼 표정이 맘에안듬 곰탕끓여서 먹고싶네  ","1"
"798","난 그 샷건 레밍턴 그거에 관련된 영화인줄 알았는데 패딩턴이야....하....  ","1"
"799","아들은 옆에서 보고 저는 잠들었네요아들도 40분정도 지나니 집중 못하고 어수선해지네요극장에서 보기 돈 아까워요  ","1"
"800","관람객잼있을 틈이없다. 지루함의 연속빨리 3편이 안나왔으면 좋겠다  ","2"
