"","reviews","points"
"1","BEST1보다 나은 속편 없다는 말은 이걸로 깨진 듯. 재밌고 귀여워요!!  ","10"
"2","BEST정말 정말 재밌게 봤어요. 입소문나면 흥행할 것 같아요.  ","10"
"3","BEST끝날때 까지 지루할 틈이 없다  ","8"
"4","BEST걍 웃김ㅜㅜ 오랜만에 영화관에서 크게 웃고 나왔다ㅋㅋㅋ 꼭 보셈 존나 귀여우니까ㅜㅜ  ","10"
"5","BEST진짜 개꿀잼!!!! 패딩턴 역대급 귀여움 ㅠㅠ  ","10"
"6","차갑게 식은 감성을 따뜻하게 감싸줄 영화  ","10"
"7","봤어요 드디어ㅠㅠ 역대급 귀여움입니다 ㅠㅠㅠ 패딩턴 역에서 패딩턴 인형 들고 사진 찍고 싶었는데 패딩턴 보는 순간 덕후가 됩니다. 패딩턴 안 본 사람은 있어도 한 번만 본 사람은 없다. 하... 딩턴이 ㅠㅠ  ","10"
"8","진짜 재미있다 패딩턴 귀여워♡♡  ","10"
"9","5살 아이와 봤는데 엄청 재밌게 보더군요ㅋ 물론 36살도 재밌게봤어요ㅋ  ","10"
"10","관람객너무 재밌었고 제 인생영화 등극했습니다. 곰돌이한테 의지해보긴 처음이네요 ㅋㅋ  ","10"
"11","처음부터 끝까지 쉴틈없이 재밌어요!!ㅋㅋ  ","8"
"12","조선 명탐정 보다 이게 더 재밌다  ","10"
"13","스토리도 재밌고 의외로 영상미도 좋다ㅋㅋㅋ추천  ","10"
"14","관람객귀여운 패딩턴 잊을수가 없네요  ","10"
"15","아~ 너무 재밋고 가슴 따뜻해지는 영화였어요. 우리 패딩턴ㅎㅎ 귀엽고 예의 바르고 그러면서 실수하고ㅎㅎ 좋아하는 배우들도 많이 나와서 좋았고 능글능글 자연스러운 휴 그랜트 연기도 재밋고, 영상미도 까지 있었고ㅎ 기대보다 너무 좋았던 100분^^  ","10"
"16","패딩턴~대박귀엽게2탄으로컴빽했는데~1탄보다더재미있으면반칙이야  ","10"
"17","100분 동안 벌어지는 동화 같은 곰돌이 이야기입니다 ^^ 성인 혼자 봐도 좋고 연인끼리 봐도 좋고 아이들끼리 봐도 좋고 참 좋은 가족 영화긴 한데.. 개인적으로는 1편에 비해 패딩턴의 등장 시간이 적어진 거 같아 좀 아쉽습니다  ","10"
"18","아 너무 귀엽고 착하고 짠하고 ㅋㅋㅋ 기분 좋았어요 진짜 힐링 무비네요  ","10"
"19","25,27살먹었는데 영화관에서 애들보다 더 재밌게본거같아요 ㅋㅋㅋ 진짜 넘 사랑스럽고 귀여운 영화네요 한번 더 보려구요 완전 취향저격입소문좀 탔으면!  ","10"
"20","1탄만큼의 재미에 조금 더 커진 뭉클함!  ","10"
"21","귀여움으로 멱살 잡힌 채 끌려가도 행복하다!  ","10"
"22","오렌지 마멀레이드 샌드위치가 먹고싶을거임..  ","10"
"23","관람객기대한 것 보다 훨씬 재밌었어요!3탄 나와라 3탄 !!!! ㅋㅋㅋㅋ  ","10"
"24","이 영화에 이렇게 빠질줄은 몰랐습니다ㅜㅜ 동화같으면서도 너무 이쁜 영상들과 패딩턴♡  ","10"
"25","로튼토마토 지수 100% 입소문만 잘 뜬다면 흥행할수 있는데 관객 성적이... 조선명탐정에 밀리고 있어서 아쉽다.. 학생들이 많이 안보로 오는건가?  ","10"
"26","1편도 봤는데 더 재미있어요...이야기는 어찌보면 평범한데 그걸 표현하는 방식이 세련되어서 어른이 보기에도 좋아요. 전 9세 아들이랑 봤는데 둘다 재미있다고 웃었어요.  ","9"
"27","지루한틈 없이 우리에게 좋은 교훈을 주는 영화인것 같아요! 강박한 사회에서 이런 이웃과 친구들이 많았으면 좋겠네요 ㅎ  ","8"
"28","재관람하려고 봤더니 관이 벌써 거의 없네요;; 주변에 애들 친구 엄마들한테도 연휴때 꼭 보라고 했었는데 이래서야 보고싶어도 볼수가 없겠네요;; 설연휴에 애들하고 볼 가족영화 없던데 이걸 벌써 이렇게 내려버리는건 좀 문제가 있지 않나요?  ","10"
"29","♡최고 웬만한 영화들보다 짜임새 구성  ","10"
"30","기차 추격 씬에서 주성치 영화에서나 나올듯한 장면이 하나 있었는데 빵 터짐. 런던 팝업북 탐남.  ","8"
"31","영국 문학, 명소 그들의 문화에 대한 자부심이 스며들어있는 영화였습니다. 세련된 유머와 너클쓰의 표현과 같이ㅋㅋ 몬가 뱃속에서 뜨거운 것이 움틀거리는 감동 느낄 수 있습니다. 런던에 다시 가보고 싶게 만드는 사랑스러운 영화입니다.♡♡♡  ","10"
"32","패딩턴  끌어안고 자고싶다..!!!  ","10"
"33","진짜 너무 귀엽고ㅠㅠ사랑스러운 패딩턴 패딩턴 인형팔았으면 좋겠닷 &gt;&lt;  ","10"
"34","진짜 우리나라 영화 상영관 독점은 지독하네요. 이 영화 제 인생영화인데 개봉한지 얼마 되지도 않았구만 벌써 볼 곳이 없네요. 다내렸어요.  ","10"
"35","조조로 봤는데  하루 시작을 즐겁게 시작해 정말  하루가 행복했어요!  ","10"
"36","휴 그랜트가 제대로 망가지는 영화  ","10"
"37","상영관 찾기가 너무 힘들다.. 염력이랑 조선명탐정같은 쓰레기 한국영화땜에 이런 꿀잼영화가 묻히다니 진심 안타깝다  ","10"
"38","3편이 벌써부터 기대가 됩니다. 초반에 잠시 잠시 나왔던 것도 단하나 그냥 넘어가는 것 없이 나중에 쓰입니다. 그런면에서 참 좋고 나이 상관없이 즐길 수 있는 영화 인 것 같습니다.  ","10"
"39","관람객1을 안봐서 걱정했는데, 장면장면마다 재미있고 스토리도 꽤 흥미진진해서 아이랑 완전 몰입하면서 봤어요. 집에 와서 vod로 1편도 찾아서 봤습니다. 영국영화 특유의 느낌도 나서 오랜만에 재미있었네요.  ","10"
"40","관람객정말 잼났어요.애들이 감동적이래요  ","10"
"41","관람객딸아이와  함께  울고  웃고^^넘나  즐겁고  행복하게  봤어요^^  ","10"
"42","개꿀르잼 신선학고 웃기다  ","10"
"43","관람객1편과 같이 너무너무 재미있어요~딸래미 또 보고 싶다고 하네요~역시 패딩턴이예요~마지막장면에서 저도 모르게 눈물 찔끔 했네요~  ","10"
"44","관람객7세아이와 정말재밋게 봤어요~아이가 울기에 왜우냐물었더니 패딩턴이감옥에 갇힌게 불쌍해서 운다고..너무나 감동적인 영화 정말잼있게 봤어요~  ","10"
"45","패딩턴완전귀엽러블리~내용이랑영상 다귀엽고재미집니다 꼭보세요!!시간대가 너무없어서 안타까움ㅠㅠ  ","10"
"46","개인적으로 올해 가장 사랑스러운영화이자 내 생에 가장 사랑스러운 영화가 될거같다.  ","10"
"47","진부하다고 느껴질수있는 전개지만 예상치 못한 코믹요소 마음따뜻해지는 대사 한마디가 인상깊은 영화에요 보고나면 마음이 따뜻해지고 패딩턴의 무한 긍정 매력에 빠지는 느낌이에요 거기에다 보기좋은 영상감은 뽀너쓰패딩턴1도 찾아봤는데 정말 재밌게봤습니당!  ","10"
"48","시간아은쥴 ㅁㅎ르고좟닝!  ","10"
"49","오늘 보고왔습니다. 최고입니다!  ","10"
"50","재밌어요 어른들을 위한 동화였네요  ","10"
"51","영화가 사랑스럽다는 말은 이 영화를 위한 말이다.  ","9"
"52","역시 실망시키지 않았습니다.  ","10"
"53","정말사랑스럽고..영상미 내용 음악 모두 최고에요♡  ","10"
"54","진짜 말도 안되게 귀여움! 꼬마들은 당연히 좋아하겠지만, 귀여운거 좋아하는 어른들도 실망 안하고 볼 수 있을 듯!  ","10"
"55","관람객값비싼 물건이 아닌 가족이 바로 그 무언것보다 값지고 가장 큰 선물이다  ","9"
"56","관람객아직 애기곰인 패딩턴한테 배워가는게 많네요^^  ","10"
"57","로튼토마토신선지수1000%  ","10"
"58","영화 보기 직전에 기분나쁜 일 생겨서 씩씩대며 들어갔는데 사르르 녹아서 나왔어요... 지친 모두에게 바치는 행복한 영화  ","10"
"59","이거 진짜 재밌고 곰덕되는데...패딩턴 덕후로써 홍보 더 되었음 좋겠어요ㅜㅜ 진짜 꼭 보세요 사랑스러움 그 자체에요....♥  ","10"
"60","관람객내 나이 스물일곱... 관람 후 박수를 쳤습니다. 너무 귀엽고 꿀잼이고 1을 안봤는데도 재밌었습니다. 1도 봐야겠어요~~~~  ","10"
"61","시간가는줄 모르게 재밌음 ㅠㅠ 흥해랏 패딩턴!!!  ","10"
"62","패딩턴2 넘나 재미있는것패딩턴3도 나오면 입소문으로꾀 유행할 듯!!  ","10"
"63","따뜻한 마음이 전해지는 가족영화  ","10"
"64","진짜 자밌어요 미국코미디에 딱 맞으면서도 감동받았네요  ","10"
"65","이번주 토요일 남자친구와 보러 갈건데.너무 기대 되네요 ㅎㅎ 패딩턴1도 같이 봤는데 만족이였습니다 ^^  ","10"
"66","관람객1편도 잼나게봤는데 2편역시 부담없이 아이들과 재밌게 하하호호 웃으며 봤네요ㅎ 패딩턴 짱ㅎ  ","10"
"67","너어어어무 사랑스러워요!!  ","10"
"68","재밌었다. 처음 교도소 장면이 나올때는 동심이 파괴되는장면이 나오지 않을까 염려했는데 모든일을 너무 아기자기하게 잘풀어나가 굉장히 좋은영화라 생각한다.애들과 성인 둘다 보기 적합한 영화라 본다.:)  ","10"
"69","영화를 보는 내내 미소가 꺼지지를 않았다. 너무 좋은 나머지 그 기분을 좀 더 간직하고싶어서 엔딩크래딧 끝까지 다 보고왔다. 순수하고 귀여운 동화 그자체. 이렇게 좋은데 왜 상영관은 많이 없을까.. 다시 보고싶어도 볼 수가 없네..  ","10"
"70","진짜 따뜻하고, 귀엽고 재밌어요 ㅠㅠ 2보고 나서 1도 봤는데 다락방에서 찾은 보물같은 영화네요 ㅠㅠ 제발 보세요  ","10"
"71","정말너무너무귀엽고ㅠㅠ 완성도가너무높아요 너무잘만든영화 1편도정말좋았는데 이번엔더업그레이드됨ㅠ  ","10"
"72","이건 정말 꼭 봐야해요!! 사랑스러운 딩턴이와 행복한 시간이었어요 ^^*  ","10"
"73","한편의 런던표 동화책 읽은 기분이였다. 보고 있던 중에도 행복했고, 영화를 다 보고 난 후에도 행복했다. 귀여운 패딩턴 솔직히 1편보다 훨씬 재미있다! 귀엽게 웃김ㅎㅎ분홍죄수복ㅎㅎ휴그랜트 미워할 수 없는 악당 늙어도 멋지네요 마지막에 간수님 날 가둬요  ","10"
"74","마음이 몽글몽글 온가족이 함께 보면 좋을 영화  ","9"
"75","ㅠㅠ진짜 시간 가는줄 모르고 ㅋㅋㅋ몰입하고 봤어요!!! 패딩턴1도 시간 순삭하면서 봤는데..역시 최고 ㅠㅠㅠ 여러분 1도 보고 가세욤 이어지는 역할이 있어서 알고가야 더 재미있는거같아옹  ","10"
"76","마음이 따뜻해지는 영화! 보는 내내 미소를 짓게 되는 귀여운 영화였어요ㅠㅠ  ","10"
"77","너무웃기고 재밌어요!! 강추강추  ","10"
"78","내가 이 나이 먹고 봐도 넘나 재밋게 잘 봐부럿스 캐릭터도 너무 귀엽고 취향 저격 해부럿스 조카들 델고 또 보러 가야쓰것는 영화여 ????  ","10"
"79","계속 실감나고 멋지다.  ","10"
"80","1보다 잼나욬ㅋㅋㅋㅋ귀여워ㅋㅋㅋ큐ㅠㅠㅠ  ","10"
"81","패딩턴 핑크 죄수복이 너무 귀여워요!!!  ","10"
"82","진짜 웃겨요 ㅋㅋㅋ!!  귀엽ㅠ  ","10"
"83","ㅣ편보다 스케일도 재미도 따뜻함도 더 커졌다  ","9"
"84","관람객강추강추 감동의 물결이 파도칩니다!!!꼭 보세요  ","10"
"85","너무나 사랑스러운, 행복해지는 영화 , 아이,어른 모두 좋아할만한 영화라고 생각합니다.  ","10"
"86","처음부터 끝까지 유쾌하고 감명깊은 영화다.패딩턴 너무 귀여워.  ","10"
"87","관람객재밌어요~재밌어요~  ","8"
"88","창문닦을때 너무 귀여웠음ㅠㅠㅠ 토실토실궁딩이  ","10"
"89","그냥.... 마음이 너무 몽글몽글 해지는... 가슴이 따듯해지는 영화에요...  ","10"
"90","패딩턴과 함께 마음을 따뜻하게 해주는 영화인듯해요 1편도 좋았는데 2편까지 재밌다니!색감과 카메라 구도등 영상미도 너무 예쁘고 짜임새있어요! 이러한 영화들도 앞으로 꾸준히 나왔으면 좋겠어요 가면 갈수록 사라져가는거 같아요ㅠㅜ  ","10"
"91","오히려 1보다 2가 더 좋았습니다. 아기자기 영상미가 너무 좋았고 감동적입니다. 아이들부터 어른들까지 함께 보기 좋은 영화. 3도 나왔으면 좋겠어요.  ","10"
"92","관람객너무 재밌었고 스토리가 좋습니다더빙말고 자막으로보세요!진짜 재밌었고, 나름 느끼는게 많았고 알찬시간이었음, 답답하거나 그지루한 부분도 없고 짜임새가 좋음..단점: 애기들이 많아서 뒤에서 어떤애기가 시끄럽게하고 스포조금 해서 짜증나서 자리옮김  ","10"
"93","관람객딸아이도 저도 재밌게 봤어요^^큰 기대없이 가서 그런지 생각보다 코믹하고감동도ㅋ  ","10"
"94","관람객넘 재밌고 가슴 따뜻한 이야기~~ 아이가 1보다 더 재밌다네요  ","10"
"95","소포모어 징크스 없는 완벽한 후속작  ","10"
"96","관람객아이들도재밌다하고저도즐거운시간이었고감동적인영화였어요  ","10"
"97","관람객우리 아이들이 너무 재미있었데요  ","10"
"98","관람객재미와  감동까지 있네요~~^^  ","10"
"99","관람객별10개줘도 안아까워요딸래미보다 제가 더 힐링돼구, 감동받았네요 강추합니다  ","10"
"100","관람객오.패딩턴 !시간가는줄모르고봤어요 ㅎㅎ  ","10"
"101","관람객8살 아들이랑 같이 봤는데 너무 재밌어 하드라구요 전체가람이라 지루할 줄 알았는데 저도 재밌게 봤어요  ","10"
"102","역시 패딩턴!!!우리 아이가 1편보다 2배로 더 재밌다고 하네요~저 역시 재미있었구요.아이가 평점 등록해야 한다고 해서 처음으로 남겨봅니다 ㅎ  ","10"
"103","관람객어른이 봐도 재밌네요.패딩턴 눈빛에 빠져들어요.  ","10"
"104","너무나 감동적이었어요 그래서 두번이나 눈물도 흘렸어요 영화평 남긴 영화는 패딩턴이 처음이에요 시즌3도 나왔으면 좋겠어요  ","10"
"105","관람객짱잼 꿀잼 왕잼 너무 즐거운 시간이었어요  ","10"
"106","관람객유치할줄 알았는데 재밌고 귀여웠어요ㅎㅎ  ","8"
"107","ㅜㅜ패딩턴이 너무 귀여워서 힐링되는 영화였어요  ","10"
"108","관람객연출도 좋고 패딩턴은 여전히 너무 귀엽고 애들뿐만 아니라 어른들도 함께 즐길 수 있는 영화입니다. 정말 좋은 영화인데 관객수가 적어서 안타깝네요  ","9"
"109","관람객아이가 재밌었다고 패딩턴 1편도 보고싶다고하네요  ","10"
"110","상영관이많이없어서 안타까움 ㅠㅠ 진짜 재밌는데 역시나 패딩턴은 귀여웠음  ","10"
"111","상영관을 내놔라.보고싶어도 볼수가없네  ","10"
"112","너무 재밌게 봤어요마음이 따뜻해지는 영화♡저는 38세입니다알바아니예요  ","10"
"113","관람객8세 11세 40세 43세 잘봤습니다.스토리가 있고.. 재미잇네요.  ","9"
"114","관람객오랜만에 딸내미랑 신나게 웃었어요^^ 패딩턴이 너무 귀여웠어요 개인적으로 그 팝업북 함 만들어보고 싶다는 생각을 ㅎㅎ  ","10"
"115","와,,왠만하면평점잘안다는데진짜너무재밌게봤어요다른영화들은다본영화였고남은시간이있어서이걸로예매하고봤는데후회하지않습니다마지막까지즐거움을주는영화강추  ","10"
"116","센스, 위트, 감동, 메시지 완벽한 영화 무덤덤하게 패딩턴이 말하는 루씨 숙모의 가치를 우리는 잊고 살지는 않는지  ","10"
"117","귀엽고 사랑스럽고 재밌고 다했어요! 보는내내 엄마미소 짓게 만든 패딩턴 색감도 너무좋고 나오는음악역시 좋았습니다 :)  ","10"
"118","꿀잼패딩턴 너무 사랑스러움  ","10"
"119","기여워 죽을뻔했어용 꼭보세요  ","10"
"120","9살 5살 딸내미들과 재미나게보고 왔어요~~~ 1편은 안봤는데 집에 와서1편까지. 다운받아 봤네용~~^^귀엽고 코믹하고 감동있고 잼있어용  ","10"
"121","관람객아이랑 보기 좋은 가족영화네요.재밋게봤어요  ","8"
"122","관람객너무 재밌고 감동적이었어요  ","10"
"123","관람객패딩턴 넘나 귀여워요. 마음이 정화되는 것 같은 영화예요.  ","8"
"124","관람객저는 코코보다 이게 더 재밌었어요 깔깔거리면서 봤네요ㅎ 7살 아들이랑 더빙으로 봤는데도 이질감 없네요ㅎㅎ  ","9"
"125","이것이.. 말이 필요한가?  ","10"
"126","관람객남자칭구 대리고 갓어여 둘다 재밋게 봣어영  ","10"
"127","관람객평점 좋길래 봤는데 재밌어요~ 단순히 귀여운걸 넘어서 마음까지 따뜻해지네요  ","10"
"128","패딩턴 너무 귀엽다 ㅠㅠ 감동적이고 재밌고 연기 다 좋아요  ","10"
"129","관람객주말에 애들과 함께 영화보고 좋았어요  ","10"
"130","여섯살 딸아이와 재밌게 봤네여 ^^강추합니다  ","8"
"131","오늘봣는데재밋구 웃겨용  ","10"
"132","유쾌하고 보고나서도 기분 좋아지고 힐링되는 영화였어요 캐릭터들도 너무 매력적이고 1.2 모두 정말 재밌게 봤습니다 패딩턴 귀여워ㅠㅠ♡♡  ","10"
"133","관람객아이들이 무척 좋아하네요  ","10"
"134","너무 너무 재밌었어요.  ","10"
"135","관람객아이가 많이재밌어하네요  ","10"
"136","꼭 보세요 꾸르르ㅡ잼 핵재밌어요! 런던 시내보는 재미도쏠쏠^^  ","10"
"137","내생애에 최고의 명작이었습니다...  ","10"
"138","아이손에 끌려왔다가 완전 반하고 가네요. 아직도 기분좋은 여운이 남아있어 평점 남겨보아요. 가족끼리보면 정말 후회 안할거에요. 꼭 보세요!!  ","10"
"139","어른이 봐도 좋을만한 동화은 영화!2시간 힐링의 시간 이였음.  ","10"
"140","재밌다!패딩턴 귀엽고 중간중간 웃긴포인트도 많았다. 개인적으로 1편보다 더 탄탄한 느낌!! 상영횟수가 조금 적은 것 같아 아쉽다!재밌어요!!  ","10"
"141","패딩턴 너무 귀여워요 ㅠㅠ 마말레이드 잼 맨날 먹이고 싶어요 ㅠㅠ  ","8"
"142","패딩턴 전편을 안봤어도 이해가 되는영화이자 리얼 코믹!! 귀여운 곰들과 인간들의 파티!! 강추!!  ","10"
"143","ㅠㅠㅜㅜ패딩턴 진짜 너무 귀엽고 스토리도 굉장히 유쾌해서 굿즈있으면 사고싶름  ","10"
"144","너무귀엽고 착하고!레알꿀잼!  ","10"
"145","최고의 가족영화 어른들도 같이 봐도 재밌어요  ","10"
"146","애니메이션이라 지루할줄 알았는데 전혀 안그랬고 진짜 재밌게 봤네요~ 가족들이랑 봐도좋고 친구들이랑 봐도 재밌게 볼수있는 영화입니다  ","10"
"147","귀엽고 깜직하면서 사랑스러운 패딩턴 괜히 로튼100!!!이 아니었네 정말 재미있고 감동적이고 이유없이 그냥 보세요  ","10"
"148","1편 안보고 갔는데 그럭저럭 재밌고 훈훈함. 곰돌이 넘 귀엽고 영국 발음이라 섹시함.  ","7"
"149","재밌네요 전 4세아이땜에 1시간 보다 나왔지만 초3올라가는딸 혼자 잼나게  다 보고 나왔어요.어른이 봐도 재밌더라구요  ","9"
"150","제대로 힐링되는 영화, 착하게 살아요~  ","10"
"151","관람객초등학생 아이들이 재밌어 합니다  ","8"
"152","괜히 평론가랑 외국평점이 높은게 아니네요. 영화 넘 괜찮게 잘만들었네요  ","10"
"153","관람객완전 재미와감동이 넘쳐흘려요♡패딩턴이  너무 귀여워요♡패딩턴 매력에 빠져보세요 ㅎㅎ  ","10"
"154","진심 OO 애새끼들다 개패버리고싶네. 영화관도 노키즈존만들어라 똑같은돈내고 관람권얻어서 보는건대 왜 피해를봐야하는거냐? 더심각한건 부모가지적을안함 머가리똥만찼나 본인자식들만중요해? 상영끝날때까지 내내 시끄럽게떠들고 중간통로 뛰어다니고 대단하다정말  ","1"
"155","진짜 갸꿀잼이네요.. 반지의제왕 이후 정말 속편이이렇게 재밌을 수가 !  ","9"
"156","2편이 더 아기자기하고 보기 좋았음..3편도 나오길 기대  ","7"
"157","1편보다 더 감동적이었던 2편! ♡  ","10"
"158","패딩턴 잡혀갈때 눈물날뻔.ㅠㅠ 패딩턴 너무 귀엽고 사랑스러워요 걸음걸이 완전 치명치명...  ","10"
"159","관람객아이들과 어른들모두 볼만한 영화입니다. 재밋어요  ","10"
"160","관람객꿈에서나 나올 법한 마법같은 이야기 너무 아름답고 따뜻했다  ","10"
"161","너무너무 잼났어요. 따뜻한 영화예요 아이들에게 좋은 영화예요. 패딩턴이 너무 귀여워요강추 강추 ~~~  ","10"
"162","관람객1편에서는 패딩턴의 어이없는 실수들이 답답하게 느껴지기도 했는데, 2편에서는 감동까지 더해져 더 재미있게 봤습니다.  ","8"
"163","너무 감동적이에요 ㅠㅠㅠ 패딩턴도 너무 귀엽고 브리운 가족들 동네 주민들도 너무 따뜻하고 마지막 장면은 진짜 보다 울 뻔했어요 비록 성인이지만 환상에 잠시 빠졌던 기분이었어요 최고  ","10"
"164","관람객편한 마음으로 기분전환하기 딱인 영화! 몽글몽글 해피엔딩이 좋아요  ","8"
"165","관람객겨울이 가기전 최고의 영화  ","10"
"166","정말 사랑스럽다 !! 행복한 영화!!  ","10"
"167","관람객정말 정말 재밌게 봤어요. 입소문나면 흥행할 것 같아요.  ","1"
"168","재밌었곰 사랑스럽곰 귀엽곰  ","10"
"169","진짜 넘 재밌음~ 패딩턴은 사랑입니다♡ 또 보고싶어요^^  ","10"
"170","100점 만점에 1000점  ","10"
"171","관람객잼났어욜~^^ 방학때 아이들과 같이 볼 수 있는 영화 좋아요  ","10"
"172","관람객아이들과 웃으며 봤어요 너무 재밋고 감동이네요 귀여운 패딩턴 울 집에도 패딩턴같은 곰이 있어주면...좋겟다  ","10"
"173","관람객아이랑 재미있게 봤어요^^  ","8"
"174","어른이 봐도 참 좋은 영화!딸과 함께 넘 재밌게 봤어요.가슴 따뜻해지는 영화 강추함다~!!!  ","10"
"175","패딩턴 너무 귀여웠어요! 가족과 보기 조은것 같아요  ","10"
"176","관람객재밌게 잘 봤어요 ㅎㅎ 패딩턴의 순수한 모습과 귀여운 행동들이 제일 기억에 남는것같아요 ~ 패딩턴1을 안보고 바로 2를봐도 무방할것같네요~  ","10"
"177","정말 정말 재밌게 봤어요.  ","10"
"178","관람객재밌게봤어여!!정말 재밌게 봤습니다!  ","9"
"179","관람객정말 재미있었어요 패딩턴 너무 귀여워요  ","10"
"180","관람객아이들과보기에너무좋왔어요~^^  ","10"
"181","관람객잘봤습니다..아이들이 좋아해요...  ","10"
"182","아주 잘 만든 영화. 가족끼리 보기 좋아요^^  ","10"
"183","최고! 휴그랜트 연기도 넘 좋았음.. 기대안하고 봤는데 대박 웰메이드 ㅋ  ","10"
"184","관람객우리(초2학년)여자아이랑 보러갔는데 나도모르게 웃음이나오더라고요  잼있고감동적이예요 아이들 모두들 재미있어하더라고요 보면후회없는영화가될거같네요 ~^^  ","10"
"185","오랜만에 깔깔 웃었던 영화 포스터만 보면 유치할 것 같지만 20대 초반이 보기에도 너무 재밌고 영화의 완성도가 높습니다.  ","10"
"186","진짜 너무 추천함 별로일 줄 알았는데 예상외로 너무 재밌었음  ","10"
"187","애들하고 봤는데 재밌게 봤어요 따뜻하고 유쾌한 영화였네요 휴그랜트..ㅋㅋㅋ 패딩턴은 미니언즈를 능가하는 귀염둥이였어요.^^  ","8"
"188","정말 정말 재밌어요 블랙팬서 보고 이거 보면 더 재밌을거예요 ㅎㅎ 1편도 다운받아 봐야겠어요  ","10"
"189","관람객스토리가 재미있었고 우리 딸하고 함께 봤는데 재미있었어요~  ","10"
"190","관람객아이따라 보게 된 패딩턴인데 제가 더 재밌게 봤네요.패딩턴 시리즈 앞으로도 쭈~~욱 이어지길 바랍니다.  ","10"
"191","관람객아기들 이랑 정말 잼나게 보고 왔어요ㅎ  ","10"
"192","1도 재밌는데 시즌2는 더 재밌네요.포인트가 너무 많고 진짜 씹덕터져서 죽는줄 알았어요.3편도 꼭 만들어주세요.패딩턴 제작진 분들 모두 감사합니다ㅠㅠ딩턴아 사랑해ㅠㅠㅠㅠ  ","10"
"193","관람객간만에 기분좋은 가족애에 대한 뭉클한 감정을 느낄수 있어 좋았어요. 울딸은 네번이라던데...ㅋ  ","10"
"194","관람객너무 재밌게 잘 봤어요~~휴그랜트 코믹한 악연연기 넘 신기했지만 역시 연기를 잘하네요~딸내미랑 시간가는 줄 모르고 보고 나왔습니다. 자막올라갈때 앤딩장면도 놓치지마세요~ㅎㅎ  ","10"
"195","관람객전편만큼 재미있었습니다. 온 가족이 즐겁게 관람했어요.  ","10"
"196","관람객엄청 재밌었어요~^^  ","10"
"197","패딩턴 너무 사랑스럽다ㅠㅠ 힐링된다  ","10"
"198","너무 재밌어요!! 패딩턴이 너무 귀여워요♡  ","10"
"199","관람객코믹스러우면서...통쾌한 영화였어요.재미있었답니다^^  ","10"
"200","입소문타서 본 영화인데... 성인이 봐도 재밌어요 . 아이있는 분들은 다같이 보러가는거 강추입니다!!  ","10"
"201","웃기고 재밌어요  엄마도 재밌데요  ","10"
