"","reviews","points"
"434","불과 싸우는 장면 하나하나가 멋있습니다. 소방관님들 감사합니다. 각자의 이유로 시작했겠지만 목숨걸고 대한민국 지키는건 다르지 않습니다.  ","10"
"435","평점 알바들 반성하자 이런게 10점이지  ","10"
"436","esse quam videri - 허울보다는 내실이 중요하다  ","9"
"437","뻥 안치고 10분동안 울었다  ","10"
"438","그들이 존경받아야 할 이유  ","10"
"439","재미와 감동 둘다있었었다  ","9"
"440","감히 내가 평점을  남길수있을까..소방관은 공무원이 아니라 영웅들이다.  ","10"
"441","평생 처음으로 평점을 주고싶었던 영화눈물은 자주 흘리지만 만이 울게한 영화  ","10"
"442","소방관의 위대함...  ","10"
"443","타노스 팀 멋지십니다!!현 시대의 영웅들~  ","10"
"444","마지막엔 정말 ... 마음이 먹먹해지고 감동이ㅜㅜ  ","10"
"445","늦게나마 접한 영화 몰입도 높고 잔잔한듯 흘러가지만  마지막은 주체할 수 없는 눈물이 나네요ㅠ  ","10"
"446","모든 소방관들에게 경의와 존경을..그리고 그들의 숭고함을 기리는 자세를 느끼다..  ","10"
"447","이런 영화를 많이 봐야할텐데...  ","10"
"448","담담하게 영웅들의 일상을 담아내다가 충격적인 내용으로 마무리가된다.너무나도 훌륭한 영화다.이분들이야말로 영웅이다.  ","8"
"449","너무명작입니다 최고네요  ","10"
"450","폼잡는 영화. 억지로 만들어 낸 영화가 아닌 있는 그대로의 그들의 고귀한 삶  ","10"
"451","사실적인 묘사와 연출로다시한번 일선의 소방공무원 들의노고에 깊은 감사를 드립니다. .  ","10"
"452","소방관들의 희생에 감사함을 전한다.  ","10"
"453","분노의 역류. 래더 49 보다 더재미있었어요 ...진심으로 감동 받았습니다  전 현직 소방관님들께 존경을표하고 ... 이런좋은 영화를 만들어주신분들께 진심으로 감사드립니다  ","9"
"454","너무 마음이 아프고 충격적인 영화다. 삼가 고인의 명복을 빕니다. 덕분에 저희 같은 일반인이 안전하게 살아갈 수 있습니다. 감사합니다. 죄송합니다.  ","10"
"455","정말 마음이 아팠습니다 ㅜㅜ 소방관님 모두 몸조심하셨으면 좋겠습니다! 파이팅하세요!  ","10"
"456","보고 울어버렸다...  ","10"
"457","스크린 독과점의 폐해 상업영화로서의 가치도 없는 저급한 몇몇 영화들이 자본을 무기로 평단과 미디어를 조작해가며 얻은 성취는 결국 한국영화의 발전을 수OO 후퇴시킨 꼴이나 마찬가지 궁x 치x트 의 독주가 유독 더 혐오스러운 하루  ","10"
"458","지루하지 않고 감동적으로 영화봤네요~  ","10"
"459","소방관님들 존경합니다~!!! 불과 5년 전 이야기라니..ㅠㅠ  ","10"
"460","말이 필요없음...그저 최고의 영웅들 이야기...  ","10"
"461","전세계모든소방관분들 화이팅  ","10"
"462","우리가 지금 안전한건 누군가의 희생이 있기때문입니다  ","10"
"463","이 분들이 이 시대 진정한 영웅..  ","10"
"464","지루한 전개속에서 피어나는 감동적인 실화  ","10"
"465","여지껏 본 영화중 손에꼽힌다 진짜 감동적인 영화  ","10"
"466","묵직한영화네요..올해본영화중최곱니다  ","10"
"467","이 정도의 영화가 흥행이 왜 이럼? 상영관 수 진심?  ","10"
"468","그 유명한  미국 산불 소방대! 영화는 감독 잘못만나서인지  조금 별로긴하지만.... 그분들이 하시는일은 대단한일이다.  ","8"
"469","간만에 마음을 움직인 영화였네요.여운이 길게 남는 영화였습니다  ","10"
"470","신파 없고 과장도 없이 잔잔한 여운을 남긴 영화  ","10"
"471","몰입도 좋고 진짜 감동이 있는 영화..그들은 영웅입니다  ","8"
"472","10점이 아까운 영화,.. 모든 소방관분들께 감사함을 느낍니다  ","10"
"473","최고의 영화 추천합니다  ","10"
"474","일요일  저녁 8시. 메가박스에서 5명이 관람했다. 상영관이 문제만은 아닌 것 같다. 좋은 영화이고 마무리가 좋은 영화였다. 뉴스가 스포가 된다.  ","9"
"475","가족애와 함께 많은걸 느끼게 해주는 영화  ","8"
"476","가슴이 먹먹해지는 영화  ","10"
"477","감동입니다. 고맙습니다.  ","10"
"478","쉴틈 없이 재밌네요 탄탄한 구성도 한몫  ","10"
"479","마음이 먹먹해지는 영화  ","10"
"480","이건 진짜 띵작이다 꼭 보세요  ","10"
"481","감명깊게 보았다. 소방관은 태생부터 타고나야되는것 같다.  ","8"
"482","소방관분들 고맙습니다  ","10"
"483","꼭 끝까지 봐야함 눈물펑펑 쏟는다  ","10"
"484","소방관님들 존경합니다  ","10"
"485","세상모든 소방관여러분 진심으로 존경합니다.  ","10"
"486","영화보고 울어보긴 처음.  ","10"
"487","억지로 감정을 끓어올리는 신파극이 아닌보고나면 가슴이 먹먹해지는 영화.개인적으로 지금껏본 재난 영화중에 제일사실적이며 작품성 또한 뛰어나다.  ","10"
"488","세상엔 묵묵히 자기일에 최선을 다하는 영웅들이 있다.  ","7"
"489","궁합같은 쓰레기 영화를 없애고 상영관좀 늘려줘라  ","10"
"490","진짜 너무 멋지고 슬픈 실화네요.영화도 멋졌습니다.상영관이 조금밖에 없어서 아쉬웠어요.많은사람들이 보면 좋을텐데.희생정신의 그들이 너무 존경스럽습니다.  ","10"
"491","주인공 아조시 넘나 멋잇는것  ","10"
"492","스크린 독점을 없애야 하는 이유.  ","10"
"493","별 백개짜리 영화다 꼭 봐라 존경합니다 소방관님들  ","10"
"494","진정한 영웅들.. 이들뿐아니라 모든 소방관들에게 감사를 표하게되는 .. 그저 감사할수밖에 없는 ..  ","10"
"495","와 이 영화를 이제야 보다니... 진짜 영웅들  ","10"
"496","무기만 바뀌었을뿐 전쟁영화 입니다. 산불과의 전쟁...한순간 기적을 바랫습니다. 그래니티 마운틴 핫샷팀과 모든 소방관님 모두가 영웅입니다.  ","10"
"497","다른말 필요없음 &#34;실화&#34;  ","10"
"498","진정한 영웅 너무 멋짐...  ","10"
"499","출근하는 장소가 죽음의 장소인곳을 알고도 출근하는 지구최강  사나이들의 고개숙여 존경합니다  ","10"
"500","너무 감동적이고 슬퍼요....특히 마지막 방어할때....가슴을 매어옴....몰입도좋고 시간가는줄 모르고 봤습니다  ","10"
"501","아..너무 가슴 아프게 봤네요...  ","10"
"502","영화 한편으로 리더의 중요성과 소방관분들의 노고와 힘든점들을 느낄수 있었습니다.  ","10"
"503","관람객그냥 저냥 볼만한 영화감동 재미  ","8"
"504","보고싶은데 근처 상영관이없어 30분 거리에 있는 영화관을 찾아갔습니다.정말 오랜만에 감동의 눈물을 흘렸네요.실화를 바탕으로한 영화의 가치는 여기에 있나봅니다  ","10"
"505","제목은 기억 안나는데 어디서 많이 본 듯한 영화 스토리.오래 전 영화라 검색해도 못 찾겠던데 이 영화 보다 어릴적 본 영화가 더 좋았던 느낌 때문인지 좀 지루한 느낌 이었습니다.호일방어막인가 사용도 비슷예전 영화 제목 아시는 분 계시면 알려주세요  ","8"
"506","보고 나서 너무 허탈해서 눈물도 안 나와요 ㅠㅠ 실화라니... ㅠㅠㅠㅠ 멋진 영화 감사합니다.  ","10"
"507","트론시리즈도 만들어줘요 ㅠㅠ  ","10"
"508","관람객감동실화너무재밌게 봤어요.  ","10"
"509","판이한 자국의 소방체제의 회의감을 비롯해 대형참사를 겪은 한국국민에겐 불난집에 부채질 하는 영화  ","10"
"510","천때기 빨리씌기 훈련이 흡사 다새는 방독면 빨리씌기로 느껴진다 보면서 사지로 막들어가기보단 인공강우로 불을 끄면 어떨까 생각이듬  ","7"
"511","관람객전세계 어디에서나 자신의 위치에서 최선을 다하는 이들에게 늘 행운이 함께하길 기원합니다.  ","10"
"512","첨엔 심심했어요 근데 보다보니 나도 모르게 몰입해서 가족애 철딱서니가 철들어가는 과정 아빠가 되고 책임을 알게되고 동료애를 보고 저는 나름 부족한듯 심심하면서 생각을 많이 들게해서 좋았습니다  양념은 약했고 삼삼한 맛이 있는 영화입니다  ","10"
"513","뭔가 중간중간 비는듯한 느낌도있지만 감동적이에요..  ","8"
"514","영웅만들기 좋아하고 또 그만한 영웅도 있는 미국과 남 헐뜻고 비방하고 남잘되는 꼴 못보는 우리나라에선 이런 류의 영웅이 나올수나 있을지... 영웅은 우리 근처에서 각자의 역활에 충실히 하는 사람들이 보이지 않는 영웅이다..  ","9"
"515","제 인생영화의 하나를 보게됐네요  ","10"
"516","관람객초반에 지루한 느낌이 있지만, 한번볼때 두번볼때 생각이 많이될거같은 느낌적느낌 살아돌아와서 기쁘다!  ","8"
"517","정말 다들 꼭보세요!!!그냥 보세요!!!  ","10"
"518","완전강추!너무감동적임ㅜㅜ  ","10"
"519","실화라서 더 감동이었어요. 이게 진짜 영화!!  ","10"
"520","진짜 처음써보는데 엄청 여운이 남고 정말 보길 잘했다라는 생각이 들었다.  ","10"
"521","관람객슬픈영화ㅠㅜ추천합니다  ","10"
"522","이랗게 감동적인 영화가 왜 흥행을 안하는지 의문. 평점도 글도 처음 써본다. 정말 마음 아프고 교훈을 주는 영화. 모두들 보세요~  ","10"
"523","진심으로 존경합니다..  ","10"
"524","슬픈내용도 있는데 신파가 없어서  더  좋았다. 상영관좀 제발 늘려라 뭔 재미없는 매번 보는 영화만 겁나 때려박냐! 플로리다 프로젝트도 씨지비에서 한관에서만 하더만 ㅉ  ","9"
"525","오랜만에  영화관에서 영화를 봤는데 이 영화을 볼 수 있던게 감사할 정도로 재있고 감동적인  영화였습니다.  ","10"
"526","우리나라영화였으면 천만관객  ","10"
"527","기본적인 정보만 알고 가서 보세요. 감동이 두 배입니다.. 다음날 아침까지 여운이 남아요  ","10"
"528","감명깊고  여운이  남네요  ","10"
"529","오늘 봤는데 정말 많이 울었어요 ㅜㅜ꼭 보세요  ","10"
"530","역시 재난 영화가 재밌어ㅋㅋ  ","10"
"531","초반엔 지루한게 없진 않지만 그래도 감동스럽고 소방관 직업을 자세하게 알게해준 영화였다.  ","6"
"532","혼자 살아 남은 것이 미안하지 않기를....  ","8"
"533","주변에 상영관이 없어 처음으로 네이버로 구매해서 봤는데 너무 뿌듯하네요ㅠㅠ상영관이 많이 늘어나서 꼭 흥행했으면 좋겠습니다.. 소방관 분들 존경합니다.  ","10"
"534","관람객다큐가 아니었음 시시했을, 하지만, 다큐여서 의미가 있는 영화. 하지만, 영화로만 놓고봤을 때엔, 대단한 찬사를 받기에는 조금 아쉬운 구석이 있다.  ","8"
"535","세상에는 죽어서 반드시 천국에 가는 직업이 몇가지 있다.그중에 하나가 &lt;소방관&gt; 이다 !  ","10"
"536","bear&#39;s on fire  ","6"
"537","가장 일선에서 뛰는 이런분들이 이렇게 중요한거다.그뒤를 컨트롤타워가 항상 바쳐줘야 줘는거고..편하게 세금축내는 공무원분들 꼭 봐야할 영화다.희생자분들이 19명인데도 이렇게 안타까운데 우린 세월호 절대 잊으면 안된다.  ","10"
"538","감동적인 영화.. 생명을 담보로 하는 직업에 대해 다시한번 생각하게되었습니다.  잔잔하게 보기 좋아요2시간20분영환데 2시간으로 줄였으면 더 좋았을듯  ","8"
"539","맞불=소방관살해작전디게 위험  ","10"
"540","세계 최고의 소방관은 이들이 아닐까싶다 미국국민들의 영웅들의 명복을 빕니다.. rip...  ","10"
"541","이래서 가정과 직장일을 모두를 챙기기 힘들다.  ","7"
"542","지루한 전개 마지막이 안타까울뿐  ","4"
"543","핫샷팀이 되기위한 욕심 그리고 일에 대한 열정 그사이에 가족간의 이야기. 산불진화 작업이 현실적이고 불길의 모습을 적절한cg로 연출이 잘 됬다. 다만 너무 많은 이야기를 채우려한건 아닌지 모르겠다.핫샷이라기 보다 마쉬 팀장의 핫샷인거 같다.  ","7"
"544","최정예 산불진화요원의 이야기군요..산불이 정말무섭고 대원들의 희생에 마음이 아픕니다..근데 너무 지루하고 전개 과정이.너무 평범합니다  ","7"
"545","관람객눈물 줄줄 흘리고있는데 갑자기 3년후 ㅋㅋ  ","6"
"546","대한항공 기내에서 제공해서 봤는데나름 잼남  ","6"
"547","훌륭한 분들인 건 누구나 인정할 듯. 다만, 영화 자체로 보면 밍밍하고 임팩트가 부족.  ","5"
"548","단지 실화라는 이유만으로 +5점.  실화가 아니었다면 3점급 영화.  ","1"
"549","사실을 기반으로 한 슬픈영화이긴한데... 영화적 재미는 전혀 없고 문화가 달라서 그런지 몰입이 전혀 안됨.  ","5"
"550","장면연결이 매끄럽지 못하고 스토리도 허접하지만 살짝 감동은 있다.  명작은 결코 아니다.  ","5"
"551","2018.3.7 cgv영등포, 나쁘지는 않은데 실화 바탕의 배경이 다른나라라서 크게 몰입이 되지는 않는다  ","4"
"552","초반부가 지루한 영화는 참고 볼 수가 없다. 실화건 뭐건 영화로 만들었으면 할 말만 해라.  ","1"
"553","아.. 알바 댓글들에 속지말자재밌어지겠지... 하면서 계속 기다리다결국 자고나왔다...  ","1"
"554","너무 지루하다... 잘 표현하지 못한듯.  ","7"
"555","전체적으로 지루하고,클라이막스 부분에서 19명이 사망하는 장면은 허탈하더군요.실화라는 건 생각 못했는데,극 전개가 아쉬운 영화였습니다.소방관들의 희생에 애도를 표합니다.  ","6"
"556","온리더 브레이브 왜 관람 후기 여기 말고 다른곳에서 찾아보기 힘든지 이유를 영화를 보고 서야 알았네요.실화라니 소방관들이 안타깝기는 하지만 너무 기대하지 마시고 보시길 ...  ","6"
"557","지루해서 도중에 나옴 가정 드라마 입니다불.나무. 자연이 주가 아니고 닭살돋는 양키식 가정.직장 드라마 입니다  ","2"
"558","관람객볼만합니당~~ㅋㅋㅋ  ","4"
"559","평이 좋아 기대했는데 너무 지루해서 혼났다..  ","2"
"560","평점 보고 기대했는데 실화의 사실은 감동이지만 영화 자체만 놓고 보면 지루하고 재미없었음..  ","2"
"561","정말 영화가 지루하다 이게 왜 9점이지jQuery22403171601698869453_1521640918240 그냥 소방관이 멋있는 영웅이라서??  ","1"
"562","선발대: 전원 퇴각하라!!!  ","1"
"563","긴말안함 개노잼 세글자면충분함  ","1"
"564","왜9.5인지 도데체가 모르겟네  ","4"
"565","한국 불끄는 영화가 백배다 아 짜증  ","1"
"566","평점이 너무 좋아 2시간14분 러닝타임동안  이제 이 평점을 나오게 한 그것이 나오겠지 나오겠지 하다가 끝내 안나오고 지루한 2시간14분이 끝나버렸다.  ","1"
"567","첨 평가글 작성해보네요. 핸드폰 보다가 나왔습니다.  ","2"
"568","산불영화라서 그런지 영화관도 너무 더워서  영화에 집중을 못했네요... 중간까지 보다가 나왔습니다 영화관이 너무 더워서...  ","6"
"569","평점이 너무 높은거 같아요 9점대까진 아니라고 생각합니다 스토리 전개나 특수효과가 평이해서 영화라기보다는 그냥 미국 드라마같았어요 희생하신 분들의 정신은 높히 평가하고 지금도 감사하지만, 영화자체로만 봐선 죄송하지만 영화관에서 볼 정도는 아닌거 같아요  ","4"
"570","장난하나 딱 10분 보고 접음  ","1"
