"","reviews","points"
"1","BEST피같은 세금을 왜 지들이 항문 관리 못해서 걸린 에이즈 치료하는데 낭비해야하는가  ","1"
"2","BEST항문이 줄줄 세금도 줄줄  ","1"
"3","BEST항문이 열리면 지옥문도 열린다.  ","1"
"4","BEST문재인 &#34;동성혼 저는 반대합니다&#34;  ","1"
"5","BEST게이새기들은 사회의 악이다  ","1"
"6","에이즈르 퍼트리는 병균들 미화 영화는 막심 물리치료가 해결책  ","1"
"7","자기들이 잘못된 후장성교해서 에이즈걸린걸 왜 일반 시민들한테 불평하나? 미친 영화다.  ","1"
"8","에이즈 박으면 꼼짝 못해  ","1"
"9","전두환 대통령이였으면 탱크로 밟았을텐데..그립읍니다..  ","1"
"10","에이즈 치료에 탁월한 물리치료사가 러시아 교도소에 있다. 이런 영화 만들 제작비로 그 분을 보석방 시켜주면 치료가 가능하다.  ","1"
"11","에이즈 환자가 수혈팩 던지면서 폭동 일으키는거 보고 OOO는 매가 약이라는 교훈을 얻었습니다.  ","2"
"12","착한게이는 죽은게이뿐  ","1"
"13","동성애는 정신병 동성애자는 에이즈를 옮기고 다니는 쥐새끼  ","1"
"14","좋은 게이는 죽은 게이 밖에 없다  ","1"
"15","느그가 음지에서 물빨하건 말건 내돈으로 치료하는건 못봐주겠다 드릅은 놈들아  ","1"
"16","동성애는 질병이고 치료법은 죽음이다  ","1"
"17","막심센세의 물리치료가 필요하다  ","1"
"18","아...진짜..;;  ","1"
"19","이딴걸 영화라고 퉷 퉷!!!!  ","1"
"20","전형적인 억지미화영화. 그들의 외침은 논리가 없다. 동성애를 반대하지는 않지만. 그걸로 생긴 문제는 스스로가 해결해라.  ","1"
"21","스킨헤드 남바완 네오나치 남바완  ","1"
"22","혐오는 사랑보다 강하다  ","1"
"23","1점도 아까운 OOO기 영화  ","1"
"24","동성애는 가장 역겨운 죄악이다.  ","1"
"25","더럽;;;..;;;  ","1"
"26",")Q( 막심센세....그립습니다  ","1"
"27","에이즈 걸린게 왜 정부랑 제약회사 탓이냐  ","1"
"28","똥꼬충 새끼들과 몇몇 인권단체는 아직도 에이즈가 동성 성관계랑 상관없다고 주장하고있다. 하지만 에이즈환자 95프로 이상은 똥꼬충이라는게 팩트다  ","1"
"29","12345678901  ","1"
"30","아무리 긍정적으로 생각해보려 해봐도 에이즈에 감염된 피를 뿌리는 테러행위 같은 걸 미화하는 것을 이해할 수가 없다  ","1"
"31","아니 무슨 에이즈 보균자 피를 멀쩡한 사람들한테 집어던지는데 저사람들 에이즈걸리면 누가 보상해줍니까? 염산테러 수준인데?  ","2"
"32","혐오스러운 퀴어축제 제약회사 에이즈 피 테러 등.. 이게 정상적인 사고 방식이라고 보이는가? 동성연애자들은 정신병자들이며 치유가 불가능... 집에 쌓인 먼지를 청소하지 않으면 병에 걸리기 쉬우므로 청소해야하듯,  우리 사회에서 동성연애자 청소해야함  ","1"
"33","혐오는 사랑보다 강합니다. 혐오스러운 동성애를 박멸해야합니다.  ","1"
"34","미친영화 미친내용 정신나간 감성팔이  ","1"
"35","돈고충에 대한 복지가 강화될수록 더 많은 돈고충이 남는다. 이런 악순환에 갇히고 싶은가?  ","1"
"36","내 세금을 왜 저런데다 씀?  ","1"
"37","동성애는 죄악이다. 자신들을 이해해주고 치료해주는 은인 사진에 망치질을 하는 쓰레기들이기 때문이다  ","1"
"38","1.지들끼리 항문성교해서 병걸림2.지들이 잘못한 주제에 일반 시민들 테러하고 다님3.돈꼬충=박멸이답  ","1"
"39","동성애는 사회적으로 용인되어선 안 됩니다..  ","1"
"40","게이새끼들 삼청교육대에 한달만 쳐넣으면 이성애자로 개조시킬수 있다  ","1"
"41","으....엨....  ","1"
"42","게이는 가스실이 답이다  ","1"
"43","똥꼬충들이 나라에 &#39;독&#39;을 뿌리고있다.  ","1"
"44","가지가지하네 진짜ㅋㅋㅋ  ","1"
"45","막심선생님 방한 부탁드립니다  ","1"
"46","아니 지들끼리 박고 싸서 병걸린걸 미화하냐에이즈걸린 새끼들 좀비마냥 쏴죽이는게 더 재밋을듯  ","1"
"47","착한 똥꼬충은 죽은 똥꼬충들뿐이다... 착해지자 똥꼬충아!  ","1"
"48","영화내려라진짜ㅡㅡ미쳐돌아가고있네  ","2"
"49","동성애는 정신병 정신병을 미화하지마세요  ","1"
"50","니들이 무엇을 하든 관심없는데 음지에서 니들끼리만 하고 다른사람들 불쾌하게 하지마라 피해의식 그만해라  ","1"
"51","똥꼬충여러분 에이즈걸려서 빨리 죽어주세요 제발  ","1"
"52","영원한 에이즈란 없는 법. 오직 죽음만이 영원하다  ","1"
"53","똥꼬따리 똥꼬따 똥꼬따리 똥꼬따  ","1"
"54","이걸 미화하네? 역겹다.  ","1"
"55","게이, 에이즈 미화 영화는 왜 만드는건데? 에이즈 치료는 정부에서 전액 지원해주기 때매 매년 2조가량의 세금을 이상성욕자 게이새.끼들한테 헛 쓰고 있음 게이새.끼들 더 늘어나게 되면 천문학적인 세금을 낭비하게 될것임. 게이새.끼들은 그냥 환생치료가 답  ","1"
"56","항문 : 대변을 배설하는 기관  ","1"
"57","대체 왜 지들이 좋다고 쑤셔제끼다가 걸린 질병을 남들더러 책임지라 논하는가? 동성애는 정신적 질병의 일종일 뿐이다. 동성애듣 정신질환일 뿐이고 이들을 인정하려면 그들이 주장하는 같은 논리대로 페도필리아와 네크로필리아도 존중해야 하는가jQuery22409170229474  ","1"
"58","똥줄줄새는 항문과 에이즈의 한판 승부!  ","1"
"59","동성애를 미화시키지마세요 동성애자들의결과는 에이즈입니다  ㆍ영화로 세뇌시키지마시오 ㆍ어리석지않습니다 우리는?현실을직시하세요  ","1"
"60","예고편 에이즈 피 던지는거 보니까 지들도 생체병기인걸 아는듯  ","1"
"61","피던지는거 소름돋는다 진짜....콘돔 안낀 지들잘못이지 ㄷㄷ 일반일한테는 생화학테러와 다를게 뭐임 ㄸㄲ충새끼들아 &#34;모든 동성애자들은 에이즈환자가 아니다. 그러나 대부분의 에이즈환자들은 동성애자이다&#34;  ","1"
"62","영화에서 똥냄새나요 우웨에에에엑  ","1"
"63","으....  피 던지는건 생화학 테러급..  ","1"
"64","똥꼬충 역병폭탄 미화시키는거 봐라ㅉㅉ  ","1"
"65","영화의 완성도가 낮은것같아요 에이즈환자들이 피를 뿌리는 장면은 생화학테러인데 왜 군대의 투입이 없던건지 궁금합니다 군대가 나와서 테러범들을 처벌했으면 별점10개짜리~!  ","1"
"66","카아아아아악~~~~퉷!  ","1"
"67","에이즈 걸려도 성욕에 미친 게이들 박멸하자  ","1"
"68","내가 낸 새금이 똥꼬충 무상치료에 씌인다니 넘 화가난다.  ","1"
"69","동성애는 질병입니다, 물리치료만이 유일한 해결법입니다  ","1"
"70","적당히해라 이러다가 소아성애영화도나오겠네  ","1"
"71","진실이라고는 1도 없는 한심한 영화  ","1"
"72","더러운 게이새a끼들.  ","1"
"73","소수자라는 이유만으로 행해지는 세상에 대한 폭력.  ","1"
"74","동성애자들은 에이즈따위  상관 없다는 식이지. 성욕에  지배  당하는 이상성애자들  ","1"
"75","막심센세...그립읍니다..  ","1"
"76","어휴~~~인간들만 나오는 영화를 만들어야지!!  ","1"
"77","동성애는 사랑이 아니다 성적취향일 뿐이다  ","1"
"78","아름답게 꾸몄지만 진실은 아릅답지못하지계속 미화하지말고 진실을마주해라  ","1"
"79","이것은 1점이 아니다 0점을 주고싶은 나의 마음이다  ","1"
"80","아니 백번양보해서 니들이 서로좋아하는건 이해하는데 왜 니들이 문란하게 똥꼬돌려서 에이즈걸린걸 나라세금으로 치료하냐고ㅋㅋ 진짜 개역겹네  ","1"
"81","줄거리조차 보지 않았다.그것보단 러시아식 선진 의료기술 도입이 시급하다.  ","1"
"82","동성애는 인류의 악이며 더러운 질병이다.  ","1"
"83","지들이 콘돔 안써서 에이즈 걸렸으면서 남탓하는거 ㄹㅇ 똥꼬충 특이냐?  ","1"
"84","PC충들 제발 그만 깝쳤으면..  ","1"
"85","돈주고 영화를 보는게 고충이었다. 줄여서 돈고충  ","1"
"86","너무 더럽다  왜 이런 영화 만들지? 우리 얘들 보라고? 정말 역겹다  동성애가 에이즈의 주 원인것 확실하네  ","1"
"87","문재앙 아웃 앙져라 문뒤재  ","1"
"88","남들한테 피해주지는 말자  ","1"
"89","지구상에서 사라져야할 질병 동성애  ","1"
"90","똥꼬에서 똥세는 냄새가나는 영화  ","1"
"91","왜 0점은 안 되냐ㅋㅋㅋ  ","1"
"92","무슨 동성애 혐오니 뭐니 떠드는데, 지들의 행위에 대한 결과로 에이즈 걸려놓고 정부와 기업에 책임을 떠넘기면서 폭동을 일으키는 인간쓰레기들을 미화한 영화를 좋아하는게 더 이상한거 아니냐?ㅋㅋ  ","1"
"93","훔...콘돔은 장착하시고 에이즈 걸리신거 맞죠? 에이즈 치료제보다 콘돔이 쌉니다.  ","1"
"94","똥이 줄줄 세금도 줄쥴ㅇㅇ  ","1"
"95","막심룰 도입이 시급하다  ","1"
"96","와 이딴걸 영화라고 만들었냐  ","1"
"97","제발 정상인들에게 피해주지 말고 살아라  ","1"
"98","똥꼬충 추하다 사회악임  ","1"
"99","영화예고편만 봐도 지들이 비련의 영화주인공마냥 일반인들에게 피해를 입히는 모습이 현실과 싱크100이다 니들이 서로 돈코를 탐하든 관심도없고 생각하기도싫다  ","1"
"100","사람이라면 누구나 절지류에 대한 혐오감이 조금씩이라도 있다고 합니다. 본능적인 것이죠. 그럼 인간들은 절지류포비아인 건가요? 게이여러분들을 볼 때마다 본능적으로 ㅈ같음이 느껴지고 역겹습니다. 본능적인 것이죠. 존중해주세요^^  ","1"
"101","기독교 거르고 똥꼬충 싫어요 20대 여자분들 똥꼬충 사랑을 멈춰주세요  ","1"
"102","질병관리본부에 따르면 이성 간의 성 접촉으로 감염된 경우가 364건, 동성이 288건이었다는데 상식적으로 이성애자가 월등히 많은 상황에서 에이즈 감염 건수가 별로 차이안난다는거는 동성애가 에이즈의 원인이라는 소리 아니냐???  ","1"
"103","돈고충 새기들은 물리치료가 답  ","2"
"104","그들만의 세상에서 나오지 말아주세요  ","1"
"105","기분 더럽게 왜 내 생일에 이 따위 영화가 개봉하냐?  ","1"
"106","똥꼬충ㅅㄲ들 미쳤음? 항문 뚫리더니 주작까지하네?  ","1"
"107","이런 영화를 개봉하나? 한국 미쳤네  ","1"
"108","우웨에에엑ㄱ에에에엥엑  ","1"
"109","에이즈를 치료하는 방법은 물리치료사 양성 및 환생치료 뿐입니다. 그 외에 다른 방법은 없습니다.당신들이 그렇게 에이즈 치료를 원한다면 셀프 환생치료를 권유해드립니다.  ","1"
"110","똥꼬충  혐오할 권리를  달라!  ","1"
"111","사회에 분란과 질병, 혐오를 퍼뜨리는 동성애를 왜 이렇게 지지함? 혹시 나라를 전복하기 위한 어떠한 세력의 공작이 아닌가 하는 합리적 의심이 들기 시작함  ","1"
"112","호모 정신병자들 때문에 1점 주는게 아니라, 영화가 쓰레기임. 최악의 구성, 단순하고 경박한 연기, 어설프고 치졸하게 분위기 띄우려는 음악, 싸구려 의상, 분위기 파악 못하고 실실거리면서 나대는 호모 주인공을 볼 때 마다 매스껍고 멀미가 나는 느낌.  ","1"
"113","제발 지구상에서 사라져 주세요 왜 당신들의 질병과 쓰레기같은 짓으로 평범한 사람들까지 피해를 입게하고 세금을 낭비하게 하나요 정말 더럽네요 제발 세상에 나오지 마세요 그게 아니면 동성애는 정신병이니 정신과에서 상담 받으시길 바랍니다  ","1"
"114","아니대체 어디까지 옹호할생각이신건지 제약회사를 에이즈감염자의 피로 테러한것을 자유와 평화의 상징이라고 생각이 드시는가요jQuery2240960643258414529_1521224706941 역지사지로 당신들 집을 에이즈환자들이 피로 테러를한다면 어떠한 생각이 드시길래  ","1"
"115","진짜 너무 싫다... 동성애는 질병  ","1"
"116","아무리 개인의 자유가 보장된 사회라고 해도그 자유가 남에게 피해를 줄때는 규제하는게 맞지제약회사 벽에 피는 왜 던져?영화를 보며 저걸 누가 치우나라는 생각이라는 생각이 들게 하는 영화다.그들의 논리를 알고싶어끝까지 보았다. 결국은알지못했다.  ","1"
"117","OO같은새끼들, 지들 세금이 똥고충새끼들 OOO 전까지 복지금으로 빠지는지도 모르고 옹호하고 찬사하고 자빠졌네.똥꼬충 세금벌레새끼들아 돈모아서 망명갈 생각 없냐?  ","1"
"118","에이즈 감염의 90% 이상이 남자 동성애로 인한 것은 팩트. 자료가 말해줌. 그들끼리 사랑하든 말든 상관 안하고 싶은데 에이즈 감염 원인이 게이들이라는 건 인정하고 남탓하지 말라.  ","1"
"119","게이 미화 영화네...  ","1"
"120","에이즈 보균자의 피를 마구 뿌려대며 생화학 테러를하고 에이즈를 정부탓하는 쓰레기 영화  ","1"
"121","수준이고 선진시민의식이고 운운하기전에 지들이 동물새끼들마냥 콘돔도안끼고 교미하다가 에이즈걸린걸 국가탓으로 돌리는 쓰레기영화를 까는건데 수준이 어쩌고 하는 빡대가리는 무엇? 에이즈 걸려서 OOO 관리하는거 다 우리 세금 아님? 왜 이런데 쓰여야 함?  ","1"
"122","게이 이미지를 이정도로 떨군것은 순전히 게이때문이다  ","1"
"123","동성애의 가장큰 문제점은 자신들을 약자라칭하며 언더도그마로 언론을 장악하고 자신들이 퍼트리는 에이즈에 대해 절대 공론화를 못하도록 하는것.  ","1"
"124","똥꼬충 극혐..모조리 생매장 당했으면 좋겠다0점은 왜 못주냐맘같아선 마이너스5 주고 싶은데  ","1"
"125","돈고충들 토나와 제발 음지에서 니들끼리 놀아  ","1"
"126","국가책임으로 에이즈에 걸렸다는건 억측이네요 ㅠ  ","1"
"127","에이즈 피뿌리기는 명백한 생화학테러이자 범죄입니다. 미화하지 말아주세요  ","1"
"128","응돈고충 out 꺼지고좀  ","1"
"129","BL 좋아하는 여자특징 못생김  뚱뚱함  ","1"
"130","정상범주를 벗어난 사람들이 오히려 정상인에게 비정상적인 프레임을 강요하고 테러를 저지르는 상황에서 동성애가 사회적으로 인정받길 바라는게 이상하다. 게다가 에이즈가 동성애와 거리가 멀다고 정신승리하려는거 추해보임ㅋㅋ  ","1"
"131","에이즈 걸린 피를 던지면서 테러하는걸 미화하다니 미쳤나봄.  ","1"
"132","착게 죽게=착한게이는 죽은게이뿐  ","1"
"133","원래 우리나라여자들 게이물이라하면 눈깔디집어지는거 누가모르냐ㅎㅎ단지  그것이 이유일뿐  깨어있는척  이해심많은척 하지말자 ^  ","1"
"134","모르고 지나가다 피 맞은 사람 있으면 대박 사형을 시켜도 모자랄 판에 피같은 세금을 에이즈의 원흉들에게 쓰네 ㄷㄷㄷㄷ  ","1"
"135","지들이 똥꼬 관리 못해서 에이즈걸린걸 제약회사 탓 나라탓 에휴 ㅉㅉ 에이즈 걸린 피를 뿌리는건 뭔생각?  ","1"
"136","똥꼬로만든 똥같은 영화  ","1"
"137","니들 맘대로 항문성교하고 개1OO떨든 말든 상관 안하겠는데 제발 일반인들한텐 피해주지마 역겨운새1끼들아  ","1"
"138","테러미화 영화 잘봤습니다.  ","1"
"139","에이즈 미화 out!!!!  ","1"
"140","문란하게 살다가 에이즈 걸리고, 연명하게 해주는 제약회사 가서 에이즈 걸린 피로 테러함 ㅋㅋㅋ  ","1"
"141","에이즈의 원인을 미화하는 영화  ","1"
"142","네 다음 똥꼬충 ㅋㅋㅋ.ㅋㅋㅋ  ","1"
"143","정말 쓰레기 같은 영화네요  ","1"
"144","더럽다. 역겹다. 혐오스럽다. 구역질난다. 징그럽다. 볼썽사납다. 흉측하다. 악하다. 추잡하다. 추악하다. 메스껍다. 천박하다. 불결하다. 상스럽다. 이 모든 말로도 동성애의 나쁨을 설명하기엔 부족하다  ","1"
"145","정말 끔찍하네요 어떻게 동성간 항문성교로인한에이즈를 미화할 수가 있죠?  ","1"
"146","에이즈걸리는게 뭐 자랑이라고 정신병자새이들  ","1"
"147","에이즈는 항문성교가 원인이 맞음  ","1"
"148","역겹고 더럽다 으토나와18  ","1"
"149","혐오스러운 영화입니다 주의하세요  ","1"
"150","동성애든, 근친상간이든, 변태성행위든 관심 없습니다. 근데 일반 시민들에게 강요, 미화하며, 본인들이 옳으며, 너희는 해보지 않아서 모른다. 같이 해보자라고 말하는건 정말 역겹네요. 저기 안보이는 곳에서 사랑 나누시고, 안보이는 곳에서 조용히 죽어가요  ","1"
"151","이거 상영몬하게 해야하는거아님?  ","1"
"152","에이즈환자가된것은 자기 자신의책임이 가장크다고생각합니다 남 탓할 것없습니다  ","2"
"153","정부와 제약회사를 테러하는 더러운 동성애집단들을 정의로운 혁명군으로 표현한 쓰레기같은 작품  ","1"
"154","돈꽃충들 씹극혐 리얼루다가  ","1"
"155","지들이잘못한걸 왜 나라가대줘요  ","1"
"156","더럽다더러워 증말 더럽다 토악질난다  ","1"
"157","1점도 아깝다ㅉㅉ 아까운 내 세금..  ","1"
"158","대한민국 에이즈의 원인 동성애  ","1"
"159","에휴...에이즈 치료비용으로 세금내기 아깝다... 자기부담금 높여주세요. 기생충 같은 놈들. 더러워 정말  ","1"
"160","지 내 집 대문 앞에다가 에이즈 묻은 피던져도 감싸시겠죠?  ","1"
"161","1점도 아깝다 0.1점은 없는가  ","1"
"162","이게 개봉한 것도 신기하다  ","1"
"163","너거들 즐기는거 그럴수 있다 치더라도 그 책임은 제약회사나 일반 시민에게 있는게 아니야.. 어떤 미친놈이 이런영화를 만든거야 대체...  ","1"
"164","막심센세 그립습니다...  ","1"
"165","똥만 싸자 제발 왜 이상한걸 넣고 그래  ","1"
"166","착똥죽똥착똥죽똥착똥죽똥착똥죽똥  ","1"
"167","제발 이런걸로 스크린을 더럽히지 말아주세요  ","1"
"168","아무리 세상이 변해도 아닌건 아닌거다.  ","1"
"169","게이새기들은 사회의 악이다  ","1"
"170","동성애 반대 사회 악이다  ","1"
"171","세금도 줄줄 ~ 아주그냥  ","1"
"172","영화 만들게 없어서 이런 걸로 만드나요ㅡㅡ  ","1"
"173","자기들이 신나게 OOOO하다 에이즈 걸려놓고 책임은 제약회사와 국가가 지라고? 동성애자들만큼 뻔뻔하고 이기적인 것들이 없다.  ","1"
"174","동성애자를 혐오하고 차별하자는 것이 아니라, 동성애자들이 하는 항문성교로 인해서 각종 성병과 에이즈 감염이 전염되어 확산되는 것에 대한 위험성을 알리고, 동성애자들도 그러한 병들로 부터 보호받고 건강하고 정상적인 삶을 살도록 하려는 것입니다.  ","1"
"175","똥꼬충은 정신병이다. 매가 약이다.  ","1"
"176","동성애는 정신병입니다.  ","1"
"177","오물을 더러워하는데 이유가 필요함?  ","1"
"178","퀴어 축제에서 온갖 변태짓을 하는걸 보고 학을 뗐습니다. 미친변태새끼들.... 니들이 좋아하는걸 존중해줄 수는 있어 그런데 사람처럼 행동을 해야 사람 대접을 받는거야 또라이새끼들아  ","1"
"179",")x(      )o(      )0(      )O(      )Q(      )○(  ","1"
"180","나 숙박업하는데 남자 둘명은 절대 안받음 게이아닌거같아도 안받음 한번 받았다가 센조이하고 나간거 알아차리고 수도관까지 교체했다. 그뒤로는  남남은 절대 안받는다.  ","1"
"181","1점도 아깝다.에휴 미화영화 out  ","1"
"182","동성애를 하던 뭘 하던 관심 없는데 이건 좀 아니지않냐?  ","1"
"183","더럽다 어쩌라고 니네끼리 딴데가서 살아라  ","1"
"184","혐오스러운 영화라고 할 수도 없습니다.  ","1"
"185","똥꼬충 ㅋㅋ똥질질ㅋㅋ 기저귀나차고다녀라  ","1"
"186","최악의 영화다. 다른 사람들은 안 보길 바란다  ","1"
"187","아닌건 아닌거다 알겠냐  ","1"
"188","에이즈 피를 던지다니 게이들 넘 폭력적인듯...  ","1"
"189","동성애는 사회의 악이며 박멸해야 할 존재다  ","1"
"190","게이들 제발 어디 쳐박혀서 절대 세상밖으로 나오지 않았으면...  ","1"
"191","이성이 있고 소통 할 줄 아는 사람이라면 1점  ","1"
"192","자유와 책임 니 자유는 니가 책임져~  ","1"
"193","막심 센세 그립습니다..  ","1"
"194","에이즈 혈액 테러 왜 미화하니?  ","1"
"195","사람대우를 받으려면 사람다운 짓을 하세요.  ","1"
"196","피같은 세금을 왜 지들이 항문 관리 못해서 걸린 에이즈 치료하는데 낭비해야하는가  ","1"
"197","?엥?오잉? 지들이 박다가 걸려놓고 왜 확산을 못막냐면서 제약회사탓 정부탓 하냐 이해가 안가네 그럼 봉합수술이라도 해드려야하나  ","1"
"198","에이즈테러 옹호는 최악이다  ","1"
"199","피테러는 뭐야 드럽게 ㅡㅡ  ","1"
"200","한국남자 똥꼬충이라고 조롱할땐 언제고 갑자기 성소수자 인권찾냐? 똥꼬충이라는 말 지들이 제일 많이 쓰는데 제발 막심센세 물리치료 환생치료 좀 받아라  ","1"
"201","메갈충♥똥꼬충, 백년해로 하길 바립니다.  ","1"
"202","이건 인권영화도 예술영화도 아님동성애는 질병입니다  ","1"
"203","와 씨발 이게 영화냐? 진짜 동성애 조장하는 영화들은 싹 다 없어져야만 한다. 말이되냐?  ","1"
"204","뭐 이딴 쓰레기같은 영화를  ","1"
"205","지들이 자처해서 걸려노쿠 OO질임  ","1"
"206","영화에서 똥냄새나요 ㅡㅡ  ","1"
"207","동성애자들이 주류문화에 투쟁하는게 그들의 정의라면, 본능적인 혐오감을 솔직하게 표출하는 자유를 존중하는것도 정의다. 자신들의 신념과 가치관을 타인에게 강요하지말길.  ","1"
"208","0점이 없다니ㅠㅠ 안타깝다 돈고춘들 사랑타령 보는 것보다 음식물 쓰레기가 더 사랑스러움 ^^  ","1"
"209","똥꼬충들은 환생치료가 답  ","1"
"210","63빌딩에 게이 번지점프 스팟을 설치해서 줄세워놓고 그냥 밀어버려야된다  ","1"
"211","나는 내돈이 에이즈 치료비로 나가는게 싫다  ","1"
"212","아니 똥꼬충새끼들아. 에이즈좀 그만 퍼뜨리라고  ","1"
"213","정말 어이없는 영화 ㄷㄷㄷㄷ  ","1"
"214","볼 필요도 없다. 똥꼬 냄새난다 꺼라  ","1"
"215","지옥에서도 똥꼬충들은 따로 모아둔다더라 에이즈 옮는다고  ","1"
"216","평론가들은 이떤걸 영화라고 저렇게 호평한건가?  항문의 기능은 하나뿐이다. 조만간 살인도 예술로 미화시킬판.. 이건 혐오의 문제가 아니라 정상과 비정상의 문제. 비정상에게 필요한건 방치가 아니라 치료입니다.  ","1"
"217","성소수자같은소리 하고있네 자기들도 자기들이 쓰래기인것은 알거다 이런 쓰래기들 옹호하다간  에이즈천국이 될거다 더러운것들  ","1"
"218","동성애는 질병입니다. 치료는 죽음입니다. 동성애 치료 선진국인 러시아와 중동 의사들의 의료 기술 도입이 절실합니다.  ","1"
"219","구제불가능한 쓰레기들  ","1"
"220","하고 싶은 말은 알겠는데, 다른 거 떠나서 피 뽑아서 던지는 건 테러행위 아닌가? 사고의 구조자체가 혐오스럽고 저열하다. 최소한의 상식이라는게 있었다면 사악한 테러행위는 영화에 담지 않았을 것  ","1"
"221","역겹다 역겨워 차별이 싫으면 피해라도 주지 말든가  ","1"
"222","ㅋㅋ응 꺼져 보댕이들~  ","1"
"223","&#34;? ????? ???&#34;  ","1"
"224","1점 드립니다.넉넉히가져가세요  ","1"
"225","드럽네 드러워 퉷퉷퉷퉷  ","1"
"226","줗줄줗줄줄줄줗줄ㄹㅇ  ","1"
"227","이런 영화를 아이들이 볼까봐 두렵네요. 질병을 미화시키다니...  ","1"
"228","응 돈낭비~~~ 씹 극혐 영화임  ","1"
"229","분당 120대씩 패버리고싶다 ㄹㅇ;  ","1"
"230","극혐 상영금지해야된다  ","1"
"231","정신병자미화영화1점도아깝다  ","1"
"232","동성애 싫어 동성애 out  ","1"
"233","1점도 아깝다 똥꼬충새끼들아  ","1"
"234","이런 폭력사태를 옹호하는 놈들은 정체가뭘까?  ","1"
"235","에이즈의 원인 자체가 남자 동성애자의 문란한 OOOO라는 건 인권위도 인정하는 사실인데ㅋㅋㅋㅋ적반하장 오진다 너네끼리 병걸렸으면 너네끼리 해결해 ㅎㅎ  ","1"
"236","혐오안하고싶어도 우리제밣험오해주세요 하며 발광하는꼴  ","1"
"237","에이즈 걸리면 살처분 시켜야한다  ","1"
"238","제발 다들 죽었으면...  ","1"
"239","막심센세.. 막심센세는 어디있는가  ","1"
"240","세금퍼주니 돌아오는건 테러?  ","1"
