"","reviews","points"
"468","100번봐도 최고인 영화.  제이미벨  내꼬♡  ","10"
"469","실화를 바탕으로 만들었다는게 믿기지 않는 내용과 연출의 훌륭한 명작  ","10"
"470","성장을 보여주는 차원이 다른 연출과 사이사이 자연스레 우릴 납득시키는 시대상. 소년의 위치부터가 비범하다.  ","9"
"471","볼때마다 명작이라는 확신이 더욱 깊어지는 최고의 영화  ","10"
"472","아들을위해정부의편을든아버지가울때정말폭풍눈물  ","10"
"473","처음 한시간은 너무 지루해서 친구한테 욕먹음. 근데 빌리가 아버지앞에서 춤추는 장면은 진짜 일품. 그리고 아버지가 아들 재능을 알아보고 탄광에 돌아가는 장면은 참 눈물난다...  ","9"
"474","45분 분량으로 줄여놓은 것 보고 원작(?)봤는데 두번 봐도 재미있네요^^  ","10"
"475","아껴두길 잘한 영화다.  ","10"
"476","14년이 지난 지금도 잊을 수 없는 영화....  ","10"
"477","DVD까지 사게만든 영화!!  ","10"
"478","영국에도 팍팍한 탄광노동자의 삶이 있구나. 자신의 재능을 발휘할 수 있는 삶을 찾아가는 소년은 행복하다.  ","10"
"479","슬픔. 분노. 희망. 기쁨. 사랑. 가족. 그리고 아버지. 굿보이 썬..  ","9"
"480","와 나 이거 고딩때 시험끝나고 obs에서 하길래 시간도 많이 남아 아무 생각없이 개 재밌게봤던 영화네 ㅋㅋ 근데 그 어떤 여자랑 배게 싸움하다가 둘이 넘어져서 침대에 우연히 넘어진 장면이 진짜 아직도 기억에 남는다. 특히 남자가 여자머리 쓸어넘기는 장  ","10"
"481","무조건 봐야하는 영화  하지만 남들한테 보여주기 아까운 나만 소장하고싶은 영화이기도 하다.  ","10"
"482","끝 부분이 살짝?! 지루했지만... 아버지의 허락을 받기까지의 빌리의 노력이 담긴 부분은.... 말로 형용할 수 없는 감동이 있었습니다..ㅠㅠ  ","10"
"483","와 진짜 감동적인 영화다...  ","9"
"484","정말 잘 만든 감동 영화.이걸 왜 이제야 봤을까....빌리의 꽃미소에 나도 절로 입가에 미소가 번진다.  ","10"
"485","재밌을때 끝나네 ㅋㅋㅋ  ","9"
"486","현재의 한국 상황이랑 뭐가 다른가?  ","10"
"487","목에 힘준 평론가들의 별 네 개도 너무 인색하다할 만한 영화.  ","10"
"488","&#39;Extremely Loud and incredibly close&#39;를 너무 감명깊게 보고 이 감독영화를 찾다보니 빌리엘리엇에 감독이었다니! 가히 성장영화의 대가다. 그리고 그는 계속 업그레이드 되고 있다.  ","10"
"489","가슴이 따뜻해지는 영화.  ","10"
"490","세번째 봐도 감돔이 여전하노,,,  ","10"
"491","굳 좋습니다 좋아요!!  ","10"
"492","사상 최고의 성장영화!! 마지막 장면 진짜 소름끼침.  ","10"
"493","이렇게 좋은 영화를 이제서야 보다니. 저도 날고 싶습니다.  ","10"
"494","Good  어렸을적 보고 한번더 보니 다 이해가감  ","10"
"495","평론가와 대중을 사로잡는 몇 안되는 영화  ","10"
"496","최고의 영화.아버지가 다시 탄광에 들어가고 마지막 빌리가 점프하던 그 장면 잊을 수 없다  ","10"
"497","학교에서봤는데 짱임...  ","10"
"498","말이 필요없음..정말 최고의 영화...  ","9"
"499","감동도 있었고 특히 빌리가 발레할땐 신들린듯 보임  ","10"
"500","정말위대한영화입니다!!!!  ","10"
"501","몇 번을 봐도 최고...  ","10"
"502","볼때 마다  좋은  영화.. 여운이 많이 남는다  ","10"
"503","이 영화 볼 당시에는 게이가 뭔지 몰라서 빌리의 절친이 게이로 나오는 거에 적지않은 충격을 받았었지.  ","8"
"504","여운을 남기는 영화.아버지가 더 대단한  ","10"
"505","이거 꿀잼입니다 굿굿굿  ","10"
"506","가족의 위대함....  ","10"
"507","몇 번을 봐도 감동적인 영화.꿈을 향해 나아가는 사람, 그 꿈을 도와주는 사람.  ","10"
"508","빌리는 마침내 더 높이 더 멀리 날았다  ","10"
"509","말이 필요 없다 발레를 향한 빌리의 열정은 오래 기억될것같다  ","10"
"510","굿 완전 교훈 영화입니다.  ","10"
"511","볼만하다 아름답고 좋은 영화 이런 영화가 많아야 하는데 ㅎㅎ  ","9"
"512","빌리 엘리어트를 이제서야 봤는데 제이미 벨의 풋풋한 어린 시절이 귀여웠어요&gt;&lt; 꽃소년들이 나오구 내용은 감동적이었어요 아버지가 변하기 시작하는 부분은 뭉클하더라구요ㅠ 최고입니다ㅎ  ","10"
"513","최고의 영화. 최고의뮤지컬.  ","10"
"514","하. 유쾌하고 슬프고 짜릿하고 아릿하다.  ","10"
"515","서글픔과 기쁨이 공존하는 감동. 부모와 자식 모두의 마음을 울리는 영화.  ","10"
"516","내 몸 전체가 변하는 기분이죠. 마치 몸에 불이라도 붙은 느낌이에요. 전 그저 한마리의 날으는 새가되죠. 마치 전기처럼  ","10"
"517","마지막 그렇게 주인공은 백조처럼 난다.런던에서 본 뮤지컬과 같이 보면 더 좋을거 같네요.  ","10"
"518","순위를 가를 수 없는 내인생 최고의 명작들 중 하나  ","10"
"519","미운오리새끼에서  백조로 진화 해버리는 빌리엘리어트 그 뒤에는 아버지의 희생과 사랑 노력이 있었다.  ","10"
"520","아버지의 감동적인 영화  ","10"
"521","잼있다. 가족의 승낙까지의 과정을 정말 세밀하게 잘 만들었다.  ","10"
"522","나는 이상하게 중간에 어머니 나오시는 장면마다 우네.. 지겹게 많이 봤는데도 안질리는 내 1순위 영화 &#39;-&#39;♡  ","10"
"523","정말 괜찮은 영화인듯 ㅎㅎ  ","10"
"524","맨 마지막에 아름답게 피어오르리라 기대했던 제이미 벨의 성인 발레리나 모습만 제외한다면 10점 만점의 10점.  ","10"
"525","새해에 주문해둔 이 빌리 엘리어트를 보고 희망 안고 시작합니다 정말 감동이네요..^^행복한 밤입니다 불우하고 힘든환경안에서도 꿈은 꼭 이루어집니다. 주인공의 아버지의 사랑 주인공 열정 좋은 선생님 모두가 희망이되네요  ","10"
"526","아버지라서 내릴 수 있는 피붙이를 위한 결단과 형제애를 본다  ","9"
"527","마지막 장면은 봐도봐도 감동이다  ","10"
"528","굉장히 사랑스럽고, 가슴 뛰지만 한켠은 애려오는 영화.  ","10"
"529","개인과 사회의 적절한 조화  ","10"
"530","정말 감동적으로 본 영화.  ","10"
"531","여러번 봐도 걸작인 영화.  ","10"
"532","진로에 관한 이야기..  ","9"
"533","&#39;꿈을 가지고 싶다 - but 가족들의 희생이 필요하다&#39;를 알려준, 그래서 슬픈 영화...  ","8"
"534","아직도 아빠가 배신자가 되어서 굴복한 장면이 기억에 남는다.  ","9"
"535","감동적이다. 할머니, 아버지, 형 그리고 빌리~  ","10"
"536","최고의 영화 안넘기고 끝까지 다 봄  ","10"
"537","역시 성장물은 좋구나..  ","8"
"538","너무 재미있고 감동이었다. 그냥 마음 한 켠이 전기가 흐른 것 처럼 짜릿해졌다. 전기가 흐른 것 처럼.  ","10"
"539","5번째 보는대도 눈물 펑펑!  정말 감동적인 영화!  ","10"
"540","명작 중의 명작  ","9"
"541","영화보고나서 라스트씬 잊어버린 사람이 없을듯..그때의 전율!!! 아 완전 소름 돋았어..  ","10"
"542","너무 좋은! 오늘밤엔 빌리엘리어트 보고 자야겠다. 봐도봐도 좋은영화  ","10"
"543","내가 좋아하는 영화중 손바닥 안에  드는 영화^^  ","10"
"544","이영화는 10번을봐도 매번 마지막장면에서 숨을멈추게된다  ","10"
"545","진짜 최고의 영화 아무리봐도 감동  ","10"
"546","2번이나 봤던 영화~재미있고 감동적이고.. 다른 사람들의 시선에서 벗어나 꿈을 이룬 빌리의 모습이 좋지만한편으로는 사춘기라 그런지 게이, 등등 개그 요소인데도 불구하고 듣기에 조금 거북했다는 점~  ","10"
"547","백조  ","10"
"548","너무 재미있당..ㅠㅠㅠㅠ!!!  ","10"
"549","이 영화를 이제서야 보다니!  ","10"
"550","우연히 티비 돌리다 어린 제이미벨의 미친듯한 연기력과 열정에 매료되어 자연스럽게 끝까지 보게됐다.  ","10"
"551","저는 학교에서 틀어줘서 봤는데..정말 완벽한 작품이라고 생각했어요!!  ","10"
"552","굿 무비  ","10"
"553","어렸을때 어렴풋이 본 적이 있었는데 정말 감동적이었다  ","10"
"554","빌리가 아빠앞에서 춤출때 너무 감동적이였고 // 형이랑 아빠랑 같이 울을때 는 너무 슬펐다..  ","10"
"555","마지막 씬은 정말 뭐라 표현해야 할지 모를 정도의 명장면  ","10"
"556","감동적인 성장기  ","10"
"557","정말 아끼고 싶은 영화예요. 진부한 표현이지만 정말 &#34;감동과 재미의 두 마리 토끼&#34;를 잡았습니다.  ","10"
"558","말이 필요 없음. 두번 보고 세번봐도 또 감동.  ","10"
"559","지금까지 본 영화 중에 최고! 영국 여행 가면 뮤지컬도 꼭 보기를!  ","10"
"560","정말 교훈적이고 재미있는 영화다.  ","10"
"561","명작이야  ","10"
"562","너무 좋다 이 영화  ","10"
"563","역사적  배경을 좀 더  설명(가령, 대처를 TV에 쏴준다든가...)해줬으면 더 좋았을텐데...  ","9"
"564","말이아닌행동으로보여주어라  ","10"
"565","가끔 선정적인 내용도 나온다만... 중2과정에서 틀어주시는 영화입니다... 장래에 대한 고정관념을 깨주는 그런 영화였습니다. 감동적이고 슬픈 그런 영화입니다.  ","9"
"566","진짜재밌네요.  ","10"
"567","이 영화 기말고사 끝나고 선생님이 틀어주시던 영화인데... 발레에 대한 고정관념을 깨는 그런 영화군요.  ","9"
"568","이런스토리너무좋아요.  ","10"
"569","정말 아버지 역할의 게리 루이스는 오랫동안 기억에 남을것 같다. 이 양반 때문에 영화 보면서 운듯..  ","7"
"570","빌리 엘리어트!  ","10"
"571","누가 탄광에 피어나는 새싹에 물을 쉽게 주랴 아버지의 마음이 100% 이해된다  ","6"
"572","감동이다 아빠랑 형 울때  ","10"
"573","아놔진짜, 영화 뭐대??^^근데, 연기가 완전, 쥑인다. 도대체 캐스팅 어떡게한거지?// 대충 일하면서봤는데도, 여운이남는영환이게첨이닿ㅎㅎㅎ  ","10"
"574","빌리♥ 감동 ★★★★★  ","10"
"575","감동적임  ","10"
"576","흙탕물속에서도 희망은 성장한다  ","9"
"577","오랫만에 다시봤는데...다시봐도 감동이네.  ","10"
"578","정말 멋진 성장영화입니다... 감동!  ","10"
"579","최고  ","10"
"580","이건꼭봐야되는영화..  ","10"
"581","이 영화를 작위적이라 평하는 전문가들 이해가 안되네요. 어찌되었든 내인생 10대영화중 하나  ","10"
"582","평점이 높은데는 다 이유가 있네요...  ","10"
"583","탄광촌에서 피어나는 희망의 백조  ","9"
"584","다시 봐야지..  ","10"
"585","아 너무 슬프다 ㅠㅠ 빌리가 울면서 합격했어요. 할때 소름돋았다.  ","10"
"586","너무 기대하고 본 영화.  ","7"
"587","아버지가 되고나서 보니까 감동이 더해졌다. 감동을 강요하지 않고 슬며시 건네는 명작  ","10"
"588","편견 속에 날개를 핀 백조. 그 아름다운 스토리 속 주인공은 백조를 위해 자신의 의지를 포기한 아버지.  ","9"
"589","너무나 아름다웠던 유년의 추억이 된 영화  ","10"
"590","별로 볼생각 없었는데 보니까 정말 감동적이더라구요..  ","9"
"591","아름다운 영화  ","10"
"592","잼있음  ","10"
"593","재밌내요  ","10"
"594","기대나 명성만큼은 아니었지만.! 눈물이 송송!  ","8"
"595","멋지다...  ","9"
"596","영상, 내용, 음악 어느 것 하나 흠 잡을데 없다. 아버지 앞에서 용기내어 추는 장면은 지금도 감동.  ","10"
"597","죽기 전에 꼭 봐야함..  ","10"
"598","내인생의영화....마지막장면이잊혀지지않는다.  ","10"
"599","영화를 보며 내가 눈물을 흘릴줄 안다는걸 알게 되었다. 앞으로의 일생에서 잊지못할 영화가 될 것이다.  ","10"
"600","마지막  장면에선 소름이 끼칠  정도다. 지금까지 본 영화 중에 최고라고 생각한다. 모든면에서, 꼭 봐야 할 영화  ","10"
"601","내 생의 최고의 명작  ","10"
"602","교과서에 까지 등장한.....최고의 명작..이라고 생각합니다!  ","10"
"603","마지막 장면이 생각나서 진짜 오랜만에 다시 본 영화.  ","10"
"604","감동적이다..ㅠㅠ 마지막 장면 너무 멋있어요.  ","10"
"605","많은 명작들을 봐왔지만 마지막 장면은 감히 최고다..  ","10"
"606","엔딩장면이 아직도 생생하다.ㅎ  ","10"
"607","옛다! 9.5점 포스터,오프닝곡 마지막까지 잊을수없었다. 늦은 평점  ","10"
"608","발레 영화인줄알았는데꿈과 현실을 이야기하는 영화였네.  ","9"
"609","마지막 엔딩이 정말 최고... 그 장면 보고 울지 않을 수 없는...  ","10"
"610","10년이상 지나도 생각이 나는 영화.  ","10"
"611","여운이 남는 ~~  ","9"
"612","ANG? Hey, let&#39;s  come  in  ","10"
"613","다른사람들이 영화로 볼때 나는 교과서로 보며 대사를 외우고있다닝 흙흙 학원쌤은 잼없다던데 잼있나바여? 봐야것어  ","8"
"614","눈물도 나고 결말도 멋지다  ","9"
"615","완전 사랑하는 영화, 영국에 가서 뮤지컬로도 봤는데, 영화의 여운이 참 좋네요^^  ","10"
"616","나는 내가 중학교 시절, 이 영화를 그 뭐야 2주에 한번 토요일에 학교 수업 말고 따로 하는 할튼 그 때 영화감상부에서 보고 많은 것을 느꼈었다.  ","10"
"617","스토리며 분위기며ㅡ 모두 최고  ","10"
"618","정말감동...  ","10"
"619","나도 꿈 을 향해 달려 가겠어 ~~~~~~~~~~~~~~~~~~~~~~  ","10"
"620","굳  ","9"
"621","볼만해요.  ","9"
"622","1년에 한번씩 7번 본 영화. 볼 때마다 나를 뒤흔드는 영화  ","10"
"623","진정한 자기 자신이 될 기회가 오면 이기적으로 행동해라!....빌리는 자신의 꿈을 찾아 이기적이 되었다...그리고 마침내  꿈을 이루었다.  ","9"
"624","아 최고다.....  ","10"
"625","내가 이곳에 감히 평점을 주게 만드는 작품. 명작이라 하겠다. 반드시 봐야할 영화  ","9"
"626","Hi, Billy:)  ","10"
"627","감동적이고재밋네요 모두가 같은 길을갈때 빌리는 다른길을 선택할용기가 있군요 더큰 세상으로~~!!  ","8"
"628","영화기술은 발전하고 기법도 끝간데 없 이 발전할 수 있을지 모르나 감동은 그런데서 오는게 아니란 걸 거칠고 서투르게 꿈을 향해 다가가는 빌리가 말해준다  ","10"
"629","말이필요없음  ","10"
"630","이런영화 더이상 안나오겠지....  ","10"
"631","와 진짜 서양의 가치관, 사고방식에 대해 배웠고 ,연기력에 감탄했음 ㄷㄷ 그리고 영국영화는 별로 못 접해봐서 영국발음도 거의 못 들어봤는데 보는 내내 발음 따라하고 재밌었음 ㅎㅎ 표정연기, 재미 뿐만 아니라 춤도 완전 예술이더군요 ㄷㄷ  ","10"
"632","bb  ","10"
"633","가족의 품을 떠나 자신만의 인생을 성취한 빌리... 어느새 소년의 티를 벗고 거인이 되버린 듯한 마지막 장면이 너무나 인상적이다.  ","10"
"634","ㅋ  ","10"
"635","아ㅠㅠㅠㅠ  ","10"
"636","여운이 남는 몇 안되는 영화  ","10"
"637","최고. 마지막 장면에서 울지 않을 수 없었다.  ","10"
"638","인생은 슬프지만, 아름답다  ","10"
"639","감동♥♥  ","10"
"640","마지막 도약하는 장면은 진짜명장면  ","10"
"641","말로는 표현 못 할 감동, 최고!^^  ","10"
"642","제이미벨의 연기 인상적  ","8"
"643","마음이 따뜻해지는 재미있는 영화여 ㅋㅋ  ","10"
"644","나를 너무나 행복하게 만들어주는 빌리의 아름다운 날개짓  ","10"
"645","진짜 감동적이에요ㅠㅠㅠ특히 맨 마지막부분  ","10"
"646","정말 오랜만에 대단한 수작을 만났다고 생각함..  ","9"
"647","너무 재밌게봤어요 ㅠㅠㅠ 정말 명작이네요  ","10"
"648","실화를 기반으로 만들어서인지 감동 두배..빌리의 꿈과 아버지와 가족의 사랑 또 주변 인물들의 하모니가 잘 느껴지는 아름다운 인생영화.빌리 넘 사랑스러워~ㅎㅎ  ","10"
"649","또봤는데 볼때마다 마지막 장면에서 눈물이ㅜㅜ  ","10"
"650","사람마다 감동의 척도는 다르지만 작위적이고 부자연스럽단 느낌은 안들었는데...선생님과 아버지역 배우가 기억에남음.  ","9"
"651","빌리는 행운아다 발레 선생에게 평생 고마워해라  ","9"
"652","EBS 명화 좋아요!  초등 울 아들들 아직 감동에서 벗어나지 못하고 있어요! 추천!  ","10"
"653","탄광촌의 몰락속에서도 희망이 이루어지는 감동적인 영화이네요 몇번을 봐도 감동입니다.  ","10"
"654","감동입니다.ㅠㅠ  ","10"
"655","몇 번을 봐도 감동을 받을 수밖에 없다. 열정  ","10"
"656","정말  몰입해서 보게된 영화 내 어린 동생에게 추천해 주고싶은 영화  ","10"
"657","꿈을 향해 가는 청소년들이 보면 더욱 좋을것 같은 영화.  ","10"
"658","빨간색도,파란색도, 흰색도 없는 세상을 꿈구며  ","9"
"659","&lt;호로비츠를 위하여&gt;보다 훨씬 더 멋있었습니다.  ","10"
"660","역시 영국 영화도 색깔이 뚜렷해  ","8"
"661","어  edd님 누구?? 원촌중 1학년 10반??  ","9"
"662","최고의 성장영화 동시에 가족과 친구의 사랑을 가르쳐주는. 아이들이 꼭 봤으면 좋겠다. 좋은 영화  ","10"
"663","seo님 혹시 원촌중학교 1학년 10반,아니면 9반이심?이경일쌤이 보여주신거?  ","10"
"664","말이 필요없다..  ","10"
"665","굿!  ","10"
"666","허구헌날 조폭 개쓰x기나 배설해대는  개한민국 영화와는 차원이 다르다 ㅋㅋㅋ  ","10"
"667","뻔한데 뻔하지 않은..잔잔한 감동이었던듯  ","8"
"668","약간의 지루함 그러나그순간 마저도 기대하게 된다 마지막장면은 여태 영화중 최고의 컷  ","10"
"669","좋은 영화다  난 무얼 이루어 가는걸까  꿈... 희망... 사랑...  모노필름처럼...  ","10"
"670","마지막 장면... 영화중 최고의 명장면  ","10"
"671","많이 울기도 웃기도 교훈을 받기도한 영화 너무너무 재미있고 감명깊게 본듯  ","10"
"672","철의 여인을 본 사람은 빌리엘어트를 꼭 봐야 한다. 반대도 마찮가지..  ","10"
"673","꼭봐야하는영화  ","10"
"674","발레학교에 시험치러갔을때 마음이찡했음. 아빠 무뚝뚝하지만 좋은아빠임  ","8"
"675","절실함에 대해서  ","9"
"676","마지막 점프  ","10"
"677","내가 평생갖고 싶은 영화, 볼때마다 감동때문에 눈물이 정말... 영화는 이거바께안봄.  ","10"
"678","감동의 도가니  ","10"
"679","감동적  ","8"
"680","잠시 잊었던 나를 돌아보며..  ","10"
"681","재미져용ㅎ  ","9"
"682","여운도 남고..보고 또보게 되는 영화  ","10"
"683","해외에서 이게왜R등급이지;;  ","9"
"684","명작  ","10"
"685","이렇게 감동적일줄 몰랐음  ","10"
"686","학교서 봤는데 괜찬앗음  ","9"
"687","꿈을 지지해주는 사람들이 있기에 더 힘낼수 있는 것 같다.  ","7"
"688","대애박...ㅠㅠ  ","10"
"689","마지막장면보고 가슴이 너무 먹먹하고 좋았음...여운이 많이남음ㅜㅜ  ","10"
"690","성장 영화를 너무 부각시키기 보다 부드럽게 이어주는 것에 이 평점을 주고 싶다.  ","8"
"691","이거 우리학교 영어 교과서에 본문으로 나옴 .... 똷  ","10"
"692","한국 아버지나 영국 아버지나 자식 사랑하는 맘은 다를게 없다. ㅠ  ","9"
"693","엔딩이 너무 좋다  ","10"
"694","왜우는지도 모르고 운적은 처음이다 정말감동적인영화다  ","10"
"695","그냥 멋진영화였다 진짜 마지막장면은 너무나도 감동적임 나도 멋지사람이 되야지  ","10"
"696","몰입감 최고에 감동적이네요...지루할 틈이 없음...  ","10"
"697","가난한 가정과 어머니를 그리워하는 한 소년이 가장 즐겁게 할 수 있는 것  ","8"
"698","할 수 있다면 그걸 하게 내버려줘도 좋다  ","10"
"699","영화가 끝나도 계속 빌리가 춤추는 모습이 생각난다  ","10"
"700","내용도 재미있고 제이미벨 너무좋다ㅋㅋ  ","10"
"701","관객을 후릴줄 아는 영화. 영화를 사랑한다면 사랑할 수 밖에 없는 영화  ","8"
"702","여기에 나오는 꼬마아이가 맨온렛지에나오는 청연이라니!!  ","9"
"703","지루하다 영화내용은 좋은거같은데  ","6"
"704","꿈을 향한 아들의 본능. 그런 아들을 향항 아버지의 선택이 날 울린다.  ","10"
"705","볼만한 정도...  ","7"
"706","아들의 꿈을 위해 신념도 동료도 버리는 아버지의 희생이 짠한 영화다  ","9"
"707","표현 불가 감동  ","10"
"708","외부적 요인, 내부적 요인 그 사이를 오가며 열정 또한 터트린다  ","10"
"709","제이미벨연기봐...  ","10"
"710","먹먹한 감동을 주는 흔치 않은 영화.  ","10"
"711","최고의 엔딩-  ","10"
"712","꼭보세요 두번보세요 세번보세요  ","10"
"713","나에겐 특별한 영화.  ","10"
"714","아버지의사랑,꿈을향한 열정 마지막장면이 아직도 안잊혀짐.. 이런영화 사랑합니당  ","10"
"715","소장가치가 있는 영화에요!!그때 영국의 내면모습도 알수있었꾸요..안보신분들 추천~  ","10"
"716","영국영화라 막 화려하지 않아서 그렇지 감동적이고 훈훈한 내용이였어요~볼만해요!!  ","10"
"717","발레를 반대하던 아버지앞에서 춤추던 장면은 감명스럽기까지..내 인생최고의 영화  ","10"
"718","이런개념없는놈들을봤낰ㅋ불쌍하네감수성이없어섴ㅋㅋㅋㅋㅋ  ","10"
"719","지루해서 죽는줄 알았다. 이래서 평점을 믿지 말자.. 하지만 마지막에 약간 울컥  ","4"
"720","1점 준사람 알바인가?  ","10"
"721","cyber133 ☜이사람 알바  ","10"
"722","auperman는 감정에 메말렸구만  ","10"
"723","정말말봐도봐도재밌습니다!!!!  ","10"
"724","말그대로 걸작임 ㅇㅇ 암 그렇고 말궁  ","10"
"725","투 썸즈 업!  ","10"
"726","국어 선생님 추천으로 봤는데...... 다시 보고 싶은 영화.....  ","10"
"727","그 빌리가 아닙니다.  ","10"
"728","세계영화사의과거와미래의중간지점에서휴머니즘을부각시킨영화다...  ","9"
"729","재능있는 소년의 성공담보다 더욱 감동적인 탄광촌 사람들의 세세한 묘사들...  ","9"
"730","아정말연기잘해 연기라고할정도의연기가아니야하정말  ","10"
"731","짠하다 정말  ","9"
"732","내 인생의 최고의 영화 중 하나  스코틀랜드의 시대적 배경 그리고 아버지의 사랑 꿈을 쫒는 소년  ","10"
"733","마치 한편의 고급 다큐멘터리를 보는 듯한 그런 영화  ","10"
"734","아름다운 천재소년의 꿈과 가족에 대한 이야기. 무뚝뚝한 세 부자 사이에 뭉클한 감동까지..!  ","9"
"735","열정이 만들어낸 뜨거운 성장영화다! 옥토버 스카이와 함께 보면 좋을 듯싶다  ","10"
"736","특히 마지막 장면은 너무 감동스러워서 온 몸에 전율이 느껴짐.  ","10"
"737","영국판 옥토버 스카이 감동적이다  ","10"
"738","열번이라도 볼 수 있겠다. 마지막 장면에서 아버지의 눈물그렁그렁한 표정은 ㅠㅠ  ","10"
"739","지금봤는데 감동. 멋지네요~  ","10"
"740","다운받아 봤는데, good!  ","10"
"741","뭉클  ","10"
"742","모든면에서 최고인 영화  ","10"
"743","아버지다!! 당신 옆의 아버지다!!  ","10"
"744","또봐도감동적인영화!  ","10"
"745","빌리로인해 나도 내꿈에대한 확신을 갖게되었다  ","10"
"746","어른보다 멋있다 하지만 좀 더 보여주지 못해 아쉽다  ","9"
"747","재미있는 스토리였지만 지루한 장면이 많았기 때문에 8점정도  ","8"
"748","내 인생 최고의 영화  ","10"
"749","너무감동적이고 빌리 발레를 너무 잘한당.. 정말정말 살면서꼭한번쯤은봐야할 영화!!  ","10"
"750","마지막 장면.. 와.....  ","10"
"751","역시 자식이기는 아버지는 없다 ㅠㅠ  ","9"
"752","눈물이주륵주륵나오는영화. 아련하고슬픈감동이전해진다  ","10"
"753","다시봐도 새로운 명작~!! 변하지않는 감동과 재미!!  ","10"
"754","너무좋았습니다!!  ","10"
"755","감동....  ","10"
"756","넘 감동적이에여 ㅠ0ㅠ!!!!  ","10"
"757","마지막씬은정말......10초정도만이라도좀만더보여줬으면하는아쉬움도살짝잇지만최고  ","10"
"758","중1 국어책인가?생국에서 나오지요,,,  ","10"
"759","너무감동..연기를너무잘한다.왜이제서야봤는지!!최고다!  ","10"
"760","걍 잔잔하고 영국풍 빈티지 색감의 배경이 예쁘네요ㅋ  ","8"
"761","그냥 보시면 됩니다 마지막 장면은 정말... 무슨말로.......  ","10"
"762","특히 마지막 장면은 압권이다. 그장면은 아직도 사진과 같이 내 뇌리에 박혀있다.  ","10"
"763","완전 감동....  ","10"
