"","reviews","points"
"489","관람객도심에서 시인으로 사는 법  ","9"
"490","관람객꾸며지지않은 누군가의 일상을몰래 들여다보는 재미.뒤돌아 나오면 큭킄 웃음이나고자꾸 패터슨의 일상으로 들어가보게 된다  ","9"
"491","관람객패터슨 보고 수첩 뽑뿌왓어요  ","8"
"492","관람객일상이 시처럼 펼쳐진다.  ","10"
"493","관람객짐 자무쉬 영화를 보았다.  ","6"
"494","관람객너무 좋았어요! 일상의 아름다움..!  ","9"
"495","관람객약간 지루. 월화수목금토일  ","7"
"496","관람객개인적으로 기대를 많이해서 다소 아쉬움  ","7"
"497","관람객작지만 확실한 행복, 그리하여 확장하는 행복  ","9"
"498","관람객아름답다. 시를 쓰고 싶게 만드는 영화다. 예술을 사랑하는 모든 이가 보앗으면 좋겠다.  ","9"
"499","관람객무엇이 시가 되는가???  ","10"
"500","관람객일상의 소소함에 관한 여운이 남는 영화입니다.  ","8"
"501","관람객이 영화를 보고 빈 노트를 사고싶어졌다.  ","9"
"502","관람객 일상이 예술이 되는 특별한 순간  ","10"
"503","관람객평범하면서도 시적인 일상, 음악 영상 그리고 시가 하나되는 장면들 신선했고 또 평범한 일상을 돌아보게 해주는 영화  ","10"
"504","관람객17년 영화중 가장 편안히  ","10"
"505","관람객구성적으로나 내용적으로나 한 편의 시 같은 영화. 알고 보니 우리 삶도 결국 한 편의 시였다.  ","10"
"506","관람객반복되는 것들..없어진 것과 다시 반복되는 것들  ","10"
"507","관람객놀라운 감동이 있는 영화. 평범한 사람들을 주인공으로 만드는 기적의 영화.  ","10"
"508","관람객시를 쓰고싶게 만드는 영화  ","10"
"509","관람객소소하게 즐겁고 재밌는 영화  ","9"
"510","관람객심심하긴 하지만 생각보다 재미있다.  ","9"
"511","관람객정말 재미 있었어요~ 배우들의 연기도 너무 좋았구요 영상미도 아주 좋았습니다~^^  ","10"
"512","관람객예상보다 웃을 일이 많았던 영화  ","7"
"513","관람객시를 좋아하지 않았는데... 이 영화를 보고 시라는 걸 좋아하게 되었습니다. 잔잔한 일상을 그린 영화지만 감동이 있네요.  ","10"
"514","나오면서 한번 더 보고 싶던 영화  ","9"
"515","관람객시 같은 영화, 영화 같은 시  ","10"
"516","관람객무조건 다시 볼 것. 많이 담고는있지만 넘치진 않는 영화  ","9"
"517","관람객생각하면 할  수록, 하지 않으면 않는 대로 짙은 의미를 갖는 영화.  ","8"
"518","관람객사실 인간에게 일상이 전부인데 그걸 잊고 지내는 때가 많다.이 영화를 통해 일상의 아름다움을 다시 한번 깨닫게 되었다.  ","8"
"519","관람객매일 같아보이지만 작은 변주가 가득한 일상. 그리고 그 속에서 시어를 건져올리는 시인의 모습.  ","9"
"520","관람객요건 좀 별루였어요. 주제는 좋았지만..  ","7"
"521","관람객일상이 시가 되고 순간순간이 그렇게 아름답다면 그 무엇이 부러울소냐  ","8"
"522","관람객잔잔합니다 짐 자무쉬 감독 특유의 세밀함이 뭍어나는 영화  ","7"
"523","관람객ㅋㅋㅋ재미있어요! 잔잔해서 더 보기 좋은! 패터슨의  하루!  ","7"
"524","관람객은은하네요볼만합니다  ","10"
"525","관람객잔잔한 스토리 라인과 영상미가 아름다웠던 영화. 언제 다시 보아도 좋은 영화가 될 것 같아요  ","8"
"526","관람객소소한것에서 찾는 확실한 아름다움, 그런것을 소중히 하는 일상을 담은 영화  ","8"
"527","관람객굳이예요 굳굳 ????-  ","9"
"528","관람객현실에는 없는 삶의 행복, 이 영화 안에는 있다.  ","10"
"529","관람객그렇게 또 살아가는 하루 그리고 시와 함께.  ","9"
"530","관람객잔잔한 일상속 울림과 다짐  ","9"
"531","관람객아-하평범하지만은 않은 일상  ","9"
"532","관람객잔잔하면서 소소한 일상의 행복과 긍정적인 마음의 중요성을 알게 해주는 좋은 영화였습니다.  ","8"
"533","관람객잔잔한 영화. 시를 써가는 과정이 무척 좋았다. 사소하고 일상적인 소재가 시가 되는 것이란... bb  ","6"
"534","관람객두 시간의 낭독회에 초대 받아 다녀온 기분. &#39;Ih memory of Nellie&#39;는 영화와 가장 잘 어울리는 마침표였다.  ","10"
"535","관람객너무 좋아요♡ 스토리 음악 내용 다 넘 좋으네요♡♡♡  ","10"
"536","관람객다를 것없는 나의 삶에서 어떤 부분을 시적으로 창조하고 승화시킬 수 있을까 궁리해보게 만드는 영화.  ","10"
"537","관람객짐자무쉬 영화는 처음.그의 다른 영화들도 궁금해졌어요.  ","9"
"538","일상에 감사하게 되는, 소중한 영화  ","10"
"539","관람객낮과 밤, 평일과 주말, 노동과 쉼의 반복이 운율이 되어 완성하는 삶이라는 시  ","8"
"540","아릅답게, 절제적이면서도 풍부하게 쓰여진 패터슨의 시는, 매일 같은 하루를 살고 있는 오늘날의 우리들에게 꿈을 갖게 해준다.  ","10"
"541","관람객맑고 고요하고 리듬이 있고 사색과 삶의 의미 시 사랑 말 그대로 인생이 아름답게 담긴 영호ㅏ  ","10"
"542","관람객패터슨 시에서 패터슨과 그의 연인 아티스트 로라와 함께 시간을 보내고 싶어지는 영화였다. 패터슨이 일상을 보내는 모든 공간이 좋았다.  ","8"
"543","관람객그래도 세상은 시가 된다  ","9"
"544","관람객일상 속 예술의 흐름이 보는내내 마음을 편하게 해주었다.  ","9"
"545","관람객일상을 되새겨 보게 되는 영화. 짐 자무쉬 특유의 현학적이고 상징적인 요소들을 맛볼 수 있다.  ","8"
"546","관람객시를 쓰듯 써내려간 영화  ","10"
"547","관람객패터슨에 사는 패터슨은 매일 시를 쓰고 버스를 몬다. 잔잔하게 오래 기억에 남는 영화였다.  ","9"
"548","관람객패터슨시에 사는 패터슨의 일상을 보는 내내 좋았다.  ","9"
"549","관람객MSG없다. 꺠알같은 유머가 있다. 다람쥐 챗바퀴 돌아가는 일상에 무료함을 특별하게 만드는 방법을 알려주는거 같았다.  ","8"
"550","관람객월화수목금토일, 행복의 발견은 디테일인 듯  ","9"
"551","관람객평범하지 않은 평범함!잔잔함 속에서도 따뜻한 울림이 있어 줗았습니다!  ","9"
"552","관람객꼭 봐야하는 영화. 패터슨  ","10"
"553","관람객음... 또 한번 보고 싶은 영화  ","9"
"554","관람객영상미 갑, 따뜻하고 소소한 웃음  ","8"
"555","잠 지무시가 아닌 잠 자무시인줄 월요일부터 화요일 중빈까지는 자버렸다 마지막에 느끼는 큰 울림이 있었다 아하  ","8"
"556","관람객일상이 시가 되는 마법.패터슨 씨의 평범한 일상. 누구나 그렇듯.편안하게 봤어요. 좋아요.  ","8"
"557","관람객일상의 작은 것을 돌아보게 만드는 놀라운 영화. 매일 매일이 가능성으로 가득한 새 페이지임을 다시 한 번 느끼게 해주는 영화임.  ","9"
"558","관람객일상이 영화 같은 일상을 위해  ","8"
"559","관람객일상이 주는 편안한 감동  ","8"
"560","관람객윌리엄 카를로스 윌리엄스! 카를로 윌리엄스 카를로스!  ","3"
"561","관람객창작이란 삶의 일부임을 느끼게 해주는 영화. 잔잔하지만 심심하지는 않은 영화. 텅 빈 영화관에서 혼자 곱씹으며 보고 싶은, 그러나 최대한 많은 사람이 보았으면 하는 영화.  ","9"
"562","관람객패터슨마을 다이어리!  ","10"
"563","관람객일상의아름다움이 느껴지는영화  ","10"
"564","시 같은 영화, 영화 같은 시  ","9"
"565","관람객역시 짐 자무쉬! 최고라는 말밖엔 없다ㅠ  ","10"
"566","관람객누군가의 혹은 누구나의 일상의 시를 위한 영화  ","10"
"567","관람객특별한 하루보다 단조로운 일상의 힘.  ","8"
"568","관람객배우들의 호연과 아름다운 미술 그리고 마음을 움직이는 시는 일상의 아름다움과 소중함을 깨닫게 해 주었습니다.  ","10"
"569","관람객상상마당 시네마 소규모라 항상 맘에들었어요패터슨 이런저런 생각을 하게 만드네요잘 봤어요  ","8"
"570","평범한 삶에도 불구하고 누구나 시인이 될수있는 가능성을 알게 해준 영화  ","7"
"571","관람객평범했던 내 일상에 대해 ㅎ생각하게 되네요  ","10"
"572","새해 소망이 뭐냐고 묻는 남편에게 &#34;패터슨처럼 사는 거요&#34;라고 답했어요.  ","10"
"573","관람객아담 드라이버의 연기 최고입니다 짐 자무쉬 영화 중 가장 좋았습니다  ","10"
"574","관람객반복적인 일상 속 예술을 말하다  ","9"
"575","관람객좋다.간결하다.노트가 사고 싶어 진다.  ","9"
"576","관람객하루하루가 인생이자 예술  ","8"
"577","관람객잔잔한 일상이지만 집중하게 만드는 힘을 가진 영화였습니다  ","9"
"578","관람객올해 마지막 영화로 보기 잘했다. 매일 타는 버스와 풍경과 시가 어울러진 최고의 영화  ","9"
"579","관람객아름다운 영화 넘 배경과 내용이 좋았어요  ","8"
"580","잔잔하게 혹은 러블리하게 표현되는 뻔한일상의 낭만  ","9"
"581","관람객고요하고 열정적인 시인의 일상  ","8"
"582","관람객딘시보러가요 아오으ㅜ노오  ","10"
"583","관람객우리의 일상도 이렇게 아름다워질 수 있을까  ","9"
"584","관람객평범한 일상을 다루는 큰 힘  ","8"
"585","관람객내가 좋아하는 영상미, 여운이 남는 영화 비지엠은 별루엿지만  ","9"
"586","관람객소소한 행복의 가치마음이 행복하게 살아야 한다는 것을 알려준 영화  ","10"
"587","관람객건조한 일상에 숨결을 불어넣는 사람과 사랑.  ","10"
"588","관람객1년의 반복되는 틀 속에서 마지막을 기억하기 좋은 영화인 것 같아요  ","10"
"589","관람객반복되는 일상 속엔 그마다의 달콤함이 녹아있다. 하지만 그 소소한 순간의 행복을 음미할 수 있는 건 결국 행복해할 줄 아는 사람들이다.  ","9"
"590","잔잔한 이야기 속에서 캐릭터들이 살아 숨쉰다.사랑스러운 영화  ","8"
"591","두번 봤음에도 일상의 흐름에 녹아들어간다.  ","9"
"592","패터슨의 시적인 일주일  ","8"
"593","관람객잔잔한  일상을  보여주는 영화!  ","9"
"594","소소한 우리의 일상과 나의 소중한 일상들에 대한 찬사  ","10"
"595","관람객반복되는 일상에 대해 보여주면서 나의 일상에 대해 다시 생각해보게 해주는 영화. 잘봤습니다  ","7"
"596","관람객월화수목금토일월-시인의마치 시와 같은,아름다운 일상.  ","8"
"597","관람객생각이 많아지는 영화 보고나면 좋네요  ","7"
"598","관람객삶과 예술의 접점을 보여주는 영화는 흔치 않다. 그러나 이 영화는 해냈다  ","9"
"599","예술 단독이 아닌, 일상이라는 탄탄한 토대 위에서 더 빛나는 예술.  ","9"
"600","Good~~~~..  ","10"
"601","난 시를 쓰진 않지만 매일 마음속으로 시를 쓰곤 한다..(시라고 해야할지 모르겠지만) 패터슨의 시각..아무튼 영화를 보면서 나는 꽤 패터슨과 비슷하다는 생각을 하면서 봐서 그런지 별다른 특별함을 느끼기 힘들었다...ㅠ  ","6"
"602","이런게 바로 힐링영화 아닐까?  ","9"
"603","관람객잔잔하고 좋았다. 깊은 의미가 있다고 생각하고, 그 의미를 찾아보려 했지만, 어쩌면 그저 한 남녀의 일상을 담아내고자 했던 영화일수도.  ","8"
"604","평화롭다 그래서 이상하다 뭔가 일어날 것 같아서 조마조마하다  ","8"
"605","관람객쭉 무료해보이는 그였지만 조용한 움직임의 시를 쓸때면 흥분되어 보이는 모습이 멋졌다  ","8"
"606","관람객지루할 줄 알았는데 졸지않고 빠져들었습니다~^^  ","9"
"607","관람객짐자무쉬의 따뜻한 시 한편  ","9"
"608","아름다운 평범한 일상을 위하여...  ","9"
"609","관람객일상의 모습들이 운율감있게 담긴 영화.  ","8"
"610","이게 왜 사건이 없는 영화라는 거냐. 막판에 찌통을 느끼게 하는 엄청난 사건이 터지는데! ..어쨌든 영화를 보면서 나도 시가 쓰고 싶어졌다.  ","9"
"611","관람객버스기사라는 직업, 가정의 남편, 바에서의 맥주 한잔과 교류 등 일상생활에서 누구나 뭔가를 끄집어 냅니다 시일수도 컨트리송일수도 연기일수도...비록 큰 것은 아니지만 최소한 자신에겐 귀한 것을...때로눈 허무할 수도...물 위에는 낱말같이...  ","8"
"612","관람객좋았다 억지스러움 하나 빼면  ","8"
"613","관람객삶이 된 시, 시가 된 삶.  ","8"
"614","관람객지루하지만 지루하게 만들 수밖에 없는 영화변주는 혁명이 아니다  ","7"
"615","관람객그와나를위해 만들어진 영화였다.  ","8"
"616","관람객내 하루를 돌아보게 된다  ","8"
"617","관람객묵묵히 담고 꾹꾹 써내려가는 패터슨의 일상. 풍요롭다.  ","8"
"618","관람객일상적인 생활을 그려낸 영화.. 현실감있으면서도 조금 동떨어지는 듯한 느낌이드는 영화를 보고 나면 지루하다고 느끼기도 하면서 많은 생각이 드는 그런 영화  ","7"
"619","나날을 맴도는 운율, 시가 있는 나날들  ","8"
"620","관람객데드맨 이후 또다른 지금의 시  ","9"
"621","관람객가장 평범한 사랑스러움  ","7"
"622","관람객아주 조용하지만 지루하지 않은 그리고 우리의 일상적인 삶을 들여다보게 되는 영화 였습니다. 주인공들에 연기가 너무 좋았구요 강아지도요^^  ","9"
"623","관람객패터슨을 보며 이런 생각을 했다. 평범함 속 소중함을 알고있는, 알고싶은 그러니까 우리는 패터슨을 보고있지 않나  ","8"
"624","관람객누군가의 평범한 일상이 관객에게는 특별하게 다가오네요. 나의 일상도 그렇지 않을까 설레이며 영화관을 나왔습니다.  ","8"
"625","반복성과 잔잔함이 혼합된 영화.  ","7"
"626","관람객영화 잘 봤습니다. 스토리가 있는 잔잔한 영화 좋아하시는 분들에게 추천합니다,  ","8"
"627","관람객눈과 귀가 즐거운 영화 갑자기 시를 쓰고 싶네요  ","8"
"628","관람객반복되는 일상, 어제같은 오늘, 내일도 아마우리의 삶이다. 단조로운 삶을 나도 살아가고 있다  ","8"
"629","관람객패터슨 Ah ha ( 아 하 )  ","9"
"630","관람객시에 대한 내용은 좋았습니다만, 뜬금없이 개를 납치한다던가 무늬에 대한 내용 언급은 제가 다시 한번 이해해볼만한 시점이네요  ","8"
"631","관람객아름다운 시와 일상을 잔잔하게 보여주는 영화  ","8"
"632","관람객반복되는 일상 속에서 꽃피는 언어들관찰하고 읊조리는 것들 모두 시가 될 수 있다  ","9"
"633","관람객영화 평점 9점 드립니다  ","9"
"634","이런 영화가 좋다. 우리네들의 이야기  ","9"
"635","관람객느리고 행복한 영화이다.  ","9"
"636","관람객일기처럼 시를 써야겠다고 생각하던 차에 만난 담백한 컵케이크 같은 영화  ","9"
"637","관람객보는 내내 답답했는데, 크레딧 올라올 때 골똘히 생각한 끝에 이해가 되니 생각할 거리가 많아지는 영화였습니다. 하지만 지인한텐 추천 못하겠네요.  ","8"
"638","관람객무던한 패터슨의 섬세한 시들  ","8"
"639","관람객일상의 은은함, 그리고 꾸준함  ","7"
"640","관람객일상 그 자체가 특별하다는 것  ","8"
"641","관람객요란하지않게 자기 삶을 살아가는 모습에밀리 디킨슨을 좋아하는 버스기사  ","9"
"642","관람객언어의 유희를 만끽할 수있었어요  ","8"
"643","사려 깊은 선물 노트, 그리고 다시 시작된 먼데이. 반복이 예술이 되는 순간.  ","7"
"644","관람객인생의 운율을 영상으로 잘 봤습니다.  ","9"
"645","관람객너무 좋은 영화!! 강력추천  ","9"
"646","관람객평범하지만 평법하지 않은 일상  ","7"
"647","관람객무난하고 굴곡없눈 영화  ","8"
"648","관람객잔잔하게 보기 좋은 영화  ","8"
"649","관람객 낮잠같은 영화.볼때는 사실 큰 감흥이 없었는데, 보고나니 서서히 스며들듯 생각나는 영화. 담담하고 온전하게  ","8"
"650","관람객아하! 의 순간을 영화로 느껴보기  ","8"
"651","관람객일상이 소중한 것이 아니라 내가 그걸 소중하게 느낄 수 있을 때 소중한 것  ","8"
"652","관람객훌륭한 배우 넬리에게 경의를.  ","8"
"653","관람객맘이 편안해지는 영화. 맥주가 땡기는 영화.  ","9"
"654","관람객약간의 지루함이있지만, 일상을 들여다 보는 기분이라 잔잔하니 여유롭게 보기 좋네요  ","8"
"655","관람객이 영화가 당신의 인생을 아름답게 만들어줄거에요.  ","9"
"656","관람객 월화수목금토일 그리고 월요일 소중한 일상과 그 일상을 담아내는 담담한 언어. 애무 시네마의 화면이 조금 더 밝았으면 하는 아쉬움  ","9"
"657","관람객시를 보는 버스운전사.일상의 환희와 상실, 조용하게 떨려오는 시의 울림으로 충분한 영화.  ","8"
"658","관람객별 거 아닌 것 같은 이야기를 덤덤하고 시시콜콜하게 풀어냈다 짐 자무쉬만의 유머도 가끔 나오는 게 좋았음  ","8"
"659","관람객사람들이 왜 시를 읽는지 나는 드디어 알았다  ","9"
"660","관람객영화보기전 기대감으로 더설레였던  ","8"
"661","관람객일상속에 위로를 주는 영화  ","8"
"662","관람객일상의 잔물결과, 그 물결에 비치는 햇살이 좋은 영화  ","8"
"663","관람객월화수목금토일 시간순으로 진행되는 영화, 기승전결이 없는 반복적인 일상 속에서 이어쓰는 시구로 전개되는 스토리. 시구들처럼 품은 의미가 많아서 한참을 곱씹게 하는 영화.  ","10"
"664","잔잔하게 흘러나오는 배경음악이 장면과 어울어져 깊은 감동을 주네요....  ","10"
"665","관람객너무너무좋아요 귀여워요 알랍  ","10"
"666","관람객평범한 일상,영화의 색감과 주인공들이 너무 이쁜영화  ","10"
"667","관람객aha!!!! 여운이 나는 영화였어요  ","10"
"668","관람객끄적끄적 시를 쓰자 ♥?  ","10"
"669","관람객독특하고 잔잔해요. 개가 웃기네요  ","8"
"670","관람객짐 자무쉬 신작이라 고민 없이 봤고, 무엇보다 패터슨에 사는 패터슨씨의 반복적 루틴이 오히려 생경하게 다가와서 좋았다. 정작 감독이 뭘 말하고자 하는지는 치덕치덕 다른 디테일 때문에 잘 와닿지 않았지만, 옆자리 포터씨 덕에 재밌게 봤다.  ","8"
"671","잔잔한 감동 그리고 편안함과 행복..너무 기분좋아지는영화입니다  ","10"
"672","정갈하게 차려진 슬로우푸드 한 접시  ","10"
"673","잔잔한 일상이 시가되는....우리 일상은 아름답다는 생각이 들게되네요  ","10"
"674","관람객일상의 창의 힘을 뺀 짐 자무쉬  ","9"
"675","이 분위기... 어쩜 좋을까  ","10"
"676","관람객한 남자의 일주일. 자극적이지 않은 평범함에서 몰려오는 삶에 대한 생각들  ","10"
"677","기억 남은 명대사 때론 텅빈 페이지가 가장 많은 가능성을 선사하죠  ","10"
"678","소소한 삶, 그 속에서 깨닫는 교훈  ","10"
"679","관람객영상도 스토리도 연기도 좋았다  ","10"
"680","관람객그 도시의 모두는 예술가였다. 나와 비슷한 일상을 살아가는 그들의 일상은 예술로 이루어져 있었고, 나는 그 사실이 무척이나 마음에 들었다.  ","10"
"681","관람객우리는 누구나 시인이고, 한 번에 여러가지 꿈을 꿀 수 있다. 버스운전기사이며 시인일 수 있듯, 컵케이크를 팔며 기타를 칠 수 있다.이창동 감독의 &#39;시&#39;의 대척점에 있는 것 같은 영화. 내게는 멋진 세트같은 영화들입니다.  ","10"
"682","관람객짐 자무시는 사랑이다. 남의 인생을 훔쳐보는 게 아닌  감상하는 기분.  ","9"
"683","관람객자칫 무료하고 따분해 보일 수 있는 일상을 다양한 변주를 통해 세밀하게 보게 해줬어요 일상이 그렇게 유지될 수 있도록 해주는 아내와 이웃들과 좋아하는 일이 있었고요 아내의 예술적인 생활도 좋았어요  ","8"
"684","관람객예술은 자신이  처한 평범함과 궁색함을 강박적으로 부정하지 않는다.   - 그을린 예술 중에서 -  ","9"
"685","관람객평범한 일상중 갑자기 찾아오는 비범한 순간.. 작고 사소한 것에 감사하고 싶고 일상의 여유를 더 누리고 싶어진다  ","10"
"686","관람객이 한 편의 영화로 당신의 하루가 아름다워질 거예요 이 문구 하나에 마음을 뺐겨 조조로 보고 왔어요~ 잔잔하고 편안하고 삶과 시 아름다움에 대해서 생각해볼 수 있었습니다.  ","8"
"687","관람객평범함 속에 특별함을 발견하는 것에 대한 깨우침..  ","8"
"688","관람객시로 바라보면 시가 되는 세상  ","8"
"689","아  - 하!!!!  아 하?  ","10"
"690","한가지 확실한건  이  영화가 개 지루 하다는 것이다.  ","1"
"691","관람객시같이 아름다운 영화, 일상 속 예술을 시작하고 싶게 한다  ","8"
"692","관람객빈노트는 가장 큰 가능성이 될 수 있다는, 한편의 시집같은 영화. 반복적인 일상 속에서 그토록 멋진 시상을 떠올려냈던 패터슨이 신기하기만 했다  ","9"
"693","관람객삶은 이렇게 사는거랍니다. 라고 하는 것 같네요. 자기가 걷는 만큼 똑같은 걸음으로 걸어오는 무언가를 만나게 되는 삶은 멋져요.  ","10"
"694","관람객월요일부터 일요일까지 지루할 만큼 반복적인 일상 속에서 삶은 아름답고 의미가 있음을 느끼게 해준다. 그 안에 사랑이 있고 예술이 있다.  ","9"
"695","관람객아하! 내 노트도 비어있다  ","10"
"696","관람객일상적 시와 시적인 일상  ","9"
"697","관람객별 내용 없는데 이상하게 끌리는 영화. 같이 본 사람과 오랜만에 긴 대화를 나눴어요. 아담 드라이버 좋은 배우네요.  ","8"
"698","당신의 하루에도 시가 있기를  ","7"
"699","관람객나만 공포영화로 봤을까.  꿈을 꾸는 그의 발목들을 잡는 아름다움의 탈을 쓴 무한반복 무료한 일상. 꿈꾸는 작은 일탈마저도 개한테 잔인하게 찢기우는 현실. 벗어나지 못하는 나약함,  배경음악마저도 음울하고 기괴하다.  이 모든것이 시처렴 흐른다  ","9"
"700","일주일의 내용이지만..그 안에는 인생이 함축되어 있고..삶에서 희망이 얼마나 중요한지를 일깨워주는 교훈적인 영화. 한마디로 좋은 영화.  ","10"
"701","관람객의식해도 좋고 의식하지않아도 좋은 호흡같은 영화  ","8"
"702","관람객살고있는 것만으로 예술  ","8"
"703","관람객자족. 이라는 단어. 자족적인 삶. 자족적인 예술.  ","10"
"704","관람객일상은 반복되지만 그 안에 변함없는 것들이 존재한다  ","9"
"705","관람객패터슨의 모습은 시인이자 버스운전자이자 남편이자 동네친구의 모습으로 우리가 평상시 인지하는 성공한 혹은 뭔가 다른 비범한 예술가의 모습이 아니라 옆사람 또는 지나가다 아무렇게나 보이는 누군가. 그 누군가가 어떻게 살고 생각하고 지내는지 보여준다.  ","8"
"706","관람객표현력이 뛰어납니다. 물고기가 될지 고민하는 주인공을 보며 위로를 얻습니다. 고민하지만 결국 하루할  가장으로서 살아가는게 인생이겠죠  ","9"
"707","관람객아하반복인듯 반복아닌 일상  ","10"
"708","관람객매일 등장하는 쌍둥이. 규칙 또는 불규칙 패턴으로 된 무언가를 매일 만들어내는 로라. 작위적이지 않은 일상처럼 흘러가지만 메타포로 가득 찬.. 규칙과 불규칙 사이에서 왠지모를 불편함과 불쾌함을 느꼈다. 헤이..아하! 에서는 피식.  ","5"
"709","관람객느린 호흡의 영화에요. 거대하고 급격한 기승전결의 변화없이 덤덤하게 하루 하루를 보여주는... 하지만 마지막에 갑자기 강아지가 주인공의 책을 뜯는 설정은 조금 억지 아닌가 싶었네요.  ","6"
"710","소소하고 평범한 일상은 한편의 시가 되어, 잔잔하게 마음 빈 구석을 채운다.  ","10"
"711","관람객정말정말좋은영화네요  ","9"
"712","패터슨처럼 항상 깨어있고 싶다. 무료하고 반복되는 천박한 일상에서 매순간 보고 듣는 모든 게 패터슨에게는 시상을 떠올려 시를 쓰게 만드는 영감이었다. 비밀노트를 잃었을 때도 오히려 자신의 한계를 넘어서은 무한한 가능성의 시작이 됐다.  ","10"
"713","관람객우리에게 영화가 필요한 이유  ","10"
"714","굳이 찾아가서 볼 가치가 있는 영화.,, 이런 영활 봐야 눈 높이가 좀 오른다.  ","10"
