"","reviews","points"
"791","관람객기억할 가족이 있다는건 축복입니다상상력과 색체가 뛰어난 영화  ","9"
"792","7살딸도 34살엄마도 같이 울었어요. 음악도 넘 좋아요  ","10"
"793","관람객너무 재밌었어요 노래도 그렇고 끝에서 눈물이 다 나오네요  ","10"
"794","관람객혼자보면서 훌쩍훌쩍 울었다 감동을준다면 영화로써의 가치는충분한거아닌가? 역시픽사영화 항상 주제가 명확하고 감동을준다 애들보는영화로 편견을가지는 사람들..설득하기힘들다  ","10"
"795","관람객꼭 보세요 두번보세요 세번보세요 네번보세요 다섯번보세요 여섯번보세요 일곱번보세요 여덟번보세요 아홉번보세여 열번보세요  ","10"
"796","관람객왜 최고의 애니라는지 이해됐다  ","9"
"797","언젠가 꼭 다시 만날 수 있기를  ","9"
"798","다큰 남자가 애니메이션 보고 울줄이야  ","10"
"799","묻지도 따지지도 말고 보십시오  ","10"
"800","관람객가족의 소중함과 꿈에 대해 다시 생각해 보게 되네요  ","10"
"801","아이들이 보기엔 좀 지루한 어른들을 위한 동화 같은 영화 기억한다는 것 어릴 적의 추억들 시간은 참 느린듯 빠르게 흘러 간다 먼저 가 있는 울 엄마 나중에 만나면 하고픈 얘기 많은데 ㅠㅠ  ","9"
"802","관람객기대없었는데 감동이었어용  ","8"
"803","관람객죽음에 대해서도 가족에 대해서도 다시 생각해 볼  수 있는 영화같아요. 마지막에 리멤버 미 부르는데 너무 슬펐어요ㅠㅠ  ","10"
"804","관람객영화보고 울었습니다  추천합니다  ","9"
"805","관람객별5개가 아깝지않은 영화!! 재미와 감동 그리고 반전까지 모두 있는 영화!!  ","10"
"806","와 진짜 최고다!...마지막에 울지 않을 수 없었다 ㅜㅠ  ","10"
"807","관람객어른도 아이도 감동하며볼수있는 영화  ","10"
"808","아이들과 보고 나오면서 한 동안 서로 처다보고 안아주게 한 영화  ","10"
"809","관람객재밌었당 코코쨩...넘나슬픈것  ","10"
"810","도대체 &#34;미구엘&#34; 로 번역한 이유가 뭐냐 ?  ","9"
"811","관람객가족을 묶는 것은 조건을 줄줄이 달고 강요되는 의무 아닌 ‘사랑’의 기억.  멕시코의 사후세계는 너무 멋지다!  ","10"
"812","관람객디즈니는 정말 깔게 없다..  ","10"
"813","치매 걸린 할머니 몇년간 곁에서 모시는 엄마 모습이 떠올라서 가슴 뭉클함.  ","10"
"814","관람객기억해줘, 아무 조건 없는 축복!  ","9"
"815","관람객음악영상 등등 모두굿 ! 동심으로 돌아간듯한 느낌  ","8"
"816","완전 감동 코코 진짜 최고염(^o^)  ","10"
"817","기억해줘 최고에요 존경합니다  ","7"
"818","죽음이 두렵지 않다는건 영원히 기억될 삶을 살았다는 것일까  ","10"
"819","할머니가 많이 생각났어요 ㅠ 보러가실때 손수건 휴지 챙기세요 ㅠ  ","10"
"820","관람객만화도 수준이 많이 높아진 느낌이예요감동적이었어요~^^♡  ","10"
"821","너무 슬펐어요 ㅠㅠ 노래도 너무 좋고! 기억해줘 ㅠㅠ 가사너무 슬퍼서 마지막에 엄청 울었어요내용도 재미있었어요~  ","10"
"822","관람객영상미까지 완벽했던 영화  ","10"
"823","관람객재밌었어요 겨울왕국도 재밌었어요  ","8"
"824","관람객해질녘 멕시코 마을의 따뜻한 영상미와 배우들의 감칠맛나는 더빙이 영화의 매력을 한층 업그레이드 하였다.마지막 no condition... 에 와르르 무너진,,,  ","10"
"825","관람객감동감동감동감동감동  ","10"
"826","관람객정말 재밌게봤어요 ㅠ  인생영화  ","10"
"827","관람객코코자체는 볼만했고 감동도 있었는데 앞에 왠걸... 겨울왕국땜에 몰입도가 별로네여  ","8"
"828","관람객아 굉장히 좋았습니다 다만 개인적으로 겨울왕국 부분은 너무 별로였습니다  ","7"
"829","관람객10점 주고 싶지만 코코에 왠 겨울왕국이 나왔던거죠jQuery2240025993679781519563_1517206012694 가족이야기에 거기다 죽음에관해 다시한번 생각해보고 돌아가신 아버님을 늘 잊지 말아야 겠다는 생각이 들었습니다.  ","8"
"830","관람객감동과 여운이 있는 영화  ","8"
"831","관람객영화는 괜찮았는데 앞에 겨울왕국을 20분?정도 보여주는건. 아닌듯. 겨울왕국영화관으로잘못들어온줄 알았음. .  ","6"
"832","관람객짱입니다. 스토리, 그림, 감동까지~ 적극 강추합니다. 여운이 길게 남습니다. 가족영화로 강력 추천합니다.  ","10"
"833","관람객코코할머니기야움 굿구수구수굿  ","10"
"834","관람객멕시코의 사후세계관에 대해서 가슴따뜻하게 배웠구요영화끝나고 극장을 나오면서도 가슴이 계속 따뜻합니다뜨겁네요 눈물 자동발사  ","10"
"835","관람객어른들이 더 감동받는 영화! 정말 강추합니다!  ","10"
"836","관람객감동감동!! 뭐가이리 멋진지^^  ","10"
"837","정말 재밌는 영화예요 보고싶어요♡  ","10"
"838","사랑하는 이의 죽음이 마냥 슬프지않게, 동심의 상상력으로 위로해주는 영화. 너무 따듯한 영화  ","10"
"839","가슴따뜻해지는 영화 사후세계가 실제로 존재한다면 영화속 모습이었으면..  ","10"
"840","관람객마음이 따뜻해 지는 영화였어요. 아이와 함께 눈물을 흘릴수 있는 감동적인 내용이었구요. 돌아가신 가족들 또한 다시한번 기억하게 만들더군요.  죽어서 잊혀진다면 저런 상황이 생길 수 있겠다는 생각은 하지 못했는데 뜻깊은 영화 였어요~  ","10"
"841","엄마 너무 보고싶어요. 엄마를 항상 기억할께요. 나중에 꼭 만나요.  ","9"
"842","죽음에 관한 소재를 부정적으로만 보지 않고 유쾌하게 풀어냈으며, 가족의 소중함이란 교훈을 유치하지않게 일깨워준 영화. 우리가 왜 조상님들의 기일을 기리고 돌아가신 분들을 기억하려 하는지. 참으로 아름다운 해석이다.  ","10"
"843","오래오래 기억하고 보고싶은 영화  ","10"
"844","돈이 아깝지 않은 영화...  ","10"
"845","Remember me.  ","10"
"846","관람객진짜 감동 재미 꿈 모든게 굿  ","10"
"847","왜 기억해줘 듣는데 서문탁노래가 맴돌지..  ","10"
"848","관람객너무 재밌고 감동적이네요 꼭 영화관에서 보세요 추천추천  ","10"
"849","정말 오랜만에 가족을 느낄 수 있는 영화를 볼수있게 해준 픽사 감사합니다~  ","10"
"850","관람객가족과 꼭 봐야할 영화입니다  ","10"
"851","관람객가족과 함께 보기 좋아요 마음 따뜻해지네요  ","10"
"852","관람객아이들은 살짝 무서웠다하더라고요~ 그래도 넘 재미있었다고 계속말하네요  ","10"
"853","인생 애니메이션입니다. 아직도 가슴이 먹먹해요. 기억하고픈  사람과 꼭 봐야할 감동 애니메이션 입니다.  ","10"
"854","관람객증말 감동적이고 진정한 가족영화네요ㅎㅎ추천합니다  ","9"
"855","관람객지루한부분이 있었는데 ㅁㅏ지막이 지루했던부분을 다날려줬네요 감동적이에요  ","10"
"856","극장에서 더빙판봤는데 정말 혼돈의 카오스였습니다.. 애기 하나가 울기 시작하더니 여기저기서 다른 애들도 동시다발적으로울기시작하면서 어른들도 참았던 눈물을 쏟기 시작하는데 애엄마들은 끅끅하며 울고 애아빠들은 미간을 잡으면서울고 엄청났습니다.  ","10"
"857","겨울왕국 진짜 짜증났다ㅡㅡ  ","8"
"858","기대안하고 봤는데 재밌고 감동적이었다 마마코코~~  ","10"
"859","관람객주루룩 눈물이 나더군요 감동이였습니다~  ","9"
"860","관람객기대이상입니다 음악 영상 스토리까지 완벽했습니다  ","10"
"861","관람객겨울 왕국은 머임? ㅋㅋ  ","10"
"862","관람객가족의소중함 따뜻한영화  ","2"
"863","ㅅㅂ 애니보고 울줄이야....가족 그 안에서 삶과 죽음, 거기에 음악까지 더하여 정말 잘 만들어진 최고의 스토리다.  ","10"
"864","옥에티는 초반에 시작하는 겨울왕국이다  ","9"
"865","애니보고 처음 울었음 추천합니다  ","9"
"866","관람객나를 기억하는 사람이 없다면...나는 완전히 잊혀진 것...모티브가 인사이드아웃 때처럼 굉장히 센세이셔널했다제단 위에 올려진 사진으로 출국절차를 밟는 아이디어는 정말 환상적이다  ","7"
"867","너무나 감동적이고 따뜻한 영화  ","10"
"868","겨울왕국은 뭐지 싶었습니다.. 어느책에선 자길 잊어주고 자기가 사라지길 원하는 사람이 있었습니다. 하지만 자길 잊어주질 않아 힘들어했죠.. 이 영화에선 잊으면 안된다는걸 보여주네요.  ","8"
"869","별생각없이 보다가 훅당했네요ㅎㅎ 감동도있고 교훈도있는 훈훈한영화네요~  ","8"
"870","우리나라와도 비슷한 정신을 공유하는 것으로 생각해서 공감이 많이 갔다. 죽음 이후를 생각하게 해주고 지금은 볼 수 없는 그리운 이들이 저렇게 잘 지내고 있겠구나 하는 생각을 하게 해준 영화,  ","10"
"871","관람객인생영화입니다 추천합니다  ","10"
"872","관람객픽사가 내인생에서 중요한 이유..  ","10"
"873","관람객가족과 보기 좋은 영화입니다  ","10"
"874","관람객오랜만에 따스함이 느껴지는 영화였어요재미와 오색찬란 영상미를 두루갖춘영화~  ","10"
"875","눈물이 나도모르게 뚝뚝 떨어졌다 ㅠ  ","10"
"876","관람객감동이 듬뿍!! 눈물이 글썽!!!  ","10"
"877","개감동받음 울었다 결국  ","10"
"878","관람객저승영화를 어찌이리  예쁘고 아름답게 만들었을까~^^  ","9"
"879","관람객화면이 넘 예쁘고 상상력이 놀라워요  ","8"
"880","관람객네 최고군요 말이필요없네요  ","10"
"881","관람객겨울왕국 시간이 좀 길었던듯 ..집중이 안되는듯 하다 죽은자의 세상부터는 몰입되더라구요.마지막에 눈물도 흘리고..아이들도 재밌었다고 하네요  ","8"
"882","애니메이션은 괜히 픽사 픽사하는게 아님  ","10"
"883","관람객저승 이야기이여서 약간 무서웠지만,재미있었습니다.  ","9"
"884","관람객오랜만에 의미있는 애니메이션을 본 것 같아요 ^_^  ","9"
"885","아무 생각 없이 봤다가 한 방 얻어맞았네요. 여운이 진하게 남는 어른을 위한 동화입니다.  ","10"
"886","8살아들은 안울고 나만 펑펑운영화ㅠㅠ감동감동  ","10"
"887","도라도가 이렇게 따뜻하게 느껴질 줄이야..  ","10"
"888","관람객완전 감동적이고 내내 행복한 영화였습니다  ","10"
"889","관람객죽음에 대한 유쾌한 통찰력에 좋았습니다.  ","9"
"890","관람객병원에 계신 할머니를 조금 더 자주 뵈러 가야겠다.  ","8"
"891","인생영화 중 하나였다. 음악도 좋았고, 몰입도도 좋았다. 정말 힐링되는 시간이었고, 이 영화를 보더라도 사람은 언제 어디서 어떻게 기회가 올지 모르는것 같다.  ","9"
"892","가슴이 따뜻해지고 돌아가신 내 아버지가 생각났다.  ","9"
"893","관람객한동안 웃지못했는데 영화가 끝나고 엔딩크레딧이 오른 후 따뜻한 미소와 웃음을 지을 수 있었습니다  ","10"
"894","여운이 길게 남는 영화,, 또 보고 싶어요.  ","10"
"895","조상을 기억하고 섬겨야겠다는 고훈을 얻었다  ","10"
"896","관람객꽤 재밌고 감동적이게 봤습니다. 내가 죽어서도 날 기억해주는 사람이 있을까 싶기도하고 여러가지 생각이드네요  ","9"
"897","스토리도 괜찮고 배경묘사는 그냥 환상적이었습니다. 근데 더빙판은 별로네요.  ","6"
"898","쭉 가다가 마지막에 폭풍감동 노랫가사 예술임.  ","10"
"899","관람객돌아가신 할아버지, 얼마전 세상을 떠난 친구 더 많이 기억하고 더 자주 생각해주려고요. 아이에게 보여주러 갔다가 제가 더 울고 나왔다는...  ","10"
"900","엔딩크레딧 올라갈때까지 여운이 가시지 않는 영화  ","10"
"901","관람객사람이  정말로  죽는  순간은,  몸이 사망하는  당장의 시점이 아니라, 사랑했던 모든 이가 자신을 잊어버렸을 때가 맞나 봅니다. 주변에 잘 해야겠네요, 후에 쉬이 잊혀지지 않게.  이 영화 역시 많은 걸 느끼게 해줬습니다. 감사합니다.  ","9"
"902","관람객우리 남매 아이들과 즐겁게잘봤어요~^^  ","10"
"903","평점 첨 달아봄.  진짜  재밌고 감동적이에요영화시작전에 겨울왕국  크리스마스편 나오는데 그거 빼고는  진짜 졸잼이에요.  최근 본것중에 젤 나음 힐링힐링  ","10"
"904","진짜 10점 잘 안주는데 엄청 마음이 따뜻해지는 기분임 고민하고있다면 보시는걸 추천해요  ","10"
"905","관람객유쾌하고 특유의 분위기가 잘 살아있는 영화. 스토리가 좀 예상 가능했지만 그만큼 편하고 재밌게 봤어요. 나쵸 먹으면서 보시면 재미두배  ","8"
"906","관람객극장에서 두번째봤어요.아들이재미있다고 또보고싶다고극장개봉중일때 돈주고 두번보기는처음인데ㅋ재미있어요  ","10"
"907","관람객신비롭고 가슴찡한 조건없는 축복~  ","10"
"908","기억해 줘 지금 떠나가지만  ","9"
"909","내 인생영화 추가 ㅠㅠ 스토리도 너무 좋고 노래도 좋다.... 더빙판 자막판 두 번 봤는데 다시봐도 재밌다!  ","10"
"910","두번보니 두배 좋더군요^^  ","10"
"911","관람객살아 있는 가족은 죽은 가족도 잊지않괴 수시로  떠올려 잊지 않고 있다는 메세지를 전해야  ","10"
"912","관람객죽은 후에도 따뜻하게 기억하는 문화가 인상깊음  ","9"
"913","저 평소에 눈물 진짜 없고 감수성 메말랐는데 진짜 막판에 울뻔했어요 너무 감동적이어서 저는 평소에 영화보면 지루해서 하품하고 그러는데 코코는 재밌어서 몰입하게 되더라고요 하나도 안지루했어요 감상평에 사람들이 감동적이라 하던데 그말이 맞네요  ","10"
"914","내 인생영화 역시 갓픽사  ","10"
"915","관람객가족의 사랑은 죽어서도 유효하다...  ","10"
"916","할머니가 “파파” 하는데 정말 눈물이...ㅠㅜ  ","10"
"917","진짜 띵작임 열 글자입니다  ","10"
"918","관람객끝에는 감동감동 사이사이마다 나오는 OST도 너무 좋고ㅠㅠ혼자보고왔는데 좋은시간이었어요  ","9"
"919","아이랑 같이봐도 전혀 지루하지 않았던 영화!  ","10"
"920","관람객재미있게 잘 봤습니다. 영화시작전에 겨울왕국무비가 30분이나 나왔어요. 코코 언제하냐고..ㅠㅠ 왜 그런거죠??  ","10"
"921","알고도 막을 수 없었던 메시처럼 다음씬이 예측가능햇지만 눈물을 막기엔 역부족인 리오넬 코코  ","8"
"922","이런게 영화지...역시 믿고보는 디즈니 픽사 미쳤다 진짜  ","10"
"923","사실 되게 뻔한 스토리. 그래도 결국 눈물을 훔치며 인생영화라고 하는 나를 발견한다  ","8"
"924","관람객너무 좋았어요 보는 내내 행복했어요  ","10"
"925","죽음을 다룬 영화중 내생에서 이렇게 아름답게 죽음을 표현한 영화는 없었던것 같아요!! 최고의 영화  ","10"
"926","&lt;인사이드 아웃&gt;을 잇는 역대급 픽사 영화. 10점 만점에 11점 주고 싶다.  ","10"
"927","초2아들과 함께 영화를보고 영화를 보는동안 아들은 내게 속삭였다.&#34;나는 엄마가 죽게되면 나는 엄마를잊지않고 기억할꺼에요~&#34;아이는 감동적이라고하며 눈물을 훔쳤다…그런 아이가 사랑스러웠고따뜻했다~  ","10"
"928","관람객가족 영화로 매우 좋습니다.시간이 길어 미취학아동은 조금 지루해 할수도 있습니다.그래도 화려한 색감의 화면배경, 등장인물, 배경음악들이 지루함을 달래줍니다.스토리도 괜찮고요  ","10"
"929","오래만에 보는 뭉클하고 따뜻한 이야기 픽사외 디즈니가 만들어낸 아름다운 협주곡  ","10"
"930","관람객그냥 너무 좋았어 나를 정비하는 시간  ","10"
"931","관람객ㅎㅎ좋음 재미지게 봐서 좋음 그렇게 좋음  ","10"
"932","저런곳이 있다면 내가 살고 있는 세상에서 더욱더 열심히 살고 싶다 더 멋진 사후를 위해  ","10"
"933","관람객너무좋은영화 잘봤어요 ㅜㅠ 율어버렸습니다  ","10"
"934","죽음에대해 알지못하는 만4세 아이는 울라프나올때 가장 재미있어했다. 코코는 어른들을 위한 애니메이션!  ","9"
"935","관람객아들하고 같이 보고 같이 울었습니다. 꼭 가족과 함께 보길 추천합니다.  ","10"
"936","잊혀지면 죽어버리는게 더 구슬프다...  ","9"
"937","그냥꼭보세요ㅠㅠ쥬만지안보고이거봤는데 재밌어요  ","10"
"938","그저 최고라는 말밖에 안나온다  ","10"
"939","관람객마마코코~ 노래도 너무 좋구 마지막에 감동적~!  ","10"
"940","관람객진심으로사랑하고싶다나의확신이다  ","10"
"941","정말 감동적이었고 너무 대밌게 잘봤어요!!  ","10"
"942","인생영화인생영화 눈물 주륵주륵 펑펑흘림 ㅠㅠㅠ 아직까지 감동이 밀려옴ㅠㅠ 엔딩크레딧올라가는데 엄마가 빨리나가자고 해서 나옴 안그랬음 혼자 계속 울면서 앉아있을뻔 ㅠㅜ 두번보세요 세번보세요!! 저는 더빙아닌걸로 한번 더 볼 예정입니다  ","10"
"943","훌륭한 동화적 이야기... 멕시코라는 나라에 호감이 많이 생긴다  ","9"
"944","픽사와 박평식 평론가님에게 존경을  ","10"
"945","관람객아이랑 감동 깊게 봤습니다  ","6"
"946","영화를 보기 전까지 이 영화를 무시했던 내가 한심할 정도로 코코 레알 띵작  ","10"
"947","사후세계가 심판의 세계가 아닌 축제의 세계로 묘사되는  상상력에 감탄하고 ...마지막 눈물로 사람을 울리네요...애들보여주러 갔다..엄청 울고 왔네요 ^^  ","10"
"948","관람객올라프도 근사했고 코코는 정말 막판에 눈물을 참을 수 없는 감동의 쓰나미 엉엉 꼭 휴지가져가세요  ","9"
"949","아이들보다 어른들을 위해 나온 애니메이션 같은 아주 감동적이였어요 ㅜㅜ 노래도 너무좋았구요  ","10"
"950","관람객몰입해서 본 정말 재미있는 애니메이션 이었습니다소중한 사람과 같이보시길 추천합니다  ","10"
"951","관람객잊지않는 다는게..기억하는 일이 얼마나 의미있고 소중한 일인지 알게해줬네요..감동이 있는 영화에요!!  ","10"
"952","관람객겨울방학 아이들이 좋아하는영화네요  ","10"
"953","큰 기대 안하고 봤는데 이건 소장각 ㅎㅎ  ","10"
"954","스토리 작가에게 경의를...  ","10"
"955","관람객내 인생 최고의 애니메이션  ","10"
"956","어른들이 보기에 스토리가 뻔하지도 않고 영상도 이쁘구 볼만해요  ㅋㅋ 오히려 앞에 나오는 겨울왕국을 빼줬으면 하는 바램 .. 겨울왕국은 딱 애들 타켓으로 만들었는지 내용도 진부하고 지루했어요.. ㅠ  ","10"
"957","관람객개울었다..진짜 ㅠㅠ 영상미 미쳤고 .... 재밌다ㅜ  ","10"
"958","관람객믿고보는 픽사 이번에도 꿀잼  ","10"
"959","아이돌 문화 득세한 요즘 세상에 찾기 힘든 예술에 대한 순수한 동경을 보여줘서 좋았다 아이돌 우상보단 백배는 더 순수하다  ","10"
"960","픽사의 상상력은 어디까지일지..  ","10"
"961","역대급 애니 이런 감동을 애니매이션으로 받을수 있다는게 놀라울 정도  ","10"
"962","넘잼나 ㅜ 울뻔함 신과함께보다 재미남 디즈니 픽사 알라뷰  ","10"
"963","최고입니다.더할 나위 없이 잔잔하고 따뜻하고 감동적이며 또한 행복해지는 멋진 영화였습니다.  ","10"
"964","관람객정말 감동적인 영화다 역시 픽사다 최고!!  ","10"
"965","관람객마지막장면은 ㄹㅇ 감동적...  ","10"
"966","관람객영화를 보는내내 아버지 생각이 많이났습니다.아버지 영화처럼 꼭 만나자멋진인생 살다갈게  ","10"
"967","관람객8살 아이와 함께보았는데 어른이 보아도 충분할만큼 감동적이고 따뜻한 영화였어요^^아이도 재미잇었다고 이야기 하네요^^  ","10"
"968","관람객감동적임 ㅜㅠ 최고!!!  ","10"
"969","관람객결말은 알지만 애들 옆에 두고 엉엉 울었네요.  ","10"
"970","감동 오백만개,,,솔직히 마지막에 코코 죽고 나온 해골에서 좀 깼지만 넘 감동과 슬픔ㅜㅜㅠ최근 본 영화중에 젤 좋았움  ","10"
"971","관람객죽음에대해 생각하게 해주는 만화영화.  ","10"
"972","관람객마지막 노래가 그전이 모든걸 상쇄함  ","10"
"973","관람객영상미가 정말 예쁜 영화네요~^^  ","8"
"974","멕시코에 금방 다녀온듯....정말 아름답고 가슴 뭉클한 순간...땡큐~~코코!  ","10"
"975","역시 디즈니라는 말이 나옴 겨울왕국에 비해 ost가 조금 부족  ","9"
"976","아주 재미 있었어요 제가본 영화중 최고 였어요 아홉살 김지수 아빠 ^^  ","10"
"977","관람객가족모두와 다같이 봐야할 영화~~  ","10"
"978","화려함과 쓸쓸함 속의 포근함  ","9"
"979","진짜 가족의 소중함을 느꼈고 나도 죽으면 누군가 기억해주길 바라게되고 주변사람에게 좋은사람으로 기억될수있게 잘살아야겠음 ㅜ  ","9"
"980","기쁨을 완전하게 해준건 슬픔이었고(인사이드아웃), 생을 보다 완전하게 해준건 죽음이었던 걸 보면(코코) ,  우리를 살아가게 하고  세상을 이해하게 하는 동력은 현재와는 다른 이면에서 오는것 같다 .  ","9"
"981","아이들이 보단 어른들이 보면 좋은 영화.죽음과 삶에 대해 다시 생각 할 수 있는 영화.  ","10"
"982","겨울왕국상영관잘못찾은줄알았다  ","6"
"983","마지막 장면에서 마마코코의 미묘한 표정변화가 인상깊다  ","10"
"984","캬~ 평식이형 평점보고 대작 나왔구나 하고 봤는데 진짜 개명작! 마지막 할머니 만나는 장면에선 진짜 인생에 담겨있는 그 무언가가 울컥 넘어와 눈물 완전 뽑았네. 아무 정보없이 봤는데 개명작.  ","10"
"985","화려하고 재밌고 스토리도 감동적이고 디즈니는 진짜 믿고보는게 맞다... 항상 레전드를 만들어낸다. 교훈?같은 것도 있고 꼭 봐야함 개울었음 애들 영화라고 무시하지말고 휴지 꼭 챙겨라..  ","10"
"986","관람객8살 아이랑 별 생각없이 보러갔다가 폭풍눈물 쏟았어요.. 애니메이션이지만 어른들에게도 강추합니다!!  ","10"
"987","관람객감동적이네요~~ 아이들과 다함께 봤는데 어린아이들이 보기엔 아직 이해하기 좀 어렵거나 무서울수도 있을거같아요~ㅎ  ","10"
"988","갑자기 먼저 떠나보낸 우리 아들이 생각나네요...  ","10"
"989","애니메이션이 내 인생영화가 될지를 몰랐다...  ","10"
"990","관람객동경가족 이후 오랜만에 영화를 보면서 울었습니다.  ","10"
"991","나도 모르게 눈물이 줄줄.. 진정한 가족영화  ","10"
"992","명작.. 반열에 오를 것 같다 이승에서 잘해야지...  ","10"
"993","최고의 영화에 눈물로 찬사를 보냅니다. 진짜 최고다 ㅠㅠ  ","10"
"994","돌아가신 할머니 할아버지 친척들 생각이 나서 참 많이 울었어요.심지어 미리 저 세상으로 갔던 강아지도 생각나더라고요  ","10"
"995","이런게 진짜 웰메이드 영화다.  ","10"
"996","인생영화가 될 거 같아요.. 가족들에 대해 다시 생각해보고 부모님께 전화한 번 더 드렸어요. 마음따뜻해지는 좋은 영화에요  ","10"
"997","관람객일찍 가버린 노래잘한 우리아빠가 많이 생각나네요.  ","10"
"998","7살 딸이 태어나서 처음으로 흐느껴서 울면서 본 영화네요. 본인이 표현을 못하네요 그 감정을... 제가 감동, 이라고 설명해 줬습니다.  ","10"
"999","관람객잔잔한감동까지 느낄수있습니다 ㅎ  ","10"
"1000","눈물이글썽 아이들이안보이기 슬쩍 눈비빔..  ","9"
"1001","식상할 것같지만 전혀 식상치 않은 영화♡강추  ","10"
"1002","매우 잘만든 애니매이션  ","10"
"1003","관람객Good!!!!..p  ","9"
"1004","관람객감동이 그자체임. 가족에 대해서 한번더 생각해볼수 있는 시간이 되었음.  ","10"
"1005","정말 아름답고 슬픈영화 ,,,먼저가신 엄마생각에  많이 울었다.하지만 주인공의 사랑 넘치고 희망을잃치않는 용기와 밝음에 감사한 마음을 같게하는영화.  ","10"
"1006","인사이드아웃 혼자보다 엉엉울었던 생각이 떠올라요. 아니 그 때보다 더 큰 감동이였어요. 진짜 픽사 디즈니는 배신안해요. 손수건 챙겨 가세요.  ","10"
"1007","관람객재밌게 잘 보고 왔습니다. ^^  ","9"
"1008","관람객멕시코 문화라서 좀 생소한 애니였고 볼만했음  ","10"
"1009","돌아가신 할아버지 할머니를 더 자주 기억해야겠다. 감동이 깊다.  ","10"
