"","reviews","points"
"872","이 영화 제목은 &#39;골든슬럼버&#39;보다 &#39;골든리트리버&#39;가 더 잘어울린다. 개같으니까  ","1"
"873","영화감독 앞으로 대형배우들 캐스팅하지마라 이딴 영화 만드려고 캐스팅했냐?ㅋㅋ  ","1"
"874","아 진짜 노잼이다...저런 배우,훌륭한 원작을 말아먹는 감독이 무섭다  ","1"
"875","동원이형 미안해요.. 너무 재미없어요  ","1"
"876","추적하고 도망가는 씬은 괜찮으나 그 외의 장면은 90년대에도 안나왔을 촌스럽고 가식적이기 짝이 없는 장면이네요...잼 없어요...  ","2"
"877","감독이 사람들 의식수준을 못 따라온다.  수준이하  ","1"
"878","강동원 주연이라 기대했었는데  스토리가 허접.  ","1"
"879","내가 그냥 감독할게 ㅋㅋㅋㅋ  ","1"
"880","정말 어처구니 없네....내가 웬만하면 이런 거 안남기는 데 그 배우들을 가지고 이런 영화를 만드냐? 일단 각본자체가 엉망이다.  ","4"
"881","1점은 처음인 듯 진짜 졸작임.. 감독이 진짜 무능력함 연출부터 연기톤까지 전부 제멋대로고 흐리멍텅함 시간이 아까운 영화 내가 투자자면 감독 멱살 잡았음  ","1"
"882","관람객사실 강동원 아님 안봤을 영화....  ","5"
"883","일반시민들도 정치적 이용가치가 있으면  정치인이 한 사람 인생을 조져버릴수있다? 이게  2시간의 영화가 주는 의미냐 애효;. 신과함께랑 비슷하게 말도안되는스토리,개연성과  함께 억지감성으로 관객몰이하려는 조잡한 D급영화;  ","1"
"884","관람객시작부터 뜬금없이 시작해서 엔딩도 너무 억지스럽고 허무하네요... 굳이 밴드연주 장면을 해야했는지...  ","3"
"885","이걸 영화라고 만든겁니까? 20OOO 내가 본 영화 중에 가장 최악이네요 장르가 추격이라고요? 장르 바꾸죠 로맨스, 가족으로 추격은 개뿔 영화 도입 부분부터 끝까지 인상만 찌뿌려지네요 그리고 영화 마지막에 레드카펫 개그물인가요?  ","1"
"886","이미 한국에서 폭망한 일본영화를 리메이크까지 왜 한거냐?  ","1"
"887","배우들 연기 덕분에 잘봤습니다  ","8"
"888","예상외로 꽤나 재밋는데?  ","10"
"889","오락물로 나쁘지 않은듯 ㅋㅋ  ","9"
"890","자동ㅊ차 폭파 될때부터 흥밈진진  ","8"
"891","원작을 나름 잘 살린영화인듯  ","10"
"892","친구와의 우정이 돈독해지는 영화  ","10"
"893","재밌었어요 감동적이기도 하고 너무 좋았습니다. 노래도 잘 어우러져 좋았고요!!  ","10"
"894","강동원 연기 좋았네요 영화속의 비틀즈 노래도 넘 좋고, 신해철 노래로 추억에 잠기기도 ~~~  ","10"
"895","내용도 재밌고 멋진배우 강동원도 있고! 짱이예요~~^^  ","10"
"896","볼만했습니다.. 강동원연기 좋았어요  ","10"
"897","어리버리 순수 강동원에 감동까지.. 너무 좋았습니다!!  ","10"
"898","볼만해요 강동원도 연기 나쁘지 않았고  ","10"
"899","노래도 좋고 중간중간 웃음터지는 영화네요ㅎ  ","10"
"900","하나의 작품에 음모,스릴,우정등 너무 많은것을 담으려다 보니 확실하게 담긴게 없어 아쉽다는  생각이 들었다.하지만 건우와 친구들,그리고 과거가 교차되는 장면에서 우정이란 무엇인가 친구란 존재는 무엇인가에 대해 생각하게 해주는 울림이 있는 영화.  ","8"
"901","윤계상 나올때 진심 좋았음ㅋㅋㅋ  ","10"
"902","흥미진진했어요 강동원님의 귀여운 모습 보는 재미도 있고 중간중간 웃긴장면도 있고 좋았어요  ","9"
"903","원작도 진짜 좋다는데 원작도 읽어 봐야겠다ㅎ  ","10"
"904","사람과 사람 사이의 믿음을 상기시켜주는 영화  ","10"
"905","영화도 좋고 음악도 넘 좋았음..  ","10"
"906","착착 풀리는 개연성 있는 스토리와 배우들의 좋은 연기, 적절한 타이밍에 터지는 ost가 영화에 몰두하게 만든다 돈이 아깝지 않은 영화 !  ","10"
"907","액션과 연기뿐 아니라 영화가 주는 메시지도 너무 좋았다  ","10"
"908","강동원의 새로운 모습들을 많이 볼 수 있었던 영화  ","10"
"909","선과 악의 이중적인 모습을 표현할줄 아는 배우였다 강동원은!!!  ","10"
"910","강동원존잘강동원존잘 영화도 졸잼  ","10"
"911","ㅋㅋㅋ 이런 배우들로 이런 쓰레기 영화 만들기도 힘들겠다. 도대체 뭘 말하고 싶은거냐?? 겁나 산만하고 겁나 루즈하다. 이 영화 극장에서 본 사람들이 불쌍하다.  ","1"
"912","뭘 말하려고 하는지는 알겠는데, 전개가 진짜 안 매끄럽내요..  ","4"
"913","관람객강동원 얼굴이 열일한 것 밖에 남지않았다  ","2"
"914","관람객별점은 그저 강동원의 얼굴값...  ","4"
"915","끝이 이상함ㅡㅡ뻔한 스토리..;;; 출연한 배우들이 아까움  ","3"
"916","이런 영화에서도 강동원이랑 한효주가 나오네요?  ","1"
"917","좋은 배우들 모아놓고 이렇게 억지감동에  뜬금 없이 영화 제목 골든슬럼버 이유가 나오고 ㅋㅋㅋ무슨 이런 영화가 아직도 나오냐  ","5"
"918","영화는그저그런데 강동원땜에끝까지봣다  ","10"
"919","이런 캐스팅으로 3류영화를 만들었어?감독이 이래서 중요하구나ㅠ강동원에 최악의 작품이될듯하넹?ㄱ  ","1"
"920","두명의 감독이 작업한 필름을 짜깁기 한 것처럼 스릴러와 드라마의 잡탕. 집중해서 보다가 한참 지루해지고, 또 갑자기 바쁘게 돌아가는 괴상한 진행은 관객 입장에서 몰입하기 어려웠어요. 뻔한 8~90년대 음악도 따분해서 긴박해야 할 씬을 느슨하게 만들었음  ","3"
"921","관람객너가 어떤장르를 좋아하는지 몰라서 다 넣어봤어 느낌  ","4"
"922","액션스릴러로 갈거면 확실히 가던가 우정에 로맨스에 유머에 이것저것 다 집어넣다보니 이상해졌어. 정말 하고 싶은 얘기가 뭔지 모르겠음.  ","6"
"923","관람객너무 조잡스러워요 개연성도 부족하고  ","3"
"924","관람객억지로 짜내는 감정신들 때문에 집중 하기가 어려웠다.  ","1"
"925","한개도 주기 아까워요 ㅋ 장르가 뭔지 계속 왔다리 갔다리 몰입 1도 안됌.. 절대보지 마세요  ","1"
"926","주인공에게만 일어날 것 같은 일이 누구에게나 일어날 수 있다는 경각심. 사건을 사소한 이들이 풀어 가는 것을 보여주며 사소한 관심이 사건을 해결할 수 있다는 걸 알려주는 원작의 최소한의 교훈은 어디갔습니까? A급 배우들로 B급 영화를 만들었습니다  ","4"
"927","너무 재미없어요... 딴거보세요  ","1"
"928","최근 몇년동안 최악...이 영화에 강동원이 왜?  ","2"
"929","강동원보러가시려면 보시구 그렇지않으면 내용이 별로 없는것같습니다~~  ","2"
"930","동원이 믿고  봤는데  이러면 안된다  ","2"
"931","정말 진지하게 연출 비주얼 스토리 감안해서 개인적인 평점임. 소재는 좋았지만 마지막까지 정리하기에는 너무 과하게연출한거같고 다풀어넣고 마지막엔 쓸어담지못한 어정쩡한 결말없는 영화  ","4"
"932","진정한 상업 영화다..속은 느낌이 드는  것 같은 데..강동원을 미끼로 오로지 돈을 위해 만든영화인듯 하..강동원 보러 간다는 생각으로 보면 억울하지는 않을 듯..  ","1"
"933","무슨내용으로 흘러가는지 개연성 떨어지고 후반부로 갈수록 뭐지하는 느낌..이건 뭐 안보느게 나을듯 심야 돈아까움 후 딥빡  ","1"
"934","킹갓제네럴엠페러동원참치충성충성^^77해도 개노잼  ","1"
"935","이런스토리 이런 배우로 이렇게 지루하게 연출하는것도 능력이다  ","1"
"936","도입부에 느껴졌던 박진감이 무색하게 스토리 전개가 정말.... 결말은 진짜.... 급조된 해피엔딩.  ","2"
"937","영화보고 댓글은 첨 달아본다. 배우들이 아깝다  ","1"
"938","스토리 라인도 조악,그나마 재미도 없는 유치 찬란플러스 CJ의 모든 제품 PPL 만 보이네요  ","1"
"939","알바들진짜 쳐맞는다 새키들아ㅎㅎㅎ  ","1"
"940","미소 된장국에서 헤엄치다가 코로 물이 들어가서 코를 풀다가 어이와 함께 뇌가 튀어나와서 비틀즈 음악을 흥얼거린 기분입니다. 이정도로 이해가 안 가는 전형적인 한국 공장영화 입니다  ","1"
"941","장난하지 않을게요. 영화 잘 모르지만 너무 너무 설득력이 없고 부족한 영화에요. 많이 부족합니다. 영화 기프티콘 있으시고 시간 많으시면 배우들 얼굴 보시다가 나오세요..!  ","1"
"942","...한국적 감성팔이가 엄청남 ㅎㅎ 극혐 진짜 1점 댓들 말 다 공감함 걍 우리 잘생긴 강동원배우님 얼굴보러 가는 거임 ^.^  ","1"
"943","괜찮은것 같아요, 조금 더 스펙타클햇음 좋앗을 것 같기도..  ","7"
"944","역시 강동원 멋지다 짱골든슬럼버 홧팅  ","10"
"945","와 역시 배우님들 ㅋㅋㅋ&gt;.&lt; 연기 너무 좋고 재밋엇어요!  ","10"
"946","초반부터 긴장감 마음에 듭니다  ","10"
"947","명절에 보기 괜찮네요 ^^  ","10"
"948","시간 진짜 금방갑니다 ㅎㅎ  ","8"
"949","재미, 감동 모두 느껴지는 영화  ","10"
"950","재밌어요ㅠㅠㅠ사실 강동원 얼굴만 봐도 좋은데 영화도 재밋더라구요 ㅋㅋ  ","10"
"951","긴장감은 물론 뭉클한 감동까지 최고였어요ㅎㅎㅎ  ","10"
"952","재미있게 잘봤어요! 감동도 있고 재미도 있고  ","8"
"953","좋아하는 작품이라 기대하고봤는데 좋네요~ 배우님들의 연기 덕분에 더 멋지게 나온 것 같습니다~!  ","10"
"954","강동원 덕분에 눈호강 듣기 좋은 노래들 덕분에 귀호강  ","10"
"955","줄거리 딱 영화적 요소고 음악과 잘 어우러집니다  ","10"
"956","오랜만에 강동원을 영화에서 다시 볼수 있어서 좋았습니다! 연기도 최고였습니다!  ","10"
"957","재밌었고 친구들의 의리 정말 멋졌어용ㅋㅋ  ","9"
"958","영화에 맞게 고스란히 녹아드는 음악까지 너무 좋았습니다  ","10"
"959","솔직히 강동원 때문에 봤는데 스토리가 너무 좋았음.. 원작도 있다는데 한번 읽어 보고 싶다  ","8"
"960","강동원의 연기는 항상 기대이상  ","9"
"961","살이쪄도 잘생긴 너란남자  ","10"
"962","여러가지 의미를 담고 있어요  ","10"
"963","영화든 현실이든 누구든 타겟이 될 수 있습니다  ","10"
"964","의외로 액션 스케일도 크고 잼나요?  ","10"
"965","노래가 아직도 귀에 맴도네요  ","10"
"966","동원오빠는 안 늙었으면 좋겠다 ㅋㅋㅋ  ","10"
"967","강동원 진심 너무 잘생김ㅠㅠㅠ 보는 내내 행복 ㅋㅋ  ","10"
"968","의외로 긴장 넘쳐서 놀랐네요 ㅋ  ","10"
"969","간만에 긴장넘치는 흥미로운 영화를 본 것 같다..감독도.. 배우도.. 시나리이오도 모두 굿..  ","10"
"970","지루할틈없이 너무 재미있음 ㅠ.ㅠ  ","10"
"971","강동원이 쫓고 쫓기는데 내가 쫓기는 기분이 들정도로 흥미로웠어요  ","10"
"972","볼때보다 보고나서가 더 여운이 남는 영화네요, 친구들 보고싶다 ㅎ  ","10"
"973","캐스팅 굿! 전체적으로 잘 빠진 영화  ","10"
"974","장첸 넘나 반가움ㅋㅋㅋ 영화 꿀잼!! 긴장감 쩌러효!  ","10"
"975","고생한 배우들이 넘 아깝다 근본없는 영화. 우정이면 우정 국가비리면 비리 어디 하나 집중되는게 없고 이건뭐. 국가는 무슨 목적으로 그OO하는지 알수도 없고 결말도 걍 패스하고 밴드 연주. 아 4점은 배우들과 그나마 쫄깃한 장면 몇개땜에 준다  ","4"
"976","관람객강동원이 갑이네 ㅎ볼만햇어요  ","8"
"977","감독이랑 작가랑 와 뇌에 마요네즈 들었냐ㅋㅋ 어떻게 저런 배우들 상대로 이딴 잡영화 만들었냐  ","1"
"978","한효주 이쁘고 강동원 잘생김그리고 끝.아무것도 기억하고 싶지 않은 영화다  ","1"
"979","관람객강동원이 아깝다.  매우 지루  ","6"
"980","동원이형이 잘생겨서 8점드림  ","8"
"981","1점도 아깝다.. 이상하게 개연성도 없이 장르를 섞어놓음... 그냥 액션으로만 갔으면 재밌을 것을...  ","1"
"982","1점도 아깝다 이 좋은 배우들을 데려다가...  어이없음 ..  구성이나 감독의 연출력이나 문제가 심각해  ","1"
"983","쓰레기OOO쓰레기쓰레기  ","1"
"984","그냥 처음부터 끝까지 강동원 잘생김만 나온 영화 그 이상 그 이하도 아닌 쓰레기영화  ","1"
"985","염력의 뒤를 잇는 희대의 망작. 이거 10점 주는 놈들 일상생활 가능한지 궁금함  ","1"
"986","관람객강동원 잘생긴맛에 봄 ㅋㅋ  ","6"
"987","솔직히 장르 코미디인거 인정하세요  ","1"
"988","스토리가 별로 감동도 없고 교훈도 없고 그렇다고 액션이 좋지도 안고...  ","1"
"989","이런 영화는 처음봄... 정말 슬픔을 유도한 장면에 웃어보기는 처음  ","1"
"990","진짜 최고의 영화였다. 이렇게 웃어본적이 몇년만인지모르겠다.  ","1"
"991","노무현입니다 보다 재미없네요.  ","1"
"992","진짜 개빡치게 만드는 영화다  ","1"
"993","관람객연출력이 좀 허술하긴 하더군요  ","6"
"994","보고 엄청나게 열받았었음 ㅋㅋㅋㅋ  ","1"
"995","최고의 수면제 입니다 잠을 잘 못자시는 분들께 추천  ","1"
"996","그냥 원작은 책으로만 읽으세요. 럭키를 노렸지만 현실은 염력인 영화입니다  ","2"
"997","강동원을 너무 믿었따..진짜 한숨만 나옴...너무재미없다  ","1"
"998","절대 아무도 믿지마라.  ","1"
"999","리뷰 처음 작성합니다. 1시48분동안 정말 감탄하면서 감상하였습니다. 무슨 생각으로 만든 영화인지 끝났는데도 모르겠습니다 대단한영화입니다.  ","1"
"1000","돈개아깝다...그냥 밥이나 맛있는거 먹자 강동원도 이제 아무 영화나 막찍는듯 스토리좀 확인하지...  ","1"
"1001","강동원때매 2점 주는거임 그냥 끝까지 강동원만 존 나 불쌍했다 권선징악도 고구마랑 계란만 먹이다가 나중에 고구마주스 주는 느낌 그냥 강동원 잘생겼고 귀엽고 불쌍하고 끝  ","2"
"1002","설날에 보고왔는데 정말 재미없었다  한국영화는 돈주고 보기 아까운 영화들만 있는것같다  ","1"
"1003","댓글알바들보고 1점드리고가요  ","1"
"1004","존나 이상함.. 보고 화나는 몇안되는 영화 중 하나 ㅋ  ","1"
"1005","걍핵노잼ㅋ보지마10자  ","1"
"1006","댓글알바 실화야? 돈 얼마받길래;이걸 영화라고 만드냐 스릴도없고. 박진감도없고 개연성도없고 감독 지맘대로 스토리 나름 쥐어짠거 같은데 죄송한데 이거볼꺼면 애들 세벳돈이나 줘요. ㅠㅠ 내인생 최악 영화  ","1"
"1007","108분동안 강동원보고싶으신분만 보세요영화로서는 개노잼임 내용성x 총격전인데 긴장감 제로 ㅋㅋㅋㅋ  ","1"
"1008","조작된도시(지창욱나온거)랑 다를게진짜뭐지^^강동원이랑 어울리지도않고 연기도안어울리고 왜봤지싶어요...  ","1"
"1009","1점까지는 아니지만 너무 높아서 1점드립니다  ","1"
"1010","그냥 1점 드릴께요 ㅇㅅㅇ  ","1"
"1011","썼다가 빡쳐서 다시 쓰는데 차라리 ㅅㅂ 강동원 cf모음집을 봐라 OO  ","1"
"1012","마지막 5초 빼고 볼 거 없다  ","1"
"1013","어이가 없다 뭐지 뭔 내용이지  ","1"
"1014","영화완성도가 많이 아쉽네요.  ","1"
"1015","진짜 연출진들 반성합시다  ","1"
"1016","최저가 1점이라니 더 낮게 주고싶은데.. 끝나고 다들 탄식함 영화가 처음부터 끝까지 엥?스러움  ","1"
"1017","한국영화특유의 저급한 억지감동을 넣으려고 했으나 그런부분들이 엄청 지루하게 느껴졌음. 감독이 어떤 메시지를 주려고 하는지는 알겠으나 연출이 너무 떨어져서 재미가 없네요 딱 50만 관객수준의 영화.  ","1"
"1018","강동원 한효주 믿고 봤는데 정말 쓰레기다. 영화라고 부르기도 싫은 쓰레기. 시간과 돈이 아깝고 강동원 한효주같은 배우들이 이런 영화를 찍다니 감독의 인맥이 엄청나다는 걸 느낄 수 있었다 이 감독 이름을 꼭 기억하고 이 사람 작품은 다신 안볼것이다.  ","1"
"1019","대한민국 댓글알바가 이렇게 많다니...  ","2"
"1020","영화 넘넘 재밋었어요! 뒤에는 쫌 아쉽기하네요 ㅎ  ","8"
"1021","특별출현, 강동원, 배경음악이 다했다  ","8"
"1022","범죄 스릴러지만 보는내내 눈과 귀가 행복했던 영화ㅎㅎ  ","9"
"1023","감동 코믹 액션 그리고 배우까지 완벽했던 영화.이제는 충분히 가능성있는 스토리에 소름끼칠 정도로 재밌었음..믿고보는 강동원 연기도 대박!  ","10"
"1024","얼굴도 스토리도 모두 좋았던 영화  ","10"
"1025","관람객강동원의 빙구미 뿜뿜  졸귀탱  ","9"
"1026","마음 따뜻해지는 영화였어요^^  ","10"
"1027","개연성은 좀 떨어졌지만, 재미있게 봤다.  ","7"
"1028","관람객잼있어요 긴장감도 있는데 따뜻하고 감동적이예요 연휴에 보기 좋음  ","10"
"1029","범죄 스릴러지만 보는내내 눈과 귀가 행복했던 영화ㅎㅎ  ","10"
"1030","이런 영화에 어떻게 저런 호화캐스팅을했지 신기  ","1"
"1031","내가 건축학개론을 보는건가? 아니면 액션 영화를 보는건가? 아니면 코믹 영화를 보는건가? 아니면 멜로를 보는건가? 뭐냐 니 정체는?  ","1"
"1032","관람객강동원 잘생겼네요 재밌어요.. ㅎㅎ  ","10"
"1033","주인공은 매력있는데. 스토리가 뒷심이 없다.  ","6"
"1034","강동원 잘생겼어요..  ","10"
"1035","다만 강동원 얼굴만 재밌었던 영화  ","4"
"1036","발로 만든 영화.. 에혀  ","1"
"1037","슬푸다 진짜ㅠㅠ 설마했는데 평점이 이렇다니 근데 정말 ㅜㅜㅜ 아쉬웠어요 가족들 다 델꼬 갔는데 진짜 당황;;; 끝나고 관객들 폭소 실소는 모든 상영관마다 다 그랬나보네요  ","4"
"1038","나만 당할순 없지 꼭 보시길  ","1"
"1039","돈과 시간을 한번에 날리고 싶다면 추천  ","1"
"1040","강동원 없으면 10만명도 안될 영화 재미없다.  ","2"
"1041","진짜 개연성은 하나도 없는 영화.진짜 말도 안나온다..이게 3위라고?결말도 황당하고  ","1"
"1042","예고편 보면 영화 전체 다본듯  ","1"
"1043","아...초반에는 좀 재밌나 싶었지만 뒤로가면갈수록 이상해지는 결말...우정팔이로 억지감동 유도하는것도 오글거렸음  ","1"
"1044","내가 망작은 진짜 잘 피해갔는데 이건 못 피했다 ㅜㅜ 그냥 이거는 감정선이나 스토리전개나 제대로 이어지는 게 하나도 없고 뒤죽박죽 그냥 개돼지 우리보다 못한 영화다bb  ","1"
"1045","사건이 왜 일어났는지 나오지도 않고 결말도 이상하고 흐름도 뒤죽박죽 올해 제일 돈아까운 영화 여러분 피하세요  ","1"
"1046","평점 처음남깁니다. 정말 어이가 없더라구요.. 설마 그정도겠어 하고 봤는데 그냥 너무 어이없는전개, 어색한 강동원 말투와 연기,  제대로된 설명 없는 영화에요.. 보지마세요. 보면서 괴로웠고 진짜 어이없어서 실소가 나오더라구요..  ","1"
"1047","정말정말정말 너무하다 시간과 돈이 아까워요  ","1"
"1048","시간을 버리고 싶으면 이 영화 꼭 보세요  ","1"
"1049","결국 노잼영화는 들통나게되어있다  ","1"
"1050","노잼...ㅠㅠ 스토리가 약해  ","1"
"1051","하하하호호호헤헤헤히히히  ","1"
"1052","경악을 금치 못한 영화...  ","1"
"1053","뭘 말하려는지 모르겠는 영화  ","1"
"1054","허술하고..억지감동 버무리  ","2"
"1055","내 만천원 ㅡㅡ 10자채우기  ","1"
"1056","잡탕밥같은 영화...  ","1"
"1057","이건 진심으로 1점주는것도 아까운쓰레기영화다장르가 어떤장르인지도모르곘고 영화도중도중에 쓸때없는 감정선을 왜 그리 쳐 집어넣는지도 모르겠고 기승전결 하나도없는 쓰레기영화  ","1"
"1058","이 영화를 끝까지 극장에서 보고 나오신 분들께 경의를 표할 그런 영화  ","1"
"1059","올해 초반부터 한국영화 왜이러나....염력에 이어 골든슬럼버까지...다세포소녀급보다는 낫지만 거의 비슷한급...  ","1"
"1060","억지스러운 영화...  ","1"
"1061","근래 보기힘든 조잡한영화.  ","2"
"1062","개연성1도없고 억지에 억지로끝나는순간 집중이이렇게 안된영화가있을정도  ","1"
"1063","이걸10점?별 한개도 아깝다 강동원 좋아하는분만보세요  ","2"
"1064","와...진짜...장난하나...나도 여기 댓글보고 영화봤는데;;  구라치는 댓글들 왜케 많냐;;  진심 개노잼. 개연성 없고, 중심주제도 불명확. 액션이 화려한 것도 아니고.말도 안되는 억지 감동;;; 강동원은 왜 이런 영화를 찍었지jQuery224073878483059  ","1"
"1065","알바 씨이바 줬같네 ㅡㅡ  ","1"
"1066","0점없냐ㅡㅡ 돈쓸곳없어고민이면추천ㅋㅋ불면증가진분들한테도추천ㅋ시간낭비돈낭비 제대로햇다.  ","2"
"1067","댓글 알바새끼들 머가리에 총으로 쏴 죽여버리고 싶다  ","1"
"1068","검사외전을 어어가는 강동원표 개 쓰레기영화  ","1"
"1069","미쳤다.... 진짜... 이걸 선택한 강동원에게 정말 실망이다.... 오죽하면 영화보다가 사람들이 나가겠냐....한줄평 쓴다면 어벤져스 배우들 다 모아두고 D-War 2탄찍은 영화라고 평 쓰고싶다. 미쳤다 감독.... 술마시고 찍은줄  ","1"
"1070","맴버십으로 봤는데도 포인트가 아까웠어요...  ","4"
"1071","스릴영화인줄 알았는데 우정영화ㅋ 주변 친구를 돌아보게하는 시간여행같은 영화 그리고 특출 윤계상 너무 반가웠어요!!^^  ","10"
"1072","학창시절 칭구들 생각남 ㅎㅎ  ","9"
"1073","강동원 실컷 본걸로 만족함 ㅋㅋ  ","10"
"1074","강동원 짱!!노래도 좋고..감동적이고..!!  ","10"
"1075","잘봤어요^^ 가볍게 보기 좋네요!  ","10"
"1076","터진다 대박 터져 내 속이^^강동원 얼굴 보고 점수 줘도 6점; 너무 많이 처줬다 지금 영화 평점 실화? 나름 액션이며 반전 비리 음모론 그 와중에 빛나는 우정?사랑? 어찌저찌 이런 저런 요소를 넣어 놨지만 내가 보기엔 지금 평점들이 더 조작된듯  ","6"
"1077","박평식이 박평하기도 아까운 수준의 영화다  ","1"
"1078","보러가지 마세요. 평점에 속지 마세요.  ","3"
"1079","관람객괜찮게잘봤어요 약간중간중간코믹도있고 감동도있고 끝이 약간냉랭하게끝난건아닌지 조금 아주조금 아쉬운점은있네요  ","8"
"1080","방금봄 개쟈밌음 일본판 유치한부분을 잘 바꾼듯  ","10"
"1081","너무나 감동.. 울어버렸ㄷr...☆  ","10"
"1082","너무 과하지도 부족하지도 않은...이 시기에 딱 좋은 영화!  ","9"
"1083","자극적이지 않고 따뜻한 영화였어요. 아들과 함께 봤는데 좋았다고 하네요.  ","10"
"1084","시사회로 보고 가족들 보라고 예매까지 해줬습니다 오랜만에 좋은 한국영화가 나왔네요  ","10"
"1085","진짜 좋은 영화ㅠ 강동원은 진짜 존멋..ㄷㄷ  ","10"
"1086","볼만함 이런영화는 평타  ","9"
"1087","강동원 잘 생김, 김의성 멋짐  ","10"
"1088","강동원과 음악이 좋았다~~그것만으로도 즐감했어요 ㅋ  ","8"
"1089","강동원은 사랑입니다~  ","6"
"1090","테러라는 소재가 톡하하면서도 현실성이 있었으며 배우들의 연기가 훌륭했다. 특히 강동원의 1인 2역 연기는 정반대 성격의 인물이었어서 독보였다. 하지만 우정을 부각시킬만한 부분이나 장면이 전반적인 스토리와는 잘 어울리지 못했던 것 같아 아쉬웠다.  ","7"
"1091","관람객 강동원이영화살렸어요  ","6"
"1092","나참..뭐하는겨 도대체  ","1"
"1093","너무 뻔한이야기에 앞부분 너무 길게 끌어서 지루했습니다. 보통 이런영화는 긴장감있고 몰입도가 있어야하는데 전혀.. 보통 평점 잘 안남기는데 이건 재미없어서 남기게 되네요.. 그리고 영화 끝자락에서 마무리가 너무 엉성했습니다. 돈아까워요  ","2"
"1094","관람객아...  염력도 못피하고 이것도.. 못피햇다  ","1"
"1095","강동원만 2시간 보는 영화  ","1"
"1096","개노잼! cj택배 이벤트 당첨되서 봤는데 돈 주고 봤음 진짜 아까웠을뻔,,모든 요소를 다 때려박음이야기 전개 무엇?웃기려고 넣은 요소들 하나도 안 웃김 ㅠㅡㅜ배우낭비 오져요  ","1"
"1097","영화 보는 내내 모아이석상마냥  무표정으로 봤다  ","1"
"1098","진짜 0점도 아깝다..와....  ","1"
