"","reviews","points"
"449","중간중간 숨어있는 웃음 포인트에서 소소하게 웃고, 긴박한 장면에선 또 몰입감 있게 봤습니다. 주연뿐만 아니라 조연들의 연기가 상당해서 영화 보는 내내 집중 할 수 있었고, 마지막 부분 골든슬럼버 ost 부분이 상황과 노래가 딱 맞아 떨어져서 좋았네요  ","8"
"450","관람객강동원 얼굴이 젤 잼씀~~~  ","10"
"451","재미와 메시지, 여운 다 갖줬네요  ","10"
"452","정말 인상 깊게 본 영화… 오랜만에 의미있는 영화였달까  ","10"
"453","시사회로 봤습니다. 골든슬럼버, 힘을 내, 그대에게 오랜만에 들으니 좋았습니다. 영화 재밌게 잘 봤어요.  ","10"
"454","화려한 출연진. 진짜 영화를 이렇게밖에 못만들었을까?  ","4"
"455","어이 이거 쫌 심한거 아니오  ","1"
"456","역시 평점을 한번 보고 영화를 봤었어야했다.. 억지감동이라는게 이런거구나 느낄 수 있네요. 스토리에 개연성이라도 있었으면 평을 남기러 오진 않았을겁니다. 설이라 가족들과 가볍게 영화 한 편 보려다가 괜히 시간과 돈만 아깝게 느껴지는 영홥니다.  ","1"
"457","친구들 전화하면서 우는 장면에서 하나도 안슬퍼서 웃겻다 ㅋㅋㅋㅋ 왜우는지도모르겟고 개연성 없고  ","1"
"458","영화보면서 처음부터 끝까지...확 잡는부분이없었어요 2시간동안 지루하고... 보는내내하.... 재미없다 하 지루하다 하윤계상 앞머리살짝 내려온거 보면서 장첸같네 그만큼영화가 지루했어요... 카드쓴 내역으로위치추적 하는데 왜 핸드폰쓰는건 못함?  ","1"
"459","보지마세요.땅바닥에 만원 버리는 꼴입니다.진짜 개연성도 떨어짐 . 웃긴 장면들도 그냥 전형적인 소재들 복사붙여넣기한 수준이고 스토리도 그냥 수박 겉 핥기에 자세한건 하나도 안보여주고 너무 뻔합니다.결말도 쓰레기. 평점 7점 넘는건 다 알바일듯;;  ","1"
"460","정말 정말 정말 정말 제미  ","2"
"461","관람객가볍게 보기 좋아요 재미났어요  내용은 어마무시한 부분을 보여주지만 제1의 김건우 제2의 김건우  ..수많은 선량한 김건우들이 있었을걸 생각하면  가슴아프고 ....ㅜㅜ참  영화에 나오는 노래들  너무 좋았습니다  ","8"
"462","영화 잘봤습니다!! 내용은 스릴있으면서 웃음코드도 많아서 재미있게 봤어요ㅋㅋ 특히 음악이 너무 좋았고 영화에 적절한 곳에 나와서 좋았어요 시사회 다녀왔는데 마지막 장면에서는 관객들이 기립박수를...ㅋㅋㅋㅋ  ","10"
"463","꼭 보세요 진짜 추천합니다 ㅠㅠ 오늘 혼영하고 왔는데 가족들이랑 또 보러가려구요! 진짜 추천합니댜  ","10"
"464","설 연휴 가족과 보기 좋아요  ","10"
"465","오늘 보러가요 강동원배우 화이팅!  ","10"
"466","지금 보고 왔어요. 재밌기도 한데 생각이 많아지는 영화네요. 보는내내 나의 오랜된 친구들이 떠오르는..ㅋㅋㅋ 끝내 코끝이 찡해지고 말았네요ㅠ  ","10"
"467","이건 원작부터 좋았는데~~한국판도 나쁘지 않군요 반가운 노래들이 들릴때마다 정말 행복했어요~!^^  ","10"
"468","골든슬럼버 소설도 보고 일본판도 보고 한국판도 봤는데..역시 원작만한게 없더라구요. 원작내용을 알아서 우정이나 스토리전개에 필요한 내용들을 짐작하고 봤지만.. 원작을 보지 않은 친구는 개연성도 없고 스토리.. 마지막에 강동원 뒤돌아웃는 모습은 굿^^!  ","2"
"469","안본눈삽니다 제발 ㅋㅋㅋ  ","1"
"470","진짜 알바한테 제대로 속았습니다 평점 10점만 계속 있을때 알아봤어야 하는건데 여러분 속지마세요  ","1"
"471","심하다 진짜 시놉 내가 대신 골라주고싶다  ","4"
"472","카메오들 보는 재미가 은근&gt;.&lt;  윤계상 나오는건 알았는데 김유정도 ㅎㅎ  ","9"
"473","갓참치♡♡갓참치♡♡너무재밌게봄ㅋ  ","10"
"474","그냥 너무 잘봤습니다 ㅜㅜ 한번 더 보고싶다  ","10"
"475","강동원 사랑해 눈호강 귀호강 제대로다  ","10"
"476","지친 나에게 위안이 되는 영화!!  ","10"
"477","cctv로 얼굴따서 추적하는 놈들이 정작 휴대폰 추적도 안하고 못잡고 자빠짐 ㅋㅋ 그리고 개연성 제로고, 중간에 친구들 끼리 회상장면에서 흐름 다깨져버림; 그냥 B급영화  ","1"
"478","친구랑 봤는데 둘다 감동받았어여 ㅋㅋ  ","10"
"479","관람객마지막 장면에서 소리지를뻔 ㅋㅋ강동원에 반하고 음악에 반하고 친구들까지 생각나네  ","10"
"480","진심 영화보다가 실소가 나온건 처음인거 같다.초반애서 중반부까진 그냥 무난한데 갑자기 영화가 이상해진다 ㅋㅋ보통 영화에 억지감동 넣는건 많으니 이해도 되고 그부분에선 공감도 되서 슬프기도 한데 살다살다 조잡한 감동은 처음 본다. 그부분에서 실소나옴  ","1"
"481","원작이 있는 영화를 이수준으로 만들수도 있구나ㅠㅠㅠㅠ 검사외전을 봤을때는 참치는 사기꾼같은 오바하는 연기가 힘들구나 했는데 이번에 보니 영화내내 우는 상으로 나오는데 감정연기가 진짜 학예회수준ㅠㅠ 참치오빠는 대사없는 연기만 하는걸로~  ","1"
"482","아ㅠ진짜  너무 조잡해요ㅠ 너무 지루하고 못만든 영화에요 진짜  ","1"
"483","별도 아깝다 노잼 OOO기 ....영화 자리도 돈두배 들여서 했는데 그냥보다 나옴 말하고자 하는게몬데 영화내용이 아휴 이것도 영화라고 ㅡㅡ알바 풀어서 평점 달기는 ..;;;친구가 보지말라고 할대 보지말걸;;;;::노잼 개노잼 ㅡㅡ  ","1"
"484","일본의 원작과 비교하면 상황 진행이 너무 급해서 스토리 진행이 전혀 매끄럽지 못하고 억지스럽네요.주인공은 할줄아는게 아무것도 없고 그냥 전직요원이 시키는대로 끌려다니기만 하고. 뒷이야기가 전혀 나올수 없는 쌩뚱 맞은 결말까지.최악의 영화  ","1"
"485","차라리 강동원한효주조합으로 청춘로맨스나 찍지그랬어요....  ","4"
"486","저희 여친님이 좋아하십니다  ","10"
"487","나로 족하다... 더 이상의 희생양을 막고자...ㅜㅜ  ","1"
"488","왜본건지..엔딩때 엥? 이러고 끝  ","1"
"489","관람객재밌어요^^ 같이 본 부모님도 재밌다구 좋았다고 하네요^^  ","10"
"490","생각보다 스케일이 크고 액션이 좋았음. 얼굴만 열일하는게 아니라 극도 꽤 잘 이끌어나가는 강동원.  ","10"
"491","감동적이고 재밌었어요ㅠㅠㅠㅠ  ","10"
"492","최신순 댓글 왜이러지? 존잼인데; 진짜 재밌고 주인공이 너무 매력있음!!  ","10"
"493","아 평점알바라는게 진짜 있구나. 보면서 장면장면마다 실소를 머금게 합니다. 개연성 없는 스토리에 배우들만 분전하는 느낌. 연출이 이래서 중요한가보네요.. 이 감독 영화는 다시는 안볼 예정! 근래 보기드문 망작입니다.. 이 시간 ㅜ 내 돈 ㅜ  ","1"
"494",".... 진짜 할말을 잃게 만드는 영화. 이도저도 아닌 영화 보는내내 헛웃음만 나옴. 배우들이 아깝다.  ","1"
"495","연기 잘하는 배우들도 웃길수가 있구나..개연성이나 액션? 장면 모든게 전부다 별로...웃기려고 했던 연기마저도 어이가 없고 조잡햇어요.. 감독님 연구 많이하셔야 될듯하네요..  ","1"
"496","김건우캐릭터 중독성있음ㅋㅋ 가족이랑 보기에.딱 좋네요  ","10"
"497","노래는 그냥 따로들으세요...진짜 대노잼 주인공을 순수하게 만들어서 감정이입 되게 만들려고 한거같은데 진쯔 고구마  ","2"
"498","전형적인 무의미 상업용 배우빨 영화..  ","2"
"499","이런 연기자를 두고 영화를 이렇게 만들다니  ","2"
"500","비싼재료사서 망친음식!!! 해도해도 너무한다 내인생의 시간과돈이 아까운 최악의 영화 보고나서 진심 화남  ","1"
"501","배우가 아까워요....  ","1"
"502","허술한 스토리와 개연성없는 전개... 보면서 짜증나는  영화는 오랜만이다. 출연배우들이 아까운 영화....그래서 감독찾아보고 이 감독 영화는 다시는 보지 않겠다고 다짐했다... 쓰레기 영화..  ","2"
"503","스토리가 허구를 넘어 달나라가는 수준이다. 밑도 끝도 없는 정보국과 음모론에, 강동원 없으면 안볼 사람 많았을 거다.  ","2"
"504","스토리가 재미없는건 아닌데.. 엉성한 연출과 개연성 부족이  영화의 완성도를 완전 하락 시켜버림.. 그래도 강동원 하나로 6점은 충분함.  ","6"
"505","이딴스토리와 허술한 영화가 캐스팅이 왜이렇게 빵빵한지 도저히 모르겠다. 돈을 엄청나게 주나?  ","1"
"506","감독님  기억할께요   리얼감독님 치외법권감독님  골든슬럼버  감독님  3대 명장  믿고  거릅니다  ","1"
"507","노동석 감독님 기억하겠습니다  ","1"
"508","OOO도에 본영화중 최악의 영화.. 연기탄탄한 배우들많이나왔는데 진짜 배우한테 미안해야한다 이건..  ","1"
"509","이런 코메디를 만든 감독을 조져야되  ","1"
"510","좋은 배우들 가지고 이런 영화나 만들다니... 할말이 없다하지만 마왕노래 좋아서 1점 더준다  ","2"
"511","이렇게 못만든 영화는 태어나서 처음보는거라 너무 충격적이네요 정신산만해서 집중도 안돼고 영화가 아니라 티저 예고편같아요 감독이정신제대로 박힌사람인가싶네요 산만한 성격이신지 어떻게  강동원과 한효주를 주인공으로  이런 그 지같은 영화를 만드실수가있나요?  ","1"
"512","넘 유치하고 개연성 없게 만들어 놓으니 배우들이 아무리 잘해보려해도 안되는구나  ","2"
"513","이영화만든 감독은 정말 영화감독 맞는거야? 아니 어떻게 강동원하고 한효주 를 이렇게 망칠수가있는거야  ","1"
"514","첨부터 느닷없는 설정에 벙찌다가  강동원 얼굴에 집중하고 마음을 다잡고 봄  ","6"
"515","관람객참치님이 나오셔서 봤는데..  초반엔 스토리 전개가 재미있었지만 뒷부분이 조금 억지스러운 면이 있었어요 ...  ","8"
"516","할말이 없다...시간아깝고 돈아깝다..  ","1"
"517","초반 강동원윤계상 캐미가 넘나 조음ㅋㅋ  ","9"
"518","참치오빠는 역시 잘생겻네요  ","7"
"519","돈은 아깝지 않았다 무난하게 재밌다 느낌  ","10"
"520","노래가 진짜 다 좋음...ㅋ  ","10"
"521","이정도면 만족스러워요 ㅎㅎ  ","10"
"522","개봉일을 기다린 보람이 있습니다  ","10"
"523","강동원 배우가 한 대사 중 나 하나 손해보고 살면 되지 않냐 라는 그 말은 다시 한번 저를 돌아보게 하는 대사였습니다. 세상에 이런 사람들 덕분에 내가 편하게 살지 않았나 싶어요 영화 너무 잘 봤습니다  ","10"
"524","어려울 때 남는 건 친구밖에 없다. 기분좋게 손 꼭 잡고 우정을 되새기기 좋은 영화.  ","10"
"525","강동원 대존잘ㅠㅜㅜㅜ  ","10"
"526","친구들 우정을 더 돈독하게 해주는 설 연휴에 보기 좋은 영화  ","9"
"527","이건 꼭 봐야 하는 영화… 친한 친구랑 다시 한번 보고 싶음  ","10"
"528","보고싶다...강동원 나오니까...일단은 믿고 보고싶다.  ","10"
"529","강동원이니 믿고 보셔요~ 영화도 넘넘 좋았슴돠~~  ","10"
"530","긴장감은 물론 뭉클한 감동까지 최고였어요ㅎㅎㅎ  ","10"
"531","노래,연기,감동 다 잡음꼭 보세요 강추  ","10"
"532","강동원 자체로 하나의 장르다.  ","10"
"533","영화 자체가 좋았지만 음악이 진짜 감성 폭발ㅠㅠ  ","10"
"534","신해철씨의 음악까지 너무 좋았습니다..  ","10"
"535","살 떨리는 긴장감과 따뜻한 감동까지! 두 마리 토끼 다 잡았네!  ","9"
"536","보는 내내 긴장감 넘치고 좋아씁니다  ","10"
"537","긴장감도 적당히있고 OST도 좋았습니다~  ","10"
"538","조금 더 속도감 있었다면 좋았을듯  ","8"
"539","책도 너무 좋았지만 음악과 배우들 덕분에 영화도 좋았음. 강동원은 언제나 최고!!  ","10"
"540","스토리의 기승전결이 그냥 개판이다. 각본이 문제인거냐 감독이 문제인거냐 보는 내내 답답했다.  ","3"
"541","좋은배우들 좋은각본가지고 어떻게 영화를 이따구로 만들 수 있지? 차라리 공장처럼 찍어낸 영화를 만들지 이건 뭐 공장기계 나사 하나씩은 빠진것 같은 이런 죠카튼 영화를 돈내고 본 내가 싫다  ","1"
"542","이런 배우들을 데리고...이렇게 개연성없는 영화를 만들다니...  ","4"
"543","이거 뭔가요? 진짜 어이없네요. 배우들이 불쌍합니다.  ","1"
"544","핵노잼입니다 배우가아깝네요  ","1"
"545","재미 없음.  연출 감독 다 엉망  ","1"
"546","이게모야 인터넷으로 봤는데도 이 배우들 가지고 이똥을싸놨네.. 중간에 잠듬 시간 아까워요 진짜 보지마세요..  ","2"
"547","와유치해 강동원이라도 봐서 그나마 다행  ","1"
"548","그냥 너무 허무했음 2시간동안 멀본건지 리얼이랑 비슷함 좋은배우두고 이렇게밖에 못하는 감독이문제임  ","1"
"549","감독   다신 연출하지마세요  한심스럽네요  ","1"
"550","감독 노동석은 막노동 이나 뛰는게 나을듯  ","1"
"551","배우가아깝다 최악입니다  ","2"
"552","좋은 배우들 데려다놓고 내용 개같이 만들었으면 영화이름을 골든 리트리버로 했어야죠  ","1"
"553","이런 배우들로 이런 영화를?  ","1"
"554","원래는2점인데 강동원의때문에 1점 더준다.. 스토리가 킬링타임에 나올법한 스토리로 짜졌고 배우들이 너무 아까워요. 강동원이 살린 영화임  ","6"
"555","관람객배우들이 좋아서 기대하고 봤는데... 힝...  ","3"
"556","레시피가 주어저도 요알못이면 요리를 망치는 법.  ","3"
"557","진짜 세상에서 제일 재미없다 초대권으로 보러갔는대 초대권준사람 원망하긴 처음임개연성도 없고 개그감동액션코드 다 이상하고 그래서 결론이 뭐임? 이생각만 들음 차라리 영화볼 시간에 늦잠이나 주무시길....내가 써도 이거보다 잘쓸듯 ㅅㄱㅂ  ","1"
"558","강동원 굿 영화는....  ","4"
"559","관람객평점보고 괜히 예약햇나싶엇는데 솔직히 염력보단 나은것같아요..  ","2"
"560","영화 보기 전 연출, 우정, 음악이 조화로운 뭐 어쩌구 하는 후기보고 갔는데... 집어치우고, 모든게 다 억지스럽더라. 그들의 눈물나는 우정?에 난 왜 하품이 나오냐? 연기 잘하는 배우들 모아놓고 도대체 왜 이런 영화를 찍었냐고! 아까운 내돈,내시간!  ","4"
"561","아 뭐냐 진짜 재미를 떠나 간만에 감독의 무능을 본 영화였다  ","5"
"562","진짜 내가 좋아하는 배우 모아두고 영화를 이렇게 만들어주시다니... 정말 아쉽지만 노잼영화 억지감동에 실망하고 갑니다.  ","1"
"563","영화 전개가 자연스럽지가 않고 들쭉날쭉  ","4"
"564","갑작스런 급전개에 윤계상은 왜 나온건지도 모르겠고 중간중간 밴드회상하는데 이게 어느장르에 영화인지 참...ㅋ  ","2"
"565","설연휴 식구들이랑 10만원치 영화보는데씀. 최악의 설날임.. 쉐엣  ","1"
"566","택배기사님들은 위대하다.  ","10"
"567","감독님이 첫작품이라 그런가 조금 아쉬운 부분이 많긴하네요ㅠ 그래도 배우들 연기나 스토리는 좋앗어요  ","8"
"568","강동워 실제로도 저렇게 착할거같음..  ","9"
"569","초반부터 엄청난 긴장감.. 생각보다 더 괜찮은 영화였다  ","10"
"570","역시 강동원. 색다른 소재와 스토리가 아주 쏠쏠한 재미를 준다.  ","10"
"571","추석때는 택시기사였다면  설날에는 택배기사다  ","10"
"572","강동원 개 잘생김ㅋㅋㅋ 개멋짐ㅋㅋ  ","10"
"573","강동원이 1인2역 하는 장면이 나올줄은..  ","10"
"574","일본 영화는 솔직히 조금 지루했는데 한국에서 나온건 긴장감 쩌는데요?ㅋㅋ 역시 우리나라가 짱임 ㅋㅋ  ","10"
"575","가벼운 마음으로 보기엔 나쁘지 않은 것 같습니다  ","10"
"576","잼남ㅋㅋㅋ 시간가는줄 모름 ㅋㅋ  ","10"
"577","친구라는 안식처에 대해 생각해보게 되는 영화강동원 비주얼과 건우와 친구들의 우정에 위로 받음  ","10"
"578","추억,음악, 친구를 생각하게 하는 감성 스릴러!!  ","10"
"579","와 진짜 얼마나 억울할까 ㅡ ㅡ 보는 내내 건우한테 감정이입되서 혼남 ㅡㅡ  ","10"
"580","초반부터 엄청난 긴장감.. 생각보다 더 괜찮은 영화였다  ","10"
"581","강동원이라는 배우에게 호감을 갖게되는 영화였네요  ","10"
"582","감동스릴모두있고 너무재밌다 믿고보는배우 강동원이니깐 귀엽고 잘생기고 카리스마 강동원의 모든것을 볼수있는 정말 재밌고 믿고볼수있는 좋은작품  ","10"
"583","신선한 스토리와 따뜻한 우정이 어우러진 새로운 스타일의 영화였다. 강동원이 어떤 포인트에서 영화화를 제안했는지 알 수 있었음.  ","10"
"584","스릴러에 감동까지! 그 동안 느껴 보지 못한 영화였네요!  ","10"
"585","끝까지 눈을 뗄 수 없는 영화!!  ","10"
"586","배우들이 아까운건 사실이네요.  ","3"
"587","감독 머가리가 나쁜거냐 도데체 명배우들 데리고 이딴 OOO기 영화를 어케 만든거냐  ","1"
"588","감독이 연출에 대한 재능이 아예 없습니다. 좋은 시나리오 완전 망쳤네요.  ","3"
"589","훌륭한 배우진을 가지고 이런 영화를 만들었다는 것이 그저 놀랍다...  ","1"
"590","강동원존잘  후반이 황당해서그렇지 잼씀  ","10"
"591","화려한 배우 캐스팅에 비해 스토리가 엉망이다. 강동원 얼굴 보는 맛으로 끝까지 버텨냈다.  ","4"
"592","개연성 정말 개폭망... 오만가지를 다 넣으려다가 다 놓침  ","2"
"593","이 영화 한줄 후기 강동원 잘생겼다  ","6"
"594","강동원 얼굴 감상하다 끝난 영화 ㅎㅎㅎㅎ 내용이 너무 앞뒤 두서가 없다고 해야되나...강동원 때문에 봤다...후^^  ","2"
"595","강동원 다큐멘터리. 강동원 한효주 비쥬얼이 유일한 볼거리임ㅋㅋ 이거 보느니 구글에 강동원 화보 치셈  ","2"
"596","뭐지 내가 뭘 본거지? 영화를 보는 내내 머릿속에 물음표가 떠나질 않았다.계속되는 의문은 끝내 해결되지 않았다.  ","1"
"597","설마 이러고 끝? 했는데 진짜 설마가 사람잡네....  ","1"
"598","관람객에효~~예약비까지내면서 보구왔는데 이게몬가요.착하게 살면 요래당한다는 교훈을주는건가요?아니면 추억여행을 그린건가요?남는게읍고 괜히 동원이 믿고 영화봤다가 낚인거같은 느낌은 몬가요  ","2"
"599","이건 말도 안되는 일이 일어난거다 정말 보면 안돼 부탁한다 보지마세요  ","1"
"600","와.. 나 진짜 웬만하면 후하게 주는편인데이건 안되겠다거기서 뜬금없이 김유정 벤이 왜 등장해서강동원을 태우고 가는건짘ㅋㅋ연계성이 하나도 없다  ","1"
"601","처음으로 평점쓴다 진심 돈아갑닼ㅋ 설날이라고 가족이랑봣는뎈ㅋ 진심 내가가족한테 미안함ㅋㅋ 이거 돈주고 좋다는ㄴㅕㄴ.ㄴㅗㅁ들 나와랔ㅋ 연기도못하고 내용존나 이상함 왘ㅋ 이거보고 망해라  ","1"
"602","감독이 원한건 댓글알바가 실재한다는걸 모두가 알게되는 큰그림인듯  ","1"
"603","리얼과 염력은 피했는데 골든슬럼버는 못피했다.. 돈아깝다  ","1"
"604","그냥 끝까지 강동원이 택배기사일이 얼마나 고된지만 보여줬어도 이것보다는 감동적일듯?  ","1"
"605","처음 로긴해본다 . 이거 사람이 볼수 있는 영화가 아니다. 감독 사람이냐?  ","1"
"606","저는 영화는 무조건 큰 스크린으로 영화관에서 봐야한다고 생각해서 인터넷 티비로 영화 안봅니다. 이건 그냥 인터넷 티비로 보세요. 영화관에서 볼감이 아니에여  ","1"
"607","진짜로 이건 아니지...  ","1"
"608","진.짜.재.미.없.음.  ","1"
"609","진짜 강동원 작품 선별 제대로 해줘요 프로필에 이런거 남기는게 옥의티같다  ","1"
"610","평이 안좋은데ㅠㅠ 왜지ㅠㅠ난 재밋던데 ㅠㅠ  ","10"
"611","볼만해뜸요 강동원졸귀  ","10"
"612","관람객초현실적이지 않은 소시민 강동원을 마음껏 볼수 있음  ","7"
"613","관람객원작을 몰라서 비교설명은 못하지만. 저는 재밌게 봤습니다!! 역시 동원배우님 *  ","10"
"614","관람객&#39;옆에서 만들다고 만 영화&#39; 라고 평하던데 혼자 마음속으로 생각하지 그랬나.난 좋았다  ","10"
"615","오락영화로 이정도면 손색이 없죠 ㅋㅋㅋ  ","10"
"616","음악선곡 굿뜨!!&gt;.&lt;ㅋㅋ  ","10"
"617","스릴러 영화로 제격이네영!  ","10"
"618","때로는 설렁설렁한 영화도 위안을 주지  ","10"
"619","오글거리긴하지만 재밋음 강동원 존잘 졸귀ㅎ다해먹음  ","10"
"620","믿고보는 강동원작품！  ","10"
"621","친구가 보고싶어지는 영화  ","10"
"622","설 연휴에 보면 좋은 영화 꿀잼임  ","10"
"623","역시 강동원 얼굴천재...  ","10"
"624","관람객음악 넘조아서 뮤비 무한반복중  ","10"
"625","강동원 덕분에 눈호강 듣기 좋은 노래들 덕분에 귀호강  ","10"
"626","음악이 없었다면 부족했을 영화.. 강동원은 정말 잘생겼다  ","9"
"627","강동원강동원강동원.  ","10"
"628","그냥 묻지도 따지지 마시고 강추!!  ","10"
"629","원래 원작으로는 일본 영화입니다 거기서는 대권 후보가 아니라 총리로 나옵니다 그나저나 잘생긴 동원이 형 굿귯!!^^  ","10"
"630","강동원 정말 너무 좋다ㅠㅠ 골든슬럼버 파이팅!!  ","10"
"631","완벽한 플롯,,, 최고다 최고  ","10"
"632","강동원 나와서 본건데 영화 자체가 훌륭.. 원작도 읽어 보고싶음  ","10"
"633","한국화 아주 성공합니다  ","10"
"634","관람객강동원은 역시나 잘생겼다  ","6"
"635","관람객솔직히 동원아 이거 왜찍었냐.  ","2"
"636","그나마 강동원나와서 본건데 ㅠㅠ스토리 기대 안하는게나음..ㅋㅋ..뭔가 따로노는거같음  ","4"
"637","관람객허술하고 억지스런 스토리..강동원님 1987 차기작으로는 넘나 아쉬움  ","7"
"638","영화를 만들다 말아부렀노  ","1"
"639","별로라고한거보고봐서그런가 난나름괜찮았고 친구라는부분에선 슬퍼서 눈물날거같았는대.. 강동원이랑 다들연기를 너무잘해서 좋았음ㅁ..근데 보라고 추천할만큼의 영화는 아닌걸루  ","6"
"640","제발보지마세요 새해를 즐겁게 보내려면  ","1"
"641","영화의 평점이 조작됨.  ","1"
"642","2시간 내내 울상연기 하느라 고생한 동원이형. 너무 안쓰럽다. 이런 영화을 만든 감독과 제작진은 반성을 해야 한다. 무슨 생각으로 이런 영화를 만든 것인가? 관객들에게 화를 돋울려고 한 영화였다면 성공하였다. 절대로 보지 마라.  ","1"
"643","댓글 알바가 있다는걸 알게 해준 고마운 영화  ","1"
"644","진짜 장담하건대 다알바다. 1점도 아깝다. 대체 강동원은 이영화 씨나리오는 보고 계약한것일까?  ","1"
"645","도대체 무슨장르죠? 스릴러? 우정영화? 아님멜로? 이도저도 아니고 막 쓰까놔서  쓰레기를 만들어놓은듯  ","1"
"646","전 너무너무 재밋엇어여ㅠㅠ  ","10"
"647","사람 하나 바보 만드는건 아무것도 아니구나  ","10"
"648","기억에 남는건 강동원의 잘생긴 얼굴 그리고 한효주의 미모  ","8"
"649","이건 진짜 한국 관객 모독 영화인가 싶을 정도로.... 강동원 앞에 내세워서 홍보했지만 내용 정말 유치하고 오글거려서 소름이 끼칠 정도였어요. 제발 다른거 보세요  ","1"
"650","평생 본 영화 중 최악중에 최악이다 정신없고 조잡하고 개연성없음  ","1"
"651","간만에 돈날렸다 여기 평점도 조작됬네  ","1"
"652","진짜 평점테러 왜 하는겨..관객평점만 올렸으면.  ","10"
"653","요즘한국영화괜찮은게 많이나ㅓ오네  ","10"
"654","오랜만에 좋은 영화 보네요  ","10"
"655","잘생긴형 영화는 믿고보는거지  ","10"
"656","모든 배우들 연기 good  ","10"
"657","스토리연출 보다 강동원 존잘 한효주 존예  ","10"
"658","정말 이거 딱봐도 강동원빨로 흥행하려고 영화 대충 만들었네ㅋㅋㅋ 1점이나 먹어라  ","1"
"659","별로..같이본친구는 잠.  ","2"
"660","관람객원작을 봤기때문에 한국에서는 더 재미있게 각색했겠지하고 가족들 데리고 갔는데 개쪽팔렸다. 지루하고 뻔한 내용전개에 회상하는씬도 뒤죽박죽이라 처음보는 사람들은 이해하기 어려웠고 영화관에서 2시간이 이렇게 긴시간인지 처음느꼈다  ","1"
"661","스토리도 음원도 좋고 재미있었어요!!!  ","10"
