"","reviews","points"
"371","댓글알바생있는지 모르겠는대신과함깨보다 백배나음OO 신과함께보지말고 이거볼걸 ㅇ추천함감동적이고 억지감동없고 믿고보는 이병헌 ㅜㅜ  ","8"
"372","내인생띵작이다 어떤헐리웃액션영화보다 짜릿하고 감동적이고 눈물이다나네 그냥최고다 눈과귀가호강한다  ","10"
"373","관람객슬프지만 감동적입니다~  ","10"
"374","영화 초반에 &#34;밥이나 더줘요&#34;에서 이병헌연기의 깊음을 깨달았습니다.  ","10"
"375","이병헌은 역시 연기신이다  ","10"
"376","제발 세상사람들이 이영화를 전부다 봤으면 좋겠어요ㅠㅠㅠㅠ  ","10"
"377","천만영화는 아니지만 이런영화가 진짜 천만영화다  ","10"
"378","관람객이병헌 짱이다 볼때마다 캐릭터소화능력에 지리고감  ","10"
"379","관람객이병헌의 생활연기.감동적인 스토리~잼납니다.  ","8"
"380","정말 아주 오랜만에 손저리도록 영화관람.  ","10"
"381","웃음코드가 유치하지 않고 웃겼어요 이병헌 대사가 하나하나 다 웃김 ㅜㅜ박정민 연주회에서 피아노 치는거 편집 안 한게 너무 좋았어요... 전 그 장면이 너무 슬프더라고요ㅜㅜㅠ계속 웃고 울며 봤어요 오랜만에 기억에 남는 영화 봤습니다  ","10"
"382","이병헌과 박정민에게 박수를보낸다뻔한 스토리를 뻔하지 않게 만든 연기와 연출오늘 두번째 관람했는데 디테일까지 놓치지않고 보게되니 더 좋았다  ","10"
"383","이병헌 연기 정말 인정ㆍ박정민 연기도 완전 몰입도좋음내용뻔하다는말많은데,,,전체적으로 재밌게 잘 본 영화가슴따듯한가족영화ㆍ  ","8"
"384","관람객웃다가 우는 영화. 이병헌과 박정민의 연기가 빛나는 영화  ","9"
"385","남잔데 이병헌 너무 멋있네... 연기는 진짜다!!!  ","8"
"386","언젠가부터 이병헌이 나오는 작품을 볼 때면 늘 내심 놀란다. 연기의 스펙트럼이 넓거니와 매번 이전 캐릭터들이 생각나지 않을 정도로 뻔하지 않은 연기를 보여주기 때문이다. 박정민의 연기도 좋았고 내용보다도 배우들의 연기가 좋았어서 한 번 더 본 작품이다  ","10"
"387","아주감동입니다이병헌씨 연기아주잘해요  ","10"
"388","믿고 보는 이병헌 연기로는 깔게 없다  ","10"
"389","이런거 잘 안다는데 영화 너무잘만들었네요 윤여정님 이병헌님 박정민님 등등 연기도 너무좋고... 이병헌은 진짜 빼박 ㅠㅠ 웃다가울다가 너무잘봄요  ","10"
"390","관람객이병헌연기는 역시..  ","10"
"391","이병헌 연기는 역시짱입니다...웃다가 울다가 배우분들 다 멋지십니다^^*  ","10"
"392","진짜 이병헌하면... 믿고보는 영화..그래서 믿고 봤습니다...연기력은 정말 그레잇입니다...두번모두 울었네요..가슴한켠에 밀려드는 아련함, 가족애, 형재애....세번을 봐도 눈물이 날듯하네요...  ","10"
"393","관람객웃다가 울다가 또 웃다가 울다가 감동적인 영화다. 믿고 보는 배우인 이병헌, 이번 영화에서도 이병헌의 연기는 정말 멋지다  ","10"
"394","관람객너무너무 감동적이고 재밋엇어요 역시 이병헌은 믿고봐도될거같아요  ","10"
"395","울다 웃다,옆에저희아빠엄청크게박장대소하시다가슬픈장면에서훌쩍훌쩍거리시는걸 봤어요..아빠가울먹거리는거처음봐요..영화에서 이병헌역이아빠랑살짝비슷하거든요.표현은 못하지만마음만은정말 사랑하는..이 영화를 보고엄마에게더효도해야겠다는생각을 했어요ㅎㅎ꼭봐야하는영화!  ","10"
"396","시간가는줄모르고봣네 괜히 이병헌 리병헌하는게 아니다ㅠㅠ  ","10"
"397","관람객이병헌의 연기력과 한지민의 미모에 시간가는 줄 모르고 봤다  ","9"
"398","관람객이병헌 연기 넘 좋았고 내용도 잘 짜여진거같다  ","10"
"399","이병헌 등장부터 그냥 몰입도 대박. 대사한마디 안해도 그가 어떤인물인지, 어떤캐릭터인지 알았네요. 따뜻한 가족영화! 너무 볼만한것 !!  ","10"
"400","이병헌 연기 진짜 깔게 없네 ... 대크박!!!  ","10"
"401","좋은 영화였다. 이병헌 연기 그냥 최고당  ","8"
"402","관람객역시 이병헌....연기너므잘하신다ㅠㅠㅠ 박정민도!!!파수꾼부터좋아한배운데 서번트증후군연기 대박..  ","10"
"403","관람객간만에 범죄영화속에서 감성적인 영화를 봤다.역시! 이병헌의 몰입연기는 최고였다.  ","10"
"404","이병헌, 박정민, 한지민씨 연기 정말 훌륭했고 조관우씨 나중에 알아봤는데 무게감 있개 잘하셨네요. 대박나시길 바랍니다.  ","10"
"405","이병헌이 왜 이병헌인지 알게 해준영화네요 잔잔한 감동이 옵니다  ","10"
"406","아씨.. 가볍게 보러갔다가 와이프랑 같이 오열했네..;; 그리고 미처 몰랐다.. 젓가락 행진곡이 이다지도 훌륭한 연주곡이라는걸..ㅎㅎ  ","10"
"407","천만 안되면 안되는영화 이런영화가 천만영화  ","10"
"408","관람객재밋엇어용 이병헌연기는 진짜 최공  ","10"
"409","신파극이나 감성팔이 영화를 극혐하는 내가 이병헌만 믿고 봤다가 이병헌이 있는지도 모르고 봤던 영화ㅋ 이병헌 포함 모든 연기 일품이고 특히 피아노는 ㅋㅋㅋㅋ  ","10"
"410","역시이병헌..  너무너무 재밌구 유쾌하고 가슴따뜻하게 재밌게잘봤습니다^^  ","10"
"411","이거 꼭 보세요 이병헌 연기력이야 알고는 있었지만 딱히좋아하는 배우는 아니었는데 이거보고 호감됨ㅠㅠ춤 잘춰 욕 찰져 ㅠㅠ매력쩔어 박정민도 연기 짱,,,한지민 짱 이뿜 한지민엄마분 카리스마쩌러...윤여정님두 엄지척 ㅠㅠ아 이건 나중에 한번 더 볼거에요  ","10"
"412","연기력 연출력 다 좋았어요윤여정 과 이병헌 병원 씬 에서 나도모르게 몇년만에 눈물이ㅠ  ","10"
"413","관람객이병헌 잘해~연기잘해~  ","8"
"414","불가능 그것은사실이 아니라 하나의 의견일뿐이다 -무하마드 알리-크~~~~  ","10"
"415","관람객역시...이병헌...연기로는 욕할게없다동생역에 박정민 역시 너무 감동적이고 울컥햇다ㅠㅠ  ","10"
"416","눈물샘이 마를틈이 없었습니다 이병헌 연기 역시나 굿  ","10"
"417","지루할 틈 없이 정말 재미있게 봤습니다.  ","10"
"418","감히 염력과 비교하지 말길....  ","10"
"419","관람객진짜 갓병헌 연기력하나는 인정합니다....보는 내내 울먹이면서 봤어여! 개강추!!  ","10"
"420","관람객이병헌 에드립 꿀잼.눈물 웃음 다잡음.  ","10"
"421","정말 오랜만에 감동있는  영화였네요이병헌씨연기 넘좋구요 피아노가 너무감동적이었네요 많이울었어요 힐링됐어요  ","10"
"422","역시 이병헌 윤여정 연기는 명불허전.  완성도가 높고 전체적인 분위기가  밝아  몰입도가  좋았다. 가족 영화로 매우 추천!  중간중간 피아노씬은  영화의 백미  ","8"
"423","저 영화평점처음으로 해봐요! 재밌고 감동있고 진짜 짱! 배우들도 다들연기도잘하시고 멋져요! 이영화추천합니다  ","10"
"424","관람객재미있다길래 보러갔는데 잘봤다는 생각이 듬  ","10"
"425","중학생도 어린애다. 김조하  ","10"
"426","이사람들 미쳤다!!! 정민조하 !! 병헌 조하 !!  ","10"
"427","진짜 ㅋㅋㅋ 신과함께니 메이즈러너니 영화 나오는거 다 챙겨보는데 이런 게 천만 가야하는거 아닌가..  ","10"
"428","역시 믿고보는배우 이병현..연기력 너무 오짐  ","10"
"429","관람객이병헌 연기 잘한다 멋있다  ","10"
"430","역시 이병헌은 다 해낸다~박정민에게도 아낌없는 박수를~  ","10"
"431","결국엔 이병헌이었다.  ","10"
"432","너무 재미있어서 다음날 또 봤습니다 인생영화라해도 과언이 아닐만큼 재밌고 돈이 하나도 안 아까운 영화 너무 재밌고 또는 너무 슬픈 영화였습니다 이병헌 나오는 영화는 꼭 보는데 그동안 한 연기중에 가장 좋았던 영화인것같습니다 너무 잘봤습니다  ","10"
"433","평론가평점은 믿을게 못되네요 정말 재밌게 봤습니다 장애 형제를 둔 가족으로서 장애 아이들과 함께 지내는 교사로서 더 의미있게 보았어요 ㅎㅎ  ","10"
"434","역시 이병헌~~~다들 잘하네요~정말 잘 봤습니다.재미있고 슬프고 감동적이네요~  ","10"
"435","이병헌의 연기는 꼭 봐야지...그냥  연기같지 않은 연기  갓병헌  ","10"
"436","이병헌 겁나 멋지다.. 사실임  ","10"
"437","개인적으로 최근 본 영화중에 가장 좋게 봤습니다. 박정민군의 연기, 연주 모두 인상적이었고 이병헌씨 연기는 역시나네요. 비슷한 느낌이었던 다른 영화들보다 볼거리도 많고, 가족들이랑 같이 보기에도 좋은 영화입니다. 피아노 직접 치셨다는건 진짜 놀랍네요.  ","10"
"438","최금본영화중엔 가슴에 뭔가 남은 영화였네요. 이병현씨 연기정말잘하구요. 한지민씨 진짜예쁘시네요 ㅎ. 넘잼있게 잘봤습니다  ","10"
"439","관람객이병헌씨 연기 다시봣습니다정말 잘하시더라구요  ","10"
"440","관람객잔잔한 영화는 어쩔수없는 지루할수있눈부분을 이병헌이 채워주어 잼있게봤습니다  ","10"
"441","관람객이병헌 연기 대박!! 춤출 때 진짜 넘 웃겼고,, 박정민씨도 피아노 연기 넘 좋았어요ㅠㅠㅠ이병헌과의 케미도 넘 굿!! 무대인사 보고 왔는데.. 더더 흥행하길..!!! 가족들과 보기 좋은 영화입니다 추천추천!!ㅎㅎ  ","10"
"442","이병헌 연기 대박임ㆍ감동  ","10"
"443","관람객ㅋㅋ박정민씨랑 이병헌씨 케미가 굿굿! 그냥 무난하게 보려고 간거였는데 너무 만족스러웠어용 :)  ","10"
"444","아 피아노연주가 이렇게 좋을수가 젓가락행진곡이이렇게 웅장하게 들릴수도 다 좋았다 뭣도 탓할수없이 그냥 좋다  ","10"
"445","진짜 재밌고 훈훈해요눈물은 안났어요ㅎㅎ예상되는 스토리지만그거 감수하고도 재밌게 봤습니다박정민님 너무 귀엽고 연기도 잘했어요이병헌님은 그냥 조하 그 자체임브레이크댄스 출때 웃기고 슬프고 ㅠㅠ글고 한지민님 너무 여신이라 나올때마다 놀람  ","10"
"446","ㅠㅠ슬펐어요 맘아팠지만 중간유머도있고 재밌게봤어요  ","10"
"447","신명나게 웃고 미친듯이 오열하게 만드는 영화  ","10"
"448","관람객재미있고 웃기고 감동적이고 슬프다 처음부터 끝까지 질리지않는 영화  ","10"
"449","관람객굉장한재미였었죠 맞죠?  ","10"
"450","정말 재밌게 봤습니다. 눈물 나오게 만든 영화  ","10"
"451","최고 .. 아직도 마음이 미어진다 배우님들 연기 최고 !!  ","10"
"452","관람객가족이함께보기좋은영화  ","10"
"453","정말 재밌게 봣어요 다시한번 더 보ㅏ도 재밌을 영화예요 배우들 연기 정말 지렸습니다 굿  ","10"
"454","관람객억지감동 끌어올리는 영화가 아니어서 좋았어요  ","10"
"455","정말 괜찮다.별로라고 얘기하는 어떤 사람들도 있겠지만전문적인 지식도 없고 보이는대로 얘기하는 나로써는 너무 훈훈하고 보기 좋았던 영화였다.배우들이 연기를 너무 잘해서 좋았던 영화!  ","10"
"456","진짜 이영화배우들에게  박수밖에웃다 울고..꼭보세요  ","10"
"457","관람객연기쨩쨩한지민이뻐욤  ","10"
"458","정말 재미지다이병헌역시 할말이없다  ","10"
"459","내용은 뻔한데.뻔해서 더 좋은영화.  ","10"
"460","관람객기대안하고 봤는데 감동도 재미도 있었다 음악도좋고...굿  ","10"
"461","관람객믿고 보는 배우 이병헌... 가족들이 함꼐 보면 좋을 감동...  ","9"
"462","너무 감동적이고 신과함께 같은 식상한 영화보단 백배나아요.  ","10"
"463","대박..폭소하다가 펑펑울다긴 웃다울다 시간가는줄모르고보고왔어요 이병헌눈빛에울고 모두연기 진짜짱입니다!  ","10"
"464","기자&평론가 평점이 좀 이해가 안가지만아무튼 저한데는 만점짜리 영화였습니다.영화자체도 감동적이고 배우들도 연기를 잘하셔서 눈시울이 붉게 참다 못해 눈물이 나왔네요. 이병헌님 정말 잘 감상했습니다. 아참  박정민님도요  ","10"
"465","관람객이병헌씨 연기 넘 잘하시구요 마지막 동생 손 잡을때 감동 이었어요  어쩔수 없는 가족ㅠㅠ.. 잔잔한 감동이 있는 영화~  추천 합니다  ","10"
"466","관람객다음에 태어나면 니만 챙길께 이 대사가기억에 남네요  ","8"
"467","개대박 믿고보는 이병헌  ","10"
"468","1 평점 좋아서2 이병헌 연기믿고3 실망안하고  재밋게 잘 밧다  ","10"
"469","최근에 영화중에 최고의 영화  ","10"
"470","영화 대박이다 역시 이병헌 ...  ","10"
"471","진짜 최고의 영화 이병헌 짱  ","10"
"472","재밌음. 역시 이병헌 연기는 끝내줌  ","10"
"473","연기 공부하는 사람에게 이병헌은 살아있는 교과서와 같다. 몇몇 사람들은 그의 연기를 아직도 아니꼬운 시선으로 보겠지만, 우리들은 매순간 놀라움으로 각잡고 본다.  ","10"
"474","이병헌..  폴라포 아이스크림 먹는것 조차연기력 오졌다..  ","10"
"475","관람객역시믿고보는 이병헌 짱재밋고감동적이고 좋앗어요  ","8"
"476","관람객그냥 이병헌이좋다 크으  ","10"
"477","진태를데리고횡단보도를건너는조하의모습은바로영화속장면이자현실의이병헌과박정민의모습같았습니다~^^세명배우님들의놀이판을볼수있어좋았습니다~^^박정민의피아노연주는압권이었습니다~^^또보고싶네요!이병헌씨,다음영화를기다립니다!!  ","10"
"478","관람객너무재밋어요이병헌짱  ","10"
"479","관람객와이프와 잼있거 봤어요  역시 이병헌!!  ","9"
"480","관람객믿고보는이병헌 피아노클라이맥스 소름쫙  ","10"
"481","관람객두번봣어요 ㅋㅋㅋ두번째가 더재밋는거같은 영화 감동임 ㅠㅠ  ","8"
"482","연기의 끝이다... 완벽한 연기  ","10"
"483","관람객이병헌연기 너무 잘해요ㅠㅠ오지는영화..갓지민에 윤사장님까지.. 박정민씨는 왜 안떴는지 모르겟네요ㅠㅠ너무 재밌어요  ","10"
"484","천만 가즈아!!!! 너무 꿀잼  ","8"
"485","12살 딸래미랑 영화데이트, 너무 좋은 영화로 완성됐어요.  윤여정, 이병헌, 한지민 배우 연기는 말할 것도 없고, 박정민 배우 처음 봤는데, 대단하네요. 최고예요~♡  ","10"
"486","이병헌은 진짜다....  ","10"
"487","다른평들대로 역시.. 예상대로의 스토리는 그대로 들어맞았다. 그럼에도 불구하고 영화가 넘 좋았던 이유는. 평이한 스토리를 도리어 역으로 더 돋보이게  살려준듯한 명품배우들의 연기♡  ","10"
"488","잼있다. 이것처럼 잼있는 영화는 없다.  넘 웃기다 넘 감동적이다 역시 이병현 끝네주게 연기잘한다.  ","10"
"489","이병헌~~~천만ㄱㄱㄱ  ","10"
"490","이병헌씨 넘버원 연기 짱  ","10"
"491","큰딸과 봤습니다. 두 시간이 어떻게 가는 줄 모르게 빠져들었습니다. 감동이었고요, 이병헌, 박정민 연기도 최고였습니다. 제 딸이 그렇게 말하니까 저도 공감할 수밖에 없었습니다. 가족이 보면 감동일 것 같아요. 특히 노래하는 이라면 더더욱~~  ","10"
"492","진심진심 강추하고픈 진실된 영화입니다!덕분에 콘서트에 다녀온거같은 기분!감동적이구요진태역 배우  팬됐구요이병헌이라는 배우의 내공에 새삼 놀랬네요.한국영화 팬의 한사람으로 이런 좋은영화가 마니마니 나오면 좋겠어용~^^  ","10"
"493","아무 기대없이 혼자 영화보러 갔다 이병헌 땜시이 영화를 선택했는데 역시! 혼자보기 아까운 영화다.엄청 웃다가 울다가 감동이였다.나도 모르게 박수쳤던 영화! 안 보면 후회할것이다.  ","10"
"494","최고예요 영화 개봉하자 봤어요  ","10"
"495","살아생전에 섬기길 다하여라.  ","10"
"496","이병헌이 주인공으로 복서의 이야기를보여주는건지알았는데 아니었다~ 소소하고 감동적인이야기 가족들과보는데 눈물훔치며 보았다 좋은영화..  ","10"
"497","평론가들이 점수낮게준건 재밌다  ","10"
"498","관람객감명깊게보았네요. 엄마입장에서보니. 가슴아픔도있지만 . 자식들의소중함도 새삼느낌니다...~~  ","10"
"499","진짜  별기대 안하고 봣는데  내인생영화  ","10"
"500","너무너무 재밌게보구왓내요~웃음 재미 감동.. 굿입니다ㅋ다만.. 내용자체는 영화답지못한(?), 조금은 아쉬운 전개였구요.하지만 이병헌이 그걸 살려낸거같습니다~다른배우가 이병헌역을 맡았음.. 이정도로 재밌지않았을거같내요~  ","9"
"501","관람객정말감동적이였어요 역시 이병헌은 믿보배넹?  ","10"
"502","마음 따뜻해지는 영화 이병헌...갓  ","10"
"503","관람객이병헌 연기는 최고입니다  ","10"
"504","내용도 좋구 연기력도 좋구 정말 잼있게 봤네요. 오케스트라와 피아노 연주 끝났을때 기립박수 칠뻔...ㅋ  ","10"
"505","관람객좋은영화잘봣어요  감동 웃음 잇는 영화엿습니다  ","10"
"506","이게재미없다면 뭐볼래?  ","10"
"507","관람객이병헌이 살렷다울고웃고...좋앗슴  ","10"
"508"," 재미와 감동을 선사해준 감독 배우들의연출력과 연기력 모두 너무좋았습니다  ","10"
"509","관람객꼭 보세요~^^ 가슴 따뜻해지는 영화  ","10"
"510","진짜 꼭 보세요~~~ 돈 주고 보고 돈 주고 다운받을거야!! 꿀잼보장  ","10"
"511","그냥 인생영화중 하나...도대체 기자들은 평론을 어떻게 하는거지?  ","10"
"512","이야기의 개연성이 떨어지지만 순간순간이 너무 재밌어서 전체적인 개연성을 생각할 틈이 없음  ","10"
"513","보고나서  울어버렷네요  ","10"
"514","인생영화!!!!정말 수작이다~잘 만들었다!!따뜻하고 즐겁고 먹먹하고 슬프고 담담하다!!강추!!!!  ","10"
"515","웃다가 울다가 너무 감동적. 연주 후에 박수칠뻔했습니다. ㅎㅎㅎ  ","10"
"516","관람객웃음과감동이최고예요  ","10"
"517","관람객그다지 기대하지 않고 갔는데 가슴이 저리도록 슬펐어요  ","10"
"518","감동이 잔잔히오는 진한영화~^^  ","10"
"519","관람객오랜만에 가슴 따뜻한 영화를 본듯.강추!  ","10"
"520","관람객너무재밌네요 가끔씩 빵빵터져주네요  ","10"
"521","관람객모처럼  가족에 소중함을 느낄수있는 영화였슴.  ","10"
"522","관람객너무 재미잇고 감동적이기도 하고 그냥 무조건 강추입니다 꼭 보세요  ","10"
"523","내용좋고 재밌었다. 한지민 너무 이뻣고 이병헌 연기는 늘 좋다..다만 윤여정배우님 사투리가 약간 거슬렸지만 그래도 경상도 할머니의 향수를 느끼게 해주었다..좋은 영화 감사합니다.  ","10"
"524","관람객피아노연주에 빠지고 형제의 연기에 빠지다  ","10"
"525","시간 가는 줄 모르고 봤고 배우들 연기는 물론이고 한지민은 진짜 예뻤다  ","10"
"526","관람객내용은 뻔한 내용이지만 배우들의 연기력과 재미는 좋음  ","8"
"527","내 가족과 내 삶을 돌아보게 하는 영화~~~웃기고 슬프고 음악과 더불어 감동까지~~~100점입니다!!  ","10"
"528","간만에 힐링영화였어요  ","10"
"529","진짜 최고 최고 이병헌의 연기는 원래 좋고~~ 박정민의 연기는 진짜 대박 박수!!!! 박수 칠 뻔 했네요  ","10"
"530","진부한 스토리를 연기력으로덮어버린 영화  ","9"
"531","관람객별 기대없이 보러갔는데,의외로 감동적이고 재밌게 관람하였습니다.  ","8"
"532","이병헌 진짜 까고싶은데 ..도저히 연기로 깔수가없다 정말  연기하나는  100점이다구성 스토리 감동  3박자 돈값제대로 해준영화  ","10"
"533","재밌고.감동있고. 슬프지만 마음좋아지게되는 이야기♥연기진짜감동  ","10"
"534","영화보는 내내 이병헌 잘생겼다 이생각만 100번한듯 진짜  ","10"
"535","내용 뻔하다해서 기대별로 안했는데 영화 속에 푹 잠겼다가 나온듯하다. 영화속 음악 때문에라도 꼭 극장에서 봐야하는 영화.  ","10"
"536","관람객즐겁게 봤습니다.이병헌의 연기는 갈수록 농익는듯  ","8"
"537","이병헌 연기 진짜 잘한다  ","10"
"538","왜 평점이 높은지 알겠다..높은 완성도 몰입도..심야영화 보고나온 1인으로 아직도 감동에서 헤어나지못하네여...피아노연주에 소름돋았습니다...  ","10"
"539","관람객너무재밌습니다 역시 믿고보는이병헌  ","10"
"540","오늘보고 역시 이병헌 연기는 ㅠㅠ최고  ","10"
"541","관람객조하형은...춤신이다 ㅎ  ","10"
"542","이병헌 나온 영화는 그냥 믿고 보시면 됩니다!  ","10"
"543","관람객역시 이병헌의 명연기. 수정역도 대박!  ","8"
"544","관람객이병헌 욕하는게 너무웃겨요 ㅋㅋ박정민도 연기짱잘하구  ","10"
"545","관람객이병헌 다른건 다 욕해도 연기론 정말 욕못하겠다 ㅠㅠ 박정민씨 연기 너무 너무 잘해요!!  ","10"
"546","영화 관람중 지루하지도 앓구 감동과재미와 고루 갖춘 따뜻한  영화인것 같아요 연기의신 이병헌.박정민 특별출연 한지민 까지 너무너무 재미게 관람했어요  ","10"
"547","역시 이병헌 연기 인정~,  박정민 정말 대단합니다 영화를 위해 배운 피아노 얼마나 피나는 노력을 했는지 보이네요 강추합니다  ","9"
"548","한번봐도 두번봐도 질리지안는 묘미네여 지금 이걸보려고 하는사람들은 망설이지 않고 보는걸 추천합니다 인생영화 등록  ","10"
"549","관람객이병헌 때문에 봤다.. 사생활은 머... 하지만 연기는 좋다.. 진부한 이야기를 해석해 나가는 능력.. 이번에도 좋아다고 본다  ","9"
"550","관람객연기짱짱 이병헌최고!!  ","10"
"551","이병헌. 이병헌. 이병헌. 진짜 대단한 배우. 영화 끝나면 이병헌 밖에 생각안남.  ","10"
"552","방금 보고왔다 어딘가에서 조하와 진태가 진짜루 집구석에서 쭈쭈바 빨면서 게임하고있을거같다 200만 밖에 안되는게 이해가안된다...이병헌 박정민 최고!!  ","10"
"553","관람객진짜진짜 잼나게 잘봣네요 이병헌 역시 연기잘하네요스토리도 잼낫구요  ","10"
"554","믿고 보는 배우 이병헌 ~ 정말 감동적인 영화입니다. 이런 영화가  관객  천만 넘어야 될듯...  ","10"
"555","관람객영화 보는 내내 이병헌 박정민을 보는게 아니라 그 캐릭터를 보고 있었다. 영화가 끝난 후에 그 둘의 연기에 소름...  ","10"
"556","관람객넘잘봤습니다~!  이병헌은 역시네요~  ","10"
"557","관람객웃음과감동을 동시에역시 이병헌이였다  ","10"
"558","이병헌. 연기의 정점에서 내려오지 않는다. 단연 우리나라 최고배우  ","10"
"559","우와~~~역시나 이병헌 배우다라는 생각이 든다어색학 부분없이 너무나 자연스럽기만 했던 연기력에 대단한 박수를 보내고 싶네요 그리고 박정민 이라는 배우 또한 놀랬고 다시보게 되었네요 여정 언니 또한!!! 대단..역시나  명품 배우들이신듯 합니다  ","10"
"560","관람객이병헌은 명불허전이다.  ","10"
"561","진짜 이병헌 연기의 신 아니냐? 와 이렇게 연기를 맛깔나게도 잘하네..  ","10"
"562","관람객기꿀잼입니다 이병헌 연기굿  ","10"
"563","관람객역시 이병헌!! 연기가 좋네요  ","10"
"564","관람객이병헌이라 쓰고 갓병헌이라 부를 영화문숙배우 포스 짱  ","10"
"565","관람객김조하조하요^^꾸민지않은 이병헌스타일의연기넘나조하요  ","10"
"566","이병헌 춤너무잘췈ㅋㅠㅠ  ","10"
"567","관람객감동적입니다 이병헌 연기 잘합니다  ","10"
"568","진태가 피아노칠때마다 소름돋았어요  ","10"
"569","최고의 영화. 역시 이병헌씨는 누가 뭐래도 최고!!  ","10"
"570","솔직히 기대안하고 봤는데 결말도 억지스럽지않고 현실적이라 평점 높게줍니다. 생각보다 개쩔었음. 가족들과 같이보는걸 추천. 느끼는게 많은 영홥니다. 저는 이 영화가 전국민이 봐야될 교과서같은 영화라 생각하는게 가정폭력에대해 다뤘다는겁니다. 많이봐야됩니다  ","9"
"571","관람객정말 재밌게 보고왔습니다~~연기들이~~최고!  ","10"
"572","웃음과 눈물 둘다 있는~~  ㅋㅋ예상대는 스토리지만즐겁게 봤어요^^  ","10"
"573","관람객전율이 일어날 정도로 멋진 영화였습니다. 배우분들 연기 굿굿 ^^  ","10"
