"","reviews","points"
"1357","관람객너무 깔깔대고  웃는  12살 우리아들 진정 시키며  보았답니다.  ^^웃고 울고^^  ","9"
"1358","관람객오진태ㅠㅠ 우리진태잘부탁해영 조하오빵ㅠㅠ  ","10"
"1359","관람객형의 정이 느껴지는 ..ㅋㅋ  ","6"
"1360","관람객웃음과 울음이 함께 하는 영화. 이병헌 연기는 말하면 입 아푸고 박정민도 너무 완벽해서 보는 내내 빠져들었다 다만 윤여정 사투리 연기 약간 어색했음 본인이 엄청 연습했다는게  느껴지기는 했으나 굳이 사투리 사용 할 필요가 있었나 싶었음  ","9"
"1361","관람객불가능, 그것은 사실이 아니라 하나의 의견일뿐이다 -김조하-  ","10"
"1362","재밋고 눈물나오ㅠㅠㅠ웃기고 최고  ","10"
"1363","관람객역쉬 믿고보는 이병헌 연기 대박임다~~  ","8"
"1364","관람객새해 첫 영화인데 후회 안합니다 재밌어요 약간 슬픔과 공존하는내용입니다 강추해요  ","10"
"1365","관람객시간가는 줄 몰랐네요. 잘 봤습니다!  ","9"
"1366","관람객평점 값을 하네요. 오랜만에 눈물 흘리며 보았습니다. 손수건 한장 챙겨가세요  ","10"
"1367","관람객박정민 피아노 치는 장면은 너무 소름돋을 정도로 멋있었다.. 눈을 뗄 수 없는 장면이었고 이병헌 춤추는 부분에서 터졌닼ㅋㅋ못하는게 없는 배우... 배우들 연기력은 말할것도 없도 웃고울고 지루할 틈이 없는 영화였다!!!  ","10"
"1368","관람객재미와 감동이 더블입니다 잘봤어요  ","10"
"1369","펑펑 울었네요..ㅜㅜ  ","10"
"1370","관람객배우들의 연기가 아주 기가막히고 코가막힙니다  ","10"
"1371","관람객시간가는줄도 모르고 너무 잘 봤습니다  ","10"
"1372","배우들 전부 연기 대단했지만 이병헌과 박정민 연기 대단하군요.  ","10"
"1373","이병헌 박정민 진짜 입이 떡 벌어지는 영화 한편 만들었다  ","10"
"1374","평론가들은 영화의 내용을 안보나? 염력이 높다니 ㅋㅋㅋ  ","10"
"1375","미쳤다 영화 손에꼽필정도로 잘만들었다.!!!ㅠ  ","10"
"1376","관람객웃다가 울다가 한영화네요ㅎㅎ추천합니당ㅎㅎ  ","10"
"1377","관람객재미있어여 감동도 있구 이병헌씨 박정민씨 윤여정씨 연기 좋았어여  ","10"
"1378","진짜 간만에 본 너무 좋은 영화♡  ","10"
"1379","관람객코믹,감동이 적절히 조화되어 심심할 틈 없이 집중해서 잘 봤어요. ^^  ","10"
"1380","관람객재밌으면서 감동적인영화 ..  ","10"
"1381","영화업계가 발전한만큼 중복되는 소재나 슬롯으로 기대치가 높을 수 밖에 없는대 어떻게 이렇ㄸㅎ도 울리냐.. 배스트평점 보면 말아톤땨 감동이라하셨는대 그때의 감동의 크기로 실감나게 해주는 영화라 더욱 높이 평가한다 잘봤습니다  ","10"
"1382","오랜만에 정말 좋은영화봤습니다  ","10"
"1383","관람객대박 이병헌진짜연기자... 이런영화좋음! 발연기연기자하나없음!&#39; 강추강추  ","10"
"1384","관람객재미와 감동 올만에 재미있게 봤네여  ","10"
"1385","오랜만에 가슴 따뜻해지는 영화를 보며 와이프와 나의 5주년 최고의결혼기념일을 보내게해준 영화 두번봐도 재밌을 영화 눈물없이는 못보는 영화..너무 감동이다..  ","10"
"1386","할리우드 스타가 된 이병헌 이 망가지는 역할 로 나온다길래 보러갔는데  박정민 윤여정 한지민 씨 연기력에 놀랬습니다.  큰 기대 하지마시고 보시면 추운날 훈훈해질겁니다.  ","9"
"1387","알바아니고 진짜 감동...  ","10"
"1388","관람객재밌고 감동적임 한지민 너무너무 이쁨  ","8"
"1389","최고다 진짜 신파극이긴 하지만 도를 넘지 않으면서 잔잔하면서 정말 감동적이다  ","10"
"1390","관람객연기력 인정합니다 재미있게 잘 시청했습니다  ","10"
"1391"," 아름다운영화 메시지가 있음  ","10"
"1392","배우들 특유읭 연기 대단하다 정말  ","10"
"1393","영화보고나서도 여운이쉽게안거시는영화 강추드립니다  ","10"
"1394","추운 겨울과 따뜻한 가족영화가 탄생했네요!  ","10"
"1395","피아노천재 자폐아, 퇴물 복서, 장애인이 된 재벌가 피아니스트, 시한부 엄마, 호스트바 운영 집주인... 3류 소설이나 만화에서 볼법한 참신함이라곤 단 1%도 찾아볼 수 없는 작위적이고 진부하고 고루하고 케케묵은 세팅들. 제자리만 맴도는 한국영화.  ","5"
"1396","이병헌 불쌍... 거의 고아처럼 자랐고 다시 재회해도 인정 못받는 어른취급 그리고 다시 엄마는 돌아가고 자폐아 책임져야할 상황 ㅠ  ","8"
"1397","정말 진짜 최고다...더할말이없네  ","10"
"1398","관람객감동재미 좋은시간이였습니다  ","9"
"1399","2017년 최고의 영화  ","10"
"1400","와우 이병헌배우의 연기 변신은 어디까지 일까? 옆집 오빠 형 같은 생활연기 짱! 엔딩 씬 진태의 손을 꼬옥 잡아 주는 조하... 잊혀 지지 않는다. 이제 조하도 행복했으면  ","10"
"1401","저새끼 안잤어..ㅋㅋㅋ  ","10"
"1402","조하가 진짜 짠한게 그래도 오랜만에 엄마랑 같이 산다고 좋은데 좋은 티를 잘 못내는게 그 춤추는 장면에서 나온것 같음..  ","7"
"1403","감동 그 자체. 안 보면 후회  ","10"
"1404","이병헌팬이되는영화 굿  ","10"
"1405","와~~이병헌 연기 참 좋네멋있네 이런거 잘 안적는데참 웃기고 재밌고 감동적인 이병헌  ","10"
"1406","박정민.. 연기 미쳤다. 이병헌도 윤여정도 한지민도.. 그리고 김성령이모 미모도 미쳤고.. 대단한 영화..  ","10"
"1407","난 이 작품을 영화관에서 왜 보지 않았을까? 라는 생각이 든다..  ","10"
"1408","재밌음. 억지로 웃기려고 쥐어짜내지 않아서 거부감 없이 재밌음. 마지막 감동부분도 슬펐음. 요즘 한국영화 웃긴거든 슬픈거든 억지로 쥐어짜내는게 싫은데 이 영화는 기대 이상.. 다들 좋았지만 다시 한번 느끼는 이병헌 연기 갑..인정  ","10"
"1409","관람객너무나 감동적이였어요  ","10"
"1410","진짜 누구하나 연기구멍 없을뿐더러 완젼 몰입해서 보게 되는 영화네요 너무 재밌고 또 슬펐고 여운이 긴...보길 잘한 영화에요 완젼 최고!!추천하고 싶은 영화네요~~마음이 따뜻~~♡  ","10"
"1411","재밋게 봣다 이병헌은 진짜 괴물이다 연기가 너무나 자연스럽고 박정민도 대박 어디서 저런배우가 나왓을까 주인집여자 딸 한지민 엄마에 비서까지 캐릭터한명 한명 골때리고 잼있었다  ","8"
"1412","마음이 따뜻해지는 아니 미치도록 뜨거워지는 영화였습니다. 환타지와 액션 피튀기는 폭력물이 난무하는 이시대에 한줄기 빛이 되어준 영화! 좋은 연기로 깊은 감동 주신 모든 배우님들 고맙습니다.  ","10"
"1413","오랜만에 가족의 의미를 다시 생각할 수 있었다  ","10"
"1414","아주 좋은영화 입니다 너무재밌고 슬픈  ","10"
"1415","진짜대박이다!!  강추!!! 세분다 연기짱!!!  ","10"
"1416","억지 스토리가 아니라 좋다 요즘 사회에 있어 참훈훈하고 좋은 영화네요 이영화 소장각입니다  ","10"
"1417","뻔하지만 뻔함에 넘어가도 좋은 영화  ","9"
"1418","미워할래야 할수없는 병헌이형...최고~  ","10"
"1419","병헌이형 연기하나믿고가는거야 가즈아  ","10"
"1420","간만에 잔잔한 영화 감사합니다  이병헌씨 색다른 연기 정말 잘봣습니다 이런영화 자주 나왓으면 좋겟습니다  ","10"
"1421","관람객최근봤던영화중최고였습니다 완전멋집니다  ","10"
"1422","이병헌배우 더 말해 무얼하나..  ","10"
"1423","관람객매우 감동적임. 두번이나 봄  ","8"
"1424","이병헌은 정말 최고일수밖에 없다  ","10"
"1425","너무 늦게봐서  미안한 영화    재밌고 감동적이고  가슴아프고  전율이 느껴진 영화  다시보고 싶어요~~  ","10"
"1426","관람객이병헌씨 연기 짱입니다 감동적입니다  ","8"
"1427","최근 몇 년간 한 번 본 영화 다시 보고 싶단 생각 해본 적 없었는데.. 이 영화는 다 보고 난 후 또 보고 싶더라.. 누구 하나 부족함이 없었다... 배우로서의 이병헌도 그렇고.. 박정민 연기는 정말 ㅎㄷㄷ이었음...  ","10"
"1428","두번봐도 최고입니다가족들 다 울었어요  ","10"
"1429","오랫만에 좋은영화 봤어요 ^^  ","10"
"1430","극장 수 별로 없어 밤에 봤네요. 울다가 웃다가 하다보니 끝. 너무 재밌어요. 배우들 연기 정말 대단합니다.  ","10"
"1431","관람객배우한명한명의꽃같은연기....  ","10"
"1432","오랜만에 좋은 영화였다...  ","10"
"1433","재밌게 잘보고왔음 신파라는장르를 인정해야된다고 비꼬는사람들도 많던데 영화는 보고나서 마음이 따뜻해지는정도만 되어도 의미가있다고 생각함. 한지민씨 정말예쁘게나온다  ","10"
"1434","설에 어머니랑 늦게나마 봤습니다 정말 소중한 시간이었습니다 감사합니다 쌍팔년도 기획이 먹히는 세상이라고 말하신 평론가 분이 계시던데 저는 쌍팔년도 기획이 먹히는 세상이 훨씬 따뜻한 것 같습니다  ","10"
"1435","진심 재밌어요진심 안보면 후회할 영화  ","10"
"1436","관람객눈과 귀가 즐거웠던 영화..신파지만 신파를뛰어넘는그런무언가가있었다  ","10"
"1437","관람객불가능, 그것은 사실이 아니라 하나의 의견일 뿐 이 다 ! ! !  ","10"
"1438","나 영화보고 운거 진짜 4개바께 없는데 오랜만에 진짜 또 울었다. 특히 병원에서 이병헌이랑 엄마랑 울때ㅠㅠㅠㅍ  ","10"
"1439","관람객배우들의 연기가 일품인영화 잔잔한감동 멋진영화  ","10"
"1440","관람객아이들하고 넘 재있게잘봤습니다 감동  ","10"
"1441","따뜻했다...병헌 정민 최고  ","10"
"1442","관람객코믹 감동 ~~ 뭉클 ! 재밌게 잘 봤어요~~ 모두 연기 너무 너무 잘하네요!  ","10"
"1443","관람객역시...배우들 연기는 말이필요없습니다!감동과 웃음 감사합니다~~  ","10"
"1444","그냥 좋았다 보는내내 시간가는줄 몰랐다  ","10"
"1445","재미와 감동을 곁들인 영화진짜 다들 연기 너무너무 잘하고,보고나서 마음이 따뜻해지는 영화였네요흥행바랍니다 ㅎㅎ  ","10"
"1446","난 댓글안다는데 정말 볼만 합니다 보고 나서 후회하지안는 영화^^*  ","10"
"1447","간만에 괜찮은 한국영화!!!  ","10"
"1448","관람객최고였다 또 보고싶다 보고싶다  ","10"
"1449","뻔한스토리라고 누가그래? 뻔한거 맞는데  난 그걸 넘어섰다고 생각해.  내내 울면서 가장 슬펐던 부분이 스포라 말하면 안될거같고 무튼  윤여정이 이병헌한테 한말인데 꺼이꺼이 울었다. 내 최고의영화.박정민 연기 만점. 정말 눈물샘 폭발하게 만드는 영화.  ","10"
"1450","역시 연기는 갑.. 오져버리네요  ","10"
"1451","관람객주변에서 보라고 추천해줘서 봤는데 정말 재밌게 잘본거 같아요 괜시리 피아노 치는 모습에 감동해서 마지막엔 여운때문에 계속 눈물 흘리면서 봤어요 연기는 두말하면 입아파요 이병헌이잖아요ㅋㅋㅋ  ","9"
"1452","진짜 최고입니다. 배우들 연기력, 스토리, 누군가 뻔한 스토리라고 할 수도 있겠지만 뻔하지 않은 감동이었고 갓병헌 연기는 그냥 갓 그 자체. 제발 꼭 봐주세요!  ","10"
"1453","관람객연기력도 너무좋고 정말 재밌었어요 강추합니다!!!  ","10"
"1454","관람객처음부터 끝까지 따뜻하고 재미 있었습니다   가족의 소중함을 알아가는 김조하(이병헌)씨  또  자폐아 연기를 훌륭하게 해낸 김진태(박정민)씨 그외 모든 분들이 다 조화를 잘 이룬 영화였습니다~~  ","10"
"1455","관람객스포당해서.안볼라고했는데오와 스포를 씹어버리네요스포당해도꼭보삼!이병헌은 연기로 모들걸 가졌다형님 연기는 그냥 표현이 안됩니다감동 웃음 모두 가진영화  ","10"
"1456","내려놓는 연기..믿고보는 배우 이병헌과 6개월간의 피아노 연습이 믿어지지 않는 박정민 배우의 호흡에 많이 울고갑니다.  ","9"
"1457","강력추천!!말이필요없습니다.  ","10"
"1458","미친듯 웃다 눈물 펑펑!! 이병헌 박정민 연기 너무 잘함~  ","10"
"1459","많이 울었습니다.배우들 연기 최고입니다.  ","10"
"1460","너무 잼있었어요~연기 정말다들 멋졌구요  ","10"
"1461","관람객스토리로 보나 연기로 보나 연초에 따뜻한 영화 만날 수 있게 되어서 뿌듯합니다ㅎㅎ 영화 대박나세요~~♡♡  ","10"
"1462","관람객이병헌연기잘하네요좋았어요  ","10"
"1463","관람객많이 울었씁니다 좋네요  ","10"
"1464","관람객오늘 보고왔어요 잼있어요  ","10"
"1465","관람객슬프고 웃기고 잼나요^^  ","9"
"1466","관람객연기도 대박이고 영화 자체도 대박이고 마음이 따뜻해지는 영화다 내인생영화  ","10"
"1467","지림;;; 진짜 지림;;  ","10"
"1468","이거 연기가아닌 실제처럼 연기는 만점이고슬픔도만점 재미도만점 걍 퍼팩트임  ","10"
"1469","관람객조하의 걸어가는 뒷모습에서도 감정이 고스란히 느껴지는 신들린 연기  ","10"
"1470","관람객가슴뭉쿨한 감동을 준  이병헌과  박정민의 손을 잡고 걷는 모습,  너무   멋있다..  ","9"
"1471","와 이병헌 광항 우럭따 ㅠㅜ  ","10"
"1472","이병헌,박정민 연기가 진짜좋아요~ 조연분들도 잘 어울리고  ㅋ수정이귀여움  ","10"
"1473","역시 믿고보는 이병헌드라마내용도 너무 좋아여 기분좋은영화  ","10"
"1474","나도 아프다 이병헌의 말..나도 어렸고 보호받아야 하는 존재라 했을때...  ","10"
"1475","관람객역시 믿고보는 이병헌 연기 !! 너무 재밌었고박정민배우 다시 배웟습니다 !  ","8"
"1476","역시 너무 슬프고 감동적인 영화..  ","10"
"1477","처음으로 평 남기네요.  ","10"
"1478","웃을 수 있는 영화입니다  ","10"
"1479","관람객웃기기도하고 슬프기도하고 신선했어요ㅎㅎ  ","8"
"1480","관람객생각한거보다 재밌었어요  ","10"
"1481","관람객추운날씨에 오랜만에 좋은 영화그것만이 내세상 좋아요  ","10"
"1482","웃기고 감동이에요!!!요즘 개봉한거중 제일 재밋는건 확실해요 ㅎㅎ  ","10"
"1483","관람객재미도 있고 감동도 있습니다  ","10"
"1484","박정민배우님 최고셨습니다  ","10"
"1485","관람객울고 웃은 영화입니다 지연스레 영화에 빠져드네요  ","10"
"1486","관람객재밌게 잘봤습니다~중간중간 코믹요소들도 많았고 마지막에 완전 감동이였어요 재밌습니다 꼭보세요  ","8"
"1487","관람객크...지렸습니다..뻔하디 뻔했지만 마음따뜻해지는영화네요  ","10"
"1488","관람객지루할 수 도 있는 내용이지만 두 배우의 연기력에 감동과 위로를 얻어갑니다^^  ","10"
"1489","너무 즐겁게 또 여운깊게 보고 나왔어요~  ","10"
"1490","관람객재밋었어요 연주 굿 연기력도 굿  ","10"
"1491","오랜만에 대작인 한국영화가 나왔군요!!  ","10"
"1492","너무 재밌고 감동적이라 부모님 예약해드렸어요 영화관에서 안보면 후회할뻔했어요  ","10"
"1493","정말 감동지고 재미난 영화 스트레스 해소짱  ","10"
"1494","한국 영화 평론가 수준하고는 영화가 이정도면 됐지 뭘 바라니....!!! 평론가들도 이제 평가 받아야 된다  ","8"
"1495","진짜 연기들 미치게 잘한다.. 감탄  ","10"
"1496","너무재미있고 감동도 짱짱 !!!  ","10"
"1497","재미와 감동을 주는 영화입니다. 이병헌 연기가 돋보이고  오버하지않고 잔잔하게 볼수 있는 영화입니다.  ","8"
"1498","정말 연기 잘하고 감동적이고 가족이 같이 보면 좋을것같아요!다시보고픈 영화네요!  ","10"
"1499","관람객간만에 영화다운 영화를 본것같다굿~~  ","10"
"1500","영화가아닌 이웃집형제를 보는듯한느낌 ㅋㅋ그래서 더욱더 좋았습니다^^생각만해도 웃음이나오네요 ㅋㅋㅋ  ","10"
"1501","배우들의 내공있는 연기의 향연이 펼쳐진 영화였다 스토리에 대한 호불호를 떠나서 주조연 가릴것 없는 연기의 케미가 매우 인상적이었다  ","8"
"1502","꼭 보세요 선물같은 영화입니다!  ","10"
"1503","오늘보고 펑펑울고 웃고 진짜 잼나게 봤어요그냥 아무생각없이봤는데  영화끝나고나와식구들 친구들 다보라고 연락했네요진짜잼나게 봤어요  ","10"
"1504","울다 웃다 마음 찡한 가슴 따뜻한 영화.모든 배우들의 연기력이 반짝반짝 빛났던영화.  ","10"
"1505","관람객너어어어어무 재밌어요!  ","10"
"1506","관람객울다가 웃다가, 너무도 뻔한 소재로 수없이 고민하고 관객들과 소통하고 싶어하신 감독님의 감정이 느껴지는 듯해서 감사했습니다. 배우님들의 열연이 대단하셨고 그분들의 수고를 과연 영화 한편 값으로 가치를 매길 수 있을까 라는 생각이 들었습니다.  ","9"
"1507","관람객우린 액션을 즐겨보는데 남자친구가 이 영화를 보자고 해서 솔직히 기대없이 봤는데 너무나 재미있게 봤다. 웃다가 울다가 재미와 감동이 있는 영화였다.  ","10"
"1508","스토리도 엉성하고, 약간 식상할수도 있겠지만... 배우들의 연기력이 너무 좋았다...  ","8"
"1509","관람객꾸르잼 감동적이면서 재밋네요  ","10"
"1510","박정민 진짜로 서번트 증후군 피아니스트인줄 ..연기 넘 좋았고 잔잔한 감동입니다.  ","10"
"1511","관람객꼭 보세요!!!후회 없습니다.9살 아들과 신랑과 감동적인 영화 봐서 기분이 너무 좋아요~~  ","10"
"1512","진짜 보세요 꼭 보세요 ㅇㄹ보다 훨씬 내용도 연기도 퀼리티 짱짱맨  ","10"
"1513","관람객말이필요없다 두번봤다.  ","10"
"1514","관람객너무 재미있게 봤네요! 추천!  ","10"
"1515","추운날씨에  가슴이 훈훈해지는  느낌ㆍ웃기면서도 감동적이라서  좋았다  굿!^^  ","10"
"1516","관람객볼만합니다. 추천해요  ","10"
"1517","관람객뻔하지만 뻔하지않은 배우들의 연기가 돋보이는 영화였지 싶습니다. 재미와 감동 둘 다 잡은 영화입니다.  ","10"
"1518","관람객너무 감동적인 영화였다.. 연기도 너무 잘하고 재밌어요!!  ","10"
"1519","관람객너무너무재미이썼어요 너무너무재미이썼어요 너무너무재미이썼어요 너무너무재미이썼어요 너무너무재미이썼어요 너무너너무너무재미이썼어요 무재미이썼어요 이병헌너무멋지고 한지너무너무  ","8"
"1520","이병헌씨는 연기로는 깔수없죠~박정민씨 연기도 대박!!!뻔한 스토리지만 잔잔한 감동을 주는 연기력입니다~!!!100퍼~  ","10"
"1521","관람객정말 이렇게 웃을줄 몰랐던 영화. 그리고 이렇게 찡하고 슬플지몰랐던영화~  ","10"
"1522","관람객정말 재밋어요 추천합니다  ","10"
"1523","이병헌 박정민 진짜 연기 잘한다 너무 재미있게봤고 진태 넘나 귀엽다 네! 네! 네!  ","10"
"1524","간만에 여운이 남는 좋은 영화를 관람했습니다. 누구는 신파라고 하지만 , 난 신파든 진부한 얘기든 연기파 배우들의 좋은 연기로 모든것이 좋았습니다.  배우들의 눈빛 연기가 최근에 본 어떤 영화보다고 나은게 없을 정도로 좋았습니다.  ","10"
"1525","눈물나도 기분좋은영화. 이병헌 박정민 윤여정 연기도 좋아요.  ","10"
"1526","관람객너무 재미있고 감동적으로 봤습니다!!!  ","10"
"1527","관람객돈이 아깝지 않았어요 좀 뻔하지만 재미있었습니다.  ","8"
"1528","관람객영화보는 내내 꽉차게  재밌어요.  ","10"
"1529","관람객감동너무좋은영화입니다  ","10"
"1530","감동, 재미오랜만에 느끼고왔네요한번 더 보고 싶은 영화 와~~~이병헌의 디테일한 연기 박정민의 정말 1도 오버스럽지 않은 장애연기 정말 대단들합니다  ","9"
"1531","말해무엇하리 최고의영화  ","10"
"1532","굿.정말 이 한마디면 모든표현이 다 되는영화~^^  ","10"
"1533","최고였네요 시간가는줄모르고  ","10"
"1534","관람객웃다가 울다가 감동적인영화  ","9"
"1535","관람객엄청 웃다가.. 눈물 왈칵 쏟공.. 정말 재미와 감동 한꺼번에!!죠아써요!!  ","10"
"1536","관람객재미있네요.한번쯤꼭봐야할영화..  ","8"
"1537","관람객너무재미있게봨씆니다  ","10"
"1538","언제나 그렇듯이 평론가들의 잔머리굴리기식의 영화평론에 신물이 난다. 그들은 더이상 영화를 즐기지 못하는 불평많은 관객들의 한 무리일 뿐이다  ","8"
"1539","그냥 최고...한국 영화의 수준이 자랑스러움을 느낄만함, 그런데 관객수가 아쉽네요.  ","10"
"1540","관람객감동있게 봤습니다.연기력도 우수합니다.  ","10"
"1541","설명이 필요한가..?  ","10"
"1542","관람객정말정말 재미있었어요! 저는 아무생각없이 영화를 보는 편인데 막눈이 봐도 꿀잼영화였어요 한 주의 스트레스를 풀어준 영화에요 피아노를 좋아하시는 분들이라면 귀도 즐거운 영화가될거에요! ㅎㅎ간만에 본 영화들 중 돈이 아깝지않았어요  ","10"
"1543","관람객너무 잘봤어요....최고입니다  ","10"
"1544","오랜만에 재미와 감동 모두 느꼈습니다  ","10"
"1545","그 와중에 박평식ㅋㅋ 쌍팔년도 기획이 먹히는 세상ㅋㅋㅋㅋ  ","10"
"1546","관람객인생영화모든 게 좋았다  ","10"
"1547","관람객너무 재밌었습니다후회 없구요 손수건 챙겨가세요배우들 연기 너무 좋고 시간가는줄 모르게 봤네요  ","10"
"1548","일상연기 정말 다들 쩔었다 진짜  ","10"
"1549","관람객재밌네요^^ 이영화도 천만 넘겠는데요?ㅎㅅㅎ  ","10"
"1550","하 평점10점 남기려고 들어왔네요ㅜㅜ 인생영화입니다  ","10"
"1551","최근본영화중 최고.갠적으로 신과함께보다 재밌게봤음  ","10"
"1552","관람객진짜 내 인생영화가 될거같다ㅜㅜ계속 웃다가 울다가 너무너무 재미있었다  ","10"
"1553","관람객후기개무시하셈 그냥재밋음  ","10"
"1554","관람객간만에 이번년도에 제일 재밌고 가슴이 벅찬 영화 봤습니다.  ","9"
"1555","관람객감동 감동가슴따뜻한영화~~이병헌역시연기력짱~박정민대박  ","9"
"1556","관람객재밌게 보았습니다. 감동도있고 유머도 있고 좋았습니다.  ","10"
"1557","관객수가 이것밖에 안되는게 아쉽다..ㅠ  ","10"
"1558","재미와 감동이 공존하는 영화네요 웃기도 하고 울기도 하며 봤어요 배우들 연기 너무 좋네요  ","10"
"1559","관람객가족이 다같이 봤는데 너무좋았습니다ㅎ  ","10"
"1560","배우들 연기 정말 대단하고... 감동을 크게받은 영화였다  ","10"
"1561","왜 사람들이 이영화를 안볼까 안타까울만큼 재미있습니다  ","10"
"1562","너무 감동적이고 재밌었어요.연기도 너무 훌륭하구요.다시보라그래도 또볼것같아요.최고예요  ","10"
"1563","무심한듯따뜻한형의 사랑 영화보면서 이렇게울어본적 처음~  ","10"
"1564","어제 봤는데 정말 재미있게 봤습니다. 스토리는 예상대로 진행되서 실망했지만 재미와 감동 그리고 듣는 귀가 즐거워서 실망한 부분 조차 티가 안나고 잘봤습니다.  ","10"
"1565","관람객웃다 울다 정신이 없네요 ㅜ 부모님과 함께해도 좋을 영화입니다. 좋은 영화 좋은 연기 였어요~~  ","10"
"1566","관람객오랜만에 좋은 영화봐서 너무 좋았습니다.좋은 영화 보고 갑니다.  ","10"
"1567","너무 재미있고, 감동적인 영화였습니다.눈물 펑펑 흘렸습니다ㅜㅜ최고였습니다  ","10"
"1568","신과함께 보다가 눈물흘렸습니다 ..그내세 보다가 대성통곡했습니다.. 하..진짜 왜이렇게 울려ㅠㅠ  ","10"
"1569","관람객오랫만에 영화 다운영화감동지대로다  ","10"
"1570","관람객스토리는 진부햇으나 연기로 다 커버햇다  ","10"
"1571","관람객정말 가만에재미있엉있어요  ","10"
"1572","관람객감동감동...다들연기너무잘해요  ","10"
"1573","관람객감동적이었고 재밌어요  ","10"
"1574","관람객이병헌.박정민연기 진짜 잘하고 재밌음  ","8"
"1575","지금 봤어요 슬프고 재밌어요!!!  ","10"
"1576","관람객역시 꿀잼~~~~!!!  ","10"
"1577","관람객감동적이에용 보세용!!!  ","10"
"1578","관람객재미있고 감동적입니다.  ","10"
"1579","관람객정말 재밌어요~~~^^짱짱  ","10"
"1580","관람객가족끼리 보기좋은 영화  ","8"
"1581","관람객좋아요이병헌 정말 연기는 참 잘하네요  ","10"
