"","reviews","points"
"1","관람객누군가 말했다..이병헌은 연기로 깔게없다고..이번에도 그말을 역시나 증명한 영화..윤여정씨연기..한지민씨연기..좋았다..그리고...박정민..머라할말이없다...연기너무너무잘한다 무서울정도로...조승우말아톤때임팩트다..내용,연출,연기,음악 다좋은영화다.  ","10"
"2","관람객미친듯 웃다가 폭풍눈물바람 ㅠㅜ이런 감동은 참 오랜만인 영화였어서 더 좋았다  ","10"
"3","불가능, 그것은 사실이 아니라 하나의 의견일뿐이다  -김조하-  ","10"
"4","관람객연초에 아주 따뜻한 영화 만났다 ㅠㅠ 이병헌 박정민 연기 대박  ","10"
"5","관람객이병헌 박정민 연기 진짜 쩜  ","10"
"6","관람객이병헌 이런연기 기다렸음 ㅋㅋ 재밌고 또 재밌다  ","10"
"7","신과 함께 보다 100배 재밌어요  ","10"
"8","관람객배우연기야 말하면 입아프고 웃기고ㅋㅋ 울리고 ㅠㅠ 진짜 짱드셈  ","10"
"9","관람객주제가 뻔한 것 같지만 배우들의 연기는 뻔하지 않네요. 정신없이 울다가 훅 들어오는 감동! 잘 봤습니다 ㅠㅠ  ","9"
"10","관람객배우들 연기가 하드캐리. 캐릭터가 다 살아있고, 너무 리얼해.이런게 진짜지!!! 굿~  ","10"
"11","관람객연기를  ㅈㄴ 잘함 3분다  영화속에선 박정민이 돋보이나 영화가 끝나고 나면  이병헌이 남는다.... 진짜 저 옆집에 살것 같다.. 진짜 프로다  이병헌  절제의 미학 쩔었고  박정민 진짜 잘하고 윤여정님은 말해뭐해  ","8"
"12","관람객솔직히 배우연기 이정도로 쩔면 끝 아닌가? 띵작 인정~  ","10"
"13","구겨진 시간 위에 구겨진 시간이 던져진다. 그 구겨짐의 마찰이 일으키는 따뜻한 온기.  ","10"
"14","이병헌 코미디가 다했네요 진짜웃깁니다ㅋㅋㅋ 윤여정배우와의 케미도 좋았구요 윤배우님 사투리걱정하셨는데 역시 연기력으로 커버되네요  ","10"
"15","관람객박정민의 발견! 이병헌때문에 기대하고 봤다가 박정민한테 반하고 나왔어요. 두 배우의 연기케미 그뤠잇!  ","9"
"16","관람객역시 연기는 이병헌 ! 박정민이랑 케미도 굿~ 깔깔거리면서 보다가 마지막에  눈물찔끔...ㅋㅋ  ","10"
"17","믿고보는 이병헌입니다. 어떤역을 해도 다 소화가능! 대박치길 기대합니당 *+*  ","8"
"18","관람객이병헌 그는정말 액션이면 액션 코믹이면 코믹 정말 올해첫영화잘골랐다고생각합니다 재밌고 감동^^  ","10"
"19","여러분 평론가 믿지 마세요. 제가 올해 본 영화중에 제일 재밌습니다. 시나리오도 잘 썼고 배우들 연기는 짱입니다. 다른 무거운 영화들 말고 이런 영화 보세요  ","10"
"20","관람객주연배우들의 연기는 말할 것도 없고 가족애를 느낄 수 있는 최고의 가족영화입니다 또 진태가 피아노 칠 때 그 행복한 표정이 제 인생을 뒤돌아보게 합니다 과연 나는 무슨일을 했을 때 저렇게 행복했을까 ...?올해 꼭 부모님 형제와 함께 보세요!  ","10"
"21","역시 갓병헌 캬.ㅠㅠㅠ  ","10"
"22","관람객유쾌하면서 마음이 따뜻해지는 영화.  ","10"
"23","관람객따뜻함. 먹먹함. 배우들 연기력까지 완벽함. 억지스럽지 않아서 너무 좋았다.  ","10"
"24","재밌네요.  추천합니다.  ","10"
"25","역시 갓병헌.. 너무 감동적이었음ㅠ천만 가즈아~~  ","10"
"26","관람객이병헌어릴때 진짜좋아했던 배우인데언젠가부터 걍시른비호감이되어서그의영화를 잘보지않았었는데오늘 난 새삼깨달았다.아. .나는 저사람 연기를 참 좋아했었다.맞아 저말투 저눈빛 . .참 많이좋아했었다. 배우로썬 정말 이병헌 참 잘한다. .  ","10"
"27","웃기고 웃기고 재밌네 감동도  ","10"
"28","관람객간마눼 영화봤눈뒈 개감동  ","10"
"29","관람객따뜻한 마음을 가질수 있는영화~~  ","9"
"30","역시 배우들 연기가 좋네요!!  요즘같은 분위기에 울다웃다 하기 좋은듯 해요~ ㅎㅎ  ","10"
"31","브레이크댄스가 원래 이렇게 슬픈 춤이였나? 이병헌이 브레이크 추는 장면부터 눈물샘 터져버림.. 근데 내옆에 남자애도 같이 울기 시작하더란..ㅠ 이병헌은 그냥 김조하였다..  ","9"
"32","이영화가 천만을 넘을가능성이 있는이유1.웃음포인트 및 웃음코드가 알맞게 들어감2.클래식이 얼마나 위대한지 보여줌3.무엇보단 이영화는 악역주연이 없음4.많은 감동및 교훈을 많이주는 영화5.겉모습만으로 절대 판단하면 안된다는걸 잘 보여줌  ","10"
"33","이병헌 연기는 역시..  ","10"
"34","신파니 클리셰니 해도 난 재밌게 봤음 주제가 단순한 건 맞는데 정말 배우들 연기력이 ㅎㄷㄷ함 이병헌 너무 대단한 사람 같음...  ","10"
"35","관람객이 영화에 한지민이 나와서 10점  ","10"
"36","신과함께같은 영화도1300만돌파했는데 그내상은 1500만 가즈아ㅡㅡㅡ  ","10"
"37","구천원이 절대 아깝지않음너무 재밌고 마지막에 진태 피아노치는거보고 너무 울었다이런 영화 진짜 오랜만이라 기분좋네요연기는 말할것도 없으니 꼭 보세요  ","10"
"38","왜 나를 데리고가지 않았냐, 나도 그땐 애였다던 이병헌의 말이 자꾸 맴도네요... 서번트 증후군에 대한 이야기인줄 알고 보러갔는데 뒤통수를 맞은 느낌입니다 부모님 혹은 가족들과 같이 보기에 참 좋은 영화인듯 너무나 재밌게 잘 봤습니다  ","10"
"39","넘넘 잼있어요~신랑이랑 같이봤는데 둘다 눈물콧물 다뺐네요~강추강추~  ","9"
"40","까다롭게 비교해도 요근래 작품중 가장  믿고봐도 좋은 작품!!!  ","10"
"41","관람객이영화 잼나네~ 역시 이병헌!!! 연기들 다들 너무 잘하고 뒤에 폭풍감동  ","10"
"42","이병헌은... 연기력으론 한국 최고다.. 하는 캐릭터마다 사람을 몰입시키고, 이전 캐릭터는 생각도 잘 안날만큼 나오는 영화에 잘녹아든다. 그리고 박정민 연기도 대단했다.. 그리고 한지민이 안구정화 시켜줬다..  ","10"
"43","이병헌보러가서 박정민 보고나오는 영화!!이런영화 진짜 기다렸어요 ㅠㅠ잔인하고, 아프지 않은 이런영화요.꺌꺌 웃다가 나중엔 가슴을 적시는.가볍게 풀어내서 신파가 아니어서 더욱 좋았던!진짜 재밋게 보았습니다. 입소문 날듯왜 대배우들이 선택했는지  ","10"
"44","이병헌 연기는  더 설명이 필요 없네...영화 정말 좋아요...피  ","10"
"45","사실 예측 가능한 스토리라 예측 가능한 감동일 줄 알았는데 피아노연주 듣는, 예쁜 한지민 보는 즐거움도 너무 컸고,윤여정 이병헌 박정민 배우분들 전부 연기 너무 잘하셔서 재밌게 봤어요!  ","10"
"46","관람객역시 믿고보는 이병헌 연기클라스.. 박정민 연기보고 또 한번 소름.. 감동적이고 따뜻한 영화 잘 봤어요!!  ","10"
"47","관람객영화보면서 소름돋았던건 처음이네요... 별점 10개도 모자람!!  ","10"
"48","관람객웃다가 울다가 2시간이 너무짧게 느껴졌네요. 추천해주고 싶은 감동적인 영화 아주 오랜만에 봤네요~  ","10"
"49","관람객배우들 연기 미쳤네요..! 약간 뻔한 스토리인데도 재미있었습니다.  ","10"
"50","관람객재미와 감동이 있는 영화^^  ","10"
"51","관람객그냥 무난한 영화였다.다들 연기파라 연기 하나는 겁나잘함  ","8"
"52","우리나라에도 세련된 가족영화 나왔다. 이 세상의 모든 조하와 진태에게 박수를!이병헌 배우가 이 영화를 찍어줘서 고마웠다.  ","10"
"53","와인 마시면서 춤추자는 엄마의 말에 이음악에 무슨 춤이냐며 혼자 브레이크 댄스를 추는 아들의 모습이장면 다른사람들은 웃고 있었지만 난 폭풍눈물을....  ","10"
"54","박정민 피아노실화냐?  정말대단하다....모든배우들  진심연기파!  이병헌은 연기로 깔수있는배우가아니다는것을 또 한번증명!  ","10"
"55","관람객뻔하지만...보고 후회없는 영화 이병헌 윤여정 연기 너무좋았어요~~  ","10"
"56","관람객추천합니다!!! 꼭보세요! 몇 안되는 인물,배경,동선만으로도  꽉 채운 영화였습니다! 무겁지는 않지만 그렇다고 가볍지도 않는, 적당한 감동과 웃음 그리고 멋진 피아노 선율들까지 눈과 귀를 동시에 만족시킨 영화입니다!  ","10"
"57","관람객이병헌식 코미디도 좋고 타 배우들의 연기도 좋고 가족드라마 좋아하는 저는 만족합니다  ","7"
"58","관람객초반은 정말 웃으면서 보다가 후반부엔 엄청울면서 봤어요 재미도있고 감동도있었습니다 ㅎㅎ  ","10"
"59","미쳤다 연기력.. 마지막 횡단보도 손잡는 씬..아.. 미쳤다 이병헌 연기력  ","10"
"60","관람객피아노 로 만든감동 좋네요  ","6"
"61","이병헌은 이제 연기력으로는 논할필요가 없는 배우다  ","10"
"62","이병헌이 나온다해서 두말없이 봤고 이병헌이 아님 묻힐 영화였고 그런데 박정민이란 배우도 훌륭해서 다시 한번 놀랐고 뻔한 스토리에도 마음이 따스했고 모두 제역활로 참 편안하게 감동있게 봤습니다모두 좋았어요~참 이병헌씨~~이렇게 힘뺀역활도 짱이신듯~~  ","10"
"63","걍 무조건 봐야함! 웃음,눈물 주의!^^  ","10"
"64","이병헌 목소리톤이 무척좋아요 윤여정이랑 담생에는 둘만살자고 약속할때 폭풍오열했어요 웃긴장면들도 많았고 감동적이예요 흔한내용이지만 그것만이내세상만의 매력이있는것같아요 터프한남자의 빙구미섞인 모습이 어찌나 사랑스럽던지.이병헌아저씨팬 됐습니다 사랑해요이병헌  ","10"
"65","관람객오랜만에 정말로 좋은 영화 보았습니다.감동적이었어요~~^^  ","10"
"66","관람객주,조연 배우들 정말 감동입니다.  ","10"
"67","이병헌님은 역시~최고의 배우!!이번에도 연기 짱!!!너무 멋집니다..저는 윤여정님 보면서 어찌나 연기를 잘하시는지..엄마생각나서 펑펑 울었네요ㅠㅠ 박정민씨도 연기짱~집에가면서 차에서 그것만이 내세상 노래들으며 다시한번 감동을 느낌니다 최고!!!  ","10"
"68","아. .이병헌 그는 너무 연기를 잘하는 것이었습니다 시바 정말 신과함께와는 비교도 안되는 눈물 폭탄맞고옴  ","10"
"69","요번에 본 영화중 최고엿음이병헌은 욕해도 이병헌 나오는 영화는 안볼수가 없다ㅜ 영화보면 역시 이병헌이란 말이 나온다  ","10"
"70","솔직히  한지민 이 피아노 직접 쳤다고 하고 연기도 좋고 아름답다고 해서 기대하는 마음으로  친구들과 아침부터 보러 갔다. 보고 나서 2시간이 완전 빨리 지나갔고 친구들도 재밌게 봤다고 아직도 영화 얘기 하고 있음ㅎㅎ 강추  ","10"
"71","억지 신파가 아닌 자연스럽..정말 또보고싶은 영화입니다.  ","10"
"72","이해하기 힘들거나 공감을 불러일으키지 못하는 감동포인트가 있는 영화도 많은데, 이 영화는 모든 요소가 공감,감동 포인트였다. 이병헌의 유년의 아픈기억부터 인생굴곡, 윤여정의 엄마로서의 책임감과 미안함, 한지민의 아픔까지 모두 다 와닿았다  ","10"
"73","역시 이병헌. 연기는 정말 예술. 박정민 연기도 좋았습니다. 해맑아 보이면서 연주할때 무아지경에 빠져  있는 모습이 보는 사람도행복해졌어요. 가슴 따뜻한 영화입니다.  ","10"
"74","어흠.. 역시 병헌 리의 연기는 알아줘야함  ","9"
"75","정말 이병헌(조하)가 아버지같지도 않은 아버지한테 분노를 보일때 진짜 눈물이 그냥 나왔네요..  정말이지 이병헌 연기는..  ","10"
"76","이병헌 참 연기잘하네... 다시한번 느꼈다. 박정민도 진짜 서번트증후군 환자같았다. 퍼펙트한 연기를 바탕으로 관객을 웃기는 코믹한 대사, 감동을 주는 씬이 적절하게 배합된 영화.  ","9"
"77","관람객이병헌도 재밋고 감동적이였음  ","10"
"78","윤여정의 세상은 피아니스트 아들뿐이었고, 박정민의 세상은 피아노뿐이었지. 그 사이에서 세상을 겉돌던 이병헌의 세상에 가족이 들어온 순간 눈물이 터졌다. 가족에게 상처받았는데 또 그들의 손을 잡는구나. 사람에게 받은 상처는 사람으로 치유하는게 맞는가봐.  ","10"
"79","오늘 개봉해서 봤는데 오랜만에 영화를봐서그런지 감동스러웠고 가족생각 이 좀 났던거같아요 .. 상영하면서 정말정말 많이 웃고 많이 울었던거같아요.. 저는 전혀 돈 아깝지않게 잘본거같아요 .. 감동스럽고 애 깊은 영화인거같고 정말정말 추천하는 영화입니다  ","10"
"80","관람객기대 안하고 봤는데 처음부터 끝까지 정말 재밌게 봤어요 ㅠㅠ과하지 않은 잔잔한 감동 영화  ","10"
"81","관람객혼자서  잘 봤어요.역시 이병헌이예요.박정민도 연기 잘했어요  ","10"
"82","이병헌 역시 연기의 신임을 또한번 느끼게 해주는 영화  ","10"
"83","관람객괜찮네요 처음에 웃음으로 다가오다가 마지막에 감동이있는 영화네요 집중해서본영화에 이영화도 포함되겠네요^^ 잘봤습니다~~^^  ","10"
"84","이병헌 박정민 두 배우의 호흡에 경의를 표한다. 더불어 이병헌의 생리얼 코믹연기에 해방감마저 느꼈다.ㅎㅎ박정민의 진태는 보는이를 행복하게 한다. 음악까지도 귓가에 맴도는 여운이 진한 영화다.  ","10"
"85","박정민의 연기에 박수를  ","7"
"86","관람객좋은 배우들의 좋은 연기를 보는 것만으로도 시간가는줄 몰랐네요.  웃다가 울다가 결국은 따뜻해지는 영화의 감성도 좋고 누구나 재밌게 볼 수 있을만한 영화입니다.  ","10"
"87","관람객배우들의 연기는 말할것도 없고 영화도 대박  웃다가 울다가..감동적입니다!  ","10"
"88","이병헌 연기는 정말 할말이 없을 정도. 웃겼다 울렸다 들었다 놨다 참 호감가는 형.. 박정민은 처음 보는데 자폐연기 피아노 연주 실감나게 잘하고. 주변사람한테  추천하고픈 영화다.  ","10"
"89","관람객느무좋습니다배우들이란생각이들지않았습니다그분들과함께웃고울고2시간정말감동이었습니다그것만이내세상~~~홧팅♡  ","10"
"90","관람객너무 좋아요 사랑해요 이병현  ","10"
"91","이병헌씨와 윤여정선생님의 연기는 말할것도 없고 박정민의 연기에 정말 감탄하였습니다 피아노소리도 정말 환상적이네요  ","10"
"92","이병헌 모든게 가능한배우  깊이있는 연기 유머러스연기 저음 목소리까지  다 되는 배우 조아조아 조하  ","10"
"93","믿고 보는 이병헌 그리고 모든 배우들이 연기력 구멍없이 다 너무 좋았다  ","9"
"94","관람객이병헌 나오는건 무조건 봐야된다..  ","10"
"95","관람객재미, 감동 둘다백점!!  ","10"
"96","관람객진짜 예고편 보자마자 너무 보고싶어서 조조로 보고옴ㅠㅠㅠ 진짜 최고이뮤ㅠㅠ 대박 웃기고 짱이다 진짜 박정민 연기 최고임 흥해랏!!!  ","10"
"97","조하 진태 엄마의 연기는 정말 진짜 같았다.. 그래서 더욱더 가슴 아프고 눈물이 멈추질 않는다.. 웃음을 주는 장면도 많지만 너무나도 감동적인 영화. 많은분들이 이영화를 봤으면 바랍니다♡  ","10"
"98","이병헌씨의 연기를 믿고 보게 되었고 박정민씨를 다시 보게 되는 영화였습니다. 박정민, 한지민씨 대역없는 피아노 연주 너무 좋았어요. 초반에 웃겨서 스트레스 풀리도록 웃었고 중반에는 피아노 연주때문에 황홀했으며 마지막엔 뭉클함에 울다 나왔어요.  ","9"
"99","관람객진심ㅠㅠ 웃다가 울다가 ㅠㅠㅠ 10차 찍을듯  ","10"
"100","감동 재미 눈물~!좋았어요~^^  ","10"
"101","이병헌은 연기 뿐만 아니라 춤도 되는구나. 아디다스 삼선에 머리도 동네 백수처럼하고 나와도 연기를 너무 잘하니까 잘생겨 보인다. 이병헌 정말 대단한 연기자다.  ","10"
"102","관람객3번 울었습니다 눈물이 목을타고 내려오더군요  ","10"
"103","이병헌 연기는 언제봐도 감동을 준다!!!!  ","10"
"104","관람객너무 감동적이고  잼있습니다  ","8"
"105","관람객겨울 날씨 흐리지만서도 가슴 한켠 따뜻하게 해주는 영화 손수건 꼭 챙겨가세요ㅠㅠ  ","10"
"106","웃기고 슬프고 다 하는 영화. 배우들 연기도 다 대단하고 너무 좋습니다  ","10"
"107","이병헌배우의 영화가 개봉하면 영화관나들이를 합니다. 되도록 큰 스크린으로 보려구요. 그것만이 개봉날 보고 왔는데 한번더  조조로 혼자 보려구요.살면서 이런 작은 소소한 엔돌핀을 주는배우 이병헌배우의 그것만이 내세상 화이팅~  ","10"
"108","이병헌씨 정말 연기자라는 직업을 가져주셔서 감사하고, 이런 영화를 그렇게 연기해서 저에게 즐거움을 가져다 주셔서 감사합니다.  ","10"
"109","정말 명작임. 이런 영화가 대박 나야지...  ","10"
"110","관람객이병헌은 그의 공간에서 신이다.  ","10"
"111","너무 감동적이라 보는내내 가슴뭉클 눈물이 줄줄했네요. 이제 폭력영화말고 이런 가슴 따뜻해지는 영화 많이만들어주세요.이병헌은 연기천재네요. 김동욱과 이병헌은 국보급 배우네요.진지함이 가슴으로 전해집니다  ","10"
"112","아~~이병헌! 이런 연기 많이 해주었으면  좋겠다  ","10"
"113","관람객이병헌연기장난없습니다  ","10"
"114","관람객이병헌.박정민 연기가 너무 좋았음.최고.  ","10"
"115","이병헌은 진짜 배우다. 맡은 역을 흡수한다박정민이란 배우도 알게되어 좋다뻔한 스토리지만 연기력에 빨려들어가는 영화  ","8"
"116","이병헌하면 딱 떠오르는게 없는 연기자 그만큼 모든 배역을 완전히 소화하는 배우!  ","10"
"117","관람객이병헌 연기를 너무 잘하시것같아요 되게 재밌고 감동적인영화이고 재밌게 봤어요  ","10"
"118","오랬만에 이병헌의 생활연기는 오지도 박정민의 장애인역은 지렸다  ","10"
"119","연기력만큼은 진짜 절정이다. 이병헌연기는 최고다.운여정씨, 박정민또한 와우!!!  ","10"
"120","관람객조하의 세상은 오기 없인 버티기 힘든 고독한 사각링이고 진태의 세상은 아름다운 피아노의 선율이 흐르는 무대라면 인숙의 저세상은 더 이상 고단하지 않은 천국쯤일까 각자의 세상을 전부라 믿으며 후회 없이 살아가야 하는 우리들에게 보내는 연민의 노래  ","10"
"121","내용도 뻔했고 마지막 눈물짜내기도 뻔했고 영화관 들어가기 전에 영화내용 다말할수 있을 것 같을 정도로 모든게 뻔해서 기대 안했지만보고나서 영화 참 잘봤다 라는 생각을 하게만드는 이병헌의 마법.  그리고 제발 떴으면 좋겠는 박정민이라는 배우  ","10"
"122","아 이병헌 최고네요! 명불허전  ","10"
"123","역시 믿고보는 이병헌 너무 재밌고 감동적임..배우들도 연기 다잘하심 너무 잘하셔 ...  ","10"
"124","관람객웃음과 동시에 눈물을 지어내는 영화네요. 정말 박수를 쳐드리고싶습니다.  ","10"
"125","관람객박정민 발견. 이병헌 인정. 한지민 여신  ","9"
"126","정말 너무좋았습니다 재미 감동 둘다잡고 피아노씬들은 전율이 장난아니였습니다 진심으로  ","10"
"127","이병헌의 연기는 드넓은 바다같았고..박정민의 연기는 에메랄드빛이 났다.둘의 시너지효과가 관객을사로잡는다.  ","10"
"128","배우들, 특히 이병헌은 진짜 작중 인물이 된 듯 하다. 박정민의 연기도 더할나위 없고. 줄거리가 우연적으로 일어나는게 많지만 오히려 영화다운 그런 점이 좋았다. 똑같은 내용을 디즈니에서 애니메이션으로 만들면 명작이라고 할거면서 트집은 ㅋㅋ  ","10"
"129","흔한 스토리 흔한 결말을 이병헌 연기가 압도함  ","8"
"130","최고네요 이병헌씨도 박정민씨도  ","10"
"131","관람객20OOO 첫영화 대박입니다 ㅎ  ","10"
"132","영화보는 동안은 박정민이 더 많이 보이고 집오면 이병헌이 더 기억에 남는다 했는데 진짜 그러네요.뻔한 스토린데 연기들이 뻔하지 않아서 너무 좋아요.  ","10"
"133","믿고보는 배우 이병헌~영화도 너무 좋았어요한번 더 볼래요  ","10"
"134","이영화는 박정민이 스타라는걸  증명하는영화이자이병헌이 왜 월드스타인지 아는영화이다마지막연주회에서 박수쳤습니다 꼭보시길  ","10"
"135","이병헌 역시 최고. 울고 웃고 너무 좋은 영화입니다  ","10"
"136","역시 갓병헌 쵝오다 무조건 봐야 될 영화  ","10"
"137","관람객처음에 별 기대 안하고 봤는데 재미있었어요!  ","10"
"138","관람객역시 이병헌 연기는 굿굿굿!!!  ","9"
"139","관람객믿고보는 이병헌 정말 보는동안 정말 연기 잘한다 생각하면서 보게됨 정말 재밋게 잘봤어요  ","10"
"140","관람객너무너무 슬프고 재밌었습니다  ","10"
"141","관람객너무 재밌고 배우들이 연기를 정말 잘한다  ","9"
"142","진짜 최고인 영화다^^20OOO 1월달부터 마음이 따뜻해지는 영화~이병헌,한지민 등 연기파 배우들~다음에도 이런 영화가 또 나왔으면~^^안보신 분들은 꼭 보세요~!!강추!!!별 10개 만점  ","10"
"143","뻔한 스토리지만 이병헌 연기에 감탄하고 간다  ","8"
"144","영화 별점도 처음 줘보는 영화인데 그만큼 진짜 완벽했던 영화ㅠㅠㅠ 이번 년도 첫 소원은 이 영화 모든 사람이 봤으면 좋겠다는 거 영화 보면서 눈치 보일 정도로 소리 지르며 웃었네용  ","10"
"145","관람객이병헌 박정민 연기 짱 마지막엔 눈물이 ㅠㅠ  ","7"
"146","춤출때 진짜 꺼억꺼억 넘어갔다 진짜  ","10"
"147","신과함께보다훨잼있네요~~  ","10"
"148","이런 영화가 진정 천만영화가 되야됨  ","10"
"149","냉정히보면 신파 맞긴함 근데.. 이병헌 왤캐 내모습 보는거 같니 폭풍감정이입.. 와인한잔 하면서 춤추는장면 남들은 웃겨 죽는데 나는 나혼자 폭풍눈물 ㅠ 막판엔 빤히예상돼서 오히려 덤덤 돌아가시고 너무 싱겁게끝 근데 박정민피아노실력실화? 피아노미침 레알  ","7"
"150","관람객코믹과 감동이 잘 섞여있어 좋았습니다. 강추합니다  ","10"
"151","관람객감동 재미 굳굳 연기는 역시 굳  ","10"
"152","관람객태어나서 영화 평점을 처음 남깁니다. 호주에 워홀을 가는 가족 같은 형과 함께 봤어요. 형은 계속 웃다가 우시고 저는 조용히 소리 없이 울었네요... 모든 것이 참 현실적이라는 느낌을 받아서 더 아름다웠어요.  ","10"
"153","관람객이병헌 너무너무 재밌었어용 역시 믿고보는 이병헌!!  ","10"
"154","정말 좋은 영화였어요 이병헌님의 연기와 박정민님의 연기는 대단하네요  ","10"
"155","정말 재밌게 봤습니다 ㅎ 보면서 어머니 생각이 나서 울컥...  ","10"
"156","이병헌연기는 최고였다....천상배우  ","10"
"157","이병헌 연기 최고입니다^^  ","10"
"158","관람객괜찬앗어요 굿굿 겨울에 눈물샘 자극  ","8"
"159","관람객감동이에용 ㅠㅠ 존잼 존잼  ","8"
"160","관람객실컷 웃다가 또 엄청 울었네요ㅠㅠㅠ 정말 재밌고 감동적인 영화입니다 연기도 정말 좋았어요! 완전 추천!  ","10"
"161","관람객-재밌네요.배우들 연기두 잘하구  ","9"
"162","관람객이병헌의 브레이크댄스가 압권  ","6"
"163","이병헌의 코믹적인 연기와 박정민의 피아노 연주의 감동이 어우러진 명작입니다. 후반부에는 감동을 넘어 눈물을 자극하네요.  ","10"
"164","이병헌의 연기는 진짜 예술연기?짱입니다감동과 웃음윤여정?한지민 연기도 진짜 멋지고멋진 피아노 연주 한 박 정민 멋져요  ","10"
"165","관람객병현이형...   연기는 진짜...피아노 잘치네요  ","7"
"166","역시 이병헌은 이병헌이다  ","10"
"167","관람객초반에 막웃다가 후반들어가서는 엄청울었네요..연기를 다들 잘하셔서 오랜만에 재미있게 관람했어요^^  ","10"
"168","다들연기를너무잘해네요  ","10"
"169","정말 이병헌은 연기로 깔게없다 ,,  ","10"
"170","실컷  웃고   울었다 역시 갓병헌  ","10"
"171","관람객평론가님들의 이야기도 공감이 가지만 조금이나마 우리 나라의 가정과 사회 문제를 다뤘다는점에 평점을 8점 주었네요~이병헌 같은 성장과정을 겪는 아이들이 없는 세상이 되길 바라며~  ","8"
