"","reviews","points"
"779","관람객잘 봤어요. 이병헌 또다시 감탄합니다.  ","10"
"780","이런 영화가 많이 나오길 바래요 이병헌최고예요  ","10"
"781","관람객이병헌의 연기는 정말 깔수가 없군요 감동도 있고 웃음도주는 개인적으로 추천 합니다  ","10"
"782","관람객이병헌 박정민 둘다 미쳤다!!!! 피아노 연습 얼마나 했을까...  ","10"
"783","관람객마지막에 이병헌이 진태 손을 잡아주는 데 울컥했다. 진태를 향한 깊은 사랑이 느껴졌다.  ","10"
"784","관람객역시 연기는 이병헌이최고 박정민 연기너무 좋네요~~  ","10"
"785","전  너무재밌게봤어여 이병헌연기야  말할거없고  피아노연주도 진짜로친거맞어 하면서 손가락에  몰입하게되더라구요   정말  재밌었어요 근래본영화중 최고!!  ","10"
"786","관람객진짜 ㅜㅠ울다웃다가 정말 꼭봐야될영화 한지민역시너무이쁘고 ㅜㅜ영화너무 리얼해 짱이에여 감사합니다  ","10"
"787","관람객가족영화추천! 여윽시 이병헌  ","10"
"788","배우분들이 다 연기를 너무 잘하네요^^지루할틈없이 재밌고 짠하기도하고..  ","10"
"789","관람객재밌는 장면도 중간중간 있어서 좋았고 네 번은 운것같다  ","10"
"790","18日원햐모자이크선우父연극표20日서촌우선총각비어킹질림21日빵구네딥쉬스♡호빵맨고베22日원햐동땀보고월곡해23日어제월곡하라며재도동땀좋다고또틸진옥화24日틸피트인세븐40퍼주인집딸과게임하고윤여정과춤추는이병헌너무좋았고각자아픔을가진한지민과박정민의피아노연주에소름돋았다  ","10"
"791","정말 오랜만에 감동과 웃음을 주는 영화를 봤네요.시간이 어찌나 금방지나가는지...역시 이병헌이더군요~~연기력 만큼은 최고인 듯!  ","10"
"792","관람객볼만해용 ㅎㅎ재미있습니다  ","8"
"793","관람객재밋어요! 네 넨 네 네 네  ","8"
"794","스토리는 살짝 뻔했지만 감동도있고 재미도 있어여  ","10"
"795","다 연기 너무 잘하시고 감동적이였습니다.피아노 너무 잘치십니다  ","10"
"796","관람객생각보다 재밋고 웃겼어용  ","9"
"797","관람객즐겁게 봤어요~ 여기자들  모두 연기를 잘해서.. 하아.. 진짜 뭐라 할말이 없습니다. 굿입니다!!  ","10"
"798","관람객연기가 다 했어요ㅠ최고  ","10"
"799","관람객오랫만에 찐한영화를 봤네요.다들연기잘하고 좋은 영화니 꼭 보세요.  ","10"
"800","호수가에 돌 하나 던진뒤에 오는 잔잔한 감동과울림  ","10"
"801","연기력 인정!!!!  이병헌 박정민 윤여정~ 누구하나 나무랄거 없는 연기에 웃고 울고~ 좋은 영화임은 확실... 난 좀 아쉬웠던거는 굳이 윤여정을 경상도  사투릴 쓰게 했어야만 했나는거... 경상도 사투리가 있어서 엄마의 애절함이 더 안묻어나는 듯  ","9"
"802","웃음과감동 두마리의토끼를 다잡았네요.  ","10"
"803","너무 감동깊게 봤어요.  ","10"
"804","관람객정말 재미있게 봤어요 ㅠㅠㅠ 재미와 감동이 함께 있는 영화 출연하는 배우분들이 다 연기를 너무 잘하셔서 흠뻑 빠져 봤네요  ","10"
"805","감동으로 촉촉해 지고 흐뭇하게 미소 짓게 만든다  ","10"
"806","말해뭐해그냥 보세요 ㅋ  ","10"
"807","남한산성에 이어서 이병헌 연기 진짜 고맙다.대단하다는 말밖에...  ","10"
"808","관람객코믹이라기보다는 가족이란 단어가  가슴에 와닿네요.  ","10"
"809","보면서 수상한 그녀를 닮은 작품이라 생각했는데, 그보다 훨씬 더 뛰어난 작품이다  ","10"
"810","관람객이병헌 연기가 후달달 ㅋㅋ잘봤습니다.  ","10"
"811","울다가 웃다가 울다가 웃다가..ㅎㅎ눈에서 땀이 주륵나와요..이건 미친 영화입니다  ","10"
"812","관람객이병헌은 역시.. 믿고보는!!ㅎㅎㅎ 너무재밌게봤어요. 감동과 웃음 소름 ..다 담긴 영화!  ","10"
"813","울다가 나왔어요.감동적이고 배꼽빠지게 웃기도하고…최고네요.  ","10"
"814","좌파영화보다가 이런영화보니까 감동 재미 한번 더 보고싶다  ","10"
"815","진짜 인생영화입니다. 꼭 보세요.  ","10"
"816","자칭 영화평론가들이 식상하다고 하는 영화들은 재밌다  ","10"
"817","요즘같이 각박한 세상에 편안하게 웃으면서 볼 수 있는 영화였어요. 이런 영화도 요즘엔 잘 없잖아요.. 쉬어가는 타임이라 생각하면서 봤는데 만족스러웠습니다 &gt; &lt;  ","9"
"818","박평식은 뭐하는놈인가  ","10"
"819","관람객소름 꿀잼 입니다 조금 뻔한 내용인데 배우들에 연기가 진짜 최고네요  ","10"
"820","관람객완전 꿀잼 웃으면서 본 영화  ","10"
"821","기대안하고 봤는데 완전 감동 이네요 12살 19살아이도 참 재미있어했고 오케스트라 연주 때문이라도 극장서 꼭 보세요  ","10"
"822","배우들 연기 모두 좋았고 웃음 포인트도 많고 너무 따뜻한 영화예요!!! 마지막 무대에서 진태 피아노 연주할때 폭풍눈물ㅠㅠ 원래 눈물이 많긴하지만 너무 감동적이었습니다. 정말 꼭 보세요!!!  ","10"
"823","관람객지기네지기주네직이뿌네  ","10"
"824","멋진캐스팅 , 그리고 배우들의 빛나는 연기 ..배우들과 스탭들의 기가막힌 호흡이 만들어낸 아름다운 작품입니다  ","10"
"825","관람객재미와감동이잇는영화엿어요 연기자들연기력짱이네요  ","10"
"826","관람객웃음과 감동 재밌게 잘봤습니다  ","10"
"827","관람객재밌당 감동도있구 ㅋㅋ  ","8"
"828","관람객진짜 최고!  엄지척 펑펑 울고웃고 잘봤습니다  ","10"
"829","진짜완전 재미있었음 !! 웃다가 죽을뻔했고 슬퍼서 마음 따뜻했고  ^^  시간가는줄모르고 본 영화 피아노 소리 너무좋아 나도모르게 같이 박수쳤다는 ㅋㅋㅋㅋ 진심 꿀잼  ","10"
"830","말이필요없다~~가즈아 극장으로  ","10"
"831","진심 평론가들의 뇌구조가 궁금해지네요.그들이 진짜로 잘나서 일반관객들의 감성따위는 찌질해보이는건지, 아니면 어떻게든 흠잡아서 잘나보이고 싶은것인지..저는 아주 감동적으로 봤습니다.잘난 평론가님들  ","10"
"832","이병헌이 달콤한인생을 찍기전 많이 보았던 애절하고 슬픈 눈빛연기를 볼수있어 더좋았다. 눈빛과 목소리 만으로도 천상배우인 사람.이제는 사생활도 모범적인 가장..그리고 더큰 배우로 거듭나길 팬으로써 바래봅니다(실망이 컸지만 배우로서의 그를 응원했던 1인)  ","9"
"833","이병헌..그는 정말 연기 TOP  ","10"
"834","내 이야기 같애서 3~4번은 넘게 감정 주체하지 못하고 울었다 그동안 우는것에 관대하지 못한 나였는데 그시간 그공간안에서 만큼 후련하게 울고나니 뭔가 맘이 가벼워 졌다.  ","10"
"835","관람객스토리는 새로울게 없지만 배우들 연기력만 봐도 충분히 배부른 영화..  ","10"
"836","역시 갓병헌.. 박정민도 진짜..대박이고..웃기고 슬프고..엄마생각나고..요즘 엄마생각나는 영화가 많네요..효도합시다  ","10"
"837","관람객이병헌 연기가 좋았다!!  ","10"
"838","관람객진짜 이병헌씨 연기가 연기인지 현실인지 헷갈렸어요. 박정민씨 연기도 너무나 감동적이었습니다. 재미도 있었고 은은한 슬픔도 좋았습니다!^^  ","10"
"839","관람객대박영화 ㅎㅎㅎ 인생영화  무조건보세요  ","10"
"840","관람객가슴을 울리는 스토리와 이병헌, 한지민의 눈부신 연기력 뻔할것같지만 예상치못한 이야기전개 이 세개합쳐져 삼위일체가 되었습니다  ","10"
"841","관람객이병헌, 박정민 연기 정말 좋았어요:) 윤여정의 가슴 아픈 엄마 마음도 눈물나게 만드네요. 조연분들의 연기도 아주 최고였습니다! 아깝지 않은 시간이었어요.  ","10"
"842","관람객재밋네요 ㅎㅎ 역시 이병헌..  ","10"
"843","관람객최고에요 재미와 감동이 다 들어가있어요  ","10"
"844","관람객쌓였던 우울함이 영화를 보면서 사라졌다  ","10"
"845","관람객저도 아픈아이가 있어서...더 마음에 와닿는 영화였습니다... 너무 감동적이였고...주인공의 연기는 최고였습니다...손수건을 꼭 준비 하시길..  ","10"
"846","진짜 감동적이고 웃기고. 이병헌 박정민 연기 짱이구ㅠㅜ한지민 엄청이뻐요ㅜ엄마랑본건데 대만족!  ","10"
"847","관람객진짜 웃음, 감동, 눈물 3박자를 다 갖춘 영화네요. 모든 연기자분들 연기가 너무 좋았어요^^영화 끝나고 진정이 안된 상태에서 눈물이 나고있었는데극장 불이 켜져서 좀..  민망했어요^^  ","10"
"848","관람객기대이상으로 너무  감동적이고 뭉클했다!!!  카리스마 이병헌은  다재다능한  연기자!!!  피아노를 치는  박정민  정말 훌륭한  피아니스트인가 하는  ..  ","10"
"849","이병헌 연기에 감탄베리굿  ","10"
"850","다시봐도 또 울거같은 영화  ","10"
"851","관람객배우들의 연기력 좋았어요.  ","10"
"852","너무 감동입니다 십점안아까워요  ","10"
"853","피아노소리듣고감동 이병헌행동재밋음 이런감동적인영화 많이많이나왔으면..  ","10"
"854","대박입니다 최고의 영화입니다.  ","10"
"855","최근에 본 영화중 웃음과 감동을 준 작품이네요  ","10"
"856","가슴깊이 쭉 울려퍼지는 감동의 물결깊은여운이 남는 작품  ","10"
"857","슬픔도 기쁨도 결국엔 함께나누는게 삶의모습이다  ","10"
"858","울고싶을 때 보면 충분히 울 수 있는 영화. 평소에 우울해서 울고 싶다는 이유로 봤는데 그 이상으로 울었던 영화. 정말 나올때 마음이 따뜻해져서 나올 수 있는 영화. 너무 뻔한 스토리라고 별로라고 하지만, 그이상의 가치가 있는 영화입니다.  ","10"
"859","관람객너무너무 재밌게봤어요~~~~  ","10"
"860","관람객진짜말이필요없었네요.박정민이라는배우가 더크게성장하길바랍니다.믿고보는 이병헌에 한지민까지.한지민엄마로나온 아주머니도 진짜멋있었고 최고!조연들도 빛났던영화네요.  ","10"
"861","관람객진짜 시간가는줄모르고 봤어요 한지민은이뻤구요  ","10"
"862","넘넘 감동적이었음,인간미와 섬세한 감정선상에서 , 또 현실적인 면에서 자연스레 눈물이 눈물이..참 많이 울고 나왔네요..  ","10"
"863","관람객대애애에에에애애박ㅋ  ","10"
"864","관람객좋은 영화네요 추천드리고싶습니다  ","10"
"865","진짜... 연기력에 감탄하고 갑니다  ","10"
"866","관람객연기 재미 감동 다잡네요피아노대박 !!  ","10"
"867","감동을 받았는데 뻔한 이야기라고 느낌을 덜 수는 없다. 웃음과 감동이 있는 아름다운 영화.가족모두와 함께 즐기길 권하고 싶다.  ","10"
"868","감동..매번 폭력적인 영화보다가 너무 웃기고 감동적이다.가족의 소중함을 다시 일깨워주는 영화  ","10"
"869","관람객코믹 영환줄 알고 아무 생각없이 봤다가 오열하고 나왔네.. 어휴..  ","10"
"870","관람객애잔한 감동이 전해지는 영화.예상치못한 눈물이 고이는 영화.가족애를 느끼게해준 영화.간만에 가슴따뜻해졌다.  ","10"
"871","박정민의  미친  연기력이 빛났다  이병현  눈빛연기 장난아니다  ","10"
"872","관람객역시 이병헌은 연기로 인정받는 배우인듯박정민또한 연기넘잘함웃음과 감동을 주는 영화  ","10"
"873","눈빛 하나하나 살아있고 연기도 좋고 정말 좋고 슬프고 웃고 즐기다 갑니다  ","10"
"874","관람객너무 재밋고 배우들 연기가 너무좋았습니다  ","10"
"875","관람객믿고보는 이병헌 ....  ","9"
"876","잔말말고 그냥봐~이형만 믿어!!  ","10"
"877","관람객배우분들이 연기를 너무 잘하셔서 몰입이 잘됐네요극 중 인물처럼 현실에서도 장애인들에게 진심으로 공감해주고, 진짜 친구가 되어주는 사람들이 얼마나 있을까요이 영화를 통해 현실에서도 작은 변화가 있기를 바라며 응원합니다!  ","10"
"878","관람객박정민 연기는 정말 좋았다...이병헌 연기도 한지민 연기도 윤여정의 연기도...모두 다들 잘하셨다ㅎㅎ  ","10"
"879","관람객마음따뜻해지는 아름다운 영화였어요  ","10"
"880","관람객엄마랑 같이봤어요..너무슬프고 감동적이고..배수들 연기는 정말 대단하고 스토리는 짱입니다  ","10"
"881","갓병헌 춤출때 웃다 숨넘어갔다.  ","9"
"882","관람객이병헌,박정민 연기대박  ","10"
"883","관람객재미와 감동 둘다있는 영화다.이병헌 연기 정말좋았고 그동생역도 진짜 같았다.엄마도 역시 엄청났다 ㅎㅎㅎ  ","9"
"884","연기파 배우의 뻔한 스토리를 살아 숨쉬게 하는 능력!!! 역시 이병헌, 윤여정~~  ","10"
"885","관람객재밌고 감동적임 역시 이병헌의연기란..  ","8"
"886","이병헌 정말 싫었는데 연기로 호감을 느끼게하는 배우 너무 대단합니다...연기는 말할게없어요...하나하나섬세한 연기라 빠져들어봤습니다  ","10"
"887","윤여정 배우님을 보는데 우리 엄마 생각이 너무나서 진짜 너무 울었다, 그냥...하염없이 눈물이 흘렀다, 이병헌 배우님이 병원에서 울때... 그냥 최고다. 꼭 보세요  ","10"
"888","새해에 처음으로 본 영화로서 정말 후회없다.일상에 가까이 있는 웃음과 감동이 정말 고스란히 담겨있는 작품이라서 더 가슴에 와닿는것 같다.모든 배우님의 연기들도 다 몰입이 잘되었으며 특히 박정민의 배우가 인상깊다.이유는 영화를 보면 알게 된다.  ","10"
"889","출연진들 연기 최고였어요 !!!!  ","10"
"890","관람객최고에요 ㅠ.ㅠ 초반엔 너무 웃기고 뒤엔 너무 감동... 피아노연주로 귀까지 행복했어요  ","10"
"891","관람객그냥...짱이다 시간이 어떻게 가는지 모를정도로...말이 필요없는 영화  ","10"
"892","피아노연주지림 이병헌멋잇음  ","10"
"893","병헌 오빠 짜응 홧팅 ㅋㅋ  ","10"
"894","이병헌..와..진짜  포스...오늘 또 놀라고 왔어요..  ","10"
"895","관람객병헌이형 연기잘합니다  ","10"
"896","좋은시나리오 볼줄아는 이병헌, 박정민같은 보석배우 알아보는 감독의 눈, 좋은영화 알아보는  관객의 힘.  근데 이영화가  왜 코미디로 분류했을까는  의문.  ","10"
"897","관람객이병헌 좋아연 잘생겻셔연 좋아여조하연  ","10"
"898","관람객굿..역시 연기 잘하는 주연.조연배우들♡~~  ","10"
"899","이병헌 연기는 최고 ....슬프다 못해 가슴이 절절하게 눈물나는 영화 여운이 길게 남네요 ....웃음 감동 다주는 영화추천합니다 ! 100점만점에 100점  ","10"
"900","관람객이병헌의 과하지않은 담백한 연기!추천!  ","10"
"901","관람객연기의신이네요 이병헌..박정민 윤여정 한지민 배우분들 모두 연기가 대박입니다  ","10"
"902","역시 이병헌...ㅠㅠ  ","10"
"903","관람객영화관에서보세요 피아노소리가 너무좋음  ","10"
"904","관람객감동적이네요 부모님 생각많이나네요  ","10"
"905","관람객네~ 꿀잼입니닼ㅋㅋ 병헌이형 최고!  ","10"
"906","죽이고 부수는 조폭영화는 이제 식상하다..이런 잔잔한 생활스토리가 얼마나좋냐고..  ","10"
"907","오랜만에 재밌는 영화내요 잘봣어요  ","10"
"908","완전 뻔한 시나리오를 배우들이 연기잘하고 음악이 좋고 한지민이 이뻐서 시간가는줄 모르고 보게만든다  ","9"
"909","관람객윤여정샘의 연기와,이병헌의 연기!감동이였어요. 엄마를 미워했지만,엄마의 아픔을 아는 그아들의 모습 속에 엄마처럼 의붓동생을 챙기는~~~그스토리와 음악~~~피아노  속에 울림~~~여운이 남아요.  ","9"
"910","베리굿감동 완벽한. 피아노 실력 대단합니다박정민 배우. 정말 멋져요 울컥한 마음 가라앉지 않네요너무 고마워요.  ","10"
"911","내용은 뻔하지만 이병헌, 박정민의 연기가 너무 좋았습니다.  ","9"
"912","최고의 연기를 선보여주신 배우님들 너무 존경스럽습니다 좋은 스토리와 최고의 연기력 덕분에 영화보는 내내 펑펑 웃고 펑펑 울다나왔습니다....최고의 영화에요 다시 한번 더 볼생각잇어요 ㅜ  ","10"
"913","솔직히 처음에는 별 생각없이 극장들어가서 봤는데 진짜 내용, 연기 뭐 하나 뺄 것 없이 다 좋았다. 중간 쯤 부터 진짜 오열했는데, 감동이 엄청나다. 최근에 본 영화 중에 베스트다. 진짜  ","10"
"914","모든 배우들의 연기력이 대단했어요..!사실같아서 몰입감도 엄청났고 이병헌은 역시..박정민 연기 너무 잘해요ㅠㅠ  ","10"
"915","최근 본 영화중 단연 최고다  ","10"
"916","관람객마지막 너무 감동입니다ㅜㅜ  ","10"
"917","관람객끝나고도 여운이남는 뭉클한영화  잘만들었다는 느낌  ","8"
"918","관람객실컷 웃을려고 간 영화를 실컷 울면서 봤네ㅠ 이병헌 박정민 캐미와 박정민 한지민 피아노 캐미 덕분에 볼만한 영화. 그리고 영화보는 내내 피아노 잘친다 라는 생각을 들게 만듦  ","9"
"919","관람객진짜 앞으로 올해 더 좋은영화 나오겠지만그걸 떠나서 박정민 이 배우는 진짜 청룡영화제 상 한자리 예약해놓은거나 다름없다.윤여정 이병헌 한지민 박정민 그 외 조연분들모두 연기대단했고 진짜 그것만이 내세상 노래와 너무 잘어울렸습니다. 마지막에 울컥  ","10"
"920","웃고 싶어서 들어갔다가 울고 나온 영화.  ","10"
"921","새해 첫 감동과 웃음배우들의 연기력이 너무나 대단했음영화보는 내내 시간 가는줄 모르고 웃다가 울다가 반복 했네요정말 오랫만에 영화다운 영화 봣습니다! 후기 귀찮아서 안남기는데이 영화는 혼자보기 아깝네요 ^^  ","9"
"922","관람객재미도 잇고 감동도 잇네요  ","10"
"923","엄마가 너무 보고싶어지는 영화네요...배우들의 연기는 말 할 것 없이 최고였구요  ","8"
"924","관람객간만에 잼있는 영화였습니다 웃다가 울다가..  배우들이 다 연기를 너무 잘하셔서 집중도도 최고에 스토리도 매우좋았습니다ㅎㅎ  ","10"
"925","마음이 따뜻해지는 영화.간만에 좋은영화 개봉함. 2시간이 순식간에 지나가면서 귀가 호강하는 피아노연주곡에 감탄 그리고 감동. 쉴틈없이 웃기고 울리고.가족들 또는 연인과 보면 좋은 영화. 오늘보고나서 평점 남김.돈이 안 아까운 좋은 영화.꼭보세요  ","9"
"926","이병헌은.진부함도 집중하게.만드네  ","7"
"927","신과함께보고 과한 신파에 실망.. 그것만이는 큰 억지나 신파없이 편하고 좋습니다 배우들한테 박수쳐주고싶어요  ","10"
"928","적극 추천합니다.이병헌님 연기가 감동이었습니다 .피아노 선율이 그렇게  아름다운줄 미쳐 몰랐습니다.  ","10"
"929","엄마와 처음으로 영화관가서 영화봤어요33살 되어 처음인데 엄마가 너무 좋아하셨어요웃고 울고 훌쩍이며 영화관 나왔네요ㅋㅋ감사합니다 감독님 이런 좋은영화 만들어 주셔서  ","10"
"930","관람객이병헌.연기는 인정.  ","10"
"931","관람객역시 이병헌..연기 대박..댄스 실력 짱~더 많은 작품 만들어 주세요 ^ ^  ","10"
"932","관람객이병헌씨 연기는 봐도봐도 대단하네요감동적인 영화였습니다  ","10"
"933","관람객역시 이병헌.. 저 영화보다 울었어요. 연기 너무 잘하고 한지민 예쁘고 피아노 연주 너무 최고...재밌습니다 정말 너무너무 꼭 보세요!  ","10"
"934","이병헌 이름에 일단 봤다.. 울다 웃다 울드 웃다 묘한 감정을 느끼고 왔다 또보고 싶다 여운이 남는다  ","10"
"935","관람객이병헌영기는 정말 일품이다  ","10"
"936","관람객이병헌 연기에 다시 한 번 놀람ㅜ  ","10"
"937","이병헌은 연기로는 깔게없다.  ","10"
"938","관람객예상가는 스토리였지만재미와 감동 두마리토끼를 다 잡은듯하네요 이병헌님과 조여정님과 박정민님의 연기는정말 흠잡을때없었슺니다  ","9"
"939","이병헌 춤 너무 잘춰서 놀람ㅋㅋㅋㅋ빵터짐  ","9"
"940","엄마보고싶다 . 그와중에 한지민이쁘다 그와중에 배우들연기가하늘을찌른다 울다 웃다 나왔다 가슴찡하다 영화가 끝나고 5분동안 앉아있다나왔다 너무 좋은영화다 .  ","10"
"941","조심스럽지만 조하가 나인것 같았다. 너무 감정 이입했다.만화같이 유치한면도 적지 않았지만 적어도 난 조하의 역할에 너무 감정 이입했다. 너무 펑펑 흐느껴 울어서 여자친구조차 당황했다. 난 남자다 난 조하의 현재 진행형이다.  ","10"
"942","이병헌 연기에 박수를 ~!!!편안하고 따뜻한 손을 내게 내밀어준듯 펑펑 울어 속이 후련했고 그 잡아준 손에  위로받고 용기내어 영화관을 나섰다 감사합니다.  ","10"
"943","관람객역시 갓병헌님입니다ㅠㅠㅜ  ","10"
"944","최고의영화다....말이필요없음  ","10"
"945","진짜 이병헌은 영화를 찍을때마다 사람이 달라짐...  연기로는 진짜 깔게없다..ㅜㅜ 윤여정선생님도 너무 잘하지고 누구 어느하나 못하는 사람이 없다..  피아노에 별로 관심이 없는데도 이영화를 보고나니 피아노 콩쿨을 찾아다니면서 보고싶을정도..ㅜㅜ  ","9"
"946","굿   재미있고  슬퍼요연기자분들  연기  좋아요  ","10"
"947","관람객이병헌그것은불가능이란없다.  ","10"
"948","이병헌이 아니었음 만들어내지 못했을 감동.눈빛이 말을함  ","10"
"949","솔까 신과함께 보다 두배는 재밌는 영화다.  ","10"
"950","진짜이병헌에연기는 깔수가없네요..거기에박정민연기 와..새로웠습니다.옆에 내사랑은 웃다가울고..이것또한깔수가없네요.  ","10"
"951","관람객뻔한 스토리... 배우들의연기로 다른영화로 만들어버림웃음,감동♡♡  ","10"
"952","소재가 너무식상함에 불구하고 이병현형님이연기를 너무잘하셔서 영화가뜬것같습니다.이영화를 보고 느낀것은 살아계신 어머님께 평소에 잘 하셔야 나중 하늘나라 갔을때 후회안한다는것을 다시한번 느끼는 계기가 되었습니다. 영화 감동 있게 잘 봤습니다.  ","10"
"953","웃다가울다가, 가슴이울컥..  ","10"
"954","관람객재밋당엄청꿀잼이야카아아  ","10"
"955","정말... 정말 감동입니다ㅠㅠㅠ 영화관 나와서도 계속 눈물이 나오던 2번째 영화네요.. 배우들 연기 너무 탄탄하고 특히 박정민 배우 피아노 연주에 자폐 연기 너무 대단했어요!!! 정말 가슴 따듯한 영화인 것 같아요. 인생 영화 등극 ㅠㅠㅠㅠ  ","10"
"956","마 뻔한 싸구리 재료로 미원 팍팍친 음식인데 맛 발란스를 너무 잘잡은 음식 먹은 기분이다. 뻔하고 10초뒤 장면 바로 예상되지만 목에 맥히는거 없이 술술 잘넘어간다. 한마디로 참 볼만하고 효심에 대해서 한번 돌아보게 해주는 영화다  ","10"
"957","편안하게 아무 생각없이 그들의 삶에 녹아들어 함께 웃고 울었습니다. 거기에 가슴을 울리는 피아노연주까지   감동입니다  ","10"
"958","한국 영화의 한계라 보일 수 있는 부분을 연기력으로 뛰어넘은 영화  ","10"
"959","오래만에 가족과 감동과 여운 남는 영화입니다  ","10"
"960","매우 재밋네요 ^^ㅇㄹ  ","10"
"961","두시간동안 웃고있던 나를 금방 울게 만드는 건 영화의 힘인거같다 꼭 봐야하는 영화!!  ","10"
"962","마음껏 웃다가, 울다가 나왔습니다.  ","10"
"963","관람객참좋은영화인것같아요  ","8"
"964","이래서 사람들이 이병헌 이병헌 한다  ","10"
"965","관람객너무나 익숙한 줄거리지만 명품배우들 연기는 감동이었다잔잔하니 재미난 드라마같은~~  ","9"
"966","관람객코믹성도있고 감동적인것이 좋아요  ","10"
"967","관람객쵝오 .. 재미 감동 소름 ... 응 쵝오예요  ","10"
"968","관람객재밌고 짠하고 역시 이병헌이다  ","10"
"969","관람객너무잼있고 감동이었네요!피씨로 다시한번 봐야겠어요ㅜㅜ  ","10"
"970","최고의 배우들 최고의 연기력♡  ","10"
"971","신파가 아니어서 좋았다. 누구나 결말은 알았겟지만 담담하게 풀어내서 좋았고 억지눈물이 아니어서 좋았으며 음악이있어 더욱 빛낫다.... 이병헌은 정말 연기로는 할말이없다. 박정민은 해맑다.한지민은 착하고 바르고 예쁘네...최근본 한국영화중 최고!  ","9"
