"","reviews"
"1051","대가리 빈 개돼지들이 뭔가 있어 보이고 싶어  씨부리는 데 종북 문가 패거리나 빠는 대가리 우동사리 가득찬 미개한  2030 개돼지들은 그냥 자살 추천한다.  우린 땐 최소한 맑스의 자본론 원전 읽기라도 했지...인터넷 요약본 보는 개돼지들은 축생이야  "
"1052","똥꼬충 개이즈 응원하는 놈들 죄다 게이즈 걸려서 OOO..  "
"1053","더러워더러워더러워더러워  "
"1054","진짜 더럽다 이거 수입한 회사 어디야?  "
"1055","이런것도 영화라고..  "
"1056","여기가 공중화장실 인가요? 똥냄새가 진동을 하네염  "
"1057","으 존나 싫다 웩 으웩 으으으  "
"1058","에이즈는 개인책임이다  "
"1059","역겹다마마나마마마아  "
"1060","오잉!똥꼬충영화  가장좋아하는  그룹이 20대여자?  다음엔  20대녀들의 가위충똥꼬질 영화도  만들어라! 깔깔깔깔!  "
"1061","0점은 못주나요? 1점도 아까운데...  "
"1062","왜 내 세금을 니네 똥꼬쇼 치료에 써야하는데??  "
"1063","X구멍에 전구넣고 깨야한다  "
"1064","돈고충에겐 하기스 기저귀가답  "
"1065","에이즈장려영화 수준ㅎㅎ  "
"1066","에이즈 걸려서  죽음으로 정화되길바란다  "
"1067","에이즈 역병덩어리 동성애자들아~부끄러운줄은 알고 살아라~  "
"1068","더럽다는 말밖에..미화할걸해야지 버러지들  "
"1069","jQuery224030793568741412236_1521285838368?이게왜개봉? 국내개봉이가능?  "
"1070","역겨운 똥꼬충들은 다 애미손잡고 재기해주세요^^  "
"1071","그들이 무었을 사랑하든 상관없다 강요는 하지마라  "
"1072","막심... 막심은 어디 있는가...  "
"1073","세금 줄줄세고 항문에서 ㅅㅅ 줄줄 센다  "
"1074","똥꼬충들아 문재인도 동성애자 싫어하자나  "
"1075","착한 게이는 죽은 게이 뿐이다  "
"1076","이젠 하다하다 돈고춘 미화까지하네막심센세...  "
"1077","사회에 해악을 끼치고 공동체를 파괴하는 짓거리를 다룬 영화.  "
"1078","정신병과 에이즈의 유의한 상관관계  "
"1079","똥꼬충 새끼들이 씨발 부끄러운줄 알아야지  "
"1080","안보는게 좋을거같다..  "
"1081","게이들은 불에태워서 정화해야한다  "
"1082","팩트) 국내 에이즈환자 9할이 게이새끼들이니까 트짹이나 페미 정신병자들은 똥꼬충 실드칠 생각말고 가만히 짜져있자^^  "
"1083","에이즈환자 치료비 한달800만언 세금 ^오^에이즈환자 1000여명 뿐일까 똥꼬충 동성애호모들이 원흉  "
"1084","또 한번 자칭 &#34;평론가&#34;라는 아무런 쓸모없는 벌레들이 높은 점수를 준 영화는 걸러야 한다는 진리를 깨우치고 갑니다  "
"1085","이 시대는 미쳤다동성애는 명백한 정신병이고 동성애자는 성욕에 미친 개들이다  "
"1086","똥꼬충들은 여자거르고 똥꼬에박는건데 메갈들은 왜 쉴드치는거임? 게다가 니들이 극혐하는 냄져인데?  "
"1087","동성애는 정신병이다.  "
"1088","세금안내는 집에틀어박혀있는 꿀꿀이들은 모른다  "
"1089","막심선생님 모시고싶어지는 영화네  "
"1090","진짜 페미는 정신병 맞는듯  "
"1091","에이즈벌레들은 박멸이 답  "
"1092","메퇘지 한녀들 방구석에서 라면 먹으면서 BL이나 처보니 동성애에 대해 이상한 상상가지지 동성애 옹호하는 한녀들은 에이즈 보균자한테 피 수혈받고 니들이 좋아하는 재기나 해라  "
"1093","똥꼬 서로 쑤시고다니는건 상관안하는데 피뿌리는건 좀..  "
"1094","별반개도 아깝네 내가낸 세금이 이렇게 쓰이는건가  "
"1095","에이즈는 피에서 피로 전염되는 병이다. 즉 일반적인 성교로는 전염이 잘 안된다. 항문 성교로 인한 조직파열에 의해 상처가 나게 되고 거기로 전염되는거다. 항문성교하는 새!끼들이 누구다? 게이새1끼들이다 ^^  "
"1096","페미 게이 레즈는 사회의 악이자 제거의 대상이지 ㅋㅋㅋㅋ 무슨 포용하는척하고 있어 어차피 포용한다는 새끼도 속으론 ㅉㅉ거림  "
"1097","지들이끼리 좋다  실컷 즐긴 다음에 생긴 병을 왜 정부에서 책임지라 하냐 양심없냐? 우리 세금을 왜 지들 병고치는데 써야하냐?  "
"1098","돈고춘 역겹읍니다 ㄹㅇ루  "
"1099","뭐이리댓글다는조건이까다로워  "
"1100","인간 사회의 암같은 존재, 똥꼬충 이런 10 새키들 미화 역겹다. 즐길거면 니들끼리 OOO 병이 걸려도 니들끼리 걸리고 니들 돈으로 치료해 더러운 쓰레기들아.  "
"1101","이거 10점주는사람들은 꼭 에이즈수혈팩 맞아보셨으면ㅎ~^^  "
"1102","에이즈는질병이야아ㅇㅈ  "
"1103","포스터 보기만해도 똥꼬가 욱신욱신거리네  "
"1104","게이 아시는구나! 혹시 모르시는분들에 대해 설명해드립니다. 남자가 남자랑 하는건데 진.짜.겁.나.더.럽.습.니.다.  "
"1105","별 반개 주는것도 아깝다  "
"1106","가나다라나베미대읃오서소  "
"1107","그립습니다 막심센세 물리치료가 시급합니다.  "
"1108","팩트) 게이들 항문으로 들어가는 돈이 느그 어머니 아버지 세금으로 나간다  "
"1109","0점은 없냐 0점은 없냐  "
"1110","OO을한다 똥꼬충 out^^  "
"1111","동성애자 양성애자 아동성애자  전부다 독가스에 쳐넣고 소각해야 합니다  "
"1112","동성애를 반대 또는 찬성하지 않는다. 하지만 무분별하게 피임기구 사용하지 않고 에이즈 걸린걸 왜 국가와 제약회사가 책임져야하나?  "
"1113","에이즈는 총기를 들고 일어난 폭동이야  "
"1114","똥꼬충새끼들 다 OO라 걍  "
"1115","ㄸㄲㅊ 아웃!!!! 에이즈 건보해주지마라  "
"1116","재미없네요 취향 갈림니다  "
"1117","항문성교 극혐 남탓으로 돌리지마라  "
"1118","동성애 미화 및 조장영화는 없어야합니다.  "
"1119","영화추천말고 게이새끼들은 청산가리먹고 디지는걸 추천합니다  "
"1120","드러워서 진짜, 그럼 에이즈 치료약이라도 지들돈으로 사쳐먹던가, 이성애자들에게 돈 뜯어서 똥꼬에 환장들린 놈들 목숨연명시켜주는게 정당하냐jQuery22406484276307478318_1521192143566?? 자유는 누리는게 맞지만 그에대한 책임은 본인들이 져야지  "
"1121","에이즈라는 질병은 동성애에 대한 벌이다  "
"1122","0점이 없는게 아쉽다 진짜ㅡㅡ 똥꼬에 쳐박을꺼면 최소한 콘돔이라도 쓰던가ㅋㅋ왜 지들이 성욕주체못해서 걸린 질병은 국가가 책임져주길 바라냐? 똥꼬충들은 양심이란게 없냐?  "
"1123","모든 에이즈 환자가 항문충은 아니지만, 모든  항문충은 에이즈 환자이거나 에이즈 환자가 된다.  "
"1124","자신에게 발생한 문제는 전부 사회탓 남탓  길가다 자빠져도 사회탓 지가 박아놓고 사회탓  "
"1125","차별이 아니라 박멸을 해야지  "
"1126","너무 재미없어요 좀 재밌게라도만둘던가..  "
"1127","에이즈 걸린건 니탓이야 누굴탓해  "
"1128","역겨운  소재 역겨운 내용  "
"1129","최소한 그들을 이해하는 사람조차 등을 돌리게 만드는 이유  "
"1130","착한똥꼬충은 죽은똥꼬충이다  "
"1131","절대 안된다 동고중들에게 죽음을  "
"1132","no gay no stress  "
"1133","이게 에이즈 테러 미화지 무슨;;  "
"1134","야갤이 해냈다 똥1꼬충들 몰아내자  "
"1135","게이가 그냥 싫어서 1점  "
"1136","부모에게도 인정받지 못하는 벌레같은 존재들  "
"1137","똥꼬충 OUT!!! 똥꼬충 OUT!!!  "
"1138","이 영화 말하고싶은게 뭔가요?  "
"1139","ㅁ ㅔ갈들이좋아하는 bl 이런거냐? 엌ㅋ  "
"1140","동물도 숫컷끼리 암컷끼리는 교배하지않는다!  "
"1141","한녀들미래의모습ㄷㄷ  "
"1142","똥꼬에 사랑을 박다....  "
"1143","하다하다 돈고 에이즈 미화영화가 나오냐?  에이즈 사이좋게 나눠갖는게 자랑이노ㅋㅋㅋ  "
"1144","디져주라 지바알...ㅠ  "
"1145","악마의영화 더이상 할말이없다  "
"1146","피테러극혐 걸린사람이치우자  "
"1147","더러워 더러워 더러워 더러워  "
"1148","에이즈 피로 테러한 걸 미화하다니 끔찍하다  "
"1149","이제는 ....ㅜㅠ그만  "
"1150","게이얔ㅋ야 분기타조!!!  "
"1151","아빠 왜 난 아빠가 둘이야?  "
"1152","ㅠㄴ든ㅊㄷㅅㅇ그닉ㆍㄴ  "
"1153","개 노답 영화 역대급 망작  "
"1154","솔직히 본인 자녀(현재의or미래의)가 커밍아웃하면 가슴미어질거잖아  "
"1155","이건 아니지..어휴 에이씨 10자  "
"1156","더러운 현실을 미화한 영화  "
"1157","일점도 주기 싫습니다 ㄸㄲㅊ 아웃!  "
"1158","별거지같은...쓰레기 영화를 물고빨고 염병이냐....  "
"1159","하다하다 에이즈 옹호영화두 나오네 몇명이나볼까  "
"1160","게이즈 혈액팩 미친ㅋㅋㅋ더럽다  "
"1161","돈고츙돈고츈동고충돈꼬충  "
"1162","더러운 게이놈들 자살 추천한다이거 피 테러 미화하는거잖아  "
"1163","토악질이 나온다 더러운 게이들  "
"1164","이런거 개봉하지마세요 더럽습니다 ㅠㅠ  "
"1165","동성애=소아성애=근친=시체성애=수간  "
"1166","고아특)이딴 애미OO 배설기관으로 성관계해서걸린 에이즈 덩어리새끼들이 제약회사에 괜히OOO떠는 영화 감동이라고 처봄  "
"1167","더럽고. 끔찍한영화다.  "
"1168","별주는거 자체가아깝다  진짜 싹다잡아넣고  개패듯이패야됨  "
"1169","똥싸는데다가왜넣는거냐  "
"1170","정말 최악의 영화이군, 동성성애는 사회악이다. 동성성애는 반드시 척결해야 한다. 동성성애자 척결로 에이즈를 몰아내자!  "
"1171","보지도 않고 1점준다고 OO하면서 마찬가지로 보지도않고 10점주는건 무슨 심리임jQuery22403063368571418694_1521215772153;;  "
"1172","별 쓰레기 같은 년들이 영화 평점을 망쳐놓네  "
"1173","1점이최저냐?0점못주나  "
"1174","1점도 아깝다 ㄹㅇㄹㅇ  "
"1175","더러운 새끼들 혐오스럽다 진짜  "
"1176","착한 게이는 죽은 게이뿐 / 이해는 할만한 것에  하는 것이다 / 게이는 이해의 대상이 아니다  "
"1177","똥꼬충 아웃....ㅅㅂ  "
"1178","병원비는 니들 돈으로 내라  "
"1179","충격받았어요.내자식은 이런거 안봤으면해요.  "
"1180","동성애는 알아서 잘해라. 사회로부터 관심 구걸하지 말고.  "
"1181","왜 지들이 노콘성교로 에이즈 걸려놓고 제약회사 탓을 하는걸까?  "
"1182","보고 토할뻔  우엑..   이런 드럽고 역겨운영화 처음이다.  "
"1183","돈.... 고... 춘...  "
"1184","OOO기같은영화다중말로  "
"1185","항문성교는 빼박에이즈의사들이 증언함 니들이 의사보다 인체를 더 잘아냐?나라탓도 정부탓도아님 지들이 똥꼬함부로 놀린탓  "
"1186","동성애...는 왜하는거지  "
"1187","동성애가 싫더라..그냥 싫어요. 본능적으로 바퀴벌레가 싫듯이..  "
"1188","ㅍ1싸개들이 조작한다해서 와봄  "
"1189","앗....아아...  "
"1190","개역겨운 새끼들 살처분 추천 똥꼬충 새끼들 똥꼬 허벌똥꼬라 맨날 똥 지리고 다닌다메  "
"1191","제약회사에 에이즈 피던지는게 동성애,에이즈에 대한 편견을 바꾸고싶어서 일으키는 평화롭고 숭고한 인권운동이라고 생각하는거임? 이런건 동성애에 대한 편견과 차별을 더 악화시킬뿐임 리얼보다 더한 쓰레기영화  "
"1192","막심선생님의 열정어린 주먹...그립습니다...  "
"1193","같은 피싸개라고 &#39;그 성별&#39; 10점 주는거보소ㅋㅋ  "
"1194","영화를 보지 않고 평점을 남기는건 좀 아니지 않냐;; 몰론 나는 1점 줬다  "
"1195","1점이나 줘야되는게 참으로 아깝다. 너희들은 꼭 심판을 받을거다.  "
"1196","별로 별로별로별로별로별로  "
"1197","동성애자들이 지네 피 던지면서 빼애액 거리는게 과연 정의로운 걸까? 에이즈환자들이? 저거 막는 경찰들은 무슨 죄야?  "
"1198","ㅇㅅㅇ7;;;; ㅇㅂㅇ  "
"1199","1점도 주기 아까운 똥꼬충 가위충 미화영화  "
"1200","개 역겹죠? 폐녀자들 보는 호모만화에서나 미소년들이 물고  빨죠? 현실은 잠재적 에이즈 환자에 비뇨기과 환자죠?  "
"1201","줄줄줄샌다샌다샌다샌다  "
"1202","똥 줄줄, 부모님 눈물 줄줄  "
"1203","똥꼬충 싫어 ~!~!~!~!~!  "
"1204","뒷싸개들 진짜 너무하네  "
"1205","구와와와아아아아악ㅡㅡ  "
"1206","우웩 항문성교 우웩우웩  "
"1207","10점은 영화보고나서 주는점수인가욤jQuery22405709974644745645_1521186327336  "
"1208","역겹다. 어떻게 보균자 피를 뿌린행위를 미화시킬 수 있지..? 살인미수랑 다름없는 일인데?  "
"1209","에이즈는 비교적 낮은 전염성의 질병이다. 하지만 어떤 &#34;성적취향을 가진 남성&#34;들에게 에이즈는 전염되기 쉬운 질환이다. 그것을 단순히 그 성적취향이 가진 핸디캡이라고 여긴다면 상관없다. 문제는 여기에 소중한 혈세가 연 1000억이 들어간다는 것.  "
"1210","ㅄ같은놈들 자격지심에쩔어서 저러는거임  "
"1211","더럽고 역겨워.. 인간 본연적으로 혐오스러워이걸 찍은새끼들이나 배급하는새끼들이나 보러가는새끼들이나 다 죽어버렸으면  "
"1212","동성혼의 합법화와 제 3의 성의 인정에 반대합니다.  "
"1213","ㅅㅂ...OO네 이게 영화냐 토나온다..  "
"1214","에이즈랑 퀴어축제 때 하는 역겨운 짓을 보면 혐오를 안할 수가 없음. 정신병자 같음.  "
"1215","아무 논리없이 그저 자신들의 혜택과 이익을 위해 떽떽대는 전형적인 억지 감성팔이 영화  "
"1216","어딜 더러운 에이즈 덩어리를 감히 ㅡㅡ  "
"1217","항문 예찬 영화 역겹다.  "
"1218","영화보지도않고 1점줘서 미안하다.. 내 가슴이 1점을 주라고 시킨다..  "
"1219","동성애는 정신병이에요 이 OOO들아 매번 선동만 당하는년들이 무슨 깨시민 코스프레를 하고 있어?  "
"1220","세금낭비 아웃!!!!  "
"1221","최악입니다 이런 영화가 만들어지고 유통된다는게 경악스러워요  "
"1222","자라나는 청소년들에게 부정적인 영향을줄것같네요  "
"1223","씨발 0점이 없다는게 아쉽다  "
"1224","되지도 않는 감성팔이로 본인병의 치료를 요구하지마라  "
"1225","이기심 미화 최악의 영화  "
"1226","어서 문재인은 동성애자를 때려죽여도 되는 법을 만들어라  "
"1227","항문이 줄줄 똥이 줄줄세금이 줄줄  "
"1228","똥꼬충은 화력발전 연료로 쓰자  "
"1229","그들은 사람모양을 한 병균이므로 몸에 해가되며 정석 치료법인 죽음으로써 관리해야 한다.  "
"1230","하 당연히 1점이지ㅋㅌ  "
"1231","제약회사가 동성애자에게 에이즈를 퍼트렸다~ 아니라고? 근데 저들은 왜 제약회사한테 화풀이 중인거죠? 똥리둥절...  "
"1232","변실금 에이즈 온갖성병 법규나먹어라  "
"1233","물리치료사 막심 센세.. 그립습니다..  "
"1234","왜 0점안됨? ㄹㅇ 어이가 없자너  "
"1235","no I don&#39;t think so  "
"1236","돈고춘 영화는 안되여 ㅇㅇ  "
"1237","평론가의 9점이 뭘 의미하는가? 바로 일반인들의 1점을 의미한다.  "
"1238","동성애는 정신병이다 니들끼리 숨어서하던가  "
"1239","싫다. 정말 싫다. 너무 싫다.  "
"1240","개인적으로 별로....  "
"1241","막심선생님의 물리치료와 이슬람식 환생치료가 시급하다  "
"1242","좋은 게이는 죽은 게이다 곱게 디지지 왜 사회에 피해나 주고 그러냐  "
"1243","게이님들 얼른사라져주세요...  "
"1244","동성애는 이해하지만 자신들이 좋아서 항문성교 해서 에이즈 걸려놓고 책임전가하는건 좀 아니라고 생각합니다  "
"1245","게이들은 항문 봉합수술이 시급하다. 이딴영화 만들시간에  게이놈들 항문봉합하는데 돈쓰자  "
"1246","웩....드러워ㅡㅡ  "
"1247","이것도 영화라고 수입을 ㅠ제대로 알려야한다 병을 병이라고  "
"1248","에이즈 피를 뿌린것은 살인행위죠.  "
"1249","동성애는 병이야 정신나간놈들아.. 어린애들이 보고배울까 겁난다.... 제발 역겨운짓은 딴나라가서해라  "
"1250","이 영화 호평한 사람들 피로 테러한 거 그 회사에서 돈 준다 그러면 가서 닦을 수 있나요??  "
"1251","핵노잼. 누가 돈 주고 보라고 해도 안 봄.  "
"1252","누구를 탓하려고 하는가  자신의 책임인 것을..  "
"1253","이건 11점이 아닙니다.  "
"1254","답이없네, 답이없어!  "
"1255","하...진짜 너무했다  "
"1256","똥은 포장해도 똥임 그사실을 똥인 본인들이 제일 잘알고 철벽치는거임  "
"1257","희대의 구역질나는 정신병자 돈코춘의 영화역시 돈코춘은 폭력이 치료인가jQuery22409696341619959865_1521284252836  "
"1258","도데체 이나라가 어디까지가야 이런꼴을 더이상 안볼까... 더럽다 못해 역겨운것들  "
"1259","자꾸 호모포비아라고 하는데 니들이 무슨구멍쓰는지 신경안쓴다니깐? 그냥 니네가 싼똥 니네가치우면돼. 동성애자라고 특혜 받을생각하지 말고.  "
"1260","드러워 지들끼리 몰래 하던가  "
"1261","내 앞에서 존중? ㅇㅈㄹ하면 바로 물리치료 들어간다 똥꼬충 드러운 새끼들아  "
"1262","군대에서 날 더듬던 선임도 머리속에선 자길 이렇게 생각하고 있겟지? 손발이 너무 떨린다.  "
"1263","어우야 이건 아니라고 생각한다  "
"1264","킁킁 어디서 똥냄새가 난다  "
"1265","더러워 이런게 개봉한다니 말세  "
"1266","왜 똥꼬충이 아닌 여자들이 와서 10점을 주냐? 남자는 지가 원하면 게이가 될수라도 있지. 지들은 전혀 공감 못하는 것들이 와서 OO들이네  "
"1267","동성애자가 에이즈 퍼트리는건 사실인디 통계 안보시나 비율로 보셈 숫자말고  "
"1268","11점 못드려서 1점 드립니다.  "
"1269","회사 창틀에 던진 피는 항문출혈로 나온거 모아논 건가요?  "
"1270","그냥 안봐도 쓰레기일듯  "
"1271","동성애자 대부분이 에이즈환자는 아닌데에이즈 환자 대부분이 동성애자라면서요jQuery2240801739545926448_1521215686809  "
"1272","평점0점은 없나요jQuery22409705054786536964_1521214694459?  "
"1273","여성시대는 성소수자들을 응원합니다  "
"1274","&#39;-&#39;나는시대의잔당이당  "
"1275","아우 똥냄새나....센조이좀 잘 하구 다녀라 게이샛기들아  "
"1276","에이즈는 사랑보다 강하다!  "
"1277","쓰레기같은 테러활동을 정부, 제약회사탓으로 돌리는 무책임하고 한심한 인간들의 군상  "
"1278","참내 살다살다 게이를미화하냐  "
"1279","에이즈는 동성애탓이 맞다.  "
"1280","진짜 동성애자들 서울광장에서 축제하는거 없애버렸음 좋겠다..정은아!여기다 여기!  "
"1281","와 웜퇘지랑 트페미 정신병년들 평점 준거봐라 개역겹네  "
"1282","똥꼬충 에이즈 걸리면 격리시켜서 가스수용소에 가둬야한다  "
"1283","똥꼬충 새끼들 또 OO났네  "
"1284","환생치료, 물리치료를 적극 권장합니다.  "
"1285","에이즈는 동성애자들의 책임이자 앞으로 짊어져야 할 짐이다 자신들의 책임을 남탓하지 마라  "
"1286","게이들 느그 치료비 국가 부담 다 없애고 니네가 다 부담한다 하면 찬성해줄게 즐길건 다 즐겨놓고 왜 국가가 니네 뒷감당 해줘야돼 센조이하다가 대뇌까지 빼버렸나  "
"1287","참 신기하게도 동성애 옹호조장하는 애들은 거의 99% 이상이 페미니즘,메갈애들임. 트위터만 봐도 메갈들이 페미니즘 하면서 동성애 찬성운동 하고 다니고 있으며,메갈언론 한겨레,경향,오마이,허핑턴같은 애들도 친 동성애 성향에,대부분 여성단체들도 마찬가지임  "
"1288","에이즈환자의 피는 생화학무기나 다름없다. 이 영화는 테러범 영화일뿐. 자기가 자초하여 에이즈에 걸려 세금 빨아마시면서도 불만을 품다니. 정말 역겹기 그지없다.  "
"1289","돈 아까운 영화 교육적으로도 안좋음  "
"1290","이거 너무 억지던데...그리고 피를  벽에 던지는 거 극혐...  "
"1291","더럽고 역겨움 불쾌하네 이런게 영화라고  "
"1292","0점을 주고 싶은데..0점은 안되는군요. 1점도 아깝다.  "
"1293","에이즈 숙주 박멸! 충성풍성!  "
"1294","68폭동을 계기로 동성애와 페미니즘 등 신좌파가 똥을 거하게 싸놓은 뒤부터 기존 선진국들은 취업난과 물가상승 등 엄청난 사회적 문제에 시달리고 있지  "
"1295","우리 달님께서 동성애 반대한다고 하셨습니다 우리모두 1점 줘야합니다 여기 10점 테러한년들 이 영화와 동성애 옹호하는애들 다 달님 까려는 일베충들이에요 속지마세요 여러분들  "
"1296","테러행위를 정당한양 미화한 영화 1점 드립니다^^  "
"1297","거울 보고 자기랑 키스하는 생각 까지 이해하는데 다른 부위 동성끼리 그건 아니지 제발 동성연예는 하지말자  "
"1298","쯧쯧쯧....한심하다 한심해  "
"1299","호모 똥구머누스 영화. 개비추  "
"1300","BL 자체가 정신병이다.  "
"1301","Dr Maxim... We missed you...  "
"1302","디파일러 실화바탕인가요?  "
"1303","에이즈~에이즈~ 신나는 질병 나도 한번 걸려보자~ 똥꼬따리 똥꼬따~  "
"1304","어디서 똥내 안나냐? 항문에서 똥가루 냄새 난다 ㅅㅂ 엮겨워  "
"1305","거짓에 더이상 속지 않아  "
"1306","에이즈를 미화하지마라  "
"1307","동성애는 병이다 물리치료가 답이다  "
"1308","여러분의몸은소중합니다  "
"1309","에이즈피 테러한 범죄자영화를 미화하네 미쳤냐?  "
"1310","공공장소에 계신데 피폭탄 맞았다 생각해보세요. 그냥 피도 소름돋는데 에이즈피? 이걸 왜 미화하나요? 뭘 어떻게 이해를 해줘야되는데요? 정신이상적인거 하시는걸 우월한 지식 가진 것처럼 설치지마세요.  "
"1311","Ddong go chung out...  "
"1312","대한사람 대한으로 길이 보전하세  "
"1313","자신들이 자초한 일을 왜 정부와 제약회사탓을 하는지 모르는 영화...  "
"1314","이런영화를 만들다니..말세다  "
"1315","게이새끼들 사살 필수~~~~  "
"1316","OO 똥꼬충 새끼들 똥냄새난다  "
"1317","0점이 없어서 1점 줍니다  "
"1318","진짜 내 주위에.똥꼬충 있음 죽이고 싶을듯 ㅋㅋㅋㅋ  "
"1319","니들 세금낭비 싫어하잖아 4대강이 그렇고 국회의원 월급들 말야 똥꼬로 에이즈 퍼트리는것들 치료비로 연1조가.넘게.들어가는 세금이 아깝다는건데 왜 사람을 포비아로 몰아가는데? 나도 니들처럼 세금낭비하는게 싫어서 그 대상을 싫어하겠다는데 문제있냐?  "
"1320","동성애자는 패 죽여도 죄를 묻지 않는 법이 생겨야 함. 저 더러운 색기들 에이즈 치료비로 멀쩡한 세금이 들어가고 있다. 서울시에선 더러운 음란 축제를 열고 있고. 박원순도 쫓아내야함.  "
"1321","영화같은건  만드셔요수간 영화,아동애자.1부다처 .기타등등 영화나올까 무섭네  "
"1322","제발 그 더러운 피를 여기저기 흩뿌리지 말아주세요  "
"1323","평론가 ^^! 발것들 에이즈나 걸려라 뭔 별 5개를 쳐박냐  "
"1324","왜 0점은 없죠?남자 빵디로 대신하라는 건가요?  "
"1325","이런 영화를 싫어한다고 죄다 한남 운운하는 돼지 메갈련들 ㅋㅋㅋ 죄다 레즈년들임 어딜봐서 이영화가 정상이냐 그리고 니네 생각 사상 강요질이나하고 버젓이 광화문앞에서 저질 퍼포먼스나 쳐해대구 저희 사랑하게 해주세요 외치지말거라 ㅋㅋ  "
"1326","에이즈 피를 뿌리는 생화학 테러리스트들을 미화하는 정신나간 영화  "
"1327","블랙홀성애자인 스티븐 호킹도 이성애자였다 호모놈들아.. 뭐 느끼는거 없냐? 그렇게 박고싶으면 블랙홀에다가 박아라  "
"1328","이 영화를 가장 좋아하는 그룹은 20대 여자입니다.  "
"1329","동성애자 처벌법 빨리만들었으면  "
"1330","2016년 신규 에이즈 환자 1199명중 여성이 94명 남성이 1105명이었다. 성비는 95:5  "
"1331","더럽다 진짜. 땅밑으로 꺼지던지 지구를 떠나라.  "
"1332","그래 게이는 둘째치고, 본인들이 위생관리 잘못해서(항문성교를 콘돔안끼고함) 걸린 질병을 나라에 책임지라고 말하는 뻔뻔함, 지나가는 시민들 에이즈 균 옮기라고 창문에 피던지는 퍼포먼스를 억압에대한 투쟁으로 둔갑시키는 것도 역겨움.  "
"1333","동고충  옹호하는 여자 특징 : bl웹툰, 소설 좋아하는 십덕녀들임  "
"1334","어디서 냄새 안나요? )0(  "
