"","reviews","points"
"365","아아 마지막 무니 너무 슬퍼 ㅠㅠ  ","8"
"366","무니의 천진난만함과 귀여움으로 난관을 잊게만듬  윌럼데표의 묵직한 조연 일품 색채가 화려한 플로리다의 건물들  ","9"
"367","관람객플로리다는 아이들의 천국  ","6"
"368","무지개빛 현실어드벤처  ","8"
"369","암담한 현실, 아이들의 천진함에 가려지지만  씁쓸함은 그대로.  ","7"
"370","애기들너무귀엽고연기잘햄♡  ","10"
"371","쓰러져도 계속자라자...  ","10"
"372","미안해 이런 어른이라서  ","10"
"373","관람객뒤늦게 관람하고 놓치지 않아서 다행이었다고 생각했습니다  ","9"
"374","관람객아이들의 천진함과 구질한 현실 간의 괴리가 투척하는 이 먹먹함을 어쩌라고.  ","8"
"375","관람객현재의 행복을 느낄수 있었습니다.  ","9"
"376","어두운 주제를 어린아이라는 소재와 컬러풀한 색감으로 풀어내 더 자극적이고 강렬하게 느껴졌다. 어렴풋이 알 것 같지만 서술하지는 못하겠다. 한 번 더 보고싶다.  ","9"
"377","관람객아이들이 꿈꾸는 디즈니랜드는 과연 있을까  ","10"
"378","관람객좋았어요 .-.-.-.-  ","8"
"379","순수함과 퇴패의 아슬아슬 줄타기, 마지막엔 결국  ","10"
"380","애처롭고 처량함 속에도 포기하지않는 일상에 소소한 행복들은 반짝인다. 모녀를 마냥 보고있자니 안쓰럽고 아프고 걱정됨이 뒤범벅 덕지덕지. (라이언의 써니 파와르. 룸, 원더의 제이콥 트렘블레이와 더불어 브루클린 프린스의 이 거대한 떡잎을 대환영한다!)  ","10"
"381","색감이 예쁜영화.잔잔한듯 싶지만 아픈 영화.  ","10"
"382","어린시절이 아련하게 떠올라 아빠미소를 지으며 몰입하며 보게된 영화. 아이들의 연기력이 어메이징하다.  ","9"
"383","너무 좋았던... 맘이 짠하고 여운이 많이 남는 영화  ","10"
"384","관람객디즈니랜드 옆에 살면 행복하겠다고 버릇처럼 말하던 때 가 있었다.영화는 디즈니랜드의 그림자가 닿아있는 곳을 이야기 한다 꿈과 희망의 사각지대를..  ","10"
"385","디즈니월드 인근 모텔에 사는 무니는 일상이 모험이다. 친구들과 불장난으로 화재를 일으켜 엄마끼리 사이가 틀어지고, 거리에서 향수를 팔던 엄마는 생활고에 매춘까지 하게되자 결국 무니를 플로리다 아동 가족부에 맡기려하나 도망친 무니는 친구 젠시와 달아난다  ","7"
"386","관람객매력적인 영화에요! 포스터가 거짓말이라는 평이 많은데.. 저도 보면서 보고나서 한동안 울적했지만.. 영화에서 말하는 메시지는 포스터에 있는 내용인 것 같아요.  ","10"
"387","관람객일요일 조조영화로는 비추. 하루종일 온몸에 힘이 빠진 상태로 주말이 지나버린다. 그만큼 감독이 하려는 이야기가 잘 전달되었고 상황에 깊이 몰입이 되었다.  ","10"
"388","관람객보고 싶었었는데... 정말 보길 잘 한 것  같아요~~  생각이 많아 지는 영화였습니다.  ","10"
"389","관람객나의 인생영화 등극무니가 했던 말들이 잊혀지지 않는다  ","10"
"390","관람객너무나 해맑게 웃는 아이들의 웃음 만큼, 많이 아팠던... 영화관 나오는 걸음이 너무 무겁고 아팠다.  ","9"
"391","매우 현실적이라 감정이입하기 좋았던 영화. 결말은 판타지로 끝나서 아쉽...  ","8"
"392","관람객현실과 영화가 교차되는 그 순간  ","8"
"393","관람객무니야.. 너 울 때 나도 같이 울었어  ","9"
"394","발랄하고 장난 꾸러기 무스가 울음을 터트리며 오열하는 장면에서 나도  울컥했다  ","8"
"395","관람객제가 본 영화 중 top3안에 들어요  ","10"
"396","풍경, 아이들의 연기, 내용다 좋았다  ","8"
"397","관람객플로리다에 한 번 가보고 싶어졌습니다.  ","8"
"398","관람객메이플 시럽은 달콤해야 하는데 ...  ","9"
"399","화려한 배경속에 먹먹한 현실 두번은 안 보련다  ","10"
"400","관람객오직 여기 말곤 다른 곳은 없는데 할퀴고 밀어낸다. 그럼에도 계속 웃으며 서로를 감싸안는 아이들. 쓰러지고 쓰러져도, 계속 자랄거야. 잃지 않을거야, 그 순수함을, 행복감을  ","8"
"401","관람객갑자기 슬픈 환상의 도피처로 점프- 그 환상의 절박함만큼 슬프다.  ","8"
"402","관람객어린아이의 눈물이 가끔은 이렇게 찡하다.  ","9"
"403","관람객아직도 자라고 있는 두 소녀의 이야기. 조금 큰 소녀와, 조금 어린 소녀와.  ","9"
"404","판타지는 없다 현실만 있을뿐  ","10"
"405","달콤 씁쓸한 영화ㅠㅠㅠㅠ  ","10"
"406","..,,..,,..,,  ","10"
"407","관람객기만적이지만 거짓이라고만 말할 수 없는 환상  ","9"
"408","플로리다 프로젝트 정말 좋은 영화였다..  ","10"
"409","올해의 영화다 왜 저렇게 홍보했는지는 모르겠지만 정말 엄청난 영화  ","10"
"410","티켓없이 세상에 태어나 티켓없인 함께 할 수 없는 운명 자유이용권을 끊어도 자유롭지 못한 어른들 과 그와 반대인 아이들, 영원 할 수 없다면 울음을 멈추고  원하는 곳으로  뛰어가자. 인생다운 짧은 인생을 위해.  ","10"
"411","쓰러져도 자라난다. 무너져도 살아진다.  ","9"
"412","여운이 많이 남는 영화네요  ","10"
"413","관람객더운곳에서 나누는 더운대화들 빗속에서 뛰어다닐때가 제일 행복해보였다  ","8"
"414","관람객아이가 자라서 어른이 돼야 하는 게 아니라, 아이는 아이여야 할 거 같아요.  ","8"
"415","철없는 아이들을 바라보는..  ","8"
"416","너무 맑은 아이들 그래서 더 아프다.  ","10"
"417","관람객내가 이 나무를 좋아하는 이유가 뭔지 알아? 쓰러졌는데도 계속 자라고 있기 때문이야.  ","9"
"418","달콤하지만 씁쓸한...  ","9"
"419","관람객비극인지 희극인지 모르겠지만 결극 인생은 쓰러져도 계속 자라나는 나무와 같은 것  ","10"
"420","관람객이상적인 색감과 상반되는 현실  ","8"
"421","관람객연보라빛 아지트에 숨어 사는 요정들이 보여주는 현실. 동화는 없는 현실  ","10"
"422","관람객화려한 무지개 끝에 자리잡은 씁쓸한 현실 이야기  ","9"
"423","무니의 상상가득한 현실모험. 젠시의 손을 맞잡고 폰카메라에 담겨 디즈니랜드를 누벼볼까?  ","9"
"424","관람객올해 최고의 영화가 될 것 같아요  ","10"
"425","관람객순수해서 더 슬프고 아린 석양  ","8"
"426","뒤통수 맞은 느낌에 엔딩크레딧이 끝날때까지 자리에서 일어나질 못했는데 다른 관객분들도 일어나는 사람 한명 없었습니다....  ","10"
"427","관람객무니야, 많이 많이 행복하길.  ","10"
"428","관람객사랑스러운 영화라더니 뭔말이야.. 내내 씁쓸한데..  ","8"
"429","가벼운 마음으로 귀여운애들 영화라 생각하고 봤다가 마음이 무거워졌다...마지막에 젠시에게 찾아가서 오열할때 나도 같이 울었다...  ","10"
"430","차갑거나 뜨겁거나 미지근하거나  ","10"
"431","관람객무니 울 때 같이 울었고, 무니가 커텐 칠 때 같이 그림자의 어둠을 느꼈다...무니야 행복해야돼 끝까지  ","9"
"432","관람객꿈과 희망만 가득할 것 같은 플로리다의 배경과 대비되어 그들의 삶이 더 안쓰러워 보였다.  ","8"
"433","관람객映?を見て出たら、姉は映?の上映中に出たかったといました。私はそのようにまで考えなかったですが、私たちはこの映?がポスタ?のように明るそうだと思いました。先日前に見た映?　’誰もいらない’を見て感じした感情がこの映?にもあった。  ","9"
"434","환각인지 실제인지 모를 마지막 장면. 그리고 나오는 엔딩크레딧 그때 들리는 아이들의 웃음소리가 여운을 남기더니. 먹먹해지네요.  ","9"
"435","관람객한여름. 풀로리다의 자연풍경을 오롯히 느낄수있는 영상에 귀여운 악동들의열연 먹먹해지는 클라이막스까지 넘 좋은 영화였습니다  ","8"
"436","쓰러지도 자라는 내가되고 싶다.  ","10"
"437","관람객어두운 현실 속에서도 서로와 살아가며 행복을 놓치 않는 모습이 먹먹했습니다. ㅠ  ","9"
"438","관람객엄마와 딸의 행복한 모습이 너무 아름다워서 슬펐습니다  ","10"
"439","관람객생각을 많이 하게 만드는 영화네요아이들의 모습과 연기 너무 좋았습니다  ","8"
"440","관람객살아남기 위한 공생. 서로를 향한 공감과 혐오 속에 아슬아슬하게 하루를 살아내고 있지만..결국 현실을 벗어날 수 있는 유일한 공간은 환상 속 디즈니월드...  ","8"
"441","살면서 우울증 영화 처음 후반부 재미 TV로 내용 스득  ","10"
"442","관람객영화 색감이 너무 너무 좋네요.  ","9"
"443","관람객오늘이 지나면 다신 못볼지도 몰라  ","10"
"444","관람객션 베이커의 연출력에 놀랐다. 슬펐고.  ","10"
"445","무니와 핼리 두 모녀에게 최선은 무엇이었을까, 어쩌면 최선은 이들의 선택지에는 없는 것일지도...  ","10"
"446","마지막 엔딩크레딧에 젠시가 데려간 디즈니랜드의 행복한 소리들이 울컥하게 만든다,  ","8"
"447","관람객아역배우의 연기를 보는 것으로도 볼만한 가치가 있는 영화입니다.  ","7"
"448","처음엔 뭐지뭐지? 멘탈 붕괴되는 느낌이었는데 보고나니 계속 생각나는 영화  ","10"
"449","영화 넘 좋네요~~마지막 엔딩은   몰입도 최고였음!!!  ","10"
"450","관람객가고싶었던 디즈니랜드로~~~  ","8"
"451","결국 터뜨린 무니의 울음. 디즈니랜드 건너 편 희망없는 동네. 어린 아이의 고통은 더 애처롭다.  리빙 라스베가스 이후 최고의 슬픔.  ","10"
"452","보는 내내 웃었지만 속으로 눈물이 나왔다  ","10"
"453","관람객무니의 터진울음. 이제 알아야 하고 알게되는 것들이 점점 많아질거야.  ","9"
"454","아이들의 천진난만함과는 상관이 없는, 절대온도 0의 지독하게 냉혹한 현실. 아이들이 신선식품, 생수 먹는 것을 볼 수가 없었다  ","7"
"455","관람객그들만의 무지개를 향해서. 꼭..  ","10"
"456","관람객한없이 아름다우면서도 찹작한 영화  ","8"
"457","관람객흥행성 보통 작품성 거의 만점인 영화  ","10"
"458","관람객마지막 장면... 탈주!  ","9"
"459","관람객동심의 눈으로 보았던 신산한 삶의 편린들을 다시 마주하기  ","9"
"460","너무 예쁘고 아름답고 슬프고 잔인하다.  ","10"
"461","관람객영화의 배경을 모르고 보면 슬픈 영화, 알고 보면 쓰리기까지 한 영화  ","9"
"462","어떻게 이렇게 만드냐,,  ","10"
"463","위선에 가슴이 먹먹해진다  ","10"
"464","관람객타인의 고통을 소비하거나 착취하지 않는 담담한 시선이 좋았습니다.  ","10"
"465","관람객매우 현실적이면서 담담한 영화. 극적인 감동을 주는 인위적 장치들이 별로 없다. 하여 그리 재미있지는 않았다.  ","8"
"466","관람객부모때문에  행복하지 못한 아이들  ","8"
"467","관람객잔인한 장면이 나오지 않지만, 잔인한,  ","10"
"468","관람객배경은 아름답고 주연을 맡은 아역들의 연기는 눈부시다. 사람들이 열광하는 영화의 가치는 그것대로 훌륭하다.하지만 조금만 이면을 뜯어보면 남들이 달갑지않아하는 꺼림칙함이 있다. 이해하고 안쓰럽지만 다가서고 싶지않은  ","8"
"469","무디가 행복 할 수 있다면 그 세상은 우리가 행복한 세상.  ","8"
"470","관람객동화같다던 말은 뭐였을까...동화라기엔 너무 잔인한 현실  ","8"
"471","관람객누구의 잘못일까? 예쁜장면과 아픈이야기.  ","9"
"472","관람객보라색 배경이 즐거운 듯 씁쓸한 느낌과 닮은 것 같다  ","10"
"473","관람객볼만하다 배우들의 힘이 크다 엄청 좋을 수 있었는데 조금 아쉬움은 있다  ","8"
"474","관람객세상의 또다른 무니들을 위해 생각하게 만드는 영화였습니다. 보는 내내 불편하다가 마지막 장면에서 한방 맞은 느낌. 눈물도 다 못 훔쳤는데 엔딩 크레딧 다 올라가고, 불이 켜져서 대략 난감했습니다.  ","9"
"475","관람객그렇게 밖에 살 수 없었던 핼리가 참 마음아프네요... 핼리가 무니를 업어줄때 슬펐습니다  ","9"
"476","무니를 통해본 세상에서 가장 참혹한 현실, 슬픔  ","10"
"477","관람객아이들에게서 디즈니 랜드를 빼앗은 건 누구일까  ","9"
"478","관람객슬픈 이야기인지 아름다운 이야기인지 모르겠다  ","10"
"479","가슴 깊은곳까지 울림을 주는 영화였던것 같습니다... 포스터의 아름다운 색감에 끌려 보게됐는데 여운이 너무 크네요...  ","9"
"480","관람객혀를 끌끌 차다가, 심란하다가, 갑갑하다가, 눈물이 왈칵  ","8"
"481","리얼하고 심각한 드라마 속에 의외로 코미디적인 요소가 있다.  ","8"
"482","관람객플로리다프로젝트플로리다프로젝트굳  ","9"
"483","미국판 인간극장 보는듯한 느낌이었어요가슴이 먹먹해지네요 연기아닌것같다는 생각들정도로자연스럽고 현실적인 영화  ","9"
"484","기대하고 봤는데 더 좋았어요..  아역들 정말 대단하네요 특히 무니역할 맡은 아이  ","10"
"485","관람객색감이 진짜 예뻣다 ㅇㅅㅇ  ","8"
"486","울고있는 무니의 손을 잡고 함게 뛰는 젠시의 모습에서 그냥 눈물이 ㅠㅜ  ","9"
"487","관람객색감과 영상미에 대비되는 씁쓸한 현실  ","7"
"488","관람객무늬만 어린이 무니.... 무니야 행복해  ","10"
"489","관람객무니야앞으로는울지마  ","10"
"490","관람객가해자는 없고 피해자만 있다  ","8"
"491","말이 안나와.에서 모든게 다 무너졌다.  ","10"
"492","관람객영상미와 사운드에 혼빠지다가 영화가 진행될수록 생각에 빠지는 영화..  ","9"
"493","관람객가난한 아이들의 일상이 소름돋을 정도로 현실적이다.  ","10"
"494","아이기에 가능하고 어른이기에 불가능한것이런 영화를 볼수있어 정말 다행이다 한동안 아주 긴 여운에 시달릴 듯 하다  ","10"
"495","관람객성급히 동정하지도 판단하지도 않는 영화의 시선. 주어진 것들 안에서 최대한으로, 진실되게 살아내는 아이들. 진정으로 아름다운 것들은 디즈니의 동화가 아니라 거친 수풀과 35불짜리 모텔 위로 이따끔 떠오르는 무지개 속에 있다.  ","9"
"496","가볍운 마음으로 영화를 보러 갔다가 무거운 짐을 들고 나온것 같은 영화!!  ","8"
"497","부모의자격에 대해서도 다시 생각해보게 되는 영화  ","10"
"498","관람객영상미가 예쁜데, 먹먹한 영화  ","10"
"499","관람객너무 좋았어요!! 즐겁고  ","9"
"500","관람객그렇게도 지나쳤던 장난감가게들 결국 네 손잡고 뛰어간 환상의나라 디즈니  ","8"
"501","무조건 어른들만의 영화는 아니다. 어쩌면 아이들의 시점으로 보면 이해되는 영화.  ","8"
"502","이 세상 모든 무니와 핼리를 위해  ","10"
"503","색채가 아름답고 대비효과가 돋보인다.캐릭터 디자인과 배우들의 연기가 좋다.아이들의 이야기는 다큐같고, 어른들의 이야기는 드라마 같다.  그 둘의 만남이 어색하다.  ","7"
"504","관람객행복과 불행은 동전의 양면... 영화홍보 너무 했다..  ","10"
"505","귀엽고 가엾은 아가들 ㅜㅜ  ","10"
"506","관람객마냥 즐거운 영화일 줄 알았더니만.  ","8"
"507","무니의 내일이 보이는 것만 같아서 지금의 사랑스러움을 마냥 느낄 수만은 없다.  ","9"
"508","관람객아름다움 속에 숨겨진 비극이었달까 이 영화의 느낌은?  ","10"
"509","관람객진짜 주인공은 핼리. 최고입니다.  ","10"
"510","1. 엉엉 울던 무니. 친한친구에게도 쉬이 표현할수 없었던 무거운 감정. 어린아이마저 느끼는 감정의 무게.2. 곰팡이 핀 내 마음에도 파스텔톤으로 덧칠 덧칠!3. 짠! 생일축하해! 잔디밭에서 함께 불꽃 보던 장면은 너무 아름다웠다.  ","10"
"511","잘만든영화 션베이커멋졍  ","10"
"512","관람객현실속에서 아이답지 못하게 행동해야 하는 모습과 정말 아이 같은 모습이 함께 어우러지며 꺠달음을 주는 영화.  ","8"
"513","무니가 세상을 구원할 것  ","8"
"514","순수한 어린아이의 눈에는  어른들의 적나라한 현실도 비극보다는 희극에 가까워보인다 비극이 되어갈 때에 무니가 너무 아파서 눈물이 났다  ","8"
"515","꿀잼!! 진짜 재미있었어요 ㅋㅋㅋ  ","10"
"516","관람객미국이란 나라....  ","9"
"517","관람객좋지 않은 것들이 나쁘지 않음을 알고 싶다  ","9"
"518","영화관을 찾기가 너무 어렵다. 그럼에도 기어이 찾아내서 관람한 영화인데, 돈이 아깝지가 않다. 아이들의 눈으로 보는 미국의 민낯을 유쾌하게 그려냈다.  특히 모텔 관리인 바비의 슬픈 눈이 왜 이렇게 더 남는지 모르겠다.  돈 앞에 모녀마저 무너지는구나  ","10"
"519","관람객결말이 약간 그렇지만 그래도 감동적인 영화  ","10"
"520","관람객아이는 사랑스러움ㅇㅇㅇ  ","8"
"521","우리가 여행하는 이유는엄마와 아빠 손잡고 철없이 뛰어놀던 공간과 비슷한 곳을 찾는 것이다그때가 처음이자 마지막 경험한 행복일 것이다대다수는 이 아름다운 곳들을 스쳐지나가 가기 바쁘다.. 슬프지만..우린 공평하지 않다..태어나는 순간부터..  ","7"
"522","읽기 어려운 소설이 있잖아요. 그러나 나주에 보면 참 감동적이고 머리속에 그 대사 내용들이 막 떠오르는 그런 소설 같은 영화입니다. 마지막 장면에 40대 후반 남자 아저씨가 눈물이 났어요.  &#34;나는 이 나무가 좋아 쓰러졌지만 자라는 나무야&#34; 무니  ","10"
"523","관람객아이들이 주인공이라고 방심하다가 묵직하게 명치 맞고 나온 기분이네요. 모텔도 아이들 옷도 파스텔 톤이지만 어른들은 그렇지 않아요.  ","8"
"524","관람객달콤한 영화일 줄 알았는데..씁쓸함이 오래 남는다.  ","9"
"525","관람객후회하지 않을 영화입니다 꼭 보세요  ","10"
"526","관람객화려한 색감뒤에 가슴 먹먹한  이야기.  ","8"
"527","관람객정말 좋았어요. 마냥 밝고 순수한 내용인줄 알았는데 마지막엔 엉엉 울었네요 ㅠㅠ  ","9"
"528","관람객예쁜 포스터에 속아버렸습니다  ","10"
"529","좋다 그냥 !! 가슴아프지만 애들이 너무 사랑스럽다  ","10"
"530","마냥 예뻐서 마냥 밝지만은 않은 영화  ","10"
"531","관람객어리지만 삶의 무게를 짊어지고 살아가는 무니와 책임감을 갖고 열일하며 신경안쓰는 듯 하면서도 사회적 경제적 약자를 진심으로 생각하고 돌보는 바비의 모습이 인상깊다.  ","8"
"532","그릇된 어른의 감성이 아이의 감성과 다르지 않음을 보여주는 영화. 아이의 감성이 성숙한 몸으로는.. 그릇된 어른으로 비춰져 통용되지 못함에 한탄하는 영화. 그것에 더 나아가, 현실에서 아이의 감성이 통용되지 못하는 안티디즈니적인 영화  ","10"
"533","관람객신선하고 먹먹해지는  영화였어요  ","8"
"534","또 보고싶은 영화, 아니 또 보고싶은 무니.  ","8"
"535","예상했던 내용이랑 너무 달랐다 ㅋㅋ끝나고 바로 일어날수없었다  ","8"
"536","오늘 보고 오는 길인데 솔직히 예고편이 잘못만들어지지 않았나 싶어요.  ","9"
"537","관람객예고편과는 완전히 다른 느낌의 영화. 끝나고도 쉽사리 발걸음이 떨어지지않았다. 솔직함이 가득했던 영화. 그러나 내가 이해하는 수준이 얕아서 인지는 모르겠지만 결말이 조금은 허무하다는 생각이 들었다.  ","8"
"538"," 밝은영화인줄 알았는데 정말 ㅜㅜ  ","10"
"539","관람객동화같은 껍질 속의 아픈 현실  ","7"
"540","영화가 끝난것 같으면 진짜 끝난거에요  ","9"
"541","관람객아름다운 배경과 비극적인 상황이 대조를 잘 이뤘고 힘든 상황속에서도 무니의 순수함이 돋보였습니다.근데 엔딩은 다소 난해하네요ㅠㅠ  ","8"
"542","어떤 사건 중심 영화가 아니고 무니의 하루 일상 영화이기 때문에 자극적인 영화가 익숙하면 실망할만함. 이해할 사람은 하고 못하는 하사람은 못할 영화. 심리적인 영화임. 아무렇지 않은 척 하지만 무니는 괜찮은걸까. 무니가 행복하길!  ","8"
"543","관람객전작부터 쭉.. 어두운 현실에 색깔을 입히는 감독만의 방법이 좋다  ","8"
"544","관람객무니앞의 환상같은 현실  ","8"
"545","이쁜 색감 너무 이쁜 아이들 어려운현실 더 어려운 행복  ","8"
"546","무지개 저편, 가려진 공간에 사는 이들에게 누가 돌을 던지랴.  ","7"
"547","그랜드 부다페스트 호텔 &#39;같은&#39; 3류 모텔에서 스킨스 찍는 엄마와 미국 초딩이 노는 법을 담은 다큐멘터리. 텀블러를 비디오화한것 같은 느낌도 든다. 그리고 바비 아저씨는 불쌍하다.  ","8"
"548","월요일이 사라졌다의 7남매 아빠가 왜 나와? 형이 왜 거기있어???  ","10"
"549","어른들에게 그랜드부다페스트 호텔이 있다면 아이들에게는  킹덤매직 모텔이 있다. 디즈니 월드와는 다른 차원의 환상적인 영화 체험! 아리지만 그래도 황홀한~  ","9"
"550","담채화, 춘곤증! 사는거 버겁다!  ","7"
"551","이런 영화가 많이 생겼으면 좋겠다 친구의 손을 잡고 디즈니랜드로 뛰는 장면이 오래 남을 것 같다  ","10"
"552","관람객너무나 예쁜 풍경 속 가슴아픈 아이들  ","10"
"553","아이를 사랑하는 법은 알지만 삶을 사는 법은 모르는 엄마. 투숙객을 진심으로 걱정하는 매니저.모두 아기를 지키지 못했다. 비루한 세상에서 사랑이란 슬프기만 할 뿐 쓸모없는 것일까..나무는 쓰러져도 자라지. 아가 넌 너무 애쓰지 마.  ","6"
"554","관람객알록달록 예쁘고 동화스럽게 표현되었지만 그안에 많은, 가슴 무거운 드라마가 있는 영화.  ","10"
"555","곱씹을수록 슬픈 영화.  ","7"
"556","관람객너무나 아름다운 색채, 너무나 아름답게 슬픈 이야기  ","8"
"557","의도는 알겠는데 왜 노오력을 안하냐?  ","8"
"558","너무 좋았다. 이 영화가 더 많이 알려졌으면 좋겠다  ","10"
"559","관람객무니의 천진한 연기 최고!!!  ","9"
"560","관람객미국 국민이 봤음 어떨지 모르겠는데, 나는 한국인이라 저 나라 사회문제에 대해 1도 공감이 안되고. 김고은이 영화 추천한다 했는데, 속았어 진짜...  ","2"
"561","관람객처절한 사회. 우리는 차고 넘쳐도 나눌 줄 모른다  ","8"
"562","무지개 무늬는 무니처럼 찬란하다.  ","9"
"563","관람객헨리의 삶은 비참한 것 같다. 근데 그 삶을 무니도 비참하게 닮아있다.  ","10"
"564","관람객울지마 무니. 다 잘될거야  ","10"
"565","어떤 아이도 아이스크림을 한입 더 먹겠다고 욕심내지 않았다. 그늘속에 살지만 이 아이들은 가지려하기 보다  나누고 있다.  ","10"
"566","극한직업에 바비아저씨  ","10"
"567","관람객결코 가볍지 않은, 그래서 더 생각이 많아지는 영화  ","10"
"568","그림같은 장면들. 아름답다.  ","8"
"569","점힐링영화 인줄 알고 봤다.. 그래서 멘탈이 나가 버렸다.물론 좋은 영화다 너무 괜찮은 영화라 가슴을 후벼 파는듯 해서 문제다  ","8"
"570","관람객우리 주변에 많은 무니들을 위하여  ","10"
"571","상황이 어떻든 밝고 행복하게 살아남으려고 발버둥치는 고작 어린 아이. 울려는 어른들은 바로 안다는 무니가 마지막 식사에서도 계속 웃으며 모른척해왔는데 결국 헤어져야한다는 이 상황조차 허용 안된다는 현실 앞에서의 그 오열.  ","10"
"572","관람객매직캐슬의 진정한 보안관 바비아저씨  ","10"
"573","밝아보이지만 어둡다. 마지막이 허무하다  ","6"
"574","분명 화려한 디즈니랜드 뒷편에 살고있는 극빈층 아이들을 삶은 보여주는거라면 미국은 역시 축복받은 나라이다...  ","3"
"575","관람객제 인생영화입니다! 마지막 무니가 우는 장면 고스란히 감정이 전해져 와서 바로 영화관을 나갈 수가 없는 그런 영화입니다.  ","10"
"576","아케데미에서 극찬을 받을만한 영화  ","10"
"577","관람객무니가 행복하기를 동화같은 결말이길 빌었다  ","10"
