"","reviews","points"
"1","관람객아이들은 모른척 한다. 어른들을 위해서.  ","10"
"2","아이들은 힘든 친구의 손이 안타까워 잡고 함께 뛴다. 어른들은 힘든 친구의 손이 불편해 놓아 버린다.  ","8"
"3","진짜 저렇게 영화 홍보하면 안된다.  ","10"
"4","내가 이 나무를 좋아하는 이유가 뭔지 알아? 쓰러졌는데도 계속 자라고 있기 때문이야.  ","10"
"5","관람객정말 가벼운  마음으로 들어갔다가 뒷통수 제대로 맞은 영화플로리다의 석양을 배경 삼아 도망치듯 걸어가는 모녀,그리고 마지막 무니의 오열은 오래 남을 것 같다  ","9"
"6","관람객너는 나의 제일 친한 친구인데, 이제 다시는 못볼지도 몰라. 말이 안나와.  ","10"
"7","이 영화 마케팅 관련자들을 고발합니다.  ","8"
"8","예쁘고 귀엽지만 안타까운...예상되는 전개에도 놀라움을 주는 아역배우의 눈부신 활약...그토록 씩씩하고 웃기만 하던 아이가 우는 장면은 가슴을 미어지게 하고 다시는 보기 싫은 눈물...디즈니랜드 앞에 살지만 눈물 없이는 갈 수 없었던 그 곳...  ","10"
"9","디즈니가 외면? 혹은 왜곡하고 있는 현실 이야기. 삶은 처절하기 때문에 숭고하고 아름답다.  ","9"
"10","무니야 항상 행복해야해  ","10"
"11","힐링영화 아닙니다 ㅠㅠ 쓰러진 채 자라나는 나무같은 무니.. 무니가 또 쉬싸러왔대? 했을 때 심장이 쿵했습니다..  ","9"
"12","마지막 식사 장면. 그냥 마냥 즐거운 무니와 영화 종일 내내 당당하고 유쾌한 핼리가 슬퍼보이는 장면이 가장 크게 남네요.  ","10"
"13","현실에서 상종하고 싶지 않은 부류의 사람들도 누군가의 부모이고 딸이고 고통을 느낄줄 안다는것...  ","8"
"14","또 다른 의미의 잔혹동화.  ","10"
"15","이 영화 포스터는 사기입니다  ","8"
"16","&#34;이 세상 모든 무니와 핼리에게 이 상을 바치며 우리 모두 그들을 도와야 한다.&#34; - 브루클린 프린스 (무니 역) 크리틱스 초이스 아역상 수상소감 중  ","10"
"17","관람객쓰러진채 자랄 아이들이 슬프다 무니가 항상 행복했으면 좋겠다  ","10"
"18","이거보고 나오니 온 세상이 칙칙해보임.. 어떤분이 하신 말처럼 연기자가 연기하는것을 찍는게 아니라 사회속 한사람의 현실을 따라다니며 찍은 느낌. 미국사회의 빈부격차를 잘 꼬집은것같다. 영상의 색감은 아름다웠지만 그 속은 차갑고 현실적이다.  ","10"
"19","어두운 영화. 미국 사회의 단면을 아이들을 통해 그려내고 있다.  ","7"
"20","무니는 어른들이 울기직전의 표정을 알아차린다 정작 자신은 언제 울어야하고 언제 슬퍼해야하는지 알지못한다  ","9"
"21","영화가 진짜 너무 씁쓸하다 쓴맛이 엄청 오래감  ","10"
"22","예고편에 속지 마세요! 실제 영화가 훨씬 좋아요!  ","9"
"23","배우들이 연기를 너무 잘해 기억에 오래 남을 영화. 마지막 장면을 제외하면 영화를 보는 내내 괴로운 다큐멘터리 처럼 느껴졌다.감독은 공간과 소리로 현실감을 어떻게 연출하는지를 너무 잘 아는것 같다.  ","6"
"24","오래간만에 보는 진정한 의미로 영화다. 다큐멘터리로 느낄 정도의 리얼리티가 공간에 설정되었고 더 개입하지도 더 방관하지도 않는 윌리엄데포가 거리를 두고 비참한 현실을 응시한다. 헬리콥터소리가 영화내내 요란하게 우리에게 경고한다. 다들 위험한 삶이다  ","9"
"25","영화가 너무 아프다.. 네이버 줄거리랑 딱 반대의 내용이다. 부디 행복하게 꿋꿋이 자라주렴..  ","6"
"26","바비아저씨같은 분이 많아졌으면 해요.  ","8"
"27","마지막장면이 아직 까지도 여운이 남는다.미국판 나 다니엘 블레이크  ","8"
"28","마지막 장면이 잊혀지지 않는다.무니의 우는연기에 놀랐고 젠시가 무니를 데리고 도망가는곳이 디즈니랜드라는것에 마음 아팠다아이들은 그곳을 꿈과 희망의 나라로 믿고있는거였다..그래서 그곳으로 도망가면 다 해결될꺼라고 생각했던 것이였다...  ","10"
"29","이 영화가 전하려는 내용이 뭔지 이해가 가지 않았다. 그저 무니 모녀가 처한 상황이 지독히 현실적인 모습이라는 것 말고는.. 하지만 집으로 가는 길 내내 이 영화가 말하려던 게 어떤건지 선명해져갔다. 포스터와는 너무나 다른 영화.  ","10"
"30","매직 캐슬, 퓨처 랜드로 위장한 공간을 시끄러운 헬기 소리로, 연보라의 음울한 페인트로 덧칠할 수는 있지만, 무지개처럼 다채로운 아이들의 속내는 감출 수 없다.  ","6"
"31","한국같으면 눈물콧물 짜는 신파로 만들었겠지만 이영환 다르다 건조한 나도 눈물 맺히게 만든다 자연스럽게 마치 한국이 싸구려빵이라면 이영화는 고급빵집 빵  ","8"
"32","사랑스럽고 유쾌한 아이들 시선으로 본 안개에 가려진 무지개 빛 세상.  ","10"
"33","온갖 CG로 돈 처발처발한 영화들 보다가 오랜만에 힐링영화 만난듯하다. 보면서 뭔가 위태롭기도하고 뭉클하면서 애잔한... 오랜만에 느껴보는 감정들... 글로 설명하긴 힘들다. 한번쯤 봐야할 영화.  ","9"
"34","꿈과 희망의 디즈니랜드 주변의 싸구려 모텔에 지내는 미워할수 없는 악동 무니와 무능력하고 뻔뻔하지만 무니를 사랑하는 엄마의 씁슬한 현실 이야기..참묘하다....  ","9"
"35","왜 엄마인 핼리에 대해서는 아무도 이야기를 안할까?..그녀가 혼자 짊어져야 할 짐이 너무도 많았다.핼리와 무니가 행복했으면좋겠다  ","10"
"36","마지막에  아동보호  직원들이 와서 무니 데려가려하자 무니 도망갈때 차에  치여 죽거나 무슨 사고 가 날줄 알았는데 내 생각이 너무나 잘못됬다 ...마지막에 친구에게 작별인사하러 가는줄도 모르고 ...그때 엄청 슬펐다 아이의 순수함...  ","10"
"37","그 불길이 자신을 덮칠거라곤 생각하지 못했겠지.  ","6"
"38","관람객갈 수 없던 곳으로 손잡고 달려 데려가주는 작고 뜨거운 심장 같은 카메라  ","10"
"39","매직캐슬과 디즈니랜드의 거리차..잿빛의 무거운 소재를 파스텔로 가볍게 그려낸 영화. 여운 남아서 후기씁니다  ","10"
"40","불편하다..  무니가 또다른핼리가 될까 심히걱정스럽다  ","8"
"41","좋은 영화는 세상을 구하는 법을 제시하지 않는다.  ","8"
"42","생각보다 어두운 이야기에 놀랐음 마지막 장면은 무슨 의미일까..  ","8"
"43","진짜 보고싶은데 상영 수도권을 제외 없다 ㅋ 심지어 수도권도 열 손가락으로 헤아릴 수 있을정도로 상영하네요 ^^^ 이게 대한민국 문화의 수치입니다 ^^ 진짜 ㅏㅉㅈㅏ증나니깐 상영관늘려라  ㅡ ㅡ  ","10"
"44","디즈니랜드가 이렇게 슬픈 장소였다니, 보고나서 버스를 타고 집에가는데 주책맞게 울어버렸다. 무니는 어떤집으로 가야하는가?  ","8"
"45","해맑기만 하던 무니가 울 땐 참..  ","8"
"46","신과xx 같은 유치찬란한 영화보다 훨씬 유익한 영화였다.  ","9"
"47","아이들의 상상과 동심이 있지만 어른들의 세계에서 자라난다  ","9"
"48","지금 현재 미국의 빈민층 삶을 최대한 꾸밈없이 보여줌으로써 관객들이 함께 생각하게 하는 영화아역 주인공들의 연기가 몰입도를 높여준다  ","10"
"49","“이 나무는 쓰러졌는데도, 계속 자라나서 좋아”무니와 헤일리를 향한 말이 아닐까 싶을만큼 가슴 아프고 먹먹한 영화였어요.  ","10"
"50","먹먹하다. 얼마 전 가 본 플로리다의 이중적인 모습을 매우 불편하게, 하지만 그대로 담은 영화.  ","10"
"51","장면마다 색감이 너무 아름다움! 처음으로 영화 포스터를 방에 붙임.ㅎㅎ 내가 얼마나 나약하고 자기연민에 쩔어서 사는지  알게된 영화ㅎㅎ  유쾌한 이야기는 아니지만 왠지 떠올리면 에너지를 주는 영화:^)  ","10"
"52","무니가 행복했으면 좋겠어  ","8"
"53","관람객부모, 육아, 친구, 사회복지 이 모든 것에 대해 생각하게 한 영화입니다. 무니의 연기!  ","10"
"54","제발 한명이라도 더 이 영화를 봐주면 좋겟다.  ","10"
"55","국내 포스터를 잘못 만들었어. 판의미로도 아니고 이게 머야..   주인공 꼬마는 쩔었지만 100분 넘게 사고치는거 보면 피곤해짐  ","8"
"56","배우들 연기는 굿. 그러나 시간을 되돌린다면 다시 보고싶지는 않은 영화다. 포스터이미지에 속지 말길. 기분 좋아지는 영화는 아니다. 보면 씁쓸하고 찝찝해지는 영화  ","6"
"57","포스터보니 제작사가 양아치긴하네 ㅋㅋㅋ  ","2"
"58","우린 끝을 알고 있음에도 이 애처로운 즐거움이 영원했으면 하게된다. 마치 디즈니랜드에 있는 아이처럼  ","10"
"59","관람객근래에 본 최고의 영화.  ","10"
"60","어른들이 언제 울지 아는 아이, 웃음만 짓던 그 아이도 우는 법을 알았다.  ","10"
"61","관람객아역의 연기는 연기가 아닌 진짜 아이의 삶을 있는 그대로 다큐를 찍은것은 아닌지..여전히 의심이 들만큼 사실적이다. 어른보다 나은 햇살같은 아이들의 마음..  ","8"
"62","정말 좋은 영화입니다. 꼭보세요.  ","10"
"63","정말 좋았어요. 분명 취향의 차이는 있을 거라고 생각해요. 하지만 같이 보던 영화관에서 끝난 뒤 박수가 나올 정도로 좋았답니다. 무니야 언제 어디서든 꼭 행복해야해 ㅠㅠ  ","10"
"64","관람객알겠는데 공감까진 무리  ","5"
"65","관람객헐리우드판 로제타. 가난과 무지의 대물림 그리고 순수함.  ","8"
"66","플로리다와 무니의 밝은 모습과  대비되는 암울한 현실이 매우 현실적인 미국 사회의  어두운면을 잘보여주었다. 그 사실적인 묘사를 아역배우가 너무 잘해줘서 오히려 불편할 정도.  ","8"
"67","엔딩은 정말..최고에요예고편보고 선택했다가 후회하지 않은 몇 안되는 영화에요  ","10"
"68","영화의 방식은 페이크 다큐에 가깝다. 그리고 영화가 말하려는 바가 뭔지 알겠다. 하지만 나에게는 너무 와닿지 않는 느낌이다. 슬프다는건 알겠지만 나에게는 그렇게 와닿지는 않는게 너무 안타깝다. 너무 의도한 티가난다. 윌렘데포는 잘했다고 하기엔 비중이.  ","7"
"69","앵벌이의 전형! ...미국에서 평점은?  ","2"
"70","인과응보. 누굴 탓하리  ","6"
"71","디즈니월드 보다 신나는 무지개 어드벤처 라고?..ㅋㅋㅋㅋ진짜 어이가 없어서ㅋㅋㅋ  ","10"
"72","관람객뭘 말하고자 하는지는 알겠으나 그걸 풀어내는 방식과 캐릭터가 개인적으로는 너무 별로라고 느껴지네요. 이런 점까지 의도한 것 같기도 한데 참 공감안되는 찬양하는 사람들 보면 음? 싶달까.. 마무리는 좋았어요. 영상도 좋았고.  ","3"
"73","아이에 대한 동정심으로 무례함을 감싸주면 안된다.  ","1"
"74","영화 시작부터끝날때까지 속으로 욕하면서 봤다. 주변사람들이 무슨 죄냐? 주변사람들에게 민폐끼치는 것들 너무 보기 불편하다. 아이들이 못된짓만 배울까봐 두렵다. 핼리와 아이들의 온갖 비행들을 수습하는 바비와 죄없는데 처참하게 폭행당한 애슐리가 불쌍하다.  ","1"
"75","관람객아이는 다 알아. 어른들이 모를 뿐.  ","4"
"76","관람객일본 영화 &#39;아무도 모른다&#39;가 생각나는 영화.유난히 더 쨍한 색감 때문인건지 뒷부분에 무니가 젠시에게 울면서 하는 말에서 눈물이 터져버렸다.  ","10"
"77","거참 꼬맹이 연기 잘하네...  ","10"
"78","홍보를 너무 본편과 다르게 하신거 아닌지요. 저희 부모님 친구분이랑 보고 오시라고 끊어드렸는데... 적잖이 당황하고 오셨어요!  ","4"
"79","영상미와 대조적인 상황이라는걸 극대화 시키기에 많이 부족한 영화같음.  보는 내내 많이 불편했음.  ","2"
"80","영화자체는 관람하는 내가 예술성이 부족해서 감독의뜻을 다 이해못한다 치는데 아무리생각해도 홍보팀이 괘씸하다  ","8"
"81","네이버 하는짓봐라 무지개 어드벤처래.... 근래에 본 가장 잔혹동화구만...  ","9"
"82","관람객사전에 아무 정보없이 보세요  ","8"
"83","멀리서 보면 희극  가까이서 보면 비극  ","10"
"84","우는 걸 보니 무니도 어린아이였다....나도 모르게 울컥햇다.  ","10"
"85","관람객우리모두 연민과 경계가 함께있는 바비지않을까..  ","10"
"86","재미는 없고 그냥 생각할거리 만드는 영화.. 영상미 는 있지만 평범한 사람들 만천원내고 보면 아깝다는 생각 들 것 같음.. 나쁜영화는 아니니만 사실 왜 저렇게 호들갑 떨면서 극찬하는지는 이해 1도 안됨..전개 지루하고 메세지도 약하다 생각함  ","5"
"87","이런영화일줄.. 꿈에도몰랐다..  ","2"
"88","이 영화의 홍보 자체가 이 영화의 반전임. 마지막 뷔페신부터 5분이 다했네. 가슴이 따뜻한 영화. 쵝오!  ","10"
"89","밑바닥을 보여주는 영화아이들은 어른들을 보면서 성장한다. 큰 슬픔을 안고 살아가는 아이들의 마래가 우울하게 느껴졌다.  ","2"
"90","관람객솔직히 영화자체의 작품성으로는 괜찮은 작품.그러나 포스터나 홍보를 본사람들은 누구라도 사기당한 기분일거다.포스터보고 너무 행복한 영화겠다 싶은 기대로 갔다가우울터져서 돌아옴....  ","8"
"91","마지막 무니가 젠시에게 &#34;넌 내단짝인데 이제 너랑 못볼수도있어 더이상 말을 못하겠어 그냥 잘지내 엉엉...&#34; 하며 울자 젠시는 큰 결심을 한듯 두번 씩씩 거리더니 무니의 손을 잡고 달린다. 무니와 젠시가 도착한 곳은 디즈니랜드. 마지막장면 전율이 쫙  ","10"
"92","관람객색감이 이쁜영화 아이들이 활발한 영화  내용은 별로  ","4"
"93","아이들은 어른의 거울이라는 말만 계속 머리속에 떠오르고, 결말은 막장으로 찢어지는 인생들에 대한 안타까움만 남음. 전체적으로 영화가 여과없이 환상을 섞지도 않고 냉혹한 현실로 가득찼지만, 그것은 관객을 납득은 시켜도 공감하게는 어렵게 만듬.  ","6"
"94","배급사 XXXX들아 판의미로도 그렇고 대체 영화를 보고 포스터를 만들기는 하는거냐  ","9"
"95","관람객현실을 놀이터 삼다 끝내 환상속으로 숨은 무니와 젠시의 비참한 선택.  ","8"
"96","너무 맑고 밝은 빛이라 더 짙게 다가오는 그림자처럼  ","9"
"97","‘매직캐슬’에 평생 살면서 생기는 마술이래봐야 무지개가 뜨는 정도?하지만 오늘도 have good day  ","8"
"98","우울해지는 영화, 뭘 말하려는  모르겠는 영화  ","1"
"99","다른걸 떠나서 상업적 재미는 개나 줘버린 다큐에 가까움. 불우이웃 결손가정은 해맑으나 불쌍해. 이게 결론임.  ","5"
"100","이게 대체 왜 평점이 높은건지 모르겠다  그냥 보면서 불편하기만 한던데  ","4"
"101","관람객세상 모든 무니를 위해세상 모든 핼리를 위해  ","8"
"102","관람객예쁜 화면만큼 아픈내용  ","10"
"103","가장 절망적으로 울려 퍼지는 희망의 송가. 단호한 태도를 보여주지도 분노하지도 애처로워하지도 않는다. 그저 그곳을 보여준다. 디즈니월드 바로 근처, 뛰어가면 닿을 거리의 그곳을.  ","9"
"104","영화가 끝을 향해 달려갈수록 천진난만한 아이들의 웃음이 아프게 다가온다. 디즈니랜드에서 가장 가까우면서 먼 아이들의 이야기  ","10"
"105","그냥 애미년 노답인거 밖에 안보인다. 처한 상황이 나쁘다고 나쁜 행동들이 감동이 돼나? 그런 애미 밑에서 크면 똑같은 인간만 나올 뿐.  ","1"
"106","아이들은 어른의 아버지 라는 글귀가 와닿는 영화...  ","10"
"107","칠해도 칠해도 갈라지는 그들의 삶 지금 뛰어가는 그곳은 무지개가 떠있기를.  ","9"
"108","도대체 뭘 얘기할려고 하는건지...최악...  ","1"
"109","어른용. 색감 좋음. 괜찮게 봤지만 무니엄마가 이해가 안되네 바비아저씨 반의 반이라도 따라가면 좋았을텐데  ","8"
"110","개노답 모녀 스토리에 엔딩도 최악  ","1"
"111","공감할 수 없는 주인공을 지지해야 하는 상황이 주는 난감함...  ","7"
"112","포스터를 보고 밝은 영화인줄 알았다.  ","6"
"113","환상의 디즈니 랜드가 있는 플로리다의 이면이자 미국 하층민들의 삶을 아이들의 눈으로 고발하는 영화. 찬란하고 예쁜 배경과는 대조되는 현실.  ","8"
"114","우리네 삶의 극적인 대비. 그런 대비 속에서도 션 베이커가 말하는 주변인들의 삶은 언제나 인간 그대로 동정 없이 그들의 삶을 응원하는 방식이라, 불편한 마음과 동시에 한없이 아름답게 느껴지기도 한다.  ","10"
"115","정말 잘만들었다. 한국 쓰랙영화 5편 볼 돈으로 이거한편보는게 더 개이득일듯... 나도 6살땐 자렇게 놀았겠지.  ","9"
"116","관람객핼리를 절대 미워할 수 없음  ","10"
"117","영화를 봤을땐 7점 후기를 읽어봤을땐 9점  ","9"
"118","줄거리 써 놓은 거 꼴 좀 보소...이 명작을 한방에 날려버리는 수준..  ","10"
"119","감독이 천재인 건가. 영화의 촬영 현장은 어떤 모습이었는지 보고싶다. 대체 어디까지 설계하고 찍은 건지... 아니면 그냥 찍다 보니 만들어 진 건지... 그 결과물이 경이롭다. &#39;엄마&#39;,&#39;딸&#39;,&#39;관리인&#39; 이 세 배우의 연기는  ","10"
"120","말이 안 나와. 그리고 손을 잡고 뛴다... 작은 뜀박질이지만 힘차다. 모두 힘내세요.  ","10"
"121","관람객어쩌면 아이들에게 그곳은 정말 Future Land와 Magic castle 이었지도 모른다. 오히려 더 철이 없는 건 어른들이 아닐지..  ","9"
"122","관람객나는 절대로 저런 부모가 되지 말아야지.  ","8"
"123","관람객맛있는 뷔페를 먹을 때 엄마의 표정과 젠니 앞에서 오열하는 무니. 그리고 신데렐라의 성  ","8"
"124","마지막 장면이 잊혀지지 않을 영화...  ","10"
"125","관람객무니야 행복해야해!!!  ","8"
"126","관람객라스트 씬의 통렬한 임팩트를 기다리는 시간이 조금 길다.  ","7"
"127","관람객무니와 핼리의 잔혹동화  ","8"
"128","관람객생각했던 것이랑 전혀 다른 영화  ","8"
"129","뿌리가 뽑혀도 무니는 자란다.  ","7"
"130","뒤돌아 있을 뿐 안들리는건 아니야  ","7"
"131","영화내내 사회악인 아이엄마때문에 불쾌했던 영화 아이만이 머리에 남는다 그러나 저렇게 큰 아이들 대부분이 또다시 문제아  ","2"
"132","굉장히 불쾌하고 불편한 영화, 차라리 다큐라고 말하면 이정도는 아닐듯.  ","1"
"133","왜곡된 모성애는 아이도 모르는 척 알고 있다.  ","8"
"134","관람객생각보다 무거운 작품이었어요.  ","8"
"135","무슨 이런영화가 예고와 홍보는 사기입니다 보지마세요  ","2"
"136","애들 안쓰럽고 그와중에 한없이맑은거 알겠는데 앞뒤 다짜르고 왜 애가태어났는지 왜 저렇게살아야하는지는 하나도 얘기안해주고 대뜸 진행하기엔 좀 반발이생긴다네이버후드 아프리카 기부 존나 싫다왜 싸지르곤 남들보고 도와달래고 책임지라는거냐 바비가 불쌍타  ","6"
"137","관람객디즈니랜드 안 행복한 아이들과 그 밖의 아이들을 통해 극적인 대비를 표현했지만 어떻게 보면 지독히 현실적이다. 그래서 영화보는 내내 불편하다. 보라색, 핑크색의 모텔과 그 안에 사람들 또한.  ","10"
"138","딱 포스터만 보고 영화본건데, 뒤통수 한대 맞은거같다... 엄마를 보고 배운대로 사고치고도 아무렇지않게 행동하고 피하는게 답이라고 생각하는 무니를 보고 어른은 아이의 거울이라는 말이 떠올랐다. 너무 현실적이고 차가운 영화였다..  ","8"
"139","관람객아이 연기가 너무 좋다.  ","8"
"140","포스터에 완전히 속았다.  명작인건 알겠는데 보는것이 불편하다.  ","7"
"141","마지막 핼리의 퍽큐!!! 와 젠시와 무니의 달음박질이 기억에 남는다. 엄마로서의 역할에 대해 생각하게 하는 영화.  ","7"
"142","관람객잘 이해가 되지 않았다. 하지만 영상미는 정말 예뻤다  ","8"
"143","관람객예쁜, 그래서 더 슬픈 분홍색  ","8"
"144","관람객많은생각을 하게해준영화  ","7"
"145","너무 어두워서 깜짝 놀랐다..  ","5"
"146","아이들은 아무런 잘못이 없는데...  ","7"
"147","관람객우울 심각 답답 암울 기분이그랬다  ","8"
"148","여러분! 포스터에 속지 마세요  ","10"
"149","차에 침뱉는 애들 보면서  영화 보자한 신랑한테 짜증냈다가, 아주 푹 빠져서 봤어요. 무니 ,저 어린 꼬맹이가 생활연기의 경지를 보여주다니 놀라웠습니다.  마지막에 친구한테 굿바이하며 울때 너무 가슴아파 펑펑 울었어요. 갠적으로 홍보문구는 정말 별로.  ","9"
"150","1.흙수저들 대책없이 애들 싸지르지말자 혼자살아 제발 2. 애들 앞에서 모범을 보이자 3.무니 너무 귀엽다  ","8"
"151","영화의 탈을 쓴 리얼 다큐  ","8"
"152","관람객외면하고 싶은 꿈과 희망의 그림자  ","8"
"153","관람객담담하고 순수해서 더 슬픈 사회의 이면  ","9"
"154","관람객미국에 대한 환상을 깨주는 영화  ","8"
"155","영상미는 부다페스트 호텔인데 시나리오가 똥파리.   밝고 예쁜 화면으로 나를 천진난만하게 만들어 놓고는 무니의 울음소리와 함께 나를 바닥에 처박았다. 그 순간 나는 무니가 되었다. 나는 분명 무니가 느낀 세상을 느꼈다.  ","10"
"156","너무 아름답고 눈이 부셔서 눈물이 나는 영화. 사랑스럽다는 말로는 표현할 수 없는, 가장 사랑스러운 걸작.  ","10"
"157","관람객앤딩크래딧을 보며 눈물을 흘려보긴 처음, 그리고 왜 눈물이 나오는건지도 모르겠고...  ","10"
"158","관람객어느 누군가의 실제 삶일 수 있다는 생각에 마음 한켠이 먹먹했네요.  ","8"
"159","어른의 눈으로 바라보기에너무나 찬란해서 온전히 마음에 담아 둘 수 없었다.마지막 장면에서 괜시리 울음이 터진건나 또한 아이의 눈이었던그 시절을 살아봤기 때문일것이다.  ","9"
"160","관람객션 베이커 감독 영화는 고유한 매력이 있는 것 같아요. 비주류의 삶을 개성있게 그려내서 독특하고 신선한 느낌을 줍니다. 색감도 이쁘고 배우들의 연기도 좋았어요.  ","8"
"161","보고나면 가슴이 아려요. 매우 좋은 영화입니다.  ","10"
"162","아이들의 세계를 보듬어야 할 어른들의 세계가 오히려 아이들의 세계를 위협하고 무너뜨리는 풍경. 그 안에서 어른들은 속수무책으로 황망히 서있을 수 밖에 없고, 그래도 아이들은 서로의 손을 붙잡고 뛴다. 슬픈 영화  ","9"
"163","아이들 연기가 볼만하다.  ","8"
"164","누구의 탓을 할 수 있을까  ","10"
"165","관람객마음이 아릿하게 저립니다...무지개끝처럼 잡히지 않는 희망...  ","10"
"166","관람객꿈이 아닌 현실 그대로인 영화  ","9"
"167","무겁지도 가볍지도 않지만 깊이 있게 그려낸 영화..많은 생각을 하게 만드는 영화  ","10"
"168","동화같이 따뜻하고 아름다운 플로리다의 배경과 현실의 처참함과 아이들의 천진난만함이 역설적으로 뒤섞여있는 작품. 올해 본 영화 중 베스트  ","10"
"169","눈부시게 밝지만 뼈속까지 가슴 시린.  ","10"
"170","억지 감동 싫어해서 포스터 보고 안보려 했습니다. 보고나서 너무 좋았어요. 영화 똥파리처럼 리얼한 영화인데 그보다 더 후한 점수를 주고 싶음. 괜히 평론가들이 9점을 주는게 아니네요.  ","10"
"171","이 영화를 많이들 봤으면 좋겠습니다. 무니가 살아갈 인생이 얼마나 고달플지 알기에 눈물이 나오지만 그래도 무니가 행복했으면 좋겠어요 꼭.  ","10"
"172","꼭 반드시 행복해져라 무니  ","10"
"173","몰입 잔잔함속에 뜨거움  ","10"
"174","결말의 연출은 날 다시 꿈꾸게 해주었다. 내 꿈이 확실해질수 있도록 용기를 준 영화.  ","10"
"175","알록달록 예쁜 영상미에 그 곳에서 피어나는 희망 같은 아이들의 웃음소리. 그럼에도 눈물이 나고 마음이 짠해지는 영화. (예고편이나 포스터만 보고 마냥 동화 같은 스토리를 기대했다면 당황스러울 수 있음)  ","10"
"176","환상적인 색감...속애 극사실주의적인 묘사  ","10"
"177","환상과 현실의 무대 사이 균형 잡힌 시선으로 바라본다.  ","9"
